user,date,rating,content
llltdesq,"Nov 15, 2001",10/10,"This is one of the best film of all time and yet it is arguably only the third best film Charlie Chaplin made, after Modern Times and The Gold Rush. Some of his most memorable bits are in here, most of them revolving around his comic (and sad) attempts to help a blind flower seller, played by Virginia Cherrill.  Chaplin's sense of timing was wonderful, as always. Wholeheartedly recommended."
jasas541,"Nov 1, 2009",10/10,"When I first saw this movie, it was my personal favorite movie for the 6-7 month's, and I can say that this is totally one of the best (or maybe the best) romantic comedy movies and it will always stay in the Top positions for many years. Charlie Chaplin was very nervous during this movie filming's, because it's been already 3 years after film characters could speak in movies, but even in that situation and that year he created one big massive silence movie, it follows 4th his genius work after ,,The Kid"", ,,The Gold Rush"" and ,,The Circus"". All I can say is Charlie didn't get so much how much he deserved, even in this years this movie mean's a lot to everyone, many filmmakers taken some ideas from this movie to make a good romance movie, Charlie's best movie so far...10/10"
Norm-30,"Jan 20, 2000",10/10,"This film is most definitely Chaplin's Masterpiece!  There are so many good ""comedic bits"" (the prizefight, statue unveiling, the drunken millionaire, etc) that it WILL hold your interest through-out the film!And, of course, the ending sequence is poignant Chaplin at his Best.....If you can watch it without a tear in your eye, you aren't HUMAN!One of THE best silents ever made!  Norm"
raptorclaw,"Jul 23, 2009",10/10,"People say a lot of things about Chaplin's immortality. Actually, they say only one thing many times, over and over again: he is eternal, his films will live forever, a hundred or two hundred years from now humanity will still turn to Charles Chaplin for joy and relief from whatever burdens they may have, as like or unlike our own as those may be. My gut tells me there is truth in this belief, but I don't think with my gut. To be honest, I am not that optimistic. And my doubts don't spring from common sense, either; common sense says, of course, someday everything disappears - so will Chaplin. But other than that, I, as a 17-year-old, know absolutely no one of a similar age that likes Chaplin or remembers having seen any of his movies in recent times. All kids in Pakistan used to see them, and maybe they still do, but no one bothers to stick to it as the years pass. Tom and Jerry et al are still on TV - their place in public consciousness is continuously reinforced; they can legitimately claim timelessness. But what about all the 17-year-olds that would rather watch 'Transformers' and have only dim memories of a funny little man in a shabby top hat, ones that like movies only in passing, without passion? How will these poor people - and they are poorer for it - find 'City Lights'? This is a truly magnificent film. Its enduring greatness (if not enduring popularity) can, of course, be attributed to nostalgia - but only in part. You need never have heard of Charlie Chaplin to enjoy it. It also has the common advantage of all silent films in that it knows no linguistic boundaries; the story, unlike that of a Buster Keaton film, is simple and silent enough that one does not really need even the sparse title cards to follow it. Keaton's films, while silent, tended to be rather talkative, requiring the viewer to do quite a bit of reading. Chaplin is perhaps more widely known than Keaton because he, unlike the latter, can be understood by people who cannot read English or any language at all.Chaplin's comedic timing is flawless. This is not, perhaps, Chaplin's funniest film, but it strings together sequence after hilarious sequence of classic slapstick nevertheless: the opening scene on the monument, the one with the suicidal millionaire, the one in the restaurant (my personal favorite), the boxing match - each is immediately familiar and unfailingly funny. (Sophisticated humor? No doubt it has its skillful practitioners and talented writers. I love it. But is it, when you get right down to it, actually any funnier than watching a chair pulled out from under someone's descending rear end? Not on this evidence.) But what sets 'City Lights' apart from other Chaplin films, and classical comedy in general, is its heart.The story is, as I mentioned, disarmingly simple. Chaplin plays The Tramp, a homeless man with an odd mustache, a top hat and a cane, who is always in trouble because of his social ineptitude. He is persecuted because of his shabby appearance. He meets a girl that sells flowers who is kind to him, possibly only because she is blind and thinks he is a gentleman. He saves the life of a drunken millionaire, whose help he needs when the girl has trouble paying her rent. Obstacles arise. The obstacles are the comedy.That really is it. It does not, on paper, sound like masterpiece material, but it is brought to life - partly by humor, yes - but primarily by Chaplin's persona as the Tramp. The Tramp is one of cinema's greatest personalities, the people's champion to end them all. His perennially good intentions, his unflagging good cheer, his clumsiness, his social inadequacy, his underdog status and his constant bedevilment by ridiculous misfortune make us cheer, cheer, cheer like we never have for any other character. It is quite possible that of all the great people invented by the silver screen, Chaplin's Tramp is the easiest to love, and love the most.The movie is, of course, a great technical achievement. It is boundlessly entertaining. Each quirky character, from the flower girl to the millionaire to the class conscious butler, serves its purpose in moving the story towards it conclusion. The conclusion, of course, is one of the finest emotional scenes in movie history; in fact, in its length and low-key conclusion, without fanfare or fireworks, anticipates in a strange way the French New Wave. The ending is abrupt. I spoil nothing by saying you will be joyful when it comes.One of the greatest of all movies. Most highly recommended."
francpsantos,"Nov 13, 2018",10/10,"If there were any doubts that Charlie Chaplin was way ahead of many of his contemporaries, this work of art will shed them away. The man did it all, and did it expertly. The classic comedic gags are not scarce in the movie and they are great as well. The comedy may not be extremely witty or even funny by today's standards, but honestly, it manages to bring a smile to my face quite frequently. A special nod to the box fight scene, which manages not only to be a smart piece of practical comedy, but also an uneasy moment, because of how much is a stake. You can't help but to feel yourself so expectant and deeply involved that it almost as if you forget the silliness of the situation for a moment. The personal interactions, in my opinion, are also undeniable proof of Chaplin's genius. Be it the interesting intermittent relationship between the Tramp and the millionaire or the tender affection between a blind woman selling flowers and a lowlife with ragged clothes. Chaplin's character is someone who is used to be looked from above, and his sincere happiness is truly poetic, when he finds gratitude from someone who, ironically, can see behind his flawed facade. That's why, to me, it came as shock when I read about the tense relationship between Chaplin and Cherrill and how she got fired from the production at some point. The connection between their characters just oozes out of the screen, in such a way that it seems unbelievable that, actually, it was almost the opposite in ""real life"". On top of all that, for the ones that find silent movies scary, rest assured that the score (composed by Chaplin himself) fits the tone of each scene so perfectly, that, a few minutes in, one already forgets that this is not a 'talkie'. I grant it that the ""speech sounds"" at the first scene of the movie are somewhat off-putting but, luckily, they do not appear for the rest of the movie, and the rest of the sound design is actually pretty well done.I can understand that the way I feel about this movie may sound exaggerated to most people. Even I question myself when I fell so strongly about a work of art and I admit that the nostalgia factor may be playing tricks on me. But sometimes, one must not question their feelings too much, and, in my opinion, the way a number of people feel about City Lights is just like the movie itself: pure and sincere without pretensions. I am usually a thick-shelled ""insensitive"" person when it comes to movies, especially the ones purposefully designed to bring that little tear out. But the ending in this one made my eyes watery. And that says a lot.""Tomorrow the birds will sing. Be brave. Face life."""
diac228,"Nov 3, 2008",8/10,"Believe it or not (especially nowadays) there was a movement of actors, producers, and directors that didn't like the addition of speech to cinema. While most of these ""voices"" didn't hold much weight, they did have one frontrunner that could definitely dent the industry of ""Talkies,"" and that was Charlie Chaplin. Chaplin was so strongly against movies with dialogue, that he continued making silent movies (then eventually with sounds) way after the fad had died. Among his films that defied the industry was the charming City Lights. City Lights is a good bubbly film that has easily one of the best endings in the history of motion pictures. Combining slapstick comedy with good direction, a nice musical score, and a dosage of drama, City Lights is another tour-de-force from Chaplin.There are two plot lines to City Lights, both of them involving The Tramp (Chaplin of course). In one tale, The Tramp tries to help and win the heart of a blind flower girl (Virginia Cherrill). In the other tale, the Tramp experiences a series of antics with a millionaire that gets drunk every evening with him, but then doesn't remember him the very next morning. Both plots mingle a few times, and complement each other as they advance the story forward. The Tramp in the latter half of the movie falls for the flower girl so severely that he begins working any sort of job to come up with the money to fix her vision.Chaplin was one of the most talented men Hollywood has ever had the privilege of supporting; the man can act, direct, write, and even compose music. The music helps make up for the total lack of dialogue and very limited sound. His story at the time was a bit original, as the lead female couldn't see, which adds a dimension of innocence to her character. She represents purity, kindness, and what's right with the world. In the meantime, the drunken millionaire represents all that is wrong. The balance between the two gives City Lights its roller coaster feel, much like the city-like atmosphere setting in the movie. Most of the sight/humorous gags were with the millionaire, while the drama was saved for the scenes with the flower girl. Chaplin himself provides all the funniest moments in the movie, especially the incredible boxing scene.With that being said however, City Lights gets a little repetitive in its jokes, which makes it overall a weaker comedy than The Gold Rush. Whether it's the joke about the amnesic millionaire, the repetitive moments of the kids spitting at the Tramp, or the scene with the chairs; City Lights has a lot of good funny scenes, but they lose flavor and quality once you see them again and again. The Gold Rush doesn't have this problem, as their gags are very varied and never repeat. The Gold Rush also has a much better cast of supporting characters, and has better cinematography.But, the one thing The Gold Rush doesn't have is the incredible ending that City Lights has. In my opinion, if you can't end the movie on a good note, you better be sure to craft a masterpiece of a flick throughout the first two acts. A great ending can save a movie, and a bad ending can utterly destroy a good movie as well. City Lights has the perfect ending for the content presented; it could not have ended in a better way. At this moment, the directing, editing, acting, and music was at its best; its as if Chaplin had saved his best efforts for last. The payoff is grand, and the tears just might stream down your face. That is, if you know what love is.Bottom Line: As a modern, bitter, out-of-the-box independent critic, I try to step away from the expected boundaries of the typical film critic; I try to not give in to the regular mannerisms of the people that get paid to criticize movies past and present. The usual film critic shall state that City Lights was Chaplin at his prime blah blah blah. This isn't the case, as Chaplin has done better work before (Gold Rush; his best work) and since (Great Dictator, a long monologue away from perfection). But, this is a good movie, and is one of the earliest examples of a spectacular ending. City Lights is better and ages better than the typical silent movie, it can hold its own with romantic comedies of today. Its charming story will keep you entertained, and its ending will leave you breathless, wondering why movies of today don't try to end in the same fashion (or at least with the same amount of effort). City Lights is a nice ""comedy romance in pantomime."""
theognis2,"Feb 28, 2024",10/10,"After the start of the sound era, Chaplin maintained his faith in silent films, with his greatest production. The gamble was successful, as audiences appreciated his effort, with strong box office receipts. It is a sort of homage to the Little Tramp character that made Chaplin famous and wealthy. Made in the final days of Prohibition, it recounts the story of a wealthy alcoholic, who befriends the tramp, who saved his life. But the tramp is more focused on saving the life of a young, beautiful, impoverished, blind flower girl (Virginia Cherrill, age 23). The comic techniques seen here draw upon and summarize the history of silent film comedy, while moving beyond it. The balletic boxing match is wonderful, but the powerful, poignant climactic scene is most suspenseful and magnificent."
jamesjustice-92,"Apr 15, 2022",10/10,"I may be mistaken because it was a long time ago but if I remember correctly ""City lights"" was the first movie starring Charles that I watched and since then it has been my absolute favorite. Although being a silent movie in the already moving forward ""talkies"" era it was a complete financial and critical success at the time and ever since is regarded as one of the best movies ever made with which I couldn't agree more.Charles perfected his formula of tragic comedy with ""City lights"", managing not only to make us laugh almost every scene but also touch our hearts and make us weep with emotions at the end (or is it just me?). Tramp is out on the streets again and falls in love with a blind girl, played stupendously by Virginia Cherrill, who mistakenly takes him for a millionaire. And being hooked up by this wonderful feeling he goes all the extra miles and runs marathons to help her selflessly; he even agrees to a boxing match just to get some money for a person in need.People got used to other people walking by or walking out when someone is helpless but Charles shows us another way, a better way to deal with life. He also shows us that looks don't matter when it comes to love: even with your eyes wide open you can miss the love of your life even if he is right in front of you - all you need to do is reach out your hand toward another human being and try and feel him. Most of the people aren't blind but they are when it comes to the simplest and very often the most important things in life and Charles will always be there for us to lead the way.""City lights"" is not just another masterpiece of Chaplin's (which it definitely is) but is also his most ultimate, touching, meaningful and undeniably best body of work before he slowly let himself step out of his role of an underdog, matured, became more political but not less revealing and powerful."
Chaser923,"Jul 20, 2021",8/10,"Yeah nahhh this was really good. I prefer Modern Times by just a little bit though. This is now the oldest film I've ever seen as of July 18th, 2021. The story was really well made, it was pretty funny, and had a great, heartwarming ending. It is only the 2nd true silent film I've seen, and I was once again not disappointed. I definitely recommend."
the-antichrist-is-near,"May 10, 2022",9/10,"Very entertaining and very engaging. Has a good balance between proper storytelling and serious drama on one side, marinated with good old (but more stylized) slapstick and an avalanche of visual gags.Characters work well together; sets are lively; direction and pace are great, the movie has a nice flow to it without getting boring."
skateboardlover93,"Nov 11, 2018",10/10,This film is definitely something special and something that all film lovers must see.
droopfozz,"Feb 5, 2002",10/10,"This may not be Chaplin at his funniest, but this is his best work. Combining pathos with an endearing strength of humanity it is shattering, tear jerking, and beautiful. It is an example of what comedy can be, how it can be used, and how its marriage with drama can work. The final scenes are both shattering and heartwarming and perhaps one of the most romanticly brilliant in film history."
mitch-bulfin,"Mar 10, 2020",10/10,"Upon rewatch, I solidify this film as a thing of astonishing beauty. As great as so much of Chaplin's filmography is, I don't think he ever did anything as perfect as the final few minutes of this movie. Even if this type of film isn't for you, give it a chance and check it out.Mitchell Bulfin"
The_S_Show,"Aug 17, 2003",10/10,"Growing up, I had the pleasure of my father showing me great oldies movies that he enjoyed watching when he was a child.  My father actually showed this film to me saying it was one of my grandfather's favorite movie. Now this is one of my favorite movie.  The emotional expressions, physical movements, and acting of Charlie Chaplin is just incredible.  If you like all of Charlie Chaplin's short flicks, you'll love this feature-length film. This film is a comic genius and is very touching."
nukisepp,"Jan 2, 2021",8/10,"To most 'City Lights' is their favorite Charles Chaplin movie. It is said to be the great auteur's personal favorite amongst his movies. I might be the rare individual in this case - 'City Lights' is not my favorite for some reason. Although, I can consider this as his BEST movie. Perhaps, because here the Tramp character is most nuanced than ever. And the writing is the most complex and complete Chaplin has ever achieved. Physical comedy is precise - just look at that fight scene (I wonder, were Buster Keaton jealous of that?). There aren't many stand-alone gags, every joke is there to move forward the story or develop the character. Funny and touching, but the most important is (one of) the message the movie carries - only an outcast can help an outcast. Psychologically and philosophically 'City Lights' is much more complex than its slapstick exterior shows at the first glance. The pantomime only enhances the magical fairytale feel - the real love never needs words. In 'City Lights' the Tramp is at his most romantic adventure ever, where he shows utmost bravery and selflessness. He doesn't only try to help his love interest, a blind flower girl (ever so charming Virginia Cherrill), but he also puts his own life on the line to save a millionaire (Harry Myers makes convincing alcoholic and is funny in his own right) from suicide, although, when sobered up, the millionaire doesn't want to make any dealings with the Tramp. Even there, Chaplin has written more complex social criticism than just pointing out the gap between the rich and the poor.Sweet, hilarious, and sad, delightful, and thoughtful movie. If you don't find yourself moved by this movie, my friend, then you are no longer my friend."
basketkokibowl,"Oct 11, 2018",9/10,"This movie was my first silent movie I have watched. 
Needless to say, performance by Charles Chaplin in this movie is really hilarious. And the way the story proceed is flawless. Every scene is important has meaning to following ones.
I knew Chaplin's performance was funny to watch and that's what I expected before. But there was something I didn't expect so much. It was romance story of this movie.
Blind girl by Virginia Cherrill, was really charming. The story of Charles and Virginia was really romantic. As of 2018, everything still holds up."
Will3451,"Jun 7, 2010",10/10,"This is what you can call real art because this movie really is a piece of real art. People frequently call many movies of current age 'work of art' or 'masterpiece' and in a sense those movies are. Me too label many of today's movies with words like these but when I compare those movies with real classics like City Lights those movies seems nothing to me. Charles Chaplin was a true genius, the way he executed the story of this movies is just amazing, the way he directed that movie is just exceptional. I won't try further to tell how great this movie was because words can't really describe how great this movie was, words can't describe art. You have to see this movie to acknowledge the greatness of this movie and Charles Chaplin."
indrajeetchutia,"Feb 28, 2020",9/10,"City Lights is my debut of Charlie Chaplain's filmography, I'm not used to silent movies yet but I definitely can say City Lights is a great start for me. While I didn't laugh a but was still funny and it was heartwarming, it actually made me care about the characters and their relationship, the movie made me happy and sad at the same time. This movie is almost 90 years old and yet I never felt once that it outdated, while watching the movie I realised how to this film or maybe Chaplain particularly inspired many movies and also many cartoons. This movie has lots of memorable moments that will remembered forever in film history."
anton-6,"Jun 19, 2001",10/10,The tramp falls in love with a blind girl who has big financial problem. The tramp has a on-and-off friendship with a drunk rich  millionaire who allows him to be the girls benefactor and suitor.....I like modern time a little bit better.But this is still one of the greatest films I have ever seen.The boxing scene is one of the funniest scenes in film history.A big masterpiece who is both funny and touching on the same time. My second favorite Chaplin film.5/5
lanqui,"Oct 5, 1999",10/10,"If there is one picture people should see, silent or otherwise, this should be at the top of the list for consideration.  Chaplin is at the top of his form.  He plays the viewers feelings like a virtuoso with a violin.  You laugh, you cry, and then your heart is squeezed tighter than a size ten foot in a size five shoe."
ethanbresnett,"Jan 15, 2025",8/10,"City Lights is my first foray into the films of Charlie Chaplin and it was a very delightful experience.Chaplin commands the frame with his impeccable comedic timing and physicality. An expertly crafted boxing sequence really demonstrates his ability in a hilarious scene, but he is marvelous throughout.The story is charming and doesn't feel particularly dated at all which was a surprise. It follows Chaplin's famous Tramp as he woos a blind woman and endeavours to pay for surgery to repair her sight. The musical accompaniment to the whole film is lovely as well and matches the vibe and tone of the film perfectly.Overall a truly lovely experience that has me excited to dive into more of Chaplin's filmography."
Billy_Boy_,"Jul 22, 2025",9/10,"City Lights might just be my favourite Charlie Chaplin film. I went in expecting some classic silent comedy (and it definitely delivers on that), but what really surprised me was how touching and emotional it turned out to be at the end.Chaplin's Little Tramp character is as funny and charming as ever, stumbling through life with his usual mix of chaos and kindness. Even nowadays, the scenes with the drunk millionaire are fun to watch, and the boxing match is still one of the funniest slapstick sequences ever filmed. But underneath all the laughs, there's this really sweet, heartfelt story about his relationship with a blind flower girl. The ending also completely caught me off guard. It's simple, but so powerful and beautiful. One of those rare movie moments that just sticks with you and Chaplin at his absolute best!"
Mnemosyne15,"Mar 18, 2020",8/10,"This is both a love film and a comedy film. The film has no dialogue, and completely relies on Chaplin's genius performance and the right soundtrack to show us a love story with tears in laughter. Inferior to the current sound film. Feeling that simple touch in the laughter, you don't need to use words to express it, you can feel it slowly. The perfect combination of music and plot in the film has further sublimated the plot."
Ruskington,"Apr 10, 2020",8/10,"City Lights is a charming film, centred around a compelling and uniquely engineered love story that is beautifully enacted by Charlie Chaplin and Virginia Cherrill. It leads to an incredibly poignant final scene that many consider to be one of the greatest moments in cinematic history.As great as this film is, I didn't enjoy it quite as much as Modern Times. It felt somewhat slow and repetitive at times and there weren't as many great slapstick moments (hilarious boxing scene aside). However, I can fully understand why it is regarded as one of the all-time greats and everyone who likes good cinema owes it to themselves to see that finale."
