user,date,rating,content
deleyshaun,"Aug 10, 2024",9/10,"Se7en - for the most part is a procedural thriller/ mystery featuring detectives young idealist ( Pitt) and cynical and experienced (Freeman) together. They are chasing the clues of a serial killer who uses the seven deadly sins as the denominator of his kills. You don't actually see the murders- only the aftermath. Throughout - the movie delves into themes such as banality of life, evil and humanity intelligently. And at the same time doesn't deviate from the story moving along. There is a lot of dread throughout which is fitting. What elevates this film to ""greatness"" is the final 35 minutes- featuring discussions between the villain ( Spacey) and the detectives after his voluntary surrender- and then the final denouement which will test the viewers faith in this world we live in. It is extremely rare that a film builds you up to expecting a great conclusion - but then actually delivers on this promise. The acting is first rate by all and is masterfully directed by Fincher with great score throughout- especially the last scenes. A truly life changing experience. An absolute must watch."
vav-61764,"Jul 12, 2015",9/10,"As I was watching Se7en, I was both shocked and fascinated, this movie surely can be used as a mirror to other suspense films to show how they should be made. The anxiety and apprehension grows along the film for having such a captivating story, even if some scenes are very disturbing to watch, you can't take your eyes off. Another big contributor to make it more hypnotic is the soundtrack, when it's needed does an incredible work to elevate even more the breathtaking feeling. The director, David Fincher, did an amazing job in crafting this movie, it's proved how talented he is and something noteworthy is in some particular scenes, how they were shot regarding the style, angles of the camera that make you feel like you're in the scene.The cast, both leading and supporting, did a marvelous work in performing the characters. They're so consistent and believable, we really have the chance to know the identity of every single one in terms of dreams, emotions, regrets. Morgan Freeman plays an old detective, Somerset, who is fed up with his detective's life, because the city and the world as in general are too hateful, the apathy is present in people's everyday life and he can't take any longer this. He's methodic, pragmatic and due to his long career in the police, he's very meticulous in a crime scene. Detective Mills is played by Brad Pitt, different from Morgan Freeman's character is a young detective with a lot of stamina, enthusiasm but he's reckless and very emotional too. The contrast between the characters is pretty perceptible and is very well explored to show a man already marked by a tough and cruel world, Somerset, and other still untouched and a bit naive about the cruelty of the society.The murder scenes are so realistic and disgusting, they really make you feel uncomfortable and revulsion witnessing them and passing how sick the serial killer is. The murderer, John Doe, is played by Kevin Spacey. The tension drastically grows when he's speaking, his performance succeeds in portraying a person mentally disordered, a psychopath. No Doubt, John Doe after such a remarkable acting gained a sit among the most famous psychopaths of the cinema."
deatman9,"Oct 14, 2012",7/10,"This movie was just awesome.A thriller that really leaves you on the edge of your seat the whole time your watching. It starts morgan freeman who always does a superb job, accompanied by brad pitt who always did an outstanding job. And to top it all off it was directed by David Fincher who has made some great movies.This movie is about two detectives (Freeman,Pitt) who are sent to invesitage a weird string of murders. There is a murderer killing people using the seven deadly sins as justification.Overall this movie was really good. Great actors, great story line and a lot of twists and turns to keep you interested. I really liked it."
archiebalsdon,"Apr 8, 2022",N/A,When I first put on the movie my expectations were very high and still it exceeded. The characters are fun to watch and Brad pitt was incredible. The villain was scary and the twist? Unbelievable.
therealwargame,"Dec 19, 2015",10/10,"David Fincher's great style of directing, a movie that's brilliantly dark and it's superbly acted. Morgan Freeman and Brad Pitt are a pairing couple or opposite personalities and Kevin Spacey is the villain we all love and hate, such a great performance. Intelligent writing with no clichés and the imagery of the grotesque never descends into thoughts unnecessary gore or sensationalism. Brilliant cinematography with a bleak tone, the film has a sense of dread and some moments are climax. Se7en sticks with you in your and it's really unforgettable. The plot keeps you hooked until the most terrifying final moments you will ever see. It is scary because it uses your imagination against you in a deep, deeper level. A classic crime thriller that remains uncompromising no matter how many times you watch it."
shahaberry72,"Mar 2, 2022",9/10,"I was too young to fully appreciate this when I first watched it. Now though, whole different game. I love it so much that I think I'm watching it every year. Fincher's finest."
sir_striker886,"May 1, 2017",10/10,It's very hard to talk about this movie without spoiling it so I need to keep it simple. Thinker/mind bender. Its insightful/disturbing nature is the only reason why I can see that it only has 8.6 rating. It's a movie you have to pay attention to. A movie you can watch over and over and always find something new. If you don't agree with that... watch it 5 years from now.
hooflethroid,"Jan 11, 2004",10/10,"I first saw this movie when I first visited America, I knew nothing about this film (as it had just opened) so I paid my money and gave the film a chance. It simply blew me away. The ending is just unbelievable. The performances are fantastic, the direction and art design are exceptional and Kevin Spacey (my fave actor) popping up towards the end was the icing on the cake. Plus every time I watch the film now it reminds me of being in America... it's my favourite movie, for so many reasons. :)"
berggeit9,"Jul 2, 2005",9/10,"Se7en is a reflection of our everyday life, we live in a world filled with media & information technology which makes people often live beside each other instead of with each other, even though the serial killer is portrayed as the devil in this movie i can empathize with his feelings/opinion about seeing sins on every corner of the streets. The intellectual, patient personality that's Sommerset & the young rebellious ""let's dance"" Mills really contrast each other, creating interesting character development.We as the audience are confronted with biblical/religious statements throughout progress of the film concerning homocide cases, if Sommerset had to choose a playing card then he'd retire as soon as possible, he's been doing detective work for way to long, but however he does get motivated by the unusual case of 7 sins that are about to unfold including all the plot twists & turns.Se7en has been directed with unusual grimmy & dark look, during the film it's constantly raining, as if time never seems to change the mood is captured with great directorial vision, the dark & wet apartments that seem to be abandonded for ages, a combination of brown & black colors recreating a new kind of innovative film noir, consciously leading us to unique cinematographic history.Sommerset comes to terms with our serial killer John Doe & even though they might agree on certain points when it comes to the subject of everyday life, these 2 characters are worlds apart at the same time, in a sense that John Doe murders his victims using the 7 deadly sins.Pacing of this movie is nice but if you're expecting a big action movie, perhaps you're better of watching a vin diesel (XXX) movie. We're invited by the director to be intellectually stimulated, while the story develops we must think along, asking ourselves new questions about every single horror murder committed as we go.With that said the film is in my humble opinion highly recommended, especially if you're a fan of the acting skills of Brad Pitt & Morgan Freeman, it's got quality(not much though)action, dark mood, acting, story development, character development, mystery, among others. Even though not for the faint hearted, since some scenes of the committed murders are visually shocking to say the least (adult rated), Se7en is a great police drama by director David Fincher. * * * * * * * * * 9 OUT 0F 10 STARS !"
danamadeus,"Jul 4, 2013",N/A,"I'm a little late to the party with Se7en, as I first watched it just this year. One of those things where it's been in the queue forever and I'm slowly working my way through. Anyhow as a result of my procrastination, my ""experience"" of the film was slightly desecrated, but my appreciation was not. I realized just before I reached the massive twist of the film that I saw what was coming. I don't even remember who spoiled it for me...but oh well.The only reason I address this is the final scene of the film is by far the most talked-about aspect of the film...by FAR. And I didn't think it was greatest final act shake-up I've seen, but the movie itself is incredible.My favorite part of Se7en is it's stylishness. David Fincher delivers a beautifully noir aesthetic to the piece that colors the entire story. And my other favorite thing about Seven is the surreality of the nameless, ever-raining, Gotham-like, hellhole city where our mystery unfolds. I cannot overstate how much I love that story-telling choice. It gives the film an immeasurable sense of dread and intrigue. Aesthetically, simply a masterpiece.Se7en's other major strength it its leads. The script doesn't over-talk anything; it's economical and concise, but provides just enough chemistry for it's protagonists to make this ""buddy cop"" film stand out. Pitt and Freeman turn in some of their most thoughtful work and play excellently off one another. It's a character piece that succeeds without dwelling too long on exposition or any forced ""bonding"". Their relationship develops naturally, and in the face of abject psychological chaos, calm moments are brief and rare.I suppose it would be unfair to not mention Seven's creatively macabre components as well. I realize I didn't include a synopsis, but if you haven't already heard it 100 times from cinephiles and review sites, I'm sure it's somewhere on this page. The killer in Seven patterns takes inspiration for his murderous work of art from the seven deadly sins, and dispatches his victims in accordance with said sins. But the bizarre and disturbing, (albeit not explicit) murders are still a means to an end. The film's really about the tone, characters, and noir feel. 8.1/10"
Tiamat10,"Jan 29, 2000",1/10,"I can't understand what the critics saw in this film.  It's basically a standard serial killer film full of cliches (old cop on verge of retiring and young eager cop full of new ideas -yawn) but with two main differences - the ending, and the sheer grossness of the murders.I've watched many horror and crime movies and I'm not squeamish but I found the murders so unpleasant that I became detached from the movie and started wondering.  .  The disgusting crimes combined with the general darkness and mumbled dialogue made the whole film depressing and hard to care about.As for the ending, it only served to remove any suspense that had been building up.  I didn't find the last few scenes shocking or surprising - I realised what was coming and just wanted it to be over.Well made - maybe.  Well acted - perhaps (if you could make out all the dialogue).  Innovative - yes, but not in a good way.  Imaginative - yes, but not the kind of imagination you want to dwell on.  Watch only if you actively enjoy being made to feel miserable."
Hitchcoc,"Mar 9, 2010",8/10,"I was totally taken with this film. It's not The Usual Suspects, but it is really something. Unfortunately, I felt almost sick when I was finished watching it. The madness of the murders and the general philosophical sickness that carries it along put it out of reach for some of us. I can't imagine the world portrayed here. Great cast. I really thing Brad Pitt is excellent; and, of course, Morgan Freeman is his usual complex self. Once again, however, in a relatively brief appearance, Kevin Spacey steals every scene he's in. It's that unflappable delivery of his. No matter what is said or done, he anticipates it. The murders are hideous. The camera doesn't show the most gory details (which I appreciated), but they are sold to us through outside factors. I missed this the first time through and wanted it to be part of my movie-going experience. I don't think I could ever watch it again."
i_know_people,"May 10, 2005",10/10,"i love this film, it is the ultimate thriller film, everything about se7en is brilliant. the cast are well picked and make the best contributions, the main characters Somerset and Mills are portrayed perfectly through Freeman and Pitt. in my opinion this is both Pitt and Freeman's best film, they still have not outshines there fantastic performances. Paltrow as mills wife was a good choice though there are a few other actresses that could have played this part, though i think that what paltrow brought to the role was the fragile emotional side of the character, so i am pleased that she played this part so well. the director is my favourite of all time, Mr David Fincher! he is a fantastic director, not just for this film but for his other films like fight club. he gets fantastic results from his cast and crew and makes the perfect film. and as i'm a budding editor myself i have to mention the fantastic edit on the film, by the editor Richard Francis-Bruce, i do love the edit on seven as he cut at hit points and generally did well.if you haven't watched it watch it, if you've seen it seen it again! i certainly will."
addictive1,"May 16, 2017",10/10,Brad Pitt and Freeman are very good duo in this movie. I admired the acting. The story was so beautiful. The final scene is very impressive and amazing. People go into a lot of different emotions.Everybody thanks for the movie. These types of movies are not satisfied with one time of watching.
supertom-3,"Jul 23, 2004",10/10,"David Fincher has become one of Hollywood's most wanted directors since this film and this is a fantastic film. Since this he hasn't done a bad film, in fact most are excellent. Seven is more conventional than his films the Game and Fight Club but it has a great script which is fantastically directed. The actors of the film are of the highest calibre. Morgan Freeman, Brad Pitt, Gwynith Paltrow and Kevin Spacey are all fantastic, Freeman and Spacey in particular. The film has plenty of twists and is involving while everything comes to a shocking and stomach churning ending. This is definitely one of the best crime thrillers ever made.As with other Fincher movies it looks fantastic. The cinematography is outstanding. The score is also fantastic and the overall look and sound of the film is top class. This is a modern classic, no doubt. *****"
Mister_Gordon_Shumway,"Dec 2, 2007",10/10,"Long is the way, and hard, that out of hell leads up to light ... (John Milton, Paradise Lost, Book II. Line 432)""Seven deadly sins, seven ways to die"" is the tag-line for this intense psychological thriller directed by David Fincher:~ Detective Sergeant Mills (Brad Pitt) is set to replace Detective Lieutenant Somerset (Morgan Freeman), a world-weary cop retiring after years on the force. Somerset can see no end to the harrowing crimes he has witnessed, the sickness that is the City. Dealing with murder, rape, abuse, and poverty has become the Lieutenant's life and he now hopes for some small shred of peace. Mills, on the other hand, is new to the city; he is arrogant and brash, having little time for Somerset's thoughtful and analytical techniques.As retirement beckons, so a new spate of killings begin. Like it or not, Somerset is given the investigation by the Captain (R Lee Ermey) while Mills is put on a different case. The murders are soon linked to the same killer - a twisted genius who chooses his victims based on the seven deadly sins in Dante Alighieri's 'The Divine Comedy' - and Mills and Somerset are paired together once more.Despite their clash of personalities Mills and Somerset strike up a good partnership, Somerset's introspectiveness and Mills's self-confidence turning out to be a useful combination. Each one learns a lot from the other; indeed, Mills's wife (Gwyneth Paltrow) thinks Somerset is a good influence on the husband she is rapidly growing concerned about.It soon becomes apparent that the 'sins' killer is playing a deadly cat-and-mouse game with the detectives, enjoying watching them either stumble or succeed at every turn in the case ... while he continues to kill according to the seven deadly sins: gluttony, greed, sloth, envy, wrath, pride, lust. They must stop him before he can finish his murder spree and most probably disappear forever ~ Se7en is not only the most accomplished film by David Fincher (Zodiac) but almost certainly - from a writing and directing viewpoint - the best psychological thriller in the history of film and television. There are none of the stereotypical clichés found in countless thrillers of violence, no room for the predictable, for the viewer is kept constantly in the dark until the very end. And the climax is both ferocious and awe-striking ... for once Hollywood kept the outcome a secret until the day of release, not an easy thing to do.Whatever vision Andrew Kevin Walker had before he took his script to screenwriter David Koepp (Secret Window) was ultimately realised once in the hands of David Fincher. Fincher's dark and rain-driven sewer, his city of sins, has yet to be matched on film. His choice of cast was spot-on. Se7en is a true classic, crossing genres like crime, horror, thriller and police procedural ... dark and moody, harrowing and painful, Se7en will appeal to the darker side within us all.Co-stars John C McGinley as California (captain of SWAT team)Matthew J Lee-Williams, Review."
swmoncur,"Dec 4, 2021",7/10,"At times, the movie felt somewhat drawn out to me. Most of the details and scenes were necessary to the buildup, but I felt it could've been done in a more concise manner. The setting and feel of the first 3/4 of the movie also began to feel repetitive and, at times, boring.With that said, the acting and plot in this movie were fantastic-especially the latter. The grand finale, which transpires over the last 20 minutes, deserves a 10/10 rating. Truly chilling the way it all comes together at the end. If it were all accomplished with a bit more brevity I think the desired effect would have been even more powerful."
gazzo-2,"Oct 15, 1999",N/A,"You are in for a real treat here film fans: endless scenes of torture, abuse, bondage, a beheading, rape; assault...body functions, the human condition as a Butcher block, if you will.Nothing in this movie makes me want to see it again-Morgan Freeman was better in the Electric Company; for Pete's sake, than he was here-and for Brad Pitt....he looks like he was mad at his agent for making him be there. Kevin Spacey is okay but so what? He was much better in Usual Suspects and the Negotiator. Gwyneth Paltrow as always seems vaguely emaciated, and the main co-star, the smothering rain-was as much in the way as anything else.Don't go see this unless you have always wanted to know what the cause of a Scripted Barfing marathon looks like. Personally I can't imagine why dreck like this and Hannibal Lector keep on getting made; Hollywood must be wanting to reach the Jeffrey Dahmer/John Wayne Gacy demographic more.Rating? ** outta ****; I hated this one-belongs in the goat bin."
peisherman42,"Jun 13, 2022",8/10,"The filter, the rain and the depressing elements from the city in general set the dark, mysterious vibe of the movie, grabbing your attention from the start.The actors are, as expect, amazing are delivering their lines and had a lot of chemistry with each other. The dinner scene was especially super natural and spontaneous.I also really enjoyed how the film isn't scared to show heavy gore in the victim's scenes.But, to be honest, the plot was not as intriguing as I was hoping for. Sometimes, the investigation seemed kinda forced, like they were really lucky to find answers. Maybe my expectations were way too high. Still one of the coolest thrillers I have ever seen tho."
pretg,"Feb 11, 2008",10/10,"This movie is such a 'blockbuster' that it is only movie I have ever purchased on DVD. I do not purchase movies because they are a waste of money to me, because I don't like to watch most movies more than once, and because it is so easy to download movies to ones PC from different websites for little money. But I purchased Se7en because this is the one movie I can watch over again. Me purchasing a movie is the highest assessment I can give. So watch Se7en for yourself; it is suspenseful, a thriller, has a great cast of actors who all perform outstandingly, and most important of all an ending no one could have guessed. I just wish that other writers, directors, etc., could produce more movies of this quality and genre."
emperor_bender,"Feb 24, 2008",10/10,"It really was. I saw this movie in a Five Below store. There were about 10 copies of the normal version, and abut 2 of the special edition ones that look like notebooks. I went on a limb and bought the special edition for $5. I had no idea what this movie was like nor what it was about. But I am so glad I took the chance and bought it. This movie turned out to be a personal favorite. Morgan Freeman was excellent, not just because he's a great actor, but because in this movie he was different than the ""optimistic, nature-loving"" characters he usually plays. In this movie he plays the close-to-retirement Detective William Somerset, who dislikes the world and what it has become. Brad Pitt gave a great performance as the loud-mouthed, over-jumpy Detective David Mills. Usually I don't like Brad Pitt and I think hes obnoxious and a lousy actor, but in this movie I'll make an exception. He was obnoxious in some ways in this movie, but it fit his character perfectly. Gwyneth Paltrow gave a decent performance as the stressed Tracy Mills. R. Lee Ermey was great as the Police Captain, I always enjoy his performances no matter what the circumstances. Even the bad guy (Will not give the actor's name to prevent spoilers) was Grade A in his part. The weather was rainy for most of the movie, and scenes were always lighted in small doses, meaning it was dark and gloomy for most of the film. THis really set the tone. I recommend this movie to fans of crime, thriller movies. 10/10"
ketulpatel23,"Nov 9, 2024",10/10,"I love long movies where there is plot and deep cinematography. Se7en maxes all that and more it is an absolute thriller. It contains strong graphic content so it is not recommended if you are watching with children. The storyline is amazing far from predictable and the actors have played their characters quiet well. Amazing shots were captured in rain. A well-executed thriller crime suspense movie captivates the audience by combining intricate plotting with psychological tension, resulting in a compelling narrative that keeps viewers on the edge of their seats. This genre demands not only a masterful control of pacing but also an ability to craft a multifaceted storyline with layered characters whose motivations gradually reveal themselves. In a standout thriller, the screenplay balances red herrings and plot twists with precision, ensuring that every revelation feels both earned and surprising.The strongest elements of this genre often lie in the interplay of suspense and surprise. A great thriller doesn't merely rely on shock value; it builds tension through atmosphere and character development, often manipulating time and perspective to heighten anticipation. The strategic placement of dramatic irony-where the audience knows more than the characters-creates an unease that lingers even after the film concludes.Cinematically, these films leverage mise-en-scène and visual storytelling to reinforce the emotional undercurrent of the narrative. A moody, often claustrophobic setting can become as integral to the plot as the characters themselves, amplifying the sense of isolation or danger. The sound design and score work in tandem, subtly guiding the viewer's emotional response while intensifying key moments of suspense.Moreover, a well-crafted thriller embraces a dynamic moral ambiguity, often leaving the audience questioning the very nature of justice, right, and wrong. The protagonists, often flawed and morally complex, can blur the lines between heroism and criminality, compelling viewers to confront uncomfortable truths about human nature.In conclusion, a truly remarkable thriller crime suspense movie is one that not only entertains but also challenges perceptions, providing a visceral experience that lingers long after the credits roll. It remains an art form that requires both technical skill and narrative ingenuity, marking the genre as one of the most enduring and impactful in contemporary cinema."
