user,date,rating,content
Finntroll,"Aug 2, 2004",N/A,"David Fincher's breakthrough Se7en is one of few movies that deserves to be called a masterpiece. An incredibly dark movie (for mainstream that is) about cruelty and human depravity that hooks it's fangs into the viewers spine like a bloodthirsty beast and won't let go even after the movie's over. This is both very wellplayed and wellcrafted. Gwyneth Paltrow, Brad Pitt, Morgan Freeman and Kevin Spacey all do top-notch performances, the script is one of the strongest in years and the ending must be on of the best I've seen. It's strange that a movie that doesn't rely on shock effects can be this shocking. After I saw this I was amazed by the pure cleverness of it all and the way I felt. The depressing mood of it all is just perfect and it works wonderfully as a foundation on which this movie lies. Go see it now.10/10"
miguelneto-74936,"May 19, 2016",9/10,"Seven has one of the best original scripts of cinema, and one of the most amazing already made ​​finals for only the second movie of the excellent David Fincher he sent well , seven with Gone Girl is the two best Fincher movies in my opinion , the performances are great , the duo Brad Pitt and Morgan Freeman works very well , the rhythm is good, and the script explains very well , even with a few holes , the soundtrack is more or less , I say it because I did not notice right it, photography is good , Seven in my opinion was wronged Oscar 1996 deserved indicated best film, best actor, best screenplay is better sound (which was his only statement, Seven is a great movie with a great cast and a screenplay very intelligent. Note 9.4"
inanisumeet,"Mar 22, 2015",8/10,"this is of 1995 and yet scenes are so realistic . it seems they really killed a person to show believable autopsy . Morgan freeman as about to retire detective plays the part very well while brad Pitt is young guy who partners him in last case . gwyneth paltrow looks charming . story is depressing . notice how the credits roll at ending , then you will know the idea of director . there is a chase scene in which cop is alert & determined , committed to his duty , uncaring of his scars , yet evil sneaks up on him . the picture of life painted is quite bleak . the limitations of law rule book are shown . the apathy of human beings to each other makes situation grim and hopeless for viewer ."
neerajmenons,"Jun 30, 2024",10/10,"David Fincher's ""Se7en"" is a grim, unrelenting journey into the darkest corners of human nature and morality. From its haunting opening credits to its shocking and unforgettable climax, this film remains a benchmark in the thriller genre.The story follows two detectives, the seasoned William Somerset (Morgan Freeman) and the brash rookie David Mills (Brad Pitt), as they hunt down a serial killer who uses the seven deadly sins as his modus operandi. Freeman and Pitt deliver powerful performances, their contrasting approaches to justice and life providing a rich, emotional core to the narrative. Freeman's portrayal of Somerset's world-weariness is a masterclass in subtlety, while Pitt's raw intensity captures Mills' youthful fervor and desperation.Kevin Spacey's chilling portrayal of John Doe, the methodical and philosophical killer, is one of the most compelling antagonists in cinema history. His calm demeanor and twisted rationale make for a deeply unsettling character that lingers long after the credits roll.Andrew Kevin Walker's screenplay is tight and meticulously crafted, each sin-related murder scene more gruesome and thought-provoking than the last. The dialogue is sharp, often poignant, and imbued with a sense of impending doom.The film's cinematography, by Darius Khondji, is visually arresting, utilizing a desaturated palette to emphasize the bleakness of the urban landscape. The relentless rain and perpetual gloom heighten the sense of decay and hopelessness that permeates the film. Howard Shore's haunting score further amplifies the film's eerie atmosphere, blending seamlessly with the visual elements to create an immersive experience.""Se7en"" is more than just a crime thriller; it's a profound exploration of human depravity and the complex nature of justice. The film poses difficult questions about the nature of sin and punishment, forcing the audience to confront uncomfortable truths about society and themselves.The climax of ""Se7en"" is one of the most shocking and powerful in film history. It is a testament to Fincher's directorial prowess that the tension remains palpable, the revelation both horrifying and inevitable. The final moments are seared into the viewer's mind, leaving an indelible mark that sparks reflection and discussion.In conclusion, ""Se7en"" is a cinematic tour de force, a film that excels in every aspect of storytelling, performance, and technical execution. It's a dark, disturbing, and unforgettable journey that stands the test of time. If you haven't seen it, prepare yourself for a relentless and thought-provoking experience that will stay with you long after the screen goes dark."
MysticSolver,"Jun 2, 2024",8/10,"The main actors of the film deliver hard on this one, bringing the stakes to another level and making the movie quite thrilling to watch, even when I have seen it multiple times.The movie of course is very dark, but considering when this was made, I can appreciate that because it must've been a very risky choice at the time when cinema was overall a more positive environment when it comes to the themes and imagery of film. This film won't hold back on its grittiness, but also doesn't show you stuff just out of the need to be dark, and that I also appreciate quite a bit with shows like The Boys around which do the polar opposite. Dark for the sake of being dark is never an appealing thing for me, and never will.So much has already been said about the movie that I'll end my review here, movie is solid 8/10."
m-burakyuksel-564-438070,"May 17, 2020",10/10,"When I first saw the movie, I was too young to understand the movie. Many years later, I re-watched the film. It's really a much better production than any other film that's been made in those years. Morgan Freeman once again plays an old retired citizen. Ever since I was born, he's always been old."
braddugg,"Sep 8, 2016",10/10,"Calling this film 'Terrific' would still be an understatement.Engaging right from the word go, and shocking at the end, this film is an epitome of writing and shows that if a well-written script is directed well, then everything becomes great. David Fincher was not a great well-known when he was making this. His first film Alien 3 was supposedly panned by most people. Then, he took on directing this cold blooded murder mystery film, and boy he did the job extremely well.The dialogues are extremely important and they have a lot of weight. It's rare to see a thriller filled with such nuances and have a deep meaning to words. The action is minimal and yet has a very high impact. The culmination or finale is a shocker. To say the least, the last 30 minutes are riveting and spine chilling.The nearly 130 minutes film becomes highly action packed after 90 minutes. In the last 40 minutes, actually, there is a lot of dialogue that's very provocative than action. Yet. it's so very engaging that it takes me to the edge of seat each time I see this film thus, I call it as action-packed. I must say, I have seen this film multiple times, with multiple people as my viewing partners, and each time I like it more. So this film just keeps growing on me.The cinematography is amazing and so is the editing. These two departments technically are supreme. Other departments did their job well too. Of all, it's the direction that mattered. Fincher gave us a glimpse what he is capable of with this supreme film, his next one was ""The Fight Club"" which is a cult in itself.It's a 5/5 for a great film that surpasses time to stand out as a classic thriller. I have not named the actual supreme character in this film, so go and find out who it is and what he does."
DVR_Brale,"Sep 7, 2016",7/10,"Why is Se7en so good? Well, one of the reasons is because it was directed by none other than David Fincher who is well known for his perfectionism. Other reasons include amazing cast and interesting concept with religious main premise. Morgan Freeman, Gwyneth Paltrow, Brad Pitt and one I won't mention because Fincher decided to kip him as a surprise all delivered amazing performance. How can you not like Freeman's relaxed and gentlemanly attitude (he loves books) as opposed to Pitt's sort of angry and action type character (he loves chase)?Do you think that people who commit deadly sins deserve to live? Of course you do, but this serial killer doesn't. He thinks that the world is better without them. Theologically speaking, deadly sins are called deadly because they have been identified as a root cause to other sins and separateness from God. As a result, one who commits one of those, shall find nothing but darkness in his life and will eventually loose capacity to be happy. If one doesn't want to end like that (spiritual death) one has to firstly turn away from his sin, ask God for forgiveness and then expiate his sin. This serial killer is not merciful. He positions himself as a god who doesn't forgive or give chances to turn away from them. Since spiritual death is a final result from consistently committing deadly sins, this serial killer delivers physical death by murdering his victims in a way that particular sin harms them. He had given himself a right to deliver justice; but justice without love becomes cruel.After this short theological reflection let me now turn my attention to detectives Somerset (Freeman) and Mills (Pitt). As I mentioned earlier, they stand opposed but somehow complement each other. Together they discover frightening and bizarre murders and react in a way specific to them. This is important when you consider the ending. Everybody knows Se7en has one the most shocking ending ever made (other being Requiem For a Dream). Since committing deadly sins influences character as well (not only spirit), carefully watching both detectives actions ads to your understanding of Se7en. This movie is not about chase or little evidences analyzed by technology; it's about seeing people behind the mask, the way we truly are. That's at least what I think.So why did I give Se7en a symbolic seven? I don't have any particular reason. Se7en just lacks that something some other movies have. Apart from being shocking, it didn't stick with me. It's predictable as well, but it seems to me that Fincher decided to make it that way on purpose. We know what is going to happen and that gives us more ""space"" to focus our attention on characters and the way they'll react and not on story itself. Soundtrack could be somewhat better as well. Se7en also lacks that noir feeling that would've made it better.So to conclude: Se7en is a shocking and cleverly made movie with great cast. Underneath the hub is a lot of material for reflection about human nature. Those of you more philosophically oriented are surely going to enjoy this one or should I say seven."
bek-25198,"Feb 21, 2016",10/10,"I may not be a Film expert, but as a new English Learner(at pre - intermediate level) when I was 11; I first saw this movie and with the help of adolescence I was touched by it(Not like your uncle did to you).Morgan Freeman was always my man, but with Brad they made and awesome couple. I watched every Freeman Movie there is and I have to say after Shawshank, This is definitely the second movie.If you are a simple movie watcher, not reading between the lines, do not bother. Themes between those lines are epic and so clear that it moves. well at least it moved me.Have Fun all;"
scarlettimogen,"Dec 12, 2019",10/10,An absolute masterpiece.....simple as that.......absolutely the best film I've ever seen
Macleanie,"Jun 19, 2019",10/10,"An incredibly dark and noir thriller by David Fincher. It stars three of hollywood's best in what is a twisted mystery with some classicly memorable scenes. Right from the off, this movie sets a tone which it continues throughout with such strong performances. This is one of my all time favourite movies."
caitlinmalone,"Sep 21, 2016",8/10,"David Fincher reveals a masterpiece of a movie in his film Seven. The movie follows the process of two detectives, Somerset (Morgan Freeman) and Mills (Brad Pitt) as they attempt to track down a serial killer (Kevin Spacey) who is choosing his methods and victims based off of the seven deadly sins. The film is high quality for two main reasons: its complex characters and its moral commentary.The most intriguing character is easily John Doe, the killer. Rather than creating a stereotypical mindless killer, Fincher makes Doe a serious, soft-spoken man, whose power comes from his brain rather than his brawn. Doe is extremely logical and methodical in his approaches, as his killings require intense planning. His character poses as a striking contrast to Mills. Although he is the ""good guy""-the cop, the detective, the one trying to stop a killer- Mills is not likable. Unlike Doe, he raves and constantly shows frustration, and often reverts to physical violence to try to accomplish his mission. Although the watcher probably will still root for Mills, when Doe speaks, they will be more apt to listen. Somerset serves as the voice of reason, reeling in Mills when necessary and respecting Doe's genius as he tries to catch him.These characters, especially John Doe, perfectly display the film's social commentary on the seven deadly sins within our culture. More importantly, they raise the moral question of what is evil, and what is good. There is a clear clash between good and evil within the film, but the reason it is so successful is that it makes the audience ask themselves questions. Are evil people able to be victims? Is society harming the killer or did the killer harm society? What is a just price to pay for evil doings? Therefore, I highly recommend Seven to anyone who is not too squeamish and who enjoys a perplexing film that will leave you thinking. I enthusiastically endorse this film with an ""A""."
davidburrows89,"Sep 22, 2013",10/10,"IMO this is David Finchers best film. Fight Club was good. The Game was interesting, but this overshadows them all.Morgan Freeman and Brad Pitt play two detectives who are after a serial killer who uses the seven deadly sins as his M.O.Brad Pitt actually acts in this film, Morgan Freeman is awesome as always, but Kevin Spacey delivers one of the best performances I have ever seen.This film had me gripped from start to finish, however it is the last 30 minutes of the film that made this so special. Never before or since I watched this film have I ever been so engrossed in a film than I was in the last 30 minutes of Se7en.10/10. Superb."
MrBoMzIMDb,"Sep 7, 2025",7/10,"David Fincher's Se7en (1995) is often celebrated as one of the darkest and most influential crime thrillers of its era. Its premise-a pair of detectives tracking a serial killer who uses the seven deadly sins as his method-is undeniably compelling, and its grim atmosphere left a lasting mark on the genre. Yet, revisiting it as part of a younger generation, the film does not strike with the same impact it once had.On a technical level, Se7en is expertly crafted. Fincher's direction, paired with Darius Khondji's shadow-drenched cinematography, creates a claustrophobic urban landscape that feels both timeless and suffocating. The rain-soaked streets, decaying apartments, and oppressive gloom perfectly mirror the bleakness of the narrative. The performances are also strong: Morgan Freeman brings measured wisdom as Detective Somerset, while Brad Pitt's impulsive Detective Mills contrasts with youthful energy and recklessness. Kevin Spacey, though appearing late, delivers chilling restraint as John Doe.Where the film falters for modern audiences is in its pacing and predictability. What once felt groundbreaking now feels familiar, as countless thrillers and TV shows have borrowed from its formula. The infamous ending, though still shocking, no longer carries the same weight after years of cultural references and parodies. Moreover, while the atmosphere is meticulously built, the character development outside the central trio is limited, making the film feel narrower than its ambitions suggest.Se7en remains an important milestone in crime cinema, but for viewers encountering it today, its impact is somewhat muted compared to its reputation.Summary: Dark, stylish, and influential, Se7en is a strong thriller, though for newer audiences it may not feel as groundbreaking as critics suggest.Rating: 7/10."
SilenceCut,"Apr 13, 2017",N/A,Review (1~5)#Content: Script 5 | Acting 5 | Cinematography 5 | Film Editing 5#Visual: Costume Design 4 | Makeup & Hairstyling 4 | Scenic Design 5 | Lighting 5 | Visual Effects 5#Sound: Score & Soundtracks 5 | Sound Editing & Mixing 5#Overall (1~10): 9
yashu-28429,"Oct 27, 2019",5/10,2.5 hours of boring. Dragged and induces drowsiness at points.
BenjaminPopkin,"Mar 30, 2022",9/10,"Se7en is a 1995 Crime/Thriller directed by David Fincher that stars Brad Pitt and Morgan Freeman as two homicide detectives on the hunt for a serial killer who is committing various dark and gruesome crimes based on the Seven Deadly Sins. This movie is very well filmed and tells a haunting yet realistic story. In the sense that there could be a serial killer who does things like this in real life, because nothing is too extraordinary in the film to the point where it's not possible; so, that's what makes the brutality of the crimes so impactful and horrific.The film has great direction by Fincher. The movie does a good job at keeping you interested throughout. It is written well and Brad Pitt and Morgan Freeman really bounced off one another. I was surprised with their chemistry on screen because I have never seen them together like this in a film before.The films aesthetic throughout the runtime is dark, gritty and filled with dread through the use of production design, composition, color and cinematography. The colors in the film were always murky. Stylistically the film is beautiful in a sick way with how Fincher manipulates what's on the screen and how it's on the screen. Although, there were times in the movie where I didn't even want to look at the screen, but there were also times where Fincher doesn't even need to show us and we still know something horrifc is on the other side by the way it is suggested through the mise-en-scene. (The Lust sin in particular). There is a clear vision that is being executed. However, the focus is not all on the violence, but on the setting and the people as well. The characters all have depth and they feel like real people that we have to spend time with. The scene with Pitt, Paltrow, and Freeman having dinner together is an example of one of these scenes we get that are character driven. The setting is constantly shown off through the mise-en-scene.Overall, I thought Se7en was an amazing movie. I thought it was written well. There were some great dialogue scenes in the middle of the movie as well as the end. The end was really good one of the best parts of the whole movie. The entire third act is pretty insane to be honest. It was very well written and executed; totally had me on the edge of my seat the whole time. The cinematography, writing, acting, and direction were all very well done. The film was disturbing and gritty yet in a way very real which makes it all the more shocking and the climax is one of the best I have seen in a while. I really liked it and I recommend checking it out especially if you're into darker movies."
danrutnut,"Jun 16, 2017",10/10,"I saw this film in an empty cinema with a mate and I came out with chills, Kevin spacey plays his role amazingly same as Morgan freeman and Brad Pitt and could watch this film over and over and it would never get boring! The effects are also amazing the tone of the films is bleak at times but I like that in films so this one is definitely highly recommend!"
PredragReviews,"Jun 13, 2016",9/10,"Seven is a very disturbing thriller about a serial killer,John Doe (Kevin Spacey), killing people via examples of the seven deadly sins - gluttony, greed, sloth, lust, pride, envy and wrath. The story begins with Detective Mills (Brad Pitt) being assigned to Detective Somerset (Morgan Freeman). Detective Somerset is due to retire at the end of the week, and Detective Mills is moving up in the world, and is to take Somerset's place. This is a very disturbing movie. It will keep you enthralled and glued to your seat for the entire 127 minutes. Indeed, I was staggered that I never once lost concentration or was bored with this movie.This is a movie with an unexpected ending that is absolutely unpredictable and which is not at all a ""Hollywood"" style ending. ""Seven"" is symbolic of several things in this film: Of course, the seven deadly sins (Gluttony, Greed, Sloth, Lust, Pride, Envy, Wrath) are the killer's inspiration; Somerset has only seven days to retirement and he was given this assignment as his final investigation; seven is the also the amount of days that transpire between the beginning and the ending of this case; and seven are the amount of victims that are at John Doe's mercy in that time span.Gwyneth Paltrow portrays Mills' wife Tracey, and there is a certain sadness to her character, something she reveals to Somerset one day while they are having breakfast in a diner. Even though her role is not one that is major throughout this movie, she is a crucial element that plays itself out in the climax of the film. One of the most haunting ironies I find in Walker's script well portrayed by Fincher's cast is the uncanny similarities between John Doe, the antagonist and Somerset, the protagonist. If you watch that one scene in the car, you will realize that Somerset agrees with Doe, yet although realizing that their consensus does not justify Doe's irrational, yet seemingly rational killings. With Doe's philosophy explaining his intolerance for the prevalence and trivialization of the deadly sins, Somerset's continuous argument that we are becoming too apathetic of a society, only motivated by such things such as our temptations and self-indulgence, there is admittedly a strong parallel that exists between the two characters. Yet, they stand opposed to one another, because while Somerset, although discouraged, managed to keep his faith in mankind, Doe did not, and could not tolerate the injustice any longer. The film has some gory and graphic scenes that might turn some weak stomachs, but it has everything you'd want from a thriller: mystery, suspense, a great plot, great acting and a great, shocking and surprising ending.Overall rating: 9 out of 10."
TheAll-SeeingI,"May 22, 2019",10/10,"Put your goblins and monster films away: This one's based on the horrors humans commit, and therefore hits home in a real-life way.The performances are incredible. Before Kevin Spacey's behavior got him ""canceled"" by emerging societal trends, he proved himself with films like this one that's a generational actor.Pitt and Freeman also deliver elite performances in a film that's thrilling, mysterious, and ultimately in the Pantheon among the greats."
dnarayan,"Apr 8, 2016",9/10,"one of the best film about serial killer... Meaningful movie,Although the story isn't original, it's powerfully directed by David Fincher, The investigation and the clues that lead to the murderer are well thought out and continually provocative. As a narrative, the film is quite involving.The Morgan Freeman gives another of his superbly understated performances. Decent film making, universal subject, overall good performance, David Fincher is at the top of his form with Seven, one of the darkest, creepiest, and most brilliant serial killer pictures in American film history, far more interesting, handles the violence with sensitivity, announcing its obscenity in spoken analyses and briefly glimpsed post Morten shots, but never showing the murderous acts themselves."
avisheksahu99,"Mar 16, 2022",8/10,"Numbers sold exotic are numbers made not eternal over dispensability inbuilt in rates by dispensability of labour deemed superficial thereby unless boring jobs of taxation do not incorporate labour in the commissioning of numbers as identity to make survive as unreferenced unless referenced in deals of the day keeping nobody over the other unless number defining position in deals is linked indispensibly to other numbers over work undertaken together to keep number loner in disguise for numbers on the loose under threat of no redemption thereby. When number is experience linkages are dreary, when number is riot linkages are weary, when number is style linkages are teary, for a number deleted is deleted nowhere when etched on paper somewhere to keep numbers recorded as identification of departments etched on concrete still."
justahunch-70549,"Sep 30, 2022",7/10,"Took a look at this again after 27 years. While the whopper of an ending has stuck with me, I recalled little else other than that I wasn't super impressed by this back then and I think a lot of that had to do with my then not very high opinion of Brad Pitt. It's a well made, unusual, sometimes gruesome serial killer crime story about with a solid performance from Morgan Freeman. I always had a problem with Pitt when he was young in that I didn't think he was all that great of an actor. I still have some issues with him here, but he's better than I remembered and has some moments that are interesting. This was a big year for Kevin Spacey with this and The Usual Suspects, but it's hard to look at him now in this creepy role that he plays so perfectly. Seems a lot of people on here love this good movie."
