user,date,rating,content
ultimoteimoso,"Apr 5, 2006",9/10,"I'm an American living in Brazil for 5yrs now. I watched the movie on TV the other night and was very impressed with it. The quality was very good and gives you the feeling of actually being there and viewing it first hand. The movie depicts life as it was and still is. The people here are generally extremely poor and desperate. The corruption within this country can be found in ever level of Government and under the table payoffs are a way of life for many. Life is cheap and large numbers of people across the country die a violent death every day. Drugs are prevalent and a big money maker for the drug lords. Every kind of drug can be found being sold on the streets. The poorest of the drug users use a cheap drug by-product which make them easy to identify as their front teeth are missing or black and rotting away. Others walk around sniffing glue. Certain areas of Rio de Janeiro are controlled by the drug lords and their followers just like it's depicted in the movie. They have a small army of very young children working as runners taking orders and delivering the drugs to the waiting customer. In those areas it's not uncommon to see even the children walking openly brandishing a firearm. Even the military and police hesitate to enter these areas as it closely resembles a war zone. What you will see in the movie, believe it, because it is NOT an exaggerated fictional movie. These things are happening in cities all across Brazil every day. On the flip side the majority of people here are very kind generous loving families. They are very religious are honest hard working people. The students work extremely hard to get good grades so they will be able to win a full scholarship to attend the best universities in the nation. Just because someone lives and grows up in a favela (slum) it doesn't mean they condone the lawlessness. Some do become great leaders in every walk of life. I can honestly say I know some of them and am very proud to be able to call them my friends. Watch the movie and I can guarantee you'll be stunned and left thinking about it for day with a sad heart that this exists in our world."
theLRGdon,"Jun 29, 2005",10/10,"wow, this movie is presented very real and done with style. The gritty reality of city of god can be summed up with the shooting of the young child in the foot. with that it becomes very clear that this war extended to everyone, and that moment captivated the crowd into this reality. Then you have the constant hits to the style of the time within the seventies. where it was a time to be ""groovy"", and that is portrayed within Benny, as it gets you captivated into this culture. And yet the conflict with Benny and Lil ze is not mainly what resulted into his death. That feel of the seventies IMO is greatly portrayed within the movie, and sets up a great vibe.A great movie all in all, me being only 15 this is a great movie to see and be able to analyze"
Erniehem2,"Apr 1, 2005",10/10,"This is quite possible the best foreign I've ever seen. I'm a fan of Fellini, of Bergman, they were artist and insightful philosophers, but the gritty reality of City of God is fascinating and unparalleled.The arch of the story and the complex interweaving of the lives we follow resembles mythology, yet this is true and it's modern. Modern Non-Fiction Mythology (which I do see is a contradiction of terms, but I don't know how else to verbalize what how I feel about it).The direction was masterful. Fernando Meirelles and Kátia Lund are equal to a Brazilian Sergio Leone. This is what Leone tried to accomplish with 'Once Upon A Time In America.' He failed. Meirelles and Lund succeeded.This movie will satisfy almost any film lover. If you like films for gangster action, if you like it film for story, or catchy dialogue or for deep philosophy on life and the surrounding world, you will love this movie. Even if you don't like subtitled movies, I will give my promise that you will like this."
Kop_Reaz,"Mar 2, 2015",8/10,"I don't know how to begin. It's one of those films you can't explain easily to anyone else but yourself. Then you have to, yes you have to watch City of God just once in your life.It's a different kind of cinema. Different than your regular average shoot 'em up. Sure it doesn't offer that kind of vibe at first. But if you see through the whole movie, you won't regret it, just have to stay focused on the on screen stuffs.If I ever learn Portuguese, it would be to watch this movie again. It's kind of shame that I had to keep reading the subtitles, when the real deal was not in it. Don't want to perform any further autopsy on this decent and entertaining piece of art.Final Verdict: 9.0/10. A super powerful slap across the face of Hollywood, where you can witness about 10 failures to create a realistic and gun fighting film every year."
tluke25,"Mar 6, 2007",10/10,"The movie FLOORED me! Without a doubt one of the greatest films ever. I will guarantee even Spielberg and Scorsese completely flipped out when they seen this.I cannot believe this was not nominated for best picture. This was easily the best film of the year. LOTR: Return of the King won that year and I can understand finally giving those movies their due, but to have Lost in Translation considered the second best movie that year (which I do adore) . . . but Translation is a script that easily could have been written in 2 days and filmed in 3. City of God is a towering achievement. What an unbelievable script with perfect casting and where they found all these actors (including the runts) and made everything feel so real - and like you were right there . . . gritty yet with beautiful cinematography.In this, there are characters you will love to hate (Li'l Ze), Characters you will admire (Rocket and Benny), and characters you will root for (Knockout Ned).City of God is just like the Middle East. You can always take out one leader but there is always someone from the generation younger waiting to step in and do the same . . . they learn it all from seeing everything around them. There will always be chickens (good metaphor used in film) and runts running around to catch."
PIST-OFF,"Nov 25, 2005",9/10,"it's been a while since anything with the violent intensity of ""city of god"" has come out in the united states. this film definitely marks a good start for the director Fernando Meirelles and his use of film technique that is very similar to David Fincher, David o Russell, and Guy Ritchie. lots of frantic energy and cinged colors. one of the movie's main antagonists Lil Ze runs around like a miniature rabid Samuel l Jackson circa pulp fiction. the story centers on the criminal lives of children and young adults in Rio de Janeiro. i think that the movie while never making a political point of it lends a good amount support about just what type of anarchy results from the failed international war on drugs, including but not limited to: the creation of a black market, that gets increasingly violent as it is cracked down on, corrupt police tactics, an excess of wealth and desire for firearms for criminal purposes, international civil unrest, and a broad tool that the have-not in society may use to fore-go education in favor of black market profits. all that nonsense aside, this film is powerful in several ways.the young actors really really manage a tremendous job of translating raw emotion directly to the screen. i'm not sure to many young American actors could have pulled off such a feet of acting. is it even acting? the wonderful pacing and extensive use of flashback to move the movie through a great narrative direction. the setting itself, much like the french setting in ronin, adds a lot of detail and quirkiness to the way the film looks and the overall feel. all these things come together quite wonderfully for one of the best movies i've seen in a while. the only thing i missed is the fate of the lovely angelica is never revealed or mentioned, she simply disappears from the narrator's life and from the film. with the exception of that i i think the film was nearly flawless. this in comparison with the recent viewing of the french movie ""those who love me can take the train"",and it looks like France's future as a leader in good cinema is uncertain at best and unimaginable at worst.9 out of 10"
alexlaradiniz,"Mar 11, 2004",N/A,"I watched ""City of God"" and I remembered a scene from ""Robocop 2"", when the movie tried to shock us showing some kids robbering a shop wearing baseball shirts. Now I am laughing about that stupid scene, it was so unreal..! So different about that scene that shows a child being encouraged to shot another one in ""City of God"": that is real! Some people did some heavy critics for the movie of Fernando Meirelles because of the violence, but it is true, that is real! Brazil still have problems like this, it is a mix of the pooverty of Africa and the power of some strong economies of Europe. Despite of these, in defense of my country, I can say that we are a very talented people with a very good future appearing at the horizon...About ""City of God"": that is the masterpiece of a re-borning movie making. Very violent, but true. If you want to know our beauties, you can search for movies like ""O Quatrilho"", ""Deus é Brasileiro ('God is Brazilian')"" or ""Bossa Nova""."
PurityofEssence100,"Oct 6, 2002",6/10,"Once again an entrepreneur has managed to turn the misery ofthe Brazilian slums into an exportable commodity.Slickly packaged within the ultra violent veneer of the postTarantino gangster genre City of God is replete with bullets,bodies, and just enough flesh to keep the international distributorshappy.It's an epic covering decades and including a good portion of theBrazilian population.  It's also aggressively aware of the latestvogue of digital effects and story telling digressions (ala GuyRitchie's Snatch).  Everywhere the camera and narratorbackpeddle through the third world carnage.  At one level, the rollercoaster pretense is intriguing.  However, given the reality of thesocial catastrophe lying at City of God's core the movie issurprisingly trite.  If you didn't know the police in slums of Brazilwere corrupt then this movie will be an eye opener.  And, despitethe fact that hundreds of those killing and being murdered arechildren the film lacks any connection, and any real humanity,beyond the level of the most superficially apology.  It's excitingBrazil is capable of depicting the slaughter of it's people in suchan eye popping manner.  It's to bad this film fails to connect withwhat lies at the heart of the matter."
mcjensen-05924,"Aug 29, 2021",2/10,"Well you're in for a 2 hour shootout here. It's not entertaining in any way. From the history of the characters growing up to how they ultimately met their decline, it was just redundant and amateur film making. The dialogue must surely have been written by 10 year olds trying out their first swear words, and man oh man do they continually repeat them. It's threats then violence then threats then killing, and people falling dead when they're hit by gunfire in laughably absurd and unrealistic ways. Extremely childish. Childish writing and directing, and all the so-called adults in this mess act childish too. It ultimately just became rather humorous it was so bad, and faded into the background as I started getting distracted by other things. It's a case of a point being hammered home so many times it loses it's power and eventually all anthenticity. It could have been a gritty portrayal of that part of the world and that type of life, but ended up failing in every aspect for me. Very poor choice of soundtrack also detracted from any possible enjoyment. I've seen exemplary films from Brazil. Funny how they never reached the level of acclaim this film did. Sadly the real talent in this business never floats to the top because what's wanted is overdone nonsense like this. I gave it a star because the squalor of the city is showed realistically, but that was purely by accident."
isaacch-99917,"Jun 30, 2016",10/10,"City of god is a different film. Its one of a kind. There aren't many films like it. There is a fair bit of criticism standing against this movie. Such as it being too violent, not appealing to everyone or it being in Portuguese, therefore being subtitled. Without these factors 'City of god' is an almost perfect movie. I don't mind those factors. I don't mind it being violent or being in Portuguese , just that some people do.Its a long movie, that makes a lot sense, its incredibly interesting and its got a bit of everything ,due to the unclear plot. The child actors in the movie are also very good.This makes it even better. You can tell the film was very well thought out, with great ideas and really well made with an obvious large amount of effort put into the making. The ending is really good an ends the movie perfectly.'City of god' also widens your awareness massively of the poverty, drugs , police abuse and general danger young adults and children experience in these environments and developing countries. This film was set in Brazil. Despite all the violence, the movie is being looked at from the perspective of a non-violent individual.I recommend this movie for any adult , due to it being a bit too much for children. GREAT MOVIE DEFINITELY WATCH IT"
Rabsi,"Jul 8, 2013",10/10,"For almost 4 years now, Die Hard had been the greatest film I had ever seen. It was top of my list of films, and it always shone as the top film, I never questioned it's position. I still do not question it's position today, simply because it is most definitely the second greatest film I have ever seen. City Of God is sensational, a masterpiece emanating from the slums of Brazil.The film starts off in a newly built City Of God, a favela in seemingly pretty good nick. The narrator, Rocket, is introduced. Rocket is a Nick Carraway from Great Gatsby sort of person. He does his best to stay honest, even talking to the audience in a way Nick Carraway does. He also tries his best not to be involved in anything, yet finds himself having a weak connection with every character in the film or book. In fact, Rocket's story is so close to that of Li'l Zé (legendary antagonist) that it becomes a plot point how far apart their lifestyles dictate them to be. Never has a film spoken so much to me about so many things. The physical and emotional power of drugs, crime and murder. The gang of Li'l Zé could be a band of misfits, composed of ginger haired cocaine addicts and aggressive 9 nine year olds, but more sinister gangs are we unlikely to come across in real lifeI often seem to have problems with the way death is treated in Western films. I remember the copious amounts of deaths, and it feels so dehumanised that I never fully enjoy western films. Clint Eastwood just shoots bandit after bandit, and never gets anything coming to him. In City Of God, every act, every murder of a person has a family behind it. A family that will seek revenge, and no matter how primary the antagonist or protagonist is, it will not make them any harder to kill. Clint Eastwood has Chuck Norris like abilities of invincibility if any of his Westerns are to be believed. These acts of retribution come as a shock to every character, as it does to the audience. It is so well made and true to life, that one cannot pick out who has what agenda. The film also uses flashbacks to now important dialogue, to enhance the facepalm at your own stupidity effect.Finally, the film making. This is what nails the film as being head and shoulders above the rest. Even Matrix-style bullet time shots are used, but they finish by being melted into a shot of the same character, but 20 years previously. Magic. We also get many scenes shown together in real time from different perspectives, and it never seems to be too much for the human eye. It beats 3D images any day of the year as well.The list can go on, but not without spoilers. If you are OK with themes such as drugs, murder, rape and heartless 8 year old psychopaths, then watch this film as soon as possible! Actually, even earlier if you can."
tysonmorris2008,"Jun 29, 2010",10/10,"Much of my own sentiments have already been echoed by other posted reviews here. As my rating indicates, I consider this one of the finest movies of all time. It's something of a Brazilian ""Goodfellahs."" A coming of age story, a mafia story. An urban ""Lord of the Flies."" There are a myriad of virtues to single out in such an epic triumph such as this, but I'd like to simply draw attention to one of the most gripping pieces of acting I've ever seen in film -- and it's that of the young boy who faces the drawn gun of another young boy. The scene comes in the middle of the movie and it is mesmerizing and horrific. It's a representation of the intensity of the film as a whole.That the events of this story aren't stretches from the reality of the slums of South America is a simultaneous testament to colossal film-making and blemish upon the history of civilization."
lsmassive,"Nov 12, 2006",10/10,"When this movie came out, I saw it 5 times in 7 days in the theater. I was waiting at tower at midnight the night that it came out and I bought two copies (one to lend out and one to keep). The documentary that came with the movie was also great ""News from a personal war"". I can't believe that the director followed this up with ""the constant gardener"", which I thought sucked in comparison. It was a decent movie, but next to City Of God, it failed to even compare. Brutal reality brilliantly shot and acted would probably be the best way to describe this movie. The Soundrack is also incredible. I was never aware of the situation in Brazil with the crime and corruption until viewing this film. This flick was a powerful way to get that message out to the American and international public."
michimimi,"Nov 16, 2022",9/10,"When I first started this movie I was not expecting this. The movie is a roller coaster ride one which might make you afraid for a little bit but you enjoy the ride nonetheless. The characters are well written and cudos to the actors because they did an amazing job. The movie was extraordinally made. From the start to the end it did great and it made a really good job in the themes it had. In the end it shows how life really is. This movie had me go through different emotions. Once again the cast was spectacular, the plot was great and the storyline gave all that it could've. This is a movie I will never forget."
lukem-52760,"Apr 8, 2024",9/10,"I would call CITY OF GOD the best gangster film I've ever seen. Miles ahead, & better, than overrated gang films such as Goodfellas (i found that film ridiculously overrated & boring) better than Casino (again boring & overrated) & City of God is better than Menace To Society & Boys N the Hood, in my opinion.Also this movie is better than any Tarantino crime film, yep beats his Fiction & Dogs.City of God is fantastically & ferociously directed for maximum impact, excitement & power. The cinematography is outstanding-all-time & the music is just awesome, with it's 70's funk flavour.The cast of unknowns was a masterful move & to get powerhouse performances from non professionals was lightning in a bottle greatness.Such memorable characters like ""Knockout Ned"" & Rocket & Lil' Z & Benny & The Tender Three & The Runts, i remember all these & I've only seen it once!!! That's how great the characters were & what an impact the story has on a viewer.Yeah the story is the basic good kid growing up in the tough ghetto & trying to break free, but few have done it this mesmerising before.I can't wait to watch it again!!!The movie is full of very colourful characters that often you can't help but like. Yes there's still some that you hate (Lil, Z) but most are just innocent kids with no way out of their desperate situation & so turn to selling or using drugs. It ain't pretty but the film shows it how it is, with the good times & the bad times like in real life.The City of God is the ghetto slum city & that place is a constant dark entity of a character too.The film discovered a fantastic actress in Alice Braga, she went to be in I AM LEGEND with Will Smith & PREDATORS.A Brazilian Masterworks of a Gang land drama/ thriller. The opening chicken chase is a superb sequence into a movie that is drenched in clever camera work, editing & back stories galore that all create a single full story structure of the city & its people.The movie is extremely gritty, grimy & brutal, but with purpose & a pure cinematic visual style.A coming of age story set in the darkest slum city of Rio."
CelluloidRehab,"Oct 28, 2004",10/10,"My first milestone at IMDb occurs (50th review) with this amazing movie. The plot of City of God revolves around Rocket (an aspiring photographer) as he grows up in the slums of Rio De Janeiro and the events that occur there. The cinematography is simply amazing, from the various ""action shots"", to the way the story is broken up into anachronous mini stories. It is also amazing how intertwined all the stories are. You get an idea of the cinematography from the opening scene where a chicken escapes from a restaurant and a whole gang of people go chasing after it. The scene is comical at first and then turns serious very quickly as the chicken ends up in front of Rocket with a gang of approximately 30 members armed with guns on one side and the police on the other side (Rocket and the chicken caught in the middle). This movie is very intense, but feels realistic. The violence does not seem over the top but indicative of a plausible situation. The movie is also wrought with social critique : from the drugs use, to the crime (murder,theft), to the poverty and the widespread corruption of the slums in Brazil (and the similarity to slums everywhere). There are similarities to other movies including Scarface (1983), Boyz in the Hood and Menace II Society. This movie seems more gritty, more real than those movies. This might be due to the fact that those movies dealt with adults and young adults (16-35 year old), while this movie deals primarily with children. The ending is a mixed bag of optimism and pessimism (good things do happen, but also history does repeat itself). This movie MUST be seen."
Rodan11,"Oct 12, 2004",N/A,"If you live through the TOP 250 List of the IMDb best films ever, there are certain milestones of movie-history which come along uncompared to whatever came thereafter. Godfather's epic design, Shawshank Redemptions brilliant story-developing, Pulp Fictions step into the next millennium of fulfillment for the movie needs of a new generation. Breathtaking adoption of fairy tales like LOTR 1-3, melting Kids and Adults together in Toy Story 1 &2 leaves one back in the seat forever. What should be next? Any new movie design possible to fit in the TOP 250 IMDb List. Impossible I shouted out loud and slept well in my movie chair, until I have seen CITY OF GODS. With no expectations at all, I didn't breathe for the entire movie, no time for POPCORN and the drink. The opening scene sums up MTV Type of Clip-Movies in 3 Minutes and leaves u wishing to read the book, so that you can check for the ending, because you are thrilled into the last peace of your body. But the movie keeps its tension till the end. Cinematography at its best, with really unseen techniques not being incorporated for the selfsuck of the cinematographer, purely for the needs of the storytelling. Not a single actor appeared in TV Sitcom before, not on stage or in the movies before and all are playing there lives better than anybody could do. I could continue to describe why I think, that this movie is expanding the TOP 250 List not only because of the voters, it is really one step ahead in movie development and the best of it: It is not out of the Hollywood-Sundance-Cannes Bowl."
Popey-6,"Jun 13, 2003",6/10,"If you looking for roughly sketched characters then this is your film. Like the film itself the central protagonists survive only on pace and violence. Unexpectedly unbloody, City of God's main saviour is its reliance on flashback and quirky narrative that owes much more to early Hollywood gangster flicks of the Bogart era than the Scorsese style many critics enthuse about. Worth a look - you'll certainly be kept on your toes."
Maciste_Brother,"Jan 25, 2005",1/10,"Though a lot of people and critics have praised this Brazilian movie, I have to say that I did not like it at all. The story is bleak & serious and yet it's filmed like a GAP commercial, with a lot of stylish editing, camera movements (like the annoying 360 degrees one) and direction, which totally belies the story's tragic intent.The film is more of a showcase of the director's repertoire of movie tricks than of actual characters going through a hellish life. In the end, the effect is jarring and at times really off putting. There are a lot of gratuitous moments in it that serve no purpose but to shock or titillate the audience (the housewife and the banana bit, for example).OUR LADY OF THE ASSASSINS was much better than this and created an unforgettable experience without all the flashy razzle dazzle.CITY OF GOD is just another overpraised foreign movie."
