user,date,rating,content
bryanprzy,"Jan 27, 2016",9/10,"Sometimes a film leaves you with that warm, fuzzy feeling inside. It's a feeling of fulfillment and completion. A feeling that everything will work out and everyone is okay Oldboy is NOT one of those films.Drunken buffoon Dae-su (Choi) is mysteriously kidnapped and inexplicably held prisoner for fifteen years by men he never sees. He is left only to watch the same television and eat the same dumplings every day. When he is just as inexplicably released back into a world that is now completely alien to him, his only mission becomes finding the man who imprisoned him, by any means necessary.The twists and turns Dae-su's journey takes him down are jaw- droppingly outside the box, leaving the audience only to wonder whether Park is a thematic genius or completely insane nihilist. Based on an equally messed up graphic novel by Nobuaki Minegishi, Oldboy has become one of the best thrillers of all time, capped by one of the best blindsides that has ever been thrown at unsuspecting viewers.Spike Lee attempted an American remake in 2013 starring Josh Brolin, which isn't entirely terrible in and of itself, but it's hard to match the intensity put forward by Park. If you haven't seen this film, don't ruin it by reading into it too much. Just turn the lights down, turn the flick on and begin to feel incredibly uncomfortable by the fact that at any moment someone out there could be plotting to absolutely destroy your life for no reason."
souripal,"Oct 15, 2022",10/10,"The movie Old Boy was doing a bit of the rounds on many good movie lists and having a weak spot for Korean movies, I thought of striking it off my to watch list.The movie started with a man being imprisoned for 15 years. It shapes him in an unimaginable way. The portion where he remains imprisoned is a bit slow, but when he gets released, the movie picks up pace and then its a whirlwind of emotions, actions and what not.It definitely has the distinctive ""weird"" charm of South Korean movies which sets it apart from other movies.After watching the movie..the thought that was evoked in me was...what the fish did I just watch? In a good way. Highly recommended."
avagantamos,"Sep 1, 2015",9/10,"This is by far one of my favorite movies of all time. This a classic revenge film with a big dumb gray area in the middle. I would really rather avoid any form of spoilers, so know this film is dark as hell(its a bit much really) and masterfully shot. The hallway scene, is an amazing shot that has since been replicated by a number of other films, even the recent Netflix, ""Daredevil,' show features something very similar. This is the kind of movie you can watch 4 or 5 times and notice new things each time, even new character developments and motivations. The foreshadowing is done in such a way that it doesn't beat you over the head, but is clear if you know what you're looking for/watching it again. A fantastic film."
diwakarmuralidharan,"Apr 2, 2021",10/10,"One of the most Dark, gripping crime thriller movie ""Oldboy 2003""
This is my favourite movie also. This movie's hero ""Choi min-sik"" Chanceless performance especially towards the climax intense,settled performance. This movie's overall background scoring is amazing,ultimate. And This Movie's Climax Twist , ""I don't want to Break the Twist.""but super Twist."
Jonny_Numb,"Nov 1, 2005",7/10,"I will admit right off that bat that I'm not a fan of the whole ""Asian Extreme"" phenomenon sweeping across North America right now; as far as horror goes, my heart is grounded in the Spaghetti Splatter of Fulci and Argento; as for revenge, Charles Bronson always ""makes the bloodlust grow fonder."" ""Oldboy"" takes a bit from both: a man is imprisoned for 15 years without any apparent purpose, and vainly attempts to break free of his shackles; once he does, he seeks out those who put him there, and embarks on a stylized--yet strangely 'civilized'--killing spree. For much of its running time, my reaction to ""Oldboy"" was a stupefied ""huh?"" It has a plot as excessively complicated as a '70s giallo, and often drifts quite far from reality (not really griping, as it provides the film with a disorienting, surreal sheen), but is simply mesmerizing. From the standpoint of visuals and camera work alone, ""Oldboy"" is as beautiful to look at as Dario Argento's ""Deep Red."" However, like Argento, the characters are less prone to expressing their feelings outside the requirements of the plot, and while there is a striking humanity underneath the bloodshed of ""Oldboy""--it simply isn't enough to elevate it above its own obsession with surface quality. Too bad, seeing as how the potential for greatness is certainly present.6.5/10"
hj1976,"Jan 25, 2006",1/10,"Don't be fooled by the high rating. You will be disappointed. Overall this is a very sick movie. In my opinion, this is more like a Japanese movie than a Korean movie. Some violence and sickness are totally unnecessary. I know that they tried to tell a thriller or suspension-like plot to attract audience. But why use such a sick and fake story? When you find out the truth at the end, you will feel very sick, I promise you. I don't know why this movie tried so hard to mimic Japanese movies. I watched several Korean TV series, most of them were pretty good. Nothing like this movie. I'm so disappointed. Why did this movie get so high rating?"
bmiah89,"Jul 19, 2012",10/10,"Oldboy (Oldeuboi) is the second installment of the 'Vengeance trilogy' directed by Chan-wook Park and is by far the best of the three.The first time I watched Oldboy it blew me away. Dark, slick, gritty and twisted, revenge has never been portrayed sweeter. I fell in love with the film instantly, I became gripped to my TV within the first five minutes. It kicks off right from the beginning and unlike some other films you don't have to wait half an hour to get interested. It seems quite straight forward a man (Oh Dae-su played by Choi Min-sik) is suddenly kidnapped and is imprisoned for 15 years without explanation and one day he is suddenly released. Now the protagonist is on the hunt for the man who's behind his imprisonment to get his revenge, however the story is more complex and gripping than that.Like me most people would probably assume that the film will go on and in the end the villain will be revealed however Oldboy is quite unique. After Oh Dae-su is released his captor Woo-Jin (Yoo Ji-tae) one day reveals himself. Oh Dae-su instant reaction is to kill this man however Woo-Jin tells him that if he kills him he won't ever find out his motives behind his imprisonment. Woo-Jin then tells Oh Dae-su to discover his motives within the next five days or else he will kill Mi- do (Kang-Hye Jeong) a young sushi chef who Oh Dae-su meets at the restaurant she works at after he got released, she becomes Oh Dae-su's love interest. If Oh Dae-su succeeds in finding out Woo-Jin's motive then Woo-Jin will kill himself. With the captor revealing himself begins the protagonist's desperate journey to find out why he was kept in a room for 15 years, which leads him to dig in his past. This makes the story so intense and entertaining.Oldboy is more than just revenge, blood and the typical overdose of violence it has a very intriguing plot portrayed very sleekly. For people that don't have a strong stomach it will disturb and disgust you(still watch it), some scenes will make your jaw drop, other scenes will make you speechless. There is nothing quite like Oldboy, it has all the correct ingredients. Chan-wook Park filmed every scene as if it's a piece of art; so stylish, bold and dark it seems as if we was to watch and feel the emotions of Oh Dae-su throughout the film. There's some amazing soundtrack and even better dialogue, everything just fits perfectly.Choi Min-sik's portrayal of Oh Dae-su is one of the best performances I have ever seen. It's gripping and mesmerising, it sticks with you no matter however many times you watch it, such a powerful and striking performance. I've never seen anyone get in to the role and portray anger in such a breath taking way as well as Choi Min-sik. Yoo Ji-tae and Kang-Hye Jeong also gave outstanding performances.For the people who haven't watched Oldboy I encourage you to watch it ASAP, it's a must see. I guarantee that you will not leave your seats, it's that entertaining. This film takes cinema to a whole new level, it breaks every barrier in ever aspect whether it's direction, acting, cinematography or background score. Oldboy has changed my outlook of cinema and after watching it everything else seemed mainstreamed to me; that's how much of an impact Oldboy has on me. I've lost count of the amount of times I've watched Oldboy, even though I know what will happen next, I was still gripped and entertained. Oldboy is in my top 5 all time favorite movies and I don't think any movie will be able to take it's place.Source of link: http://www.imdb.com/title/tt0364569/"
mankaras,"Oct 14, 2015",10/10,"First of all, I want to clarify that I'd personally give Oldboy a score of 9.2 or so but given the nature of IMDb's rating system if you like a movie you gotta give it a 10 Where to begin? From the amazing score by Jo Yeong-wook to the compelling and skillful acting of Choi Min-sik, Oldboy is, all the way through, a masterpiece. Few movies manage to be so gripping and at the same time so emotional. Oldboy tells the story of Oh Dae-su, a middle-aged drunkard who, after one of his many late-night drunken endeavors, mysteriously disappears off the face of the earth, leaving his wife and daughter. Turns out Oh Daeu-su is actually imprisoned in what seems to be a hotel room and he has to spend the next 15 years of his life there with no other human connection. After he is finally released, Oh Dae-su, now a shell of his former self, embarks on a quest to find the man responsible for his mysterious imprisonment and his reasons behind it.Oldboy is a great journey through human psyche and you will find yourself thinking about it way after you've watched it. A must-watch for anyone who enjoys good cinema."
NicolasTheWolf,"Aug 3, 2021",10/10,"South Korean films are something special. And Oldboy is one of the best of the best. From the brilliant camera work and the extraordinary performances to the excellent carried out plot and shoking ending. I just love every single facette in this film. This results in a perfect film, a masterpiece."
sweekley-94234,"Apr 3, 2020",N/A,"What an amazing ending, mind blowing, brilliant storytelling, this movie had it all!!!"
Mad-Scientist-Matt,"Jul 27, 2007",6/10,"This is a case of a movie where the director has lavished too much attention, too impressive cinematography, on a story that can't support it. Chan-Wook Park starts with an almost Hitchcock-like tale of a man abducted and held against his will by an enemy he could not see. It is rather moving to see his anger, confusion, and frustration come to the surface. Sometimes the intensity is broken by dark humor, the sort of comic ""relief"" that also serves to ratchet up the tension. And the sense of composition and style is first rate. It seems like it's sometimes a cross between Hitchcock and the Wachowski Brothers.But they you start to see loose threads appear, and instead of tying them up, the climax just makes everything unravel. We know that the hero, Oh Dae-Su, has been the victim of some elaborate plot for revenge or sadism. But then we find out just how elaborate it is, how many things the villain would have had to have under his thumb to make them not be coincidences, how many times Oh Dae-Su had to make the wrong choice, and just as importantly, how many times he had to escape getting killed by dozens of thugs at the wrong moment. At this point, the movie stops being an assault on our sensibilities, and turns into an assault on the willing suspension of disbelief. There's a fine line between shock and schlock, the sort of violence that produces horror and the sort of violence that is so unbelievable it can only produce numbness or laughter. I can appreciate both, but Oldboy crosses the line into schlock at the end - and seemingly doesn't realize it. ""Laugh, and the world laughs with you?"" Maybe not, in this case...When Hitchcock went for shocking, he could leave you thinking that the world is twisted and sick. Chan-Wook Park only succeeds in leaving you thinking his own imagination is twisted and sick. Not really the same sort of shock."
ottaky,"Feb 26, 2005",7/10,"I wasn't able to find the time to see Oldboy at the cinema despite the overwhelming praise it received on release, so I had to wait until today to see the DVD.Looking at the voting results here the split between the usual ""love it"" or ""hate it"" responses are even more marked than usual and I've been looking forward to the DVD release so that I could make up my own mind. I'm a little disappointed to admit that I neither love or hate Oldboy.Oldboy is not a bad film, but it didn't bowl me over as I'd been hoping - maybe the months of anticipation meant that my hopes were always going to be dashed.The main problem with this movie is that it's just not very well explained. OK, that can be expected in the beginning where we are all as confused as Dae-su Oh, but too much of Oldboy is played out without the audience having much of an idea about what they're seeing.The explanation, when it arrives after a brief period of simplistic detective work, is something of a disappointment and, frankly, seems fairly trivial compared to the effort expended on exacting revenge for it. Dae-su Oh had forgotten the incident himself, and I really couldn't blame him.Overall, definitely worth watching for the great atmosphere and some nice set pieces, but a little underwhelming in the final analysis."
Benjamin-M-Weilert,"May 17, 2021",10/10,"Some storylines are so timeless; they can't help to be made into something modern-thus becoming timeless in the process. Oldboy (2003) can easily draw comparisons to The Count of Monte Cristo in its structure but adds depth and layers to a wild ride that unfortunately could not be even closely matched in its American remake in 2013. As it stands, Oldboy is one of the pillars that shows how culturally significant South Korean cinema has been and how its predecessors like Parasite (2019) and Minari (2020) stood on its shoulders to achieve greatness.Oldboy is a lot like Memento (2000) in that it demands a second viewing, often right after reaching the end credits. Many of the plot's twists and turns readjust the viewer's understanding of previous events-to the point where you'll have to watch it again with this new knowledge fresh in your mind, thus opening up a whole new experience to the film. Revenge is piled upon revenge, but the motivation of these characters is always clear, even if it is uncomfortable at times. Oldboy certainly doesn't pull its punches when it comes to sex or violence, but don't let that distract you from the engaging story.In fact, I would hope that anyone who likes well-done action sequences will take the time to watch this movie. Without spoiling it, I can honestly say there is a moment with a hammer that is as hilarious as it is disturbing. And sure, it might be a bit over-the-top at times, but what action film doesn't land in this pitfall and still manage to entertain? Either way, by the end of the movie, both the characters and the audience are ultimately changed by what they just learned and saw, respectively.One of the best South Korean action films ever made, I give Oldboy 5.0 stars out of 5."
shingiriraimataga,"Feb 1, 2025",10/10,"I just watched the most incredible film! The cinematography was breathtaking, the acting was superb, and the storyline was engaging from start to finish.The movie had a perfect balance of action, suspense, and emotional depth, keeping me on the edge of my seat the entire time. The characters were well-developed and relatable, making it easy to become fully invested in their journeys.The film's themes were thought-provoking and timely, leaving me reflecting on the story long after the credits rolled. Overall, I highly recommend this movie to anyone looking for a compelling and unforgettable cinematic experience.""
I absolutely love it."
jameslinton-75252,"May 18, 2016",9/10,"Oldboy is a film that hit me like a sledge-hammer. It is a remarkable film about the dangers of how revenge can consume you. The characters are three-dimensional, authentic and entirely believable. Stylistically the film is absolutely gorgeous. There is so much detail in every single shot. There are enough twists and turns to keep viewers on the edges of their seats. It isn't a film for the faint- hearted, but I advise that you just buckle up and get ready for a wild ride. Sure there are a few plot-holes here and there, but as a whole, Oldboy is a charging bull of a film. It stops for no man. You just have to keep up.Read my full review here: http://goo.gl/xGP14r"
dnmhxm,"Oct 28, 2021",10/10,"This movie is dark, violent, confusing and at times quite cruel. It is also visually stunning, immeasurably surprising and finally beautifully tragic. It is one of the great films of our time and echos of Greek tragedy.Not to mention that friggen hammer sequence is one of the craziest things on film."
Sourangel_agus,"Aug 28, 2025",9/10,"This film is intense and unforgettable, achieving exactly what it sets out to do: deeply unsettle and provoke the viewer. Its story is gripping, with a style and pacing that keeps you hooked from start to finish. The performances are powerful and the direction precise, creating a world that feels both raw and compelling. While it can be emotionally heavy and traumatic at times, that intensity is also what makes it so effective and memorable. A dark, daring, and brilliantly executed thriller that stays with you long after watching."
ALIENIGHTMARE,"Apr 21, 2021",8/10,"At the beggining it was interesting to watch, what will be next... but then somehow it turned in to the action movie. Battle scennes didn't look natural. For me it was terribly hard to consentrate to the storyline while watching some ''Naruto'' scenes..."
ozi_wozzy,"Aug 18, 2011",N/A,"I'll echo the majority of the viewers' sentiments, this film is brilliant.I really did not know what to expect when I first sat down to watch it, except that I'd hoped it would be a good thriller from a well respected Korean director.And that's how you should approach this film if you haven't watched it, expect nothing, because that's when you get the most out of it. I've read a couple of reviews regarding the ""incomprehensible"" plot and ""rambling storyline"" and it beggars belief how these people have come to this conclusion.In terms of plot and storyline, it's one of the most original and tightly controlled I've ever watched. From the start, when a man is put in a private jail without explanation for 15 years, you're drawn into the story. Then it just gets better.Acting by the two central characters, the antagonist and the protagonist - at times they easily swap places, such is the clever story line and the brilliant acting - is outstanding. The energy and the inner rage with which both go about the roles was just brilliant to watch.The music score was pretty much perfect for any film I've come across and the main melody is as memorable as any you're likely to come across in any medium.The twists are not over-egged, as they don't need to be, and the gut-wrenching, brutal yet emotionally charged penultimate scene will stay with you for a long time afterwards. This film is in my top 10 of all time. Just watch it with an open mind. It's a great, great film."
akshatmahajan,"Sep 5, 2023",7/10,"I decided to watch this movie after hearing so much positive about this movie but after watching the movie, I think that this movie is little bit overrated.The story was good with good thrill and suspense throughout the movie. The screenplay was little bit uneven, the direction was good and the performances were good. The main problem I faced with the movie was it's pacing. The pacing was uneven making movie dull at some points. Also, I think ghe movie is little bit overrated. Though, it is good but it doesn't have anything great or special in it.Overall, you can give this movie a try if you want to."
hareyT,"Aug 13, 2008",9/10,"This was a gem of a movie. Please watch it in it's native language with subtitles. The English dubbing was not great and was a real distraction. I had to watch this movie twice to catch all the nuances of the plot. I just watched it on Bluray and it looked terrific. The cinematography looked great and the music stood out. Sure, the plot is your basic revenge story. A man is imprisoned (where? not sure)for fifteen long years released and is finally released (stuffed in a suitcase!)with very little money as he sets out to solve the mystery and get revenge on his captors. Good stuff here and worth checking out! The performances were terrific too! There's a scene on a rooftop with a guy trying to commit suicide that has a funny (and sick) ending to the scene."
frankfob,"Sep 1, 2008",7/10,"Interesting premise (man is locked away for 15 years by a mysterious organization and isn't told what he's done or how long he's going to be there), beautiful photography, good acting and a director with real flair combine to make a very good movie that could have been great if it didn't go off into outer space at the end.The character Oh-Dae Su starts off as completely unsympathetic--a drunken, annoying, loud-mouthed, obnoxious jerk who's sitting in a police station after obviously having been arrested for drunk and disorderly. He's eventually released, but soon afterward finds himself locked in what at first appears to be a jail cell but turns out to be a fairly well-appointed room, complete with TV. However, he soon realizes that it's not any kind of government jail or prison; it's run by a mysterious private organization, and no one will tell him why he's there or for how long and, in fact, he never sees another human being in all the time he's there. What he does see is a news report on the TV that his wife has been killed, his daughter has been taken away and that he is the prime suspect in the murder, but he knows he didn't do it because he had been locked up in that room. It's not long before he begins to go crazy, trying to figure out why someone would go to the trouble of locking him up and framing him for his wife's murder. Eventually he escapes after having been locked in his ""cell"" for 15 years--or did he really ""escape""? The all-seeing, all-powerful organization seemingly knows not only his every move, but knows what he'll do before he does. He meets a beautiful young chef in a sushi restaurant and moves in with her--but is she what she seems to be? Things snowball from there, and the plot twists, turns and surprises will have you going. It's been mentioned by others that this is a ""nasty"" film, but it's really not. There are some brutal violent scenes, but the ""nastiness"" is much more of an atmospheric nature. Although beautifully shot and brightly lit, the tone of the film is dark and oppressive (a nice contrast) and parts of it will definitely have you on the edge of your seat.However, the last half-hour or so of the movie went completely awry. I won't say exactly what happens for the sake of not spoiling the ending, but suffice it to say that it will most likely leave you shaking your head saying, ""What the hell is going on here?"" However, even taking into account the disappointing last part of the movie, the film itself is still worth a look. It has more pluses than minuses, the actress who plays Mi-Do is gorgeous (that always helps) and has several not particularly gratuitous sex scenes (that always helps even more) and it does give you a lot to think about. If it wasn't for the ending, I'd have given it a much better rating than I did. Check it out."
Rurik_Snorri,"Apr 3, 2006",2/10,"Try as I may I cannot for the life of me understand the slack given to the type of rubbish like this. Let me rephrase, it's more than slack, in some cases there has actually been critical acclaim. For what?! Please stop it with the references to Oedipus Rex, Beckett, Count of Monte Christo, Hitchcock or whatever. This is a C grade exploitation film, poorly cast, poorly directed, poorly shot, poorly edited, poorly everything. It is one small step better than another waste of film that came out a few years ago which I believe was called ""Audition"" I think by a guy named Miike Tadashi. (Too lazy to check now). The amount of attention that crap got blew me away. I remember when Japanese cinema used to be acclaimed for Ozu, Oshima, Kurosawa, Mizoguchi, Ichikawa, Teshigahara and others. Those were real filmmakers. Miike is nobody.That's as far as Japan goes. Surely there must be some South Koreans who are doing better things than this Sickboy.The only reason I give it a 2 instead of a 1 is because the very initial premise IS indeed interesting but is handled so incompetently and sophomorically that you might as well be watching a snuff film. In fact, if the octopus counts, it is somewhat of a snuff film. Just as violent and just as juvenile as Tarantino but without his (for lack of a better word) ""talent"".Basically a completely vile and disgusting exercise that should be relegated to the cutout bin."
