user,date,rating,content
laura-vanbaren,"Nov 10, 2008",10/10,"You know, a classmate of mine told me for years I had to see this movie, and since we like the same kind of movies, I just knew it had to be great. Still, it lasted for about 3 years 'til I actually saw the movie.Well, I was totally blown away! I watched it with my boyfriend, and nothing could prepare me for the realistic feeling this movie gives you. Normally, I really don't feel like watching a movie for 130 minutes, (I really think movies shouldn't be any longer than 90 minutes tops, but that aside) but by this movie I didn't want it to end. And that's rather crazy, because it's horrible what you see. And it makes it even more horrible to know that this is what's happening out there. You just know it by watching this movie.I'll never forget a certain scene, involving two little kids and a couple of older kids, where one of the little kids starts to cry so intensely, it breaks your heart. I almost started to belief that this was no longer acting, but that this was what was happening at that moment, but then I thought: no way the director would do such a thing to this little boy, especially when you think about the reason why he even bothered to make this movie.Well anyway, the thing is, you've got to be kind of prepared for this movie. It's no happy ending like we all see in those Hollywood-blockbusters, it's no horror like we see in the same movies, it's no thrill like we see in the same movies and it's even no humor like we see in those movies. Yes, even though the topic of this film is horrible, there's still a sense of humor in it too. And why? Because the director didn't direct this movie from one side of the story, but from both sides. You get to see the reason why those kids do what they do, what happened to them, why they choose to be with this man rather than with the other, why their lives are so bad, they really don't have another choice than this one. And all this time the director stays close with his people; he's not overdoing it. He knows why he's filming this and he knows how he wants to film this and he stays with that. You'll never get the feeling that this is such a Hollywood movie about a terrible topic, that in the end wants you to confess your sins and say: 'Yeah, you're right, we should do something about this, I should give my own life to do something about this.' None of that crap in Cidade De Deus: yeah, sure, he wants you to know what's going on and he's so straightforward that you'll feel like he's slapping you in the face, but nowhere you will find that thing Hollywood-movies do to you; he lets you think what you want to think. Just see and undergo this. Be one of their neighborhood for once. And he did a damn well job!Go and see, really, you'll be blown away."
kgav-20022,"Nov 5, 2017",1/10,"I watched by accident, it seemed like a great idea to tell an story as it is. Acting was very good. But there is too much graphic extreme violence towards little children. I would never watch again and the fact it has so many awards only shows how desensitize our society is. Stay away from this movie."
fchriskoch,"Dec 15, 2011",10/10,"This is my first time reviewing a film in IMDb or any site. This seemed liked the perfect title for me to start with. The reason is because no other film has ever effected me like City Of God.To start off I want to say that like anyone that uses this site on a regular basis,,,,I've seen a TON of movies. From American classics all the way to disturbing Japanese gorefests.City Of God takes every single aspect of modern cinema and storytelling to the peak of what a film can be. A lot of ""normal"" people will immediately stop watching once they realize they will have to read through subtitles. This is one of the most unfortunate mistakes a human can make because of all the amazing foreign films that people miss out on.Fernando Meirelles needs to be recognized as an elite director for making this masterpiece. The film's opening scene with the kids chasing the chicken and shooting at it to catch is perfect. I think the important point of the films shows the innocence of all the characters mixed with the brutality of the environment they are raised in. The violence of it is powerful in certain parts showing how there is no shame or feeling in the outcome of their actions. The scene where Lil Ze catches up with the runts is still one of the most disturbing scene I can think of.The cinematography is in every way what you want. A distinguished look. The colors of every room and street mixed with the time lapse scene in the drug apartment is fantastic.The sound editing and score are perfect for everything you are seeing on the screen.This is really a movie I would and do recommend to anyone that wants to take a change on a foreign film. I have a lot of fanboy movies i love like certain big budget scifi movies from Cameron and Lucas of course,,,but for some reason when someone asks me what my favorite movie is I always come back to City Of God and say its the best. It's not necessarily my ""favorite"" movie because that would be too hard to generalize.So if you come across this online or see it at a video store and your wondering what this is,,,,please give it a chance so your not missing out on a true masterpiece"
NoeMan,"Apr 9, 2004",10/10,"This is without a doubt one of the most brilliant films ever made. It tells the story of a few boys that grow up in the ""city of god"", an outskirt of Rio De Janeiro where the poor live. A city where children carry guns and need to steal to have enough food to stay alive. The boys go in different directions as they grow up, one becomes a photographer while another becomes the most powerful criminal in town. Over 100 people are killed in this movie and many of them are kids so it might not be for everyone.This story is so brilliantly told that I was breathless the whole 130 minutes of it. It´s one of those movies that will leave you thinking about it a long time afterwards. Powerful stuff."
Quinoa1984,"Aug 8, 2003",10/10,"City of God played for months on end at an the Angelika theater in New York City back in 2003, and I was hesitant whether or not I should go there to spend ten dollars and to sit in a little theater with a packed audience, or to wait in video. I gave in to my temptations to see the film, from what I heard from various reviewers, and by the end, I knew it was truly worth the admission, and then some. Director Fernando Meirelles, along with co-director Katia Lund, crafts a film that steams so much with a passion to tell this story, to reveal all these characters (most of which who wear their flaws right on their sleeves like badges of honor), and to be honest with how their tales unfold, that even the most die-hard of action film or gangster connoisseur will feel the visceral, hardcore nature of the City of God long after the lights come up, subtitles and all.This true story (from a novel by Paulo Lins, former resident in the slums) is told, much like Scorsese's master-work Goodfellas, in a kind of flashback format where the narrator takes us back to the City of God when the lower class were shuffled into the slums of Rio De Janeiro without much hope. Our narrator, who only calls himself Rocket until the end, lives amongst the Tender Trio, friends of his whom start out robbing oil trucks and whatever they can get their hands on to stay alive. An impromptu heist at a motel gets the cops swarming, and the trio becomes scattered, though not dissolved. As it proceeds into the seventies, we find out that some members of the group died, a few went to jail, and Rocket stays on the sidelines, hoping to become a professional photographer with little or no assets to become one in and outside of the City of God.Then there's Li'l Dice (played through most of the film by the equally terrifying and gleeful Firmino Da Hora), who in the first act of the film is a kid who's the smallest among the bunch of older teens who make more or less successful robberies, though as Rocket says ""You need more than guts to be a good gangster, you need ideas."" In flashback (not to spoil) we discover what went down at the motel that night, and from there in a brilliant stroke of editing we see how Li'l Dice became Li'l Ze, who rises up little by little in the drug dealing schematics of the slum and soon takes over a supplier to sell cocaine. Rocket (Alexandre Rodrigues) may be the protagonist viewers can identify with, but Li'l Ze is as fascinating an antagonist as any I have seen in a long time, who masks his insecurities with boyish joy in all of the mayhem he creates. Otherwise without hope, Li'l Ze becomes the dominant supplier in the slums, something of a tyrannical businessman, and as his story unfolds as does Knockout Ned (Seu Jorge), who becomes Ze's rival in the eighties.The only way a movie like this could work is if we feel for the characters plights and heights and such, even if they're evil in nature like Li'l Ze, Carrot, and Knockout Ned. That's why the filmmakers plunge us right into the City of God, and the nature of the city, and while the narrator may pass judgment on people he's known his whole life, he like us know why they're up to no good. The thieves and dealers and killers became such by looking up to their role models, the older hoods of the region, and with each younger group of kids who want to smoke dope and vandalize is another and another. As long as you don't get caught with your pants down by the cops, or get raided by chance, the odds for anarchy are in your favor in such a place. We understand equally why Rocket wants to get out of the city his own way as much as we understand the wars between the gangs, and this crucial facet makes the film work extraordinarily well to its advantage. Indeed, we understand the tragedies of such minor roles as the Runts- the orphans of the streets- much as we would understand the importance of such roles as in a Dickens novel.Along with this technique of storytelling, is the way it's filmed that's eye grabbing. The first scene shows in fast action a chicken chase, and then our hero between the gang and the cops viewed in a tailspin fashion as we are sent back to the beginning. Then, we get all the energy of even the simplest of scenes, and the hidden passion (Rocket on the beach with Angelica, for example) all by the mostly hand-held photography by Cesar Charlone, and the break-neck editing (i.e. the montage of how Li'l Ze makes a name for himself, or the disco dance sequence) by Daniel Rezende."
DennisLittrell,"Dec 29, 2005",9/10,"(Note: Over 500 of my movie reviews are now available in my book ""Cut to the Chaise Lounge or I Can't Believe I Swallowed the Remote!"" Get it at Amazon.)This Brazilian Portuguese language film set in the slums of Rio de Janeiro, the so-called ""City of God,"" is a mesmerizing coming of age gangsta drama second to none you'll ever see. At the same time it is a tale of redemption and the triumph of relative good over relative evil.Representing evil is the psychopathic L'il Dice/L'il Zé (Douglas Silva/Leandro Firmino da Hora), who kills people just for the joy it gives him. Representing the good is the story's narrator, Rocket (Alexandre Rodrigues), who will grow out of the slum to become a newspaper photographer. And representing something in between is the charismatic Benny (Phellipe Haagensen). The acting is excellent, including that by the ""runts,"" actual kids from the City of God; but what carries the film is sharp direction by Fernando Meirelles from an outstanding script by Braulio Mantovani from a novel by Paulos Lins.I think Hollywood directors ought to note well that it is the authentic realism of the film as seen from within the City of God by one of its own that makes this such a compelling experience for the audience. None of this can be faked. True, the story is a bit romanticized as a (very talented) kid might tell it to his friends, but that is all the better because the world view of those kids is part of what makes this film so effective. Additionally, all the little side stories: the woman at the newspaper who takes Rocket home with her for, shall we say, personal reasons; the story of the girl Rocket loves; the desire of the ""runts' to be men, etc., add layers of genuineness that also can not be faked or dreamed up by any filmland script writer. These things have to be lived.Last time I looked Cidade de Deus was rated #17 at IMDb, ahead of hundreds of great films. There's not much I can add to that. Is the film over-rated? I think so, and I think it will fall in the standings as time goes by. Good recent films tend to get a lot of attention, and then reach their level after some years have passed and they can be evaluated more objectively. Regardless, this is a watermark film for the Brazilian cinema and especially for director Fernando Meirelles who because of it rocketed from obscurity to world-wide fame almost overnight."
roger-pettit1,"Jun 23, 2012",10/10,"""City of God"" is a quite brilliant film that portrays three decades - the 1960s, the 1970s and the 1980s - of child and adult drugs gang warfare in the slums (favelas) outside Rio de Janeiro. Its quality is all the more astonishing given that many of its stars are non-professional actors who seemingly act out their own personal experiences for the camera.The film is set in a crime-ridden housing project known as Cidade de Deus (City of God). It focuses on two young boys - Li'l Dice (who becomes known as Li'l Ze, when an adult) and Rocket - whose lives develop in opposite directions. Rocket attempts to escape the crime, violence, drug-dealing and killing that is the norm for young men and adults who live in Cidade de Deus. He is fascinated by photography and attempts to pursue that as a career. Li'l Dice opts to go with the flow, and with his determination and ambition for power and control becomes a ruthless drugs dealer and eventually the head of one of the gangs that control life in the favela. The plot highlights the turf war that is waged with ruthless violence between the different gangs in Cidade de Deus over drugs, money and (to them, perhaps most important of all) influence, control and power.""City of God"" is absorbing and extremely thought-provoking. Living as I do in the relative comfort of middle class London, I can only imagine what life must be like for the people portrayed in the film. ""City of God"", which seems from this relatively safe distance to be infused with a gritty realism that few feature films possess, makes one realise in no uncertain terms the extent to which all our lives are governed by an accident of birth. How would any of us cope if we were born and brought up in circumstances like those of the characters in the film that are almost impossible to escape from?The narrative structure of the film is excellent. The principal characters are introduced to the viewer one by one and at a particular point in their lives, usually when they are relatively young. The film then returns to their story later on in their lives when they have become more adult and have been exposed more fully to the difficult circumstances which they have to confront head on. There is a judicious use of narration and of flashback, both of which help to explain what motivates each character's actions. The acting, the cinematography and the direction are superb. What is more, the film does not romanticise the violent lives on display. And, (how can I put this without giving too much away?), it does not - as many films of this sort probably would - opt for a wholly redemptive and hopeful ending. Indeed, one of the many messages of the film is how difficult it is to escape from a life of poverty and violence, on a generational as well as an individual basis.""City of God"" is a brilliant, almost faultless film. It's a masterpiece of modern cinema. 10/10."
tjvinod97,"Aug 26, 2015",10/10,"In my opinion, a good movie is one that tells an important and entertaining story, makes you feel a range of emotions and makes you believe and feel for the events that are happening on screen. It should be able to do this by harmonising acting, writing, directing, post production and sound. And when I think about movies that have been able to exceed these expectations, often City of God is one of the first titles that pops up in my head.City of god takes a look at the lives of various kids and teenagers involved in a turf war in the slums of Brazil that spans over 2 decades. Life in the slums, corruption, gang violence and growing up in a dangerous place are some of the themes addressed in the film. It has a unique storytelling structure, transitions from one story of a 'hood rat' (or gangster) to another, before they intertwine in the climax.The characters of the film are amazingly likable and relatable. The slightly psychotic tyrant 'Lil'ze', Peace loving Ned, charming Benny and lovelorn Shaggy are some of the more prominent characters in the movie. My favourite would be Rocket, the narrator. He aims to be uninvolved in the turf war and become a successful photographer. All he wants to do is mind his own business, stay alive and get laid. That's about as relatable character a movie character will ever be. The raw and emotional acting of the cast makes the movie all the more memorable and authentic.One of the main filmmaking achievement of City of god is the way that it immerses the audience in its unfamiliar setting through brilliant editing and music. The famous opening, the 'chicken chase' sequence, is a perfect example of this. The actors, played mostly by residents of the slums itself, provide great authenticity. They manage to provide great, believable acting performances as well, despite having no prior experience in the craft.Despite being an emotionally impactful story, this movie still has several scenes that ooze coolness, without straying away too much from the actual grittiness of the subject material. Also, there are several witty dialogue scenes that help to prevent the film from getting too gloomy. Without scenes like Ned on the bus, Rocket taking photos of the gang and Benny's party, these characters would be mere participants in the harrowing events of the area. These scenes are crucial in highlighting one of the film's main theme: That these hood rats and gangsters are, at the heart of it all, still humans like the rest of us."
gregorybnyc,"Jun 24, 2004",10/10,"I was rather surprised by some of the negative reviews about thisabsolutely masterful film.  I didn't get the connection to GoodFellasbecause while those guys grew up together, they are older whenwe meet them, and their economic environment is very middle-class as opposed to the flavelas of Rio where the grindingpoverty is soul-destroying.The corruption that infects all levels of Rio society is sickeningfrom the drug and gun dealers to the crooked police and even thecynical media.  The scene about the violence in the City of God hasbecome so bad, that the media is now reporting on it, thereforeforcing the police to do something, left me slack-jawed.  This kindof insane lawlessness has to be answered.In the end, this is a movie with a message of  grim hope,astonishing as Rocket has begun to fulfill his dream of becominga photographer.  No such luck falls to Ned whose dreams arecompletely destroyed by the horrible violence of the flavelas withtheir drugs and their indifference to violence.  Any movie thatshows children  wielding guns as though they are toys should bea wake-up call.  It shows how our own indifference to children'sneeds for a good education, loving families, and healthcare is  justanother step in wrong direction of their futures.A though-provoking film that is also riveting in its intensity.  Pleasesee  it."
arisebabylon,"Nov 7, 2007",10/10,"This movie really captured me. I am very critical about certain movies, but this one was so well presented and was so gripping and powerful, there is no way you can't walk away from this movie without feeling like you were there in the City of God. The character's faces will stay stuck in your head for days and you will see Brazil in a whole new light.Perfect film. I don't just recommended this, I urge you to see it. The only movie better than this, IMO and in all of the friends I've shown, is the Godfather. And this movie definitely comes close to beating the Godfather. Hands down it's that amazing."
ineffableee,"Dec 8, 2020",7/10,"One of the most memorable films about life in the favelas. Captivating plot, cool shooting. A film where you have to make an important choice in your life and showing how important it is to go towards your dream"
Dimi1822,"Apr 23, 2005",N/A,"Coming from being a huge fan of the Lord of the Rings series because of its epic and powerful impact, I watched City of God that was set in a closer to modern time and a poverty-stricken location. Even knowing that, the realism and powerful impact that City of God had upon me was at the same epic level as Lord of the Rings. The acting was not the best I have ever seen, although it still was excellent and didn't hurt the movie at all. The emotions that it brought out and the realism that I felt while watching every moment of it was incomparable to any other movie I have watched. It really brought me fully into the action and to the story, and I felt like I was truly experiencing it. It drew me in fully through the end with its Tarantino style story-telling and captivating recollections through the eyes of Rocket the photographer. In all honesty, I almost can't believe it was a movie. It was so realistic and so well done, that it felt like a documentary capturing the true occurrences of every scary and powerful moment of this story. It was that realistic and that powerful, that I couldn't believe behind each scene there was a director coordinating every moment; as it all just flowed so smoothly together from start to finish. Every scene was perfectly detailed and constructed and the director's brilliance emanated from the screen during every minute that passed by. All in all a brilliant creation worthy of the recognition and appreciation it has received from those who have been privileged enough to see and enjoy what is City of God."
saoconrado40,"Nov 8, 2009",10/10,"City of God is a Masterpiece. With all the rubbish that is coming out of Hollywood these days, this Brazilian movie shows that plot and substance will smash CGI special effects any day of the week. Not for the weak of heart, COG is shocking, confronting, and also fascinating. It depicts real life in the favelas of Rio de Janeiro, where the horror of drug warfare is juxtaposed with spectacular scenery and beauty. Unlike the privileged few, the favelados are trapped in a vicious cycle of poverty and violence, which is almost impossible to escape from. Hollywood could learn more than a thing or two from this movie, it far surpasses any other action movie of the past decade. Simply a must see. 10 out of 10"
annoman,"Aug 7, 2007",10/10,"One of the most powerful dramas of the decade is 'City of God.' Fernando Meirelles proves that he can run with the most acclaimed directors in modern cinema with this film. His disciplined style is vigorously enchanting as much as it is appealing. For his furious and violent tale, 'City of God,' he portrays, with shocking realism, the slums of Rio de Janeiro from the late 60's to the mid 80's, where crime was the way out and those not involved were the suckers. But among these criminals and suckers is a minority of those dedicated the goodness that is often overlooked in cities as torn as Rio, and Meirelles exemplifies that notion through a young photographer and the story he comes to tell.The film follows a boy named Rocket (Alexandre Rodrigues), whose dream is to become an accomplished photographer. Growing up, Rocket was raised in a lower-class quarter of Rio's Ciudad de Deus (City of God), in which most of his peers had aspirations of becoming the City of God's next big thing  whether the path they led was bright or familiar. Among them was Lil' Dice, a young boy who ran with a gang of hoodlums whose main intention was stealing, though had killed before.As years progressed, both Rocket and Lil' Dice meandered down very different corridors; Rocket found fulfillment in honesty and kindness, whereas Lil' Dice eventually found himself the city's most infamous drug-runner, Ze Pequeno, or Lil' Ze. Soon before long, the City of God is ravaged by unseen violence, led by Lil' Ze, and Rocket is capturing the horrific footage via his hand-held camera. While Rocket's intentions focus on keeping down an honest, clean path, he finds that he can make amends with both Lil' Ze and the local police, by submitting photos of Ze and his entourage to the tabloids. Win-win for both, eh? Not quite. Even those who find success, struggle in the City of God, and by film's end that fact is recognized by all  and it's not soon forgotten either.The screenplay, adapted by Braulio Mantovani from Paulo Lins' novel of the same name, allows viewers to relate and reside with its characters and surrender their absolute emotion to a film that exhausts each and every emotion imaginable. Retrospectively, Meirelles' demand for the viewer's attention, through unwavering brutality and almost dizzying camera-work, makes for intense movie-viewing and enthralling entertainment. Additionally, the film carries a surrealistic beauty  and is shot with an overexposed lens that brightens the photography and implies perfectly the authenticity of the beautiful city of Rio de Janeiro  that elevates the heart when the movie reaches burrowing depths. All in all, 'City of God' is flawless; and with an array of resonating performances and flawless direction, it is sure to be one of the greatest films one will ever see."
