user,date,rating,content
somf,"Sep 8, 2005",6/10,"Nothing about this film rang true. I've enjoyed a lot of Asian cinema, but perhaps I have just no understanding of the Korean culture. Little that the characters did during the entire film made much sense. There were some wonderful individual scenes and great camera-work, but that didn't make up for a lot of things in the film that appeared for lack of a better word ""lame"". An example is when Oldboy holds off a gang of thugs with a hammer. It didn't work as ""comic book"" action nor as a realistic fight. Another example is the ant thing. Especially the giant ant on the subway. ""Hey, this would look arty"" Really disagree with those that loved this film. It has its merits. I wasn't fooled by the ending twist. Some disgusting scenes that made little sense. Just overall forgettable. I must admit though, I'm really curious how the American remake will turn out."
hikmet_03,"Feb 1, 2005",10/10,"A Vengeance Movie from ""the Vengeance Trilogy"" by the Philosopher, Chan-Wook Park. The first movie was Sympathy For Mr. Vengeance. So this movie's about vengeance.Chan-Wook's feature about vengeance;""Venegance's a huge might and a sense that needs passion. A man who runs after vengeance have to put all the pleasure of life aside. The Venegance brings a different pleasure within but in the end this pleasure is not useful.Though the man takes his revenge on aim, he can't bring what he lost back. Here is a great paradox about the sense of vengeance. The man's focusing an event that leads nowhere in the end with his all power and pleasure interests me."""
i090992,"Jun 26, 2011",9/10,"Oldboy is what you can call a sick master piece of the south Koreans. The Film is very well plotted and the direction is excellent. This is one of the films that should never be allowed by Hollywood,Bollywood to remake. It is an original.This is Asian cinema at its best.In the realm of revenge thrillers, you'd be hard pressed to find more ultra-violent vengeance and psycho thrills than in the creepy story of Oldboy.Do watch the film and do not be offended by it,look at the greater aspect of the movie and enjoy it.Oldboy deserves to be watched and appreciated."
irawanrizki1808,"Feb 19, 2014",10/10,"At first I used to be have this personal negative sentiment about Korean movie. Korean people tends to make everything over-dramatic (my experience watching FLU which is so painful to watch). And then the sentiment is slightly lowered when I finished this movie.Briefly, this is a story about a man who has been kidnapped and imprisoned for almost 15 years without any explanation. Suddenly he is released only to find note given by the kidnapper which asking him to find the answer who he/she is, why the reason he was imprisoned and get revenge.A journey to find the answer is begin.Right from the opening scene until the very last scene, there are no room for me to breath. The cinematography is so stylish and the acting was top-notch performance. The story development is well-thought and the twist is brilliant, relentless and merciless. The last 15 minutes is my favorite part in this movie. It satisfies my curiousness. By the end credit rolls you will find yourself speechless by how disturbing yet gorgeous the movie was and how the director intentionally leaving us some unanswered questions.My only concern is that I find some of the last part a bit too cliché and sentimental for my taste but it doesn't material.This is Park Chan-Wook's masterpiece and one of the best Korean movie ever made. You will find many elements like gore, thriller, drama, action blends into one perfectly mixed element.And just like any other revenge themed movie, the same question will arise:""When you had your revenge well, what's left for you?"""
KScythe,"Oct 20, 2015",10/10,"This was the movie that got me into Korean cinema. This was in my opinion the best movie from Park-Chan Woo's ""Vengeance Trilogy"" and quite possibly one of the best movies ever made. Around 7 years ago, I have been a huge fan of extreme cinema and I heard about Oldboy from one of my friends. When I actually sat down to watch it, I was completely blown away. This was not like any movie I have ever seen before. The storyline, cinematography, acting and soundtrack have exceeded far beyond my expectations.The story follows a man named Oh Dae-su, who has been held captive in a cell of what seems to be a hotel room for 15 years. After being released, he tries to find his captor, find out his motives, and achieve ultimate vengeance.The storyline seems simple enough, but the movie blows up in the faces of the audience with all kinds of unexpected plot twists. Not only that, but the story involves the audience with the characters in the movie by including very good character development and acting.I could go on and on about this film, but the fact is that it's terrific and worth checking out. It will leave many with lots to talk about after finishing it."
doomsdaycome,"Oct 20, 2018",10/10,"Everything about this movie is perfect. Acting, soundtracks, story, everything. Easily the best South Korean movie ever. No need to talk too much, go watch it."
dosyasoda,"Sep 10, 2022",10/10,"How often do you see a movie that makes you think, ""What did I see? I don't know, but it's genius"". That's exactly what you think after watching ""Oldboy"", 2003, directed by Park Chang Wook. Very mixed feelings of disgust and delight overtake the viewer as soon as he reveals the final twist of the plot.In a nutshell, the plot tells the story of an ordinary businessman, Oh Dae-su, who unexpectedly disappears for 15 years. And where he was and who stole him is to be found out over the course of the film.""Oldboy"" comes across exactly as a psychological drama, pushing the feelings and raising reasonable philosophical questions.The main character does not show emotion on his face, but there is so much pain in his eyes, thanks to the acting of Choi Min-sik. The viewer feels sorry for Oh Dae-su and wants to empathize with him, but judging his behavior soberly, it's the opposite. The antagonist Lee Woo Jin played by Yoo Ji Tae also proves to be more than just a faceless villain, the viewer finds out how smart he is and how justified his actions are. So well-reasoned, in fact, that you don't realize whose side you're on.The main problem with the movie is the cast. Other than Oh Dae-su and Lee Woo Jin, the characters are not memorable, seeming faceless. After watching it, it's hard to remember a single minor character who was interesting.The film raises questions about the viewer's personal life stance. What is love? Platonically, relationally, sexually? Is there a difference? What does it mean to get revenge? At what point does revenge end? And what is the difference between a man and an animal?You won't find the answers to these questions in the film, but it will make you think for a long time, the hyperbolized details of the scenes, the close-ups, the cruelty. All of this can be justified by the desire to create an atmosphere of discomfort, because it's the only way you can feel at least a little bit of what Oh Dae-su felt.It's hard. Very hard to watch, but it doesn't make it any less interesting. Separately, I would like to highlight the camerawork. A lot of angles, camera moves, theatrical scenes, and a lot more. All of these visuals serve their purpose. The fight scene in the hallway is considered iconic for a reason. The entire fight is worked out to the smallest detail."
mistoppi,"Feb 20, 2016",8/10,"To be hones I'm in a shock right now.The story of Oldboy is absolutely horrible. And no, I don't mean it's written badly, I mean the story is so horrifying that after I was done I just had to sit and stare the screen for a while. The only thought in my head is: ""What the hell did I just see?"" This is the beauty of movies with clever plot twists that actually do surprise you: Oldboy, Primal Fear, Fight Club... I'm sure there are many more, but just making a list would be lazy. The plot twist in Primal Fear is just surprising. It's clever, but the thing is, it's not that bad. while Oldboy... That plot twist is absolutely shocking. And the story is well written even when you don't count the plot twist. The main character's narration gives a lot more interest to the story. The mystery is intriguing, and the writers have a way of keeping the viewer invested in the story. Even when you don't really like Oh Dae-Su, you still want to know why. And even Oh Dae-Su is not really a likable character, you still wonder if he deserved that. That would be an interesting philosophical debate.There are a few group fight scenes in this film, and they are excellent. They are well coordinated and enjoyable (or as enjoyable as fight scenes are) to watch. The visual side of Oldboy amazes with how good it looks when it needs to. There were few gore-y scenes, yet nothing too horrifying was shown, so something was left to imagination. Still those scenes keep you on the edge of your seat.Oldboy is a very well made movie. It's shocking, and I'm not sure how good it is when you watch it a second time, but at least after this first time I am astonished - and shocked. I'd love to recommend this movie but I don't know how risky that would be."
gopikrishnan92,"Aug 14, 2011",10/10,"Sometimes in life, one can face awful situations than death. Here in oldboy, we witness a situation like this..I heard many people saying about Korean pictures, watched sm of it, and i can honestly say, dis korean stuff, is truly amazing, we could be thrown into shadows of sadness for many hours even after watchn d film. This is rare, very rare, for a man like man to remain sad aft watchin a movie, so wht will be d condition of others? I can't even imagine that..Truly painful, but brilliantly twisted story, it is d best twisted film i hv ever seen.."
SnoopyStyle,"Oct 8, 2014",8/10,"It was 1988 Seoul and Oh Dae-Su got drunk on his daughter's birthday. After his friend Joo-Hwan got him out of the police station, he is kidnapped off the streets. He is imprisoned in a motel-like cell. He gets gassed periodically without explanation. After 15 years, he is released from a giant suitcase on top of a building. There's a strange guy with a poodle who falls to his death. A bum gives him money and a cellphone. A mysterious man calls to taunt him. He passes out in a sushi restaurant and the cute chef Mi-do takes him home. They both have had hallucinations of ants. His daughter is adopted and living in Stockholm after his wife was murder and he's assumed to be the culprit. He discovers the prison where he was imprisoned. The wealthy Lee Woo-jin reveals himself as his tormentor with a deadly threat against every women that he loves.As I watched this, I kept thinking of David Lynch and to lesser extend Quentin Tarantino. It's got the bloody violent revenge plot at the center of this. What I love more is the weird surreal touches. There's no way that a guy is going to eat a live octopus in any Hollywood movie. It is such a strange plot move to find a place by how a dumpling taste. It takes the cool violent movie to a weird off-kilter place."
chiragrathod09,"Apr 29, 2023",10/10,"""Oldboy,"" directed by Park Chan-wook, is an extraordinary South Korean thriller that leaves viewers both enthralled and disturbed.The plot centers on Oh Dae-su, a seemingly ordinary man played brilliantly by Choi Min-sik, who is inexplicably imprisoned in a small, windowless room for 15 years. As he is released without explanation, he embarks on a relentless quest to uncover the identity of his captor and the motivations behind his haunting imprisonment. As Dae-su's journey unfolds, it transforms from mere revenge into a dark exploration of the human condition, identity, and the consequences of one's actions.One of the most striking aspects of ""Oldboy"" is its intricate narrative structure. Park Chan-wook crafts a suspenseful tale filled with unexpected twists and moral complexities that challenge traditional notions of justice. The film's pacing is gripping, keeping viewers on the edge of their seats as secrets unravel and the stakes rise. The film culminates in a shocking climax that forces audiences to reflect on the nature of revenge and its unbearable costs.Choi Min-sik's performance is nothing short of exceptional. He embodies the anguish and rage of Dae-su with a raw intensity that remains unforgettable. His transformation from a passive victim to an agent of vengeance is both compelling and haunting. Supporting performances by Yoo Ji-tae, who plays the enigmatic antagonist, and Kang Hye-jeong, who portrays a pivotal character in Dae-su's journey, add further depth to the film's emotional landscape.Visually, ""Oldboy"" is a feast for the senses. Park's direction is complemented by captivating cinematography that captures both the bleakness of Dae-su's imprisonment and the vibrant yet dark world outside. The film is peppered with striking imagery, including the iconic hallway fight scene shot in a single continuous take-an exhilarating blend of choreography and cinematographic expertise. Furthermore, the haunting score by composer Jeong Jong-hyeon perfectly complements the film's tone, amplifying the viewer's emotional experience.However, it's essential to note that ""Oldboy"" does not shy away from graphic violence and disturbing themes, which may be unsettling for some viewers. Yet those willing to confront its darker elements will find a rich tapestry of storytelling that transcends typical genre conventions.Oldboy"" is not without its controversies, as it delves into graphic violence and disturbing themes that may not be suitable for all viewers. However, those who appreciate bold storytelling and complex character arcs will find it to be a remarkable and thought-provoking film.In conclusion, ""Oldboy"" is a cinematic masterpiece that challenges and captivates its audience. With its blend of psychological depth, stunning visuals, and a haunting narrative, it remains a cornerstone of modern cinema and a vital part of the conversation around the portrayal of revenge on screen. Park Chan-wook's film is not merely a movie; it is an experience that lingers long after the credits roll."
taalan,"Feb 26, 2007",10/10,"Let me just say first and foremost, that anyone who cannot stand heavy handed violence, language or sex should probably miss this film... for the rest of us, this film has it all! One of the most incredible performances ever by Choi (the acting all around is spectacular, but he stands out above the rest), great directing, the corridor scene is just pure glee, one of the most ingenious plots and story line twists of all time, and believe it or not, the movie is extremely funny in some parts (the whole, ""now let me tell you my story"" part is hilarious, just to name one example). However what really shows the quality of OldBoy is that it's not just a excellent conglomerate of all those things that make a movie good, it was how it affected you. OldBoy is a extremely deep and psychological movie on the level as well as the carnal level, and it gets better every time you see it. If you think you can handle the content, and don't mind subtitles, then this film is a absolute must see. Overall, this is quite possibly the best revenge drama of all time."
jakethebiggestsnake,"Mar 7, 2008",9/10,"I saw this movie for the first time on a pay per view channel together with my dad. He thought it was not bad, but I was entranced. The second I got home I bought it (it was one of the first DVD's that I ever bought).I've shown it to over 50 people by now and they all agree on one thing, it has some amazing parts in it. Even people who really didn't like the movie, loved the fight scene in the middle, it has comedy, extreme violence and some good old fighting.This movie is in my top 5 favorites of all time and the only reason I didn't give it a 10 is because after watching it as many times as I have some scenes get a bit boring.This movie has it all, plot twists that would make M. Night Shyamalan confused, action that would make john woo proud, sex scene's that are worthy to be in a porn, and action that should've gotten an Oscar.If you haven't seen it yet, do so now. If you've seen it but didn't get it watch it again. And if you're like me and love it, just watch it for the fun of it again."
igormontenegro,"Sep 4, 2018",10/10,I know nothing about this movie before watching it. Now I can tell that this is one of the best movies ever.
TedStixonAKAMaximumMadness,"Feb 17, 2012",10/10,"I just recently noticed that I have written 99 reviews on IMDb since joining in 2005. And I have decided, in honor of my 100th review, to tackle my favorite film- a Korean release from 2003, directed by the masterful Park Chan-Wook. I am speaking of course, of the controversial and amazingly elegant film ""Oldboy.""Based loosely upon a Japanese Manga, Chan-Wook's ""Oldboy"" stars the amazing Choi Min-Sik as Oh Dae-Su, a drunk businessman in Korea. The film opens with his abduction from public, as he is mysteriously placed in a dark, dingy building, where criminals pay to have people held captive. Dae-Su is locked in the hotel-like room, being fed daily and only having a TV to keep him company, for 15 years. One day he learns on a news report that his wife was found murdered, and he later learns that his young daughter was sent to adoptive parents out of the country. Over time, he becomes depressed, angry, and eventually empty. He begins to train himself to fight, plotting to escape and seek vengeance. Then, all of the sudden, he awakens one day to find that he has been set free... given money, a suit and a cellphone. A taunting phone call from the one who ordered his captivity ensures that Dae-Su will stop at nothing to get his revenge.He is joined by Mi-Do (Kang Hye-jeong), a beautiful and feisty young chef and his old friend No Joo-hwan (Ji Dae-Han), whom try to assist him as he solves the mysteries surround why he was imprisoned. He also does eventually encounter the man who ordered his capture- a wealthy businessman who lives in a towering skyscraper named Lee Woo-jin (played by Yoo Ji-tae), though the encounter only raises the stakes- Dae-su cannot kill him, for he will kill himself first to rob Dae-su of his revenge if he tries... And now, Dae-su only has five days to solve the mystery, or else Woo-jin will kill Mi-do, whom Dae-su has began to fall for.The acting is superb, especially from our leads Choi Min-sik and Yoo Ji-tae. Both deliver astounding and detailed performances. Choi Min-sik is sympathetic yet at the same time frightening and unstable... you will root for him while fearing him. And Yoo Ji-tae is incredible as our villain, who is oddly likable and charming despite his cruel and often evil nature, much in the same way Hannibal Lector was in ""Silence of the Lambs"", and he plays the role with much joy and delight. Both were chilling.Supporting roles were all well-played. Kang Hye-jeong and Ji Dae-han were both phenomenal, and all other secondary characters were well-played. (Particularly funny is Oh Dal-su as ""Mr. Park"", the nasty little jerk who runs the building where Dae-su was imprisoned. He's the sort of guy who would double-cross his mother for a nickle, and he's a lot of fun to watch.)Park Chan-Wooks direction is what really, truly elevates this film to unknown bounds, though. Chan-Wook has a poetry and a distinctive, sharp visual sense to his camera-work. Everything is perfectly deliberate and perfectly fine-tuned. His choice of colors, textures and patterns also set a marvelous mood. This is one of those films where even if muted, the visual tell the story just as much as the dialog. Everything is perfectly planned out- right down to the wallpaper on the walls and the tiniest prop. (It's even in the making-of.) Chan-Wook's visual sensibility and ability to communicate his ideas with the actors is the closest to perfection as is obtainable. He is truly a master of film.The script is very tight, dare I say, even flawless. It all fits together like an enormous jigsaw puzzle, and each piece is important. The few action sequences are amazing and gritty, the music is perfectly implemented to compliment the story. The many twists and turns the plot takes are breathtaking, and you will leave this film feeling touched and disturbed. It gets under your skin and infects you. You will not forget this movie!This is truly an amazing film. I usually try to find something negative to mention in each of my reviews, but here... I just can't.""Oldboy"" is a 10 out of 10. It is as close to perfection as a film can get."
vortexrider,"Jan 20, 2007",6/10,"I would say that although this film does have its good moments, its not as good as many say it is. First half of the film is pretty intriguing and mysterious. You can't help but wonder what you would do in the situation of a man who has been locked up in a room for unknown to him reasons for fifteen years.The film goes downhill after Oh Dae Su gets out of the prison and starts seeking revenge. The plot has been made way more complicated than it had to be. What I found most annoying is various sentimental scenes where a piano is playing and we supposedly get to see someone's emotions or their ""softer side"" . I did not like it because I thought it took away from the continuity of the movie and its straightforwardness.When I said the plot is too complicated I meant not only that but also that its a very unrealistic plot in which characters do not act the way, I think, people would act in real life. Its just dumb sometimes.There is also a pretty tasteless sex scene that is just painful to look at.I feel like this movie is intentionally glamorized by the director and does not reflect real human emotions. I feel like he was copying Fight Club or similar movies made in the west."
martinwOO7,"Apr 16, 2022",7/10,The film is slow to begin with and has some very hammy acting and fight scenes but it is worth seeing it though to the second half when it comes alive and there is a very big surprise awaiting you.
mannyg93,"Jul 31, 2013",9/10,"Oldboy was a fantastic film which had an unexpected ending. It's one of those films where you purely and genuinely feel sorry for the main characters. The execution of the film as whole was genius and very well done.Character development was really well done and it wasn't hard to follow the storyline at any point of the film. The flashback scenes were done really well as well, and the black & white shading added nice tone to the scenes.Highly recommend this film to anyone who is a fan of Tarantino pictures or anything left-of- field!!"
bowmanblue,"Aug 4, 2015",8/10,"I recently saw another Korean film 'I Saw the Devil' and, in light of the fact that I've now watched a film made by the same people, 'Oldboy' I'm glad I did. Because I think that many of us have been kind of lulled into believing that the only way to make a film is 'the Hollywood way.' I didn't like 'I Saw the Devil' when I started watching it, but, after persevering, I was glad I did in the end. Plus, now I feel I know Korean cinema a little better (or how it's done) I was able to enjoy (if that's the right word) 'Oldboy' from the off.And it's certainly a difficult film to describe, let alone say who's its target audience is. A man – and not a particularly nice one – doesn't bother seeing his estranged wife and baby daughter in favour of generally going out and getting drunk. However, things quickly catch up with him when he's swiped off the streets and locked in a room for no less than fifteen years without explanation. However, during this time he's had more than a few changes of heart. Now he's not only ready to find out and punish whoever imprisoned him in the first place, but also make amends with his daughter, who is now basically grown up in his absence.It would be easy to label Oldboy as a 'revenge thriller.' Yes, there are certainly aspects of hunting down those who wronged him. But it's the way it's done that makes it so different. I would go into specifics, but it's one of those films where if you say too much about the plot you will give away vital points which will lead to you predicting what's to come. It's fair to say that there are more than a few twists and turns to keep you interested (or disgusted?) and you will not only need to be ready for those, but also have a strong stomach in terms of content material.Which brings me back to my thoughts on who it's marketed at. I don't really know – people who like revenge movies, but can tolerate some pretty disturbing story lines mainly. Oh, and subtitles. It's got subtitles – but then you probably guessed that. However, even though you have to read the dialogue it's still easy to tell that the cast are pretty impressive and there are performances that are going to stick with you – even if some of them are for the wrong reasons.Basically, if you like your foreign revenge films dark then give this one a go. Just don't blame me for any therapy you may require after sitting through it. A classic, but a dark one."
Ms_Carter,"Mar 17, 2024",8/10,"I have known about this movie for quite a while
But for one reason or another
I never got around to watching it until recently
This is a sick twisted tale of revenge
It's not a perfect movie
(In my opinion anyway) The story moves to fast and feels all over the place
When I think of revenge movies
I think of slower pacing and more details on why the person is seeking revenge
I actually had to watch one of those ending explained videos
Before I understood it
To me the fact I had to go to a ending explained video indicates it's not a perfect movie But now that I get it I'd say it's a good movie and the ending suits the story But it's nowhere near a great or perfect movie."
