user,date,rating,content
asaar,"Jun 3, 2008",10/10,"First off, the plot, one of the things I noticed was a common theme in the comments criticizing ""Oldboy"" was actually quite impressive. There is a twist like in all good movies. If you were one of the folks who saw it coming a mile away, good for you, congratulations. Now you can sit back and enjoy the ride. Oldboy is one of those films that starts out strong, builds you up the whole way through, and then ends with a bang, leaving you satisfied and thinking back at what a great film it was. It follows a lonely man who has many problems but refuses to face them. The movie guides him through a healing path where he discovers the mistakes he made in his life and as a result pays the consequences for them. It really makes the viewer draw many parallels between his or her life and the life of our tragic hero in the film. Not to mention it is beautifully filmed. The choreography in a rather impressive sequence involving some torture and a fight scene involving a hammer (I won't say much more for sake of avoiding spoilers) was fabulous, almost a bit Matrix-esquire. See this movie! It's worth it!"
nkw88,"Sep 3, 2004",N/A,"Some Koreans enjoy eating living octopus though other Koreans don't. It is just as the same as eating sushi and sashimi. You may not be used to eating it or even seeing the scene. Anyway, it is not so shocking to Koreans as to Western audience. You may want to feel 'living things' or 'something fresh',to feel what the life means by eating which is the basic humaninstinct, if you are prisoned 15 years and eat just one itemfried dumping for 15 years. How about canned Ravioli for 15 years or Big Mac for 15 years? Or French Fried for 15 years?For me, Oldboy to Sympathy for Mr. Vengeance is what Koryo Blue Porcelain to Chosen White Porcelain. Each film has its own attraction but OldBoy is much more decorative than Sympathy for Mr. Vengeance which shows the beauty and power of the simplicity.I still prefer the latter, though Oldboy is still great."
Chandru2206J,"Sep 15, 2024",7/10,"This movie is about Dae-su Oh, held as a prisoner for 15 years and gets released to find his captor. The movie covers the pursuit of Dae-su, the reason for being in prison for 15 years, and disturbing revenge by the villain.The story had a good start, as the plot was interesting for the first 40 minutes. The scenes were written in a raw and dark sense to create a hard-hitting movie. The first fighting scene was good, but at last, it was lame. The characters were written well to create a mysterious feel to the story. The villain's motive was not good enough to take revenge on Dae-su, but after all, being delusional is the villain's trait, too.I slept in between and woke up in a flashback scene; I didn't rewind the movie but continued watching, and still, I understood what was going on. Still, I am not curious to look back on what I missed while I slept. The last and final hard-hitting twist, unfortunately, I saw that coming, and they hinted it already with her things in the bag.The actors were good at their roles. The cinematography and composition were good and set the right mood for the story. The music was not memorable at all.In conclusion, it was a was a decent revenge story for me. Some may find it excellent and hard-hitting due to the last twist. But after watching some even more twisted movies, it's just a predictable one."
mlucien,"Jul 4, 2005",8/10,"Old Boy is a slick action thriller that is both entertaining and ultimately thought provoking. Fincher's 'Fight Club' and Miike's 'Ichi The Killer' have both been raised as stylistic comparisons and there is a lot of merit to this perspective.Essentially, it is about a man's imprisonment and subsequent quest for vengeance against his initially unknown captor. To state more than that would be to spoil a film that relies upon a significant plot-twist. This plot twist has been much discussed. Further, there appears to be a significant amount of ambiguity in the final scene that leaves it open to interpretation as to whether the protagonist has 'taken steps' to move on from the events, or whether he is still a warped monster of revenge.It is safe to say that it is a niche film - one for people who like overt cinematic technique - namely flashy visuals and inventive action sequences. My personal bias is towards such films that take an innovative approach to visuals and for this reason, and the provocative ending, I found it to be a very good film.I think that most people would find it entertaining to some degree. Whether they would find it a good film is a matter of debate. There have been a great many reviews extolling the merits of the film and many eloquent criticisms - both are equally valid.There are continuity lapses and some facile quasi deus ex machina (omnipotent villain) explanations, but in particular, I think the charge of nihilism is quite accurate. It is not a movie where the message is obvious, or indeed one where you could really categorise as having something profound to say about the futility of revenge or the human condition. That said, as a stylish piece of entertainment I enjoyed it immensely. I have seen Park Chan-Wook's 'JSA' and 'Sympathy For Mr Vengeance' and preferred this film. Whether this makes me a vapid pop-culture victim, so be it, but I honestly have a better time seeing something like 'Performance' or '...if' or even 'Ichi The Killer' than 'The Sorrow and the Pity' or 'Through a Glass Darkly'. Great films, like great literature, can be hard work and not always more rewarding."
liciuantonio-03349,"Aug 25, 2024",7/10,"Ok, it's not a bad movie, it's just an ok movie.Too overhyped and without a doubt who gives this movies a rating higher than 7.5 just wants to be different so damn much.I saw some posts that says that this movie is so much better than Shutter Island... shut the **** up. The ""plot twist"" - if you saw more than 3 movies you'll get it from the middle of the movie. Too much dramatic stuff in the end of the movie and too drastically exaggerated.Don't get me wrong, it's worth the watch but i think i'm just upset with the fact that it's sooooooo overrated.If you watched Shutter Island and your rating is 8, ""Oldboy"" i think it won't get higher than 6.5-7."
TDeath,"Sep 8, 2004",4/10,"I went to see this movie because it had a 8.6 rating at IMDb.com. How can people overrate it like that?The first 90 minutes were sooo boring. The whole movie, you wait for something to happen which explains everything. And when that happens in the end, it's just a disappointment. The story is unrealistic, the dialogues are poor (and no they are NOT intellectual, for all wannabe-intellectuals - not only since the few wise sentences have to be repeated five times for everybody to remember them). The few messages could've been brought to the viewer in a much more entertaining way.Like in David Lynch movies, Oldboy forces you to think about it, and think about it, try to find a deeper sense, and while you are watching you realize that there is none - and that's just poor."
bandare-1,"Jan 31, 2007",9/10,"Not having seen any previous films by this director, I went in with an open mind. While I was in Korea in 2004, I asked a few Korean friends, what movies they thought would be worth watching (subtitles permitting!). All of them suggested Oldboy.This film is quite slow to get going but its fitting that you get eased in to the film. It's a very disturbing film and extremely graphic in places. However, I do think its all in keeping with the storyline.To me this is a must see film as a result of the acting, the twists throughout and overall difference that the film puts out to the standard US based movie! If you don't mind some violence and general disturbing content based around torture and violence, then you wont be disappointed. Fantastically executed with great camera work, give it a go!"
kosmasp,"Jun 13, 2014",10/10,"I haven't read the Manga (comic) this is based on, but I can tell you that the movie is very devastating. It also features things that might not be as apparent as they are, especially to western audience members. There is a different sense of honor and sensibility in general, something that is difficult to translate (more on that on my review for the US remake).The lead role is played by great gusto, but the villain of the piece is great too. You can argue about motives all you want and about character decisions (see sensibility and how this movie ends), but it all works out nice. There are quite a few remarkable things happening (especially visually - think octopus and ""Hammer time"" to name a couple - but also tonally or story wise - one very big twist, that is as twisted as it gets) and some will take you by surprise. Unless you have read about them or seen the remake before this. Would be a shame, because if you only watch one Oldboy, make it this one!"
zleverton,"Mar 23, 2006",10/10,"one of the most up-and-coming film makers of the day is one Chanwook Park, an auteur from South Korea who just may go down in the history books as the 21st centuries first great storyteller.Revenge. the word itself denotes a certain tingle on the back of your neck. we all know what it means, some of us have even been a part of it's tangled web. Vengeance is the culmination of almost every emotion the human mind is capable of understanding, and some we don't. Chanwook Park has written, directed and produced three film that tackle the psychology, philosophy and grand theme of vengeance, and Oldboy is the second installment and probably the most important.the story is quite convoluted, and much of it should be left to be witnessed with virgin eyes and ears, but sufficing to say that a sully drunk named Oh Dae Su is captured by a man with a purple umbrella one rainy evening after a few hours in the drunk tank. he is kept in a small motel room with a fake window, a TV, an eerie painting and a gas pipe for the duration of 15 years. during this time, he witnesses his wife and child murdered on the 11 o'clock news, and he is framed for it. Dae Su sort of goes into a slow state of focused madness. his body becomes tough and trained, his hair becomes shaggy and beast-like, and his wrist becomes an hourglass, counting the years in checks until his release. When Dae Su is released, he is no longer Dae su, but something else, he's a beast, a monster, an unstoppable force of vengeance created by the rage and sorrow of the former Dae su. he still looks like the same disheveled 40-something, but there is a deadness to him, a crouching killer waiting to spring on his pray- the people who killed his family and put him in that horrible place, but with all the anger inside Dae Su, there still lurks a very human being, one so desperate for contact with another life after 15 years of deprivation, he consumes a living creature as his first meal upon release. this is only the first half hour of the film, and it's really the simplest part of the plot to explain- a precurser. this should give you an idea of how deep and dark this film plunges into the human psyche. for all it's cartoonish moments and stylish look and feel, Oldboy is unmatched in its well of emotion and deeply human story. you are not asked to take what you see as literal occurrence, but rather to accept what you see and draw meaning from it. there are some scenes many people find obligatory, consciously shocking or just plain gross, but they are all necessary in order to understand the epicness of this tale.on a technical scale, Park has taken a complete divergance from his previous effort- Sympathy for Mr. Vengeance and instead gone into a kind of surrealist filmnoir-meets-hong-Kong wonder-world from which this fantastical story can be properly told in the grandios form it requires.a lot of people disliked the ending to this movie, and if you watch this film the same way you watch something like Fight Club or Memento (both fine films) then you wont like it either, but this isn't fight club or memento, this is Shakespeare, this is Homer, this is what lies beneath the gloss and dirt. the core. the story itself is unimportant, it's what the story implies that makes it a masterpiece.i mourn the idea of remaking this film, giving the helm to the man who'll do Fast and the Furious 3, and making the main character go to prison rather than the original mysterious hotel room. all the things that make Oldboy Oldboy are gone, and all we're left with is the homage of someone who obviously missed the point. so i urge you to see this version of the story before it becomes a bastardized memory of itself stuffed into a Pepsi advertisement."
wwwranga,"Aug 22, 2018",10/10,"Amazing movie ,its stays in your memory forever.let's start to watch it and experience a unexpected plot.those who gave a disaster review for this movie definitely they must be get more mature to watch this movie."
gavin6942,"Dec 28, 2011",8/10,"After being kidnapped and imprisoned for fifteen years, Oh Dae-Su is released, only to find that he must discover the reason for his capture in five days.I am a bit surprised to find this film in the top 250. Not that it is not a good film (it is), but it does not seem like the sort of thing that would get the honor. I suppose, certain plot elements aside, it has incredible cinematography (both in movement and color) and excellent directing. The acting is fine, as well.The violence is hard to categorize. On one hand, some of the bloodiest scenes call to find the films of Takashi Miike. But Miike lacks a certain sensibility that Park does not -- this may be a revenge film, but it is also beautiful in a way. The violence, at times, comes off like a well-scripted choreography. Where Miike tries to shock the audience and push the limits, Park seems content to stay just on the edge and make sure it is done in good form.The biggest problem with this film is that it suffers from the same issue that ""The Sixth Sense"" did. While ""Oldboy"" has many twists and surprises, one of them will probably be told to a viewer before he or she watches the movie. And that is unfortunate. Does it ruin the movie to know twists in advance? Maybe not. But it might be best to have things revealed as the story intends them to be.All in all, a solid film. If I had any complaint, I could say the film was a bit long. But the pacing was steady, so it was not an unenjoyable longness. Not for all audiences, this film should be seen by those who can appreciate it."
bloogrim,"Apr 18, 2005",N/A,"Don't get me wrong. I thought this movie was awesome. The fight scenes were hilarious and Dae-Su's not so desirable appearance made him all the more likable. I only wish that movies made in this country could live up to foreign or even independent films. But alas, that's not how it is. One of the few good things about living in NYC is being able to know and see more things that you wouldn't otherwise see in Smalltownsville, USA.I only wrote all that so my main point can be posted (10 line minimum).The most f*cked up thing for me about this movie was how I felt in the end after getting all worked up about the sex scene in the beginning. I literally wanted to vomit.Thats all.save the whales.-karen"
jonathanrandleff,"Feb 7, 2022",6/10,"Had so much potential, and the build up was great...However, it was so blatantly obvious what the reveal in the end was going to be that it lost all of its drive and purpose...."
buffychik,"Jul 2, 2006",10/10,"I came into this film knowing absolutely nothing about it. My manager said ""buy it, it's AMAZING"". First of all, the plot. After a man has a terribly drunk night, he ends up imprisoned for 15 years without knowing who imprisoned him and why. When he is released, he is given a new suit, a cell phone, and ends up at a sushi restaurant, where he meets Mi-do. Along with Mi-do, to save those he cares about most, Oh-Daesu is given 5 days to figure out who imprisoned him and why. This film definitely focuses on the fact that even the smallest things can blow up out of proportion, and the results can be catastrophic. The acting is by far the best I've seen in Asian cinema, and the writing is fantastic. I highly recommend. 10 stars all the way."
yuenyeeac,"Apr 25, 2020",7/10,"The brutal and almost perverted revenge caused by an unfavorable love is bound to be achieved by causing another unfavorable love. Ignoring the fierce bloody and psychological distortion process for a while, the theme of the film is clearly cleared in a clearer way. This incident of incest is faced with the brave posture of resistance shown by today's powerful ethical and moral system, and some kind of interpersonal crisis of modern people revealed in this stiff and unpretentious posture.
Just as Marquez said in his magical realism masterpiece, the end of incest-a person with a pig tail, modern biological science can also testify to it, incest will lead to deformity of future generations due to the similarity between genes. However, the reason why incest has become a taboo is not such a biological reason. To trace back the history of mankind with the population of the earth today, we can simply make a simple estimate of the population of thousands of years ago or even ancient times, and then we have come up with an impossible number. Such a fact of population growth. This incident proves that incest is not a long-forbidden and rare, but a basic fact of human beings for millions of years. The reason is very simple, it is just a small number of people. In fact, it is difficult to imagine a social organization without incest. Because incest succeeded in preparing the network of in-laws, it enabled the continuation of society, and people in any society without it would be unsustainable.
The birth and reproduction of human beings, from the necessary combination of men and women to family construction to today's monogamy, is a long evolutionary story. From the initial biological, physical, and slowly to the so-called cultural and social evolutionary path of today. One of the basic premises for its realization is the gradual increase in the number of people, so that people no longer have to choose whom to combine from in-laws; at the same time, another more important reason is not fertility distortion, but incest. The disorder caused by human relations makes incest gradually unnecessary and further becomes a taboo.
Therefore, the original primordial incest can actually be generated naturally; now incest has become a problem again. It is actually artificial. The most important thing is of course all kinds of sexual taboo thinking, which causes the so-called sexual repression. Sex has become a shame and even a sinful thing, and the lust can't find an exit. It makes people return to the ancient stone carvings that have only direct blood relatives and only a few heterosexual blood relatives in disguise. . In this way, incest seems to have gone from the ancient ""naturally forced"" occurrence to today's ""artificially forced"" occurrence. And this is the most important reason for the film to be almost invisible but concealed under the modern incest system.
Finally, in the wilderness and snow of the desert, the father realized the detached love with his daughter by choosing to forget. This scene is like the ancient moment when humans are scattered in the earth, but the truth is that this is an extra-legal place free from ethics and social taboos. Love itself is not guilty, even if it is not good, who has hurt it? In fact, it is meaningless to discuss the actual rationality of the ending. It is just a window that condenses the airtight cultural and moral system constructed for modern human civilization, and a buffer that dispels the pressure of the system. Belt for some people who can't bear the burden to take a breath."
dhkdhk,"Jan 25, 2005",9/10,"This is one heck of a film experience, a cinematic joyride unlike any in recent memory. A well-crafted tight package it is, of electrifying acting performance (Choi Min-Sik is simply great), innovative cinematography, unbelievably warped story line, bone-jarring action, black humor, all fortified by a moody and captivating music score(it tends to lodge in the recesses of one's right hemisphere, and won't leave).A role that demands a tremendous emotional range, Choi Min-Sik gives one of the most memorable acting performances in recent years. We see a man brimming with bottled up rage for vengeance barreling his way towards the inevitable encounter with his nemesis, and when the moment arrives, we are witness to a heart-wrenching transformation of a broken man pitifully begging for his mute mercy. If there ever is a measurable scale to the emotional spectrum of acting, then Mr. Choi's performance pushes through the untested limits of infrared and ultraviolet. His brilliantly inscrutable and ambiguously formed sweet-and-sour smile(Mona Lisa would be proud) near the end is the singular summation of a tortured soul who has just been reminded of the unbearable cost of his hollow victory. Perhaps it is the smile beneath which a glimpse of the ""monster"" can still be seen. Many will ponder.Throughout the movie, the viewer is treated to some striking imagery which effectively appear almost embossed onto the film. Some of the more memorable scenes appear to be lifted right out of its dramatic Manga frame composition. Dramatic pose of our protagonist holding back the man and his dog, Mr. Han's momentarily frozen Judo form, the ""Great Wave""(poster) of emotion towering over Dae Su.. There is no stylistic over-byte here, just enough dramatic essence distillation to stick. Simply brilliant. Of course, this is in sharp contrast to the infamous hallway fight scene, an all out, no cuts, make-your-palm-sweat realism. This is largely due to Mr. Park's mastery of his directorial craft to match the subject drama and acting.Those cineastes who like their cinematic Martini ""shaken AND stirred"" will no doubt discover a winding, twisted emotional vista, one that we rarely see. A rock and a grain of sand may sink the same, but surely this cinematic de la creme will ascend to its rightful notice. Indeed a stylistic substance and substantial style."
bsinc,"Aug 26, 2004",9/10,"That's how big an impact ""Oldboy"" made on me! The opening of the movie alone is perhaps the coolest opening I have ever seen because when that music started playing and the first scene starts rolling I was in movie heaven. It was one of those perfect moments I guess, and it was all the much harder to believe, because I am no Asian-movie fan. Actually I avoid Asian movies as much as I can because I don't like their storytelling and directing, plus I never remember the faces because they all look the same. I have, since seeing ""Oldboy"", changed my opinion on that. How could I not, the movie has more style that the first two Matrix movies combined, visual effects that are more than equal rivals to any big-budget Hollywood movie, actors that I was somehow able to recognize were amazing, despite having to read the subtitles all the way through, and a music score that has been playing in my head for many days now. And I haven't even gotten to the true core of this movie. It's a story that blew me away, it's a hardcore revenge movie that won't leave you cold. Put all of this into exactly two hours of pure entertainment at it best, countless memorable scenes that are beyond amazing, and give it a dash of perfection. You got it, an instant cult classic. 9/10"
