user,date,rating,content
antonie4,"Nov 11, 2014",3/10,"This film is an example of having to many irons in the fire and not knowing what to do with them, which results in an over sentimental mess that is called Interstellar. Nolan finally shows clearly his hubris in that he thinks of himself as a cinematic mastermind, in fact he's just a Hollywood pet with cheap tricks. There is nothing wrong in getting the science incorrect, a competent filmmaker manages to work around the incoherence and still create a unified whole, Nolan on the other hand wants us to think that he understands the science behind Interstellar, but he also shows clearly that he doesn't put much trust in the audiences' intellect.This results in an over abundance of exposition which is there just to inform us of how stupid we are. The sentimentality, which is most of the time laughable, doesn't go along with the overall structure of the film because the plot is disorganized. The problem comes from the inability to transform a concept into a film without allowing the audience to interpret what they are seeing - instead Nolan tries to overwhelm us with his elitist vision and it comes out as a mess because he doesn't trust his audience, he's lack of vision doesn't come from him not having a concept but from the inability to mediate that concept through a film, in other words: he is a bad filmmaker."
iamjeet-24179,"Apr 4, 2024",10/10,"Nolan knows what he is doing, the time concept has to be the best one in this Nolan's movie making. It has to be my top 5 movie. The cast has been incredible with the performance. Fav scene has to be the one where Matthew McConaughey is in the black hole. That scene has to be my one of the favourite moments in the movie, the emotions were raw and couldnt contain myself but to shed a tear on the wonderful performance.I am a fan! I cannot stress the incredible work that Nolan has executed, in all different levels of performance it was just miraculous and I can watch this movie back to back without not being a fan!"
abhimanarjun,"Apr 20, 2020",10/10,"When I watched this movie years ago, I got obsessed with it, even six years later I continue to watch the movie repeatedly. The story is unique. Yes, it is about space like many movies, but not a single movie about space can even come near to Interstellar. Your whole body is immersed in the plot, you are on the same emotional level as the actors, Matthew McConaughey and Jessica Chastain but also Christopher Nolan who did a phenomenal job. My heart was pounding in those exciting scenes. I can't even describe how perfect this movie is. It is my all-time favorite and I can just recommend it to everyone."
hubertzak,"Feb 14, 2022",10/10,"This has to be the best space-related movie i've seen so far. All the effects were magical! Everything looked so realistic! It gets 10 stars, without doubt."
jamesbont-11753,"Oct 1, 2023",10/10,The first time I witnessed the perfection of this film I was in wow.Before today I had seen it already at home 3 times and every time I enjoyed it even more. It's a masterpiece in every way every single time I start watching it I know I will cry at some point.In addition to the cinematography the music by Hans Zimmer takes the experience to another dimension.Today after all these years I watched it for the first time in theatre and the experience was beyond amazing. It's one of those movies that you wish you can erase from your memory and then rewatch time and time again.Thank you Christopher Nolan!
bareqalqaisi,"Sep 18, 2023",10/10,"I wish I could erase it from my memory and watch it again. This movie made me love movies and series. I rewatched it until I forgot how many times I rewatched it. Full of feelings, adventure, and that great music that can never be forgotten. He took us to a wonderful space as if we were with them, a great movie that will not leave my memory until I die. There will never be a movie on the same level as this movie. It breaks the laws of space-time and remains wonderful no matter how many times you watch it again or how much time passes through it. Thank you, Christopher Nolen. Thank you, Matthew. Thank you to everyone who contributed to this work."
lvleteor,"Mar 19, 2024",10/10,"Interstellar is mind blowing to say the least! Emotional family bond, survival of the human race, plot twists, inter-dimensional time and space travel with insane sci-fi theories and gorgeous scenery. Betrayal with an incredible cast and legendary director Christopher Nolan delivers one of the greatest movies of all time. This is a movie everyone must see and appreciate.Earth's population and its human inhabitants must find an alternate planet to survive. A wormhole was discovered near Saturn that contains hope for the human race. Time is relative and a ghost from the future communicates through a dimension unknown to present day Earth. Will the human race become ghosts as Earth loses its ability to sustain life?Interstellar ... Enjoy the ride!"
ori_64,"Nov 21, 2014",3/10,"The film is spectacular and starts off really nice and promises to be very interesting. But once the spaceship leaves the ground, the movie deteriorates rapidly, and as it progresses it becomes so unbelievable and ludicrous, that I left the theater quite annoyed and very disappointed. I didn't like most of the characters. They are clichés, and none made me sympathetic to their cause or character. The robot is also extremely familiar and it's design is ludicrous, trying to be both advanced and ancient at the same time. I really likes other films by the Nolan brothers, but it seems they don't give their scripts as much attention as they used to. A disappointment."
Antumc,"Jan 20, 2023",10/10,"Interstellar is one of my 3 favorite movies, it is simply art, the practical effects are very good, Hans Zimmer's music is one of the best in the history of cinema, the story is moving and emotional, the performances especially those of McConaughey and Mackenzie
Foy are incredible. I don't know how Interstellar was not nominated for best film at the Oscars. It has certain similarities with Kubrick's masterpiece ""2001 a Space Odyssey"" even in some aspects surpassing this one.Christopher Nolan is one of the best current directors and this is surely his most complex and best made film in his career, surpassing the incredible ""Inception"" or the best superhero film ""The Dark Knight"" simply incredible."
looneygameryt,"Aug 9, 2024",10/10,"I don't really think this movie will ever be surpassed in my movie rankings. It has the most stunning visuals of any film I have seen. The acting is incredible across the board. I cry every time I watch it. The story is very compelling and unique for a ""world ending"" movie. The musical score by Hans Zimmer is perhaps the most beautiful thing my ears have been blessed to hear. This film just gives me a certain unmatched feeling of awe and wonder. This film alone makes Christopher Nolan my favorite director. I recommend this movie to everyone that is on this earth. It's a must watch. Oh and, it has Matthew McConaughey, by the way."
franckbossi,"Nov 2, 2023",10/10,"Christopher Nolan's ""Interstellar"" is a cinematic masterpiece that delves deep into the realms of space exploration, human survival, and the unbreakable bonds of love. With its breathtaking visuals and a hauntingly beautiful score by Hans Zimmer, the film takes audiences on a journey that is as much about the vastness of the universe as it is about the intimate connections between a father and his daughter.Set in a dystopian future where Earth is dying, the narrative follows a group of astronauts, led by the former pilot Cooper (Matthew McConaughey), as they embark on a perilous mission through a wormhole near Saturn in search of a new home for humanity. The film beautifully juxtaposes the vast, cold expanse of space with the warmth of human emotions, making it a deeply moving experience.The scientific concepts, including black holes, time dilation, and the theory of relativity, are intricately woven into the plot, making ""Interstellar"" not just a visual spectacle but also a thought-provoking exploration of the mysteries of the universe. While some may argue that the film takes certain liberties with scientific accuracy, it's essential to remember that at its core, ""Interstellar"" is a work of fiction meant to entertain, inspire, and provoke thought.The performances are top-notch, with McConaughey delivering one of his career-best roles. Anne Hathaway, Jessica Chastain, and Michael Caine also shine in their respective roles, bringing depth and authenticity to their characters.However, what truly sets ""Interstellar"" apart is its emotional depth. The film's exploration of love, sacrifice, and the passage of time resonates deeply, making it a tear-jerker for many. The relationship between Cooper and his daughter Murph (played by Mackenzie Foy and later by Jessica Chastain) is the beating heart of the story, and their emotional reunion is one of the most touching moments in cinematic history.In conclusion, ""Interstellar"" is a grand, ambitious, and emotionally charged film that pushes the boundaries of storytelling and filmmaking. It's a testament to Nolan's genius that he can craft a narrative that is both epic in scale and deeply personal in emotion. A must-watch for anyone who appreciates cinema that challenges, entertains, and moves the soul."
AntonH14294,"May 20, 2022",10/10,"Incredible music, some of the best actors in the world and visuals that got oscars.The soundtrack of this movie has a fanbase of its own and McConaughey plays the role of an argumentative pilot perfectly.Best movie ever made."
AliGh10,"Apr 30, 2019",10/10,"I have watched this movie 3 years ago , since then I couldn't stop thinking about it . I'm a huge Nolan fan and this movie was the finest work that he ever did... The duality between Nolan and Hans zimmer took it highest level of perfection in Interstellar.
I have never seen anything like this... I would recommend you to see this masterpiece as soon as you can even if you love sci-fi or no."
adelalfaifi-43096,"Oct 29, 2023",10/10,"Interstellar is a visually stunning film with some of the most impressive special effects ever seen in a science fiction film. The film's depiction of space and black holes is both awe-inspiring and scientifically accurate. Nolan also does a masterful job of creating a sense of scale and scope, making the audience feel like they are on the journey with the astronauts. In addition to its visual effects, Interstellar is also a deeply emotional film. The story explores themes of love, loss, sacrifice, and the human spirit. The film's performances are also excellent, with McConaughey and Hathaway giving particularly standout performances."
lalalelelililulu,"Nov 21, 2014",N/A,"This movie would have been better if it was only about TARS and drones and robots and completely remove humans characters and the damn corny filler dialogue.All that hard science, special effects, scientists working together, making it seem most real bound together by fantasy and bullshit and missing plot lines and time paradoxes and love and religion. This movie is really a cheeseball Hollywood film with a hard science backdrop.The characters were as flat as a piece of paper. The guy likes the girl, the daughter is mad at dad, dad loves daughter doesn't care about saving mankind. Even TARS had more personality than many of the movie's characters. The daughter was probably most developed but felt so off. Still she holds a grudge 30 years later.Is a movie for average joe blow using the bedazzle tactic of impressing you with confusing story, special effects and hard science when is really no meat and nothing usefulTARS gets 10/10 rest of the movie 1/10I have learned nothing. Made me think about nothing. Wasted my time."
gianlucamarzano16,"Nov 5, 2014",10/10,"Intersellar. What Christopher Nolan has done so good with this movie was that he kept the plot simple,but we know that it's Christopher Nolan so it not going to be a simple movie. It's not. The overall plot is that the earth is dying so cooper(Matthew mcconaughey) and a team of scientists must go and find another place to live. The acting is great,what makes it so great is cooper and his daughter. Every time they were together it was WOW. The visuals were on another level. If you can,see it on the biggest screen possible. Some people may not like this movie because it talks a lot about science and many other things but you enjoy that, you will have a blast with this.Overall interstellar is a must see. I think it was Nolan's best film."
ammt-52113,"Nov 3, 2022",6/10,"To be a 2.5 hours movie, it is watchable. The performance of the casting somehow keeps you interested. However, the science concepts they dive into, weather they are accurate or no, can be a little bit of a turn off and at the end the complicated relationship between Cooper and his daughter was the only thing that kept the plot alive. I just basically watched the whole movie to find out if he was able to came back to earth or not to meet again with her. So, yes, a kind of interesting movie, but if i have more than 2 hours to watch a movie, i would probably choose a different one. A little bit overrated i would say."
cosmo_tiger,"Nov 16, 2014",10/10,"""We're still pioneers. We've barely begun. Our greatest accomplishments cannot be behind us because our destiny lies above us."" Mankind has finally used up all of Earth's resources and it has become a dying planet. When Cooper (McConaughey) and his daughter stumble upon a secret outpost that contains the remnants of NASA they are told of the seriousness of the problem facing humanity. Cooper is a former astronaut and is given the responsibility of traveling into space to find a habitable planet for the human race. I have been writing these little reviews for almost 5 years now and for the most part I have found it easy to talk about every movie. This one I can't seem to find the right words for. The reason has less to do with my vocabulary and more to do with the awesomeness of the movie. There are some movies that words just cannot do justice to. The last one I felt that way about was The Passion Of The Christ. This is a movie you want to tell everyone about but no matter what you say it's just not enough. I loved Gravity and this was 1,000 times better. Overall, really nothing I can say about this movie other than watch it. Christopher Nolan is a genius. I easily give this an A+"
nvfl123,"Nov 5, 2014",10/10,"A simply breathtaking film, Interstellar completely blew my expectations out of the water. The Nolan brothers took a huge risk in making a film about space travel, but they succeeded.The movie was one of the most visually stimulating movies I've ever watched. Be prepared to stare in awe. Hans Zimmer didn't disappoint with his original scores for the movie as well. Just wave after wave of amazing CGI and music throughout the film is enjoyable just by itself.But what I enjoyed most was the fact that the movie sticks to the main theme of human survival and curiosity. Everything that happens always links back to those themes.Not everyone will like the movie; some of the plot twists and more bizarre explanations the Nolan brothers came up with will leave some laughing, confused, mad, and/or skeptical. After all, it is a movie on the unknown. But, the Nolan brothers outdid themselves. You have to understand that there is so much in space physics and astronautics that humans cannot even fathom. You have to understand that what the Nolan brothers came up with could be true or not be true; there's no way to know because they came up the best interpretation for the movie based on incomplete data.TL;DR, one of the best movies made ever so go watch it. go in with an open mind and accept that humans do not know everything about space."
nataliaberugno,"Jul 4, 2022",N/A,I am a firm believer that Time Travel is real. I may not be able to explain it with eloquence but I know that stories like this are based off of some random authentic account.
A_Different_Drummer,"Jan 23, 2015",10/10,"Not so much film as much as strange milestone for Hollywood.With A-List stars and a final running length of about 3 hours.This in an age where Hollywood is so desperate for profit and fast turnover that even TV shows have more commercials and less content.How is this possible? Easy answer: Nolan Brothers. Look in a mirror, say those names 7 times quickly, the Hollywood Rule Book disappears.The bizarre length effectively gives the viewer not one but three entirely separate movies joined only by the title.This reviewer in particular was gob-smacked by the first movie, effectively from the beginning until the space flight, and wanted to jump to an alternate universe where the whole movie took place in that small town, post-apocalyptic setting. With the dust. And stray drones. And the school teachers who taught that the trip to the moon was just propaganda.I cannot over-emphasize how strange this is. Even though that was not the point of the film, I suggest the production company unintentionally created (in that first hour) the best sci-fi future-world ambiance in the history of film; and, unaware of what they had accidentally done, they just moved on.BTW, a number of futurists have said that in the early part of the 21st century the odds favor at least one major volcano going ""super,"" or blowing for extended days or weeks. This will place ash/dust in the air will will cover the planet. Until this film, I never saw the image of what this might look like. Now I know. Wow.)The second film is like every Star Trek film you have ever seen, but by way of Stanley Kubrick. Not bad, but nowhere near as much fun as the first portion, Another really really cool thing is the robot that resembles one of those ladder kits you buy at Home Depot, that can form a variety of shapes. Ultra cool.Until you finally get to the third and final movie (or Act) which is meant to have profound spiritual implications but in reality only works if you have been paying careful attention for the first two and a half hours. Which is itself a strange contradiction.But the whole film is full of contradictions. There is an Epilogue too (following the unstated theme of three Acts and an Epilogue). It is fun, it is moving, it connects with the viewer, and it makes no sense at all. There are plot holes in the Epilogue that you could lose a Black Hole in. Joke intended.So, there you go, one of the oddest and most contradictory films of all time.Oh, don't even bother trying to figure out how a society that can develop AI to a degree beyond anything ever seen in film before (the Costco ladder people) still has teachers that dispute the Moon Landing and doctors who can't deal with a cough.As I keep saying, a very strange movie.But a very powerful one*** REVIEW UPDATED OCT 2016****Greetings from the year 2016. For those reading this from the far future when everyone who wishes it has instant access to the IMDb database, probably beamed right into the cortex, I am updating my review with this addenda: I confess I missed the point of the film on first viewing. After all, this is a Nolan Bros 3 hr opus which, sadly, never really achieved a proper audience and now is more or less lost to time, much like the characters in the story. On second viewing, I ""got"" that this is basically a love story set against a sci-fi backdrop. The love of a father for his daughter, the growth of Man to a new dimensional experience where love itself is quantifiable - these are amazing concepts and this is an amazing movie."
greebo-01548,"Mar 20, 2022",4/10,"The premise here is relativity. Time vs gravity. The story, if there is one, is pointless. Christopher Nolan has surpassed Stanley Kubrick in making a visually stunning but ultimately pointless piece of Sci Fi nonsense. Nobody can give me a convincing explanation of 2001: A Space Odyssey, but in 1968 it was jaw dropping. Interstellar's problem is we've seen it all before, and Nolan is not Kubrick.Perhaps there is an analogy of the futility of life here, but it's spurious at best.This ranks with Prometheus as an incredibly beautiful waste of my time."
s-vinaykumar123456,"Nov 7, 2014",10/10,"There used to be movies where the purpose of it might be giving entertainment, educating or enlightening them. But apart from most of the movies, 'Interstellar' is more than that. It is not a movie. You never realize that you spent 2 hrs 40 mins in the theater. It blends with you. It makes you a third person in the lives of the character watching then to go through all the experiences they have.This is not a movie, this is an absolute experience that everyone should experience. It educates you, It questions you wit to the maximum level possible (How many of you understand quantum physics and Wave theory?) It raises an in-numerous questions even to the researchers who are the top in this domain, Is that possible? The answer is yes and no at the same time. For believers, it is possible as explains the paradoxes and decodes how it is possible and for non-believers, there are always questions that cant be answered.Apart for science, the human connections are stupendous. It makes you to connect emotional not just to a character but to the future of the earth.And the best part in the movie is subtlety in the picturing it. There is enormous possibility of making it more of a scifi journey showing colorful planets etc etc. But Nolan used what is required without going for too much unnecessary visual elevations.The science, emotions, story & the screenplay are the best in the movie.It is an experience that everyone should experience. Question your wits !?"
drnarimantavakoli,"Dec 8, 2020",10/10,After watching it i was paralyze for 3 hours. pure Epic!
roysoumya76,"Nov 10, 2014",10/10,"Whether it is audacious or not, Whether it outdoes Kubrick's Odyssey or not,Whether it would get Oscar or not, That wont concern ! What matter is did I get the goosebumps or not while seeing ! And there it scores. You don't need to know General theory of Relativity. The Morse code, Wormholes, Spacetime can wait. you don't need to know physics at all. You just go to watch it and see the beauty of IMAX. Great performance from all those brilliant actors and actresses. And then the score by none other but the great Hans Zimmer ! But last, The Nolan brothers. Christopher Nolan delivers again. An epic voyage with lot of emotions. The astonishing cinematography is a pleasure to our eyes. Mankind is saved from destruction but it needs a great deal of courage and conviction. you get this here. Entering wormhole without violating physics is yet another milestone in the genre of science fiction. A monumental film with every aspects of life and science is depicted by Nolan."
evdokstepan,"Dec 18, 2023",10/10,"""Interstellar"" directed by Christopher Nolan was released in 2014. This film is about astronauts and scientists who went to another galaxy to find a new planet for human life. The soundtrack in the film keeps us focused and tense throughout the film. The plot is complex, fascinating and attention-grabbing from the beginning to the very end. Starring Matthew McConaughey, Anne Hathaway, Michael Caine and many others. Scientists go into space where they have discussions, disagreements, disputes. The main breakthrough in this film was the image of a black hole. As for me, this is the best film in Nolan's filmography. Soundtracks, special effects, characters, plot."
niels2006,"May 16, 2022",10/10,"This is my all time favorite Movie. It looks astonishing, the story is deeply human and the actors all do a great job at leading through this emotional journey. 11/10."
JoaquinM-34,"Oct 17, 2025",N/A,"The characters lack of complexity and real problems, I mean couldn't they have more of a real problem like having diarrea and coughing at the same time or Alzheimer with diarrea, I mean that's a real problem not just having to travel through the space and time and type shi. I will just let it like this because of my aunt Ricky, but my opinions about the movie will grow larger every time I watch it."
brettsanace,"Jun 10, 2018",7/10,As of 11 June 2018. It is a max 7/10 on a good day
mikecrean-97804,"May 22, 2020",7/10,"Not Nolan's greatest work, Interstellar is a slow burn mind bender but it keeps you in the game until the end, and features stunning visuals and a great cast. Recommend to Nolan fans."
davidqvist,"Nov 11, 2014",5/10,"It's not a bad movie, but it's ordinary at best. Dialogue is very clumsy at times. It's too long, and way too much time is spent on explaining phenomenons that don't need to be explained. It could have been such an elegant and thought provoking movie, but instead it's dead set on explaining absolutely everything. It ruins the mystery, and the opportunity for me to use my own imagination. Unfortunately the time spent making sure that everyone in the audience understands the movie EXACTLY the way the director wants you to, is spent, at the expense of a good storyline and the development of believable characters and meaningful relationships. A funny idea, and a powerful soundtrack, just doesn't cut it for me. I was very underwhelmed and disappointed, but go see for yourself."
