user,date,rating,content
LeonardoOliva69,"Aug 14, 2024",10/10,"An unmissable date for any science fiction fan. Nolan reaches limits rarely seen and is on par with Kubrick or Andrei Tarkovski in terms of his representation. Matthew McConaughey is incredible and it may be one of the few Nolan films where there are strong female characters who make themselves known. It is a visual and sound journey, because yes, the soundtrack is one of the best we can see from Hans Zimmer (and I think that says a lot).The level that Nolan reaches to get to this point is incredible, how everything is there, the scientific, it is plausible, it is credible. Although sometimes he may be arrogant and intellectual, I do not consider that he is making fun of the fans, it is all there, all the time.It convinces me from beginning to end and despite its length I would watch it a thousand times."
Robert_Escamilla,"Nov 5, 2014",10/10,"OK, I've just seen Interstellar and I can tell it's one of those movies that you either love or hate.Personally I loved it and probably I'm going to watch it again to process it a little bit more. It's not a simple movie, maybe that was already clear, is a Nolan's film.Matthew McConaughey does a great job by portraying Cooper. The most touching scenes are those between his character and Mackenzie Foy, who plays the younger version of Murph, Jessica Chastain character. Either it seems to be an ""Outer Space Film"" is more about human relations and how important is for us to be linked with others.Even it's a long movie, 169 minutes, I didn't felt it that long or tedious. The director managed to keep us engaged through the whole film.The experience on IMAX in 70mm film. The image quality perceived was superb, now I get why Christopher Nolan and other directors are fighting to keep film alive.I had the opportunity to watch it at the Chinese theatre and was a great experience, my first time in that theatre. The staff from the theatre even told us that Nolan himself watched several scenes of the movie in that theatre to ""calibrate"" the experience. Which is very cool.Well, I encourage you to go and watch Interstellar to see of you love or hate it."
Gordon-11,"Nov 6, 2014",N/A,"This film tells the story of an ex-pilot in a world full of dust storms. He is chosen to travel to the uncharted parts of the space in search for a new habitable planet.""Interstellar"" is a long film, and the first two hours of it does not seem like a typical Christopher Nolan film. Most of the scenes are (literally) down to Earth, with no fancy visual effects. It spends much time building up the story, telling the story of a father and his daughter who sees 'ghost' in her bedroom. Through this ghost, one thing led to another, and the man is in space. When the film is not down on Earth, it looks more like a disaster film. The first adventure is a spectacular feat involving water. It also introduces the physics of relativity, on how time slows down in another world, leading to a misguided decision of the astronauts in retrospect. This sets the foundation for future plot involving more relativity.As the film progresses, there is more adventure, both in the form of adrenaline pumping adventure and humanity and integrity testing conditions. Matt Damon's character forms a central subplot that makes me reflect on what lengths would people go in order to achieve a certain goal. It reflects on the reality that people are driven by egocentric instincts. It is not a pretty truth, but it tells that human are not idealistic creatures.The final half an hour is what a typical Christopher Nolan film is like. It makes me hold my breath because it is so intense, both emotionally and cognitively. The ending gives me inexplicable exhilaration. Things come to a full circle, and it is filled with joy.It is not a film for everyone, as the story is long and takes a lot of time to build. Two people walked out of the cinema an hour into the film, and someone sitting behind me remarked after the film ended that he opined it was the most boring Christopher Nolan film ever. For me, I enjoyed ""Interstellar"" thoroughly, because it is emotionally captivating and intellectually challenging."
tavm,"Dec 1, 2014",9/10,"Just watched this on IMAX with my movie theatre-working friend who had seen this before. It has Matthew McConaughey and Anne Hathaway going to space and seeking possible livable planets for places to move the earth people when that planet becomes uninhabitable. Christopher Nolan directs quite a long but mostly intriguing tale of how long this journey lasts and the effect on McConaughey's offspring when they grow up without having him around during those times. I have to admit that part of me was ready to sleep during some scenes but something exciting does always come up and it gets a little better as the narrative keeps on going. So on that note, Interstellar is very much worth seeing if you're patient enough to watch quite a long movie requiring you to think."
indiedavid,"Nov 7, 2014",6/10,"""Interstellar"" was an above average film and I have no regrets spending a Friday night checking it out. Unsophisticated audiences may enjoy it if they don't analyze it too deeply. However, if you are one who understands the world of physics, aviation, or space travel, this one is hard to watch. There are a plethora of continuity issues as well as plot holes. It seems like Chris Nolan watched ""Gravity"" and decided he could make a really terrible film into something worth watching. He added the ""Contact"" premise and inserted some Physics theories and some expanded back story to create a mediocre film. I was hopeful that I would be impressed by the obviously inflated reviews but I wasn't. The guy next to me actually fell asleep during the first hour which was very grueling. Of our group, there were three thumbs down and one thumbs up."
liana-moisescu,"Nov 9, 2014",10/10,"I just returned after seeing ""Interstellar"" again (2nd time) and I can say that my second experience was even more powerful than the first. I'm trying to find the right words to express the thrilling journey that is this film.First I'd like to advice you to try and pay attention to every single line - nothing is said without purpose and everything is somehow connected. It slowly builds up with the beginning to this phenomenal emotional ride and it will not let go until the very end. It will keep you on the edge of your sit - literally -, it will make you cry, it will make you jump, it will completely absorb you. Throughout the course of it I forgot I was in a cinema. I was living every single moment with the characters, feeling what they're feeling. At times, I found myself staring blankly trying to comprehend its complexity - How can this be? Is this really happening? Can it be so epic?The second time I saw it I understood the importance of every single scene and line, I saw more connection, more intricacy and (even) more genius in it. The first time it was grand and overwhelming, it just hit me hard and I couldn't really pay attention to details.The emotional journey part was very important to me; but of course, there are the stunning visuals which contribute immensely and transcend you there, into the action. They were fantastic, superb, simply put, film-making at its finest.This is all, of course, from my point of view - a super sci-fi, fantasy, adventure and all associated genres enthusiast. Although I cannot imagine how one, regardless of their movie preferences, can dislike ""Interstellar"" - it's that good.What I'm obviously saying is GO SEE THIS MOVIE. Expect epicness. It will not disappoint."
dvigrad1,"Nov 9, 2014",6/10,"I won't give it a 1 to even things up a little, I give it a 6 which is real. Maybe 6.5 but 7 would be a stretch. I'm disappointed with a film that I waited for so long, with a great title that was waisted. Interstellar should have been a masterpiece, with, well, a lot of Interstellar traveling. The duration is just to long, especially the first part, which brings nothing extra to the story. It's just to stretched out trying to bring I don't know what. A feel of 2001 maybe, but 2001 is in another galaxy for this one. I didn't like Inception either, so maybe it has got to be something with Nolan. I'm a sci-fi fan, but today everyone's trying to make sci-fi, but they don't succeed. They are doing it wrong! District 9 was the last good sci-fi I watched. Interstellar has got great visuals, I give it that, but Gravity had more (another film that sucked big time). I wouldn't watch it again."
facebook-999-887838,"Nov 8, 2014",10/10,"What an incredible film, a mesmerizing ride from minute 1 to minute 169. I couldn't believe when it ended that it was already finished; time appeared to go away quickly when watching this in the theater and remember when it ended, I wished there was more of this epic movie.Great directing, great performances, the effects/sets could have been better (I like my detail which unfortunately some scenes/effects lacked) and you got to take a big leap of faith to ignore the obvious paradox. If you do the latter, you will enjoy a Nolan's masterpiece.One of my top ten movies of all time and most likely the best sci-fi I have ever watched."
aleksandra-yakubenko,"Nov 12, 2014",10/10,"I have never in my life experienced such an emotional brake as I did today watching Interstellar! I left theatre shaking violently, crying and having I think 150 BPM. Every single piece of the movie from the story itself, visuals, music and acting is a perfect combination and perfection. I even can't find right word to give you proper review (partly because English is not my native)and summarization won't give the movie justice. The only thing I regret that I watched it dubbed (though in my country dubbing is really good) I advice t go see the movie alone on yourself as I did and it will pull you in from the first frame to this epic journey!P.S. Oscars to Nolan and the movie right away!"
andy-r-harris,"Nov 13, 2014",10/10,"the sixth sense meets inception. makes you cry, sweat, and question your own actions in the face of these scenarios, if you approach the film wholeheartedly and ready for the ride then it will take you on quite a journey, and you'll only want to see it again and again. the music really does the job of keeping you suspended, Anne Hathaway and Jessica chastain do fine work, as does Matthew McConaughey, and the little girl playing a younger Jessica Chastain pulls at your heartstrings. i was really really pleased with this and wish it was getting as much attention and praise as it deserves, i think the writing was genius and it really had my brain working hard. you walk out of the theater and everyone around you is talking about it from the sidewalk to the subway ride home, everyone, it was really funny to see."
ChViewer,"Nov 15, 2020",N/A,"Don't know about you, but this is the best movie I have ever watched..."
deloudelouvain,"Apr 19, 2015",9/10,"Well to me this was one of the better science-fiction movies that I ever saw. It's been a long time since I didn't see a sci-fi like this one. It's extremely long but you won't get bored for a second. And that says enough about it. All the actors gave us a very good performance and some shots were stunning. The story was very well written even though sometimes too complicated to understand but then again who are we to understand anything about the unknown dimensions, black holes or wormholes. You have got to stay concentrated during the whole movie to understand the story but like I said before with Interstellar it is certainly not a problem at all. I was completely absorbed by the story and was actually surprised that time flew by so easily. One of the better movies I watched this year and certainly the best sci-fi in years."
sohylejain,"Nov 8, 2014",10/10,"Bad-ass... is the adjective which I choose to type the first word of this review. As I left the theater I was not only spellbound, but I was also sulking about the fact that the movie had ended.The movie has a slow pace at the beginning, but not really boring. Steady and unique in its nature, I did feel that this movie might end up like last years blockbuster 'Gravity' starring Sandra Bullock and George Clooney. With every minute that passed, I could feel the importance of time, which let my prejudice drain away. With twists and turns, but not brain-spraining at all, it did make emotions come at par with adventure.Great acting by Matthew McConaughey did overshadow Anne Hathaway. With an epic storyline and Nolan's direction Space, Galaxy and the Universe did reach a whole new level.I would love to rate this movie 10 stars without a second thought because it reached the depth of my heart and left me speechless. This movie is not a movie which is meant to be wasted by watching it at your laptop or TV. It's buck worthy and a must watch for all the people who wait for some new serious, touching, heartwarming, adventurous, Science Fiction and Oscar deserving movies of all time. Hat's off to both the Nolans!"
mill_8,"Nov 14, 2014",7/10,"Even though I'm a big fan of Christofer Nolan, I find this movie pretty boring. Respect for tackling such a complex subject and for making generally smart blockbusters. Unfortunately, movie is a big mess. Wrong pace, melodramatic acting, terrible music and mumbling i'm-a-badass-cowboy Matthew McConaughey speech just didn't work for me. One of the most miscast movies I have ever seen. I'm familiar with Solaris and 2001 Odyssey, but this one just didn't work for me. I gave it 7 after all, since I don't think movie is terrible, I just think it's not great, and people got brainwashed by marketing tools into loving this film and giving it such high grade."
Xstal,"Nov 23, 2022",8/10,"Having destroyed all resources on the planet, like a rapacious, insatiable gannet, it's time to move on, to vacate and be gone, find a new place to rampage and beset. But where can you take all the people, to build their new churches and steeples, and how to get there, if you can find somewhere, without a breakthrough in science and maths rules.Juxtaposing a more than probabilistic forecast of things to come with the absurd, to produce a wholly engaging and imaginative piece of sci-fi that may well get you thinking of what might just happen to the planet and the people of it when the help and support of as yet undiscovered dimensions fails to materialise.Great performances, great effects, leaves you wanting to revisit 2001: A Space Odyssey but you know you'll never know why."
imdbfan-6279994250,"Apr 18, 2025",8/10,"I don't watch movies very often, I'm not a film critic and I don't really know much about movies. But I liked this movie. I had the opportunity to watch it earlier at an earlier age, at that time it seemed that it's an ordinary movie. Now that I've watched it again, I realize that it's not a movie. It's a masterpiece. I won't talk about the plot, I'll just insist that you watch it. Thank you for your attention. I still need to write 150 characters to publish so the score will go from 90 to 0 90, 89, 88, 87, 86, 85, 84, 83, 82, 81,
80, 79, 78, 77, 76, 75, 74, 73, 72, 71,
70, 69, 68, 67, 66, 65, 64, 63, 62, 61,
60, 59, 58, 57, 56, 55, 54, 53, 52, 51,
50, 49, 48, 47, 46, 45, 44, 43, 42, 41,
40, 39, 38, 37, 36, 35, 34, 33, 32, 31,
30, 29, 28, 27, 26, 25, 24, 23, 22, 21,
20, 19, 18, 17, 16, 15, 14, 13, 12, 11,
10, 9, 8, 7, 6, 5, 4, 3, 2, 1, 0."
Dvir971,"Dec 14, 2024",10/10,"Interstellar is and always was one of my personal favorite films of all time. I first experienced the film in IMAX when it was released in 2014, and I've been a devoted admirer ever since. But this week, I was fortunate enough to be in New York precisely when the film was being re-screened in IMAX - and not just any IMAX, but in the grandeur of IMAX 70mm - as part of the 10th-anniversary celebrations of its release. Despite having seen the film several times before, rewatching it multiple times to mark its decade-long impact, in the magnificent IMAX theaters of the U. S., stands as one of the most extraordinary cinematic experiences we've had in our lives.No matter how many times I watch the film, it always excites me, intrigues me, and also brings me to tears. A unique cinematic experience like no other, that pushes the boundaries of cinema and how science can be depicted in film.The collaborative process between Christopher Nolan and his brother Jonathan (known for Memento, The Prestige, The Dark Knight, and Westworld, among other works) in crafting the screenplay united two brilliant but slightly different minds. This dynamic provided the creative friction that birthed such an extraordinary story. In the early stages, Jonathan was the principal screenwriter, entrusted with the task of shaping the script. He worked on the project for several years alongside producer Lynda Obst and theoretical physicist Kip Thorne. The original draft was heavily centered on the intricate scientific principles underpinning the plot, such as Einstein's theory of relativity and, in particular, the concept of time dilation.When Christopher came on board as director, he reworked the script to emphasize the emotional and philosophical dimensions of the story. This shift - from a strict focus on science to one that balanced scientific rigor with emotional storytelling - became one of the defining aspects that granted the film its unparalleled strength. It is, ultimately, this synthesis of emotional depth with scientific exploration that elevates Interstellar to a truly extraordinary work within the sci-fi genre.The scriptwriting process between the brothers included a continuous exchange of ideas at every stage of its development. Christopher's inclination toward emotional storytelling intertwined with Jonathan's passion for scientific precision and narrative complexity. As the film's director, Christopher also had the responsibility of translating Jonathan's abstract scientific concepts into compelling, visually stunning cinematic moments and images. This process enabled audiences to grasp abstract and extremely complicated scientific ideas through groundbreaking visual storytelling.It's incredible to witness how, with the passage of time, Interstellar is increasingly recognized not only as a monumental chapter in Nolan's legendary filmography but also as a bona fide classic in the sci-fi genre. With the Nolans now receiving the broader recognition they deserve from the global film and television community (not just their core fanbase), more and more people now grasp the thematic essence the Nolans were striving for with the unique storytelling elements they insisted on including in Interstellar.One of the most unique characteristics of Nolan as a filmmaker is his profound love and respect for science, as well as his understanding of its importance in both storytelling and real-world impact. This is reflected in the themes he chooses to explore, the logical framework behind his scripts, and the technical aspects of his filmmaking process. From project to project, he constantly experiments with new techniques that push the boundaries of film industry technology. He strives to maintain scientific accuracy in his narratives as much as possible while telling captivating stories that highlight the vital role of scientists and the value of intellect in the modern era.Contrary to the common criticism that Nolan's films often sideline female characters, Interstellar features a significant and very welcome representation of strong, influential women in the field of science. Jessica Chastain and Anne Hathaway deliver compelling and charismatic performances, taking center stage in the film's unfolding events and playing a crucial role in the story's progression. Mackenzie Foy also impresses in a once-in-a-lifetime performance of a curious, intelligent, and ambitious child that doesn't shy from the performances of other veteran actors and actresses in the film, with a role that will surely inspire future generations of young viewers.If we delve further into the unique collaborations behind the making of Interstellar, and to the film's unique property of depicting science in the most accurate way possible, the extraordinary partnership between Christopher Nolan and theoretical physicist Kip Thorne stands out as one of the film's most intriguing aspects. This collaboration was paradigm-shifting in its own right, as it sought to depict Einstein's theory of relativity as accurately as possible on screen. Instead of resorting to clichés or convenient narrative shortcuts, Thorne, a Nobel Prize-winning theoretical physicist, acted as both scientific consultant and producer of the film. His primary role was to ensure that depictions of black holes, wormholes, and the effects of relativity on time dilation were as scientifically accurate as possible.Maintaining scientific precision required a delicate balance between creative cinematic storytelling and the constraints of established physics. While Nolan, known for his narrative complexity and visual ambition, occasionally sought to introduce elements that bent the rules of physics, Thorne firmly insisted on absolute scientific accuracy. This principle of realism shaped not only the depiction of time dilation but also the emotional and philosophical core of the film, where time itself becomes a central, emotionally charged narrative device. Their collaboration continues to set a gold standard for how science can be faithfully integrated into cinematic storytelling.After watching the film in an IMAX theater in the U. S. this week, I noticed a group of young students from a school or some sort of academic club attending the screening. They even took a group photo afterward to commemorate the experience. If that doesn't highlight Nolan's influence in inspiring future generations of innovators and scientists, we don't know what does.Of course, no discussion of Interstellar would be complete without mentioning Hans Zimmer's phenomenal score, which the legendary composer himself has referred to as his most cherished soundtrack in his extensive career.The process of collaboration between Zimmer and Nolan was unconventional and experimental compared to their previous collaborations. Instead of supplying Zimmer with a script or a detailed plot outline, Nolan wrote him a one-page letter describing the film's central emotional core - the relationship between a father and his daughter - and asked him to compose from that emotional premise alone. Without knowing that it was a sci-fi epic, Zimmer crafted an intimate and deeply moving score built around a church organ, capturing the emotional anchor of the story. This approach yielded a score that felt personal and evocative, rather than tethered to the spectacle typically associated with the sci-fi genre. The two also chose to emphasized the use of a church organ to evoke a sense of cosmic awe and spiritual transcendence. Ultimately, the focus on emotional authenticity, rather than bombastic spectacle, produced a soundtrack that has become one of Zimmer's most celebrated works, earning critical acclaim and nominations for the Academy Award and the Grammy.In a typical fashion to Zimmer's groundbreaking works, Interstellar did not initially receive the recognition it deserved from major award bodies like the Oscars or the Golden Globes. But history tends to favor the enduring, and today the Interstellar soundtrack is regarded as one of the most powerful and timeless film scores ever created. The raw emotional resonance it evokes during the film, and even while listening to it completely outside of watching the film, is nothing short of extraordinary.Even generally speaking, looking back at the awards season following the film's release, the Academy's reluctance to recognize Interstellar and Nolan's achievements while creating the film remains truly baffling. Nolan did not receive nominations for Best Director or Best Original Screenplay, decisions that now seem glaringly questionable in hindsight. Particularly when compared to certain contemporaneous winners, like Alfonso Cuarón's Gravity, which Interstellar, in comparison, stands head and shoulders above in ambition, visual storytelling, and philosophical depth in our opinion. With Nolan's triumphant sweep during awards season for Oppenheimer, one can only hope that the Academy will, in the future, be more open to recognizing his contributions to the Sci-Fi genre, which has long been overlooked at such ceremonies.What might have been an open question 10 years ago is now clear: Interstellar has cemented its place in the annals of cinematic history as one of the greatest and most important Science Fiction films of all time. Its scientific precision, gripping narrative, breathtaking visuals, extraordinary performances, masterful soundtrack, and impeccable execution on all fronts have earned it a rightful place as one of the most iconic films to ever grace the silver screen.And above all, it's a whole lot of fun."
cpallaria,"Dec 13, 2024",10/10,"This has been one of my favorite movies ever since it was released in 2014. I've watched it countless times and Nolan is by far my favorite director, but I had never seen any of his films, besides Oppenheimer, in IMAX... until last night. I was fortunate to catch the 10 year anniversary showing of Interstellar in IMAX and was absolutely blown away. The fact that I was on the edge of my seat for a movie I know so much about is a testament to how powerful this movie is. The score is the best in any film and the space visuals are simply stunning. The film flew by and I left the theatre with my mind blown, even more than I could have anticipated. I plan to always see this movie whenever it is shown and truly believe everyone needs to experience it the way Nolan intended.1000/10... simply the greatest film I've ever seen on screen."
