user,date,rating,content
tomgillespie2002,"Jan 19, 2014",8/10,"Boasting the fifth collaboration between lauded director Martin Scorsese and can-do-no-wrong A-lister Leonardo DiCaprio, The Wolf of Wall Street signals the moment the two finally took the step over the brink. Their previous films together - Gangs of New York (2002), The Aviator (2004), The Departed (2006) and Shutter Island (2010) - were all solid, if hardly groundbreaking works. With The Wolf of Wall Street, Scorsese seems to have let go of his reservations and embraced the daring, X- rated innovations of his 70's and early 80's work, and DiCaprio deserves to look smug after giving his finest performance to date. From the opening shot of DiCaprio snorting cocaine from between a prostitute's open legs, this is 3 hours of utter depravity. And it's hilarious.Shortly after being taught the ways of excess and cocaine by his Wall Street boss Mark Hanna (Matthew McConaughey), young stockbroker Jordan Belfort (DiCaprio) finds himself out of work following Black Monday. When he takes a boiler room job at a stockbroker's dealing in penny stocks, he learns that commission for these stocks are 50%. Soon enough he is making money hand over fist, setting up his own company, Stratton Oakmont, along with his dentally-challenged follower Donnie Azoff (Jonah Hill). He recruits some of Donnie's marijuana-dealing friends and teaches them a script designed to sell, but ultimately the operation is a pump and dump scam. He is labelled The Wolf of Wall Street in a negative magazine article, yet this propels him to cult fame, and soon has flocks of eager young Gordon Gekko's begging for a piece of the pie.At one minute shy of 3 hours, the film could certainly do with a trim. Yet Scorsese and DiCaprio's obvious fascination with this anti-hero means that we are treated to experiencing every juvenile and ridiculous second of Belfort's rise to Wall Street superstardom. We get flights with on-board orgies and drug taking, Jonah Hill masturbating in the middle of a crowded party at the sight of Belfort's future wife Naomi (the stunning Margot Robbie), dwarf-tossing, and Belfort taking helicopter lessons whilst drugged off his face. This is certainly dangerous territory - the film could easily slip into a celebration of frat-house antics, which is kind of does, but Scorsese keep the insanity levels at such a height that it's hard not to just laugh and shake your head.A lot of it is down to the performances of DiCaprio and Hill, the latter of whom is proving to be a damn fine actor beneath that Jew-fro and obnoxious mannerisms. The film's highlight focuses on a botched scheme to smuggle $2 million dollars via Brad (Jon Bernthal) to reptilian French banker Jean (Jean Dujardin). Having learned that FBI agent Denham (Kyle Chandler) has his phones tapped, Belfort must get home to warn Donnie to get off the phone. The only problem is, they've taken a large quantity of Qualuudes. Thinking that years of indulgence have caused a tolerance to build up, the expired best before date have simply lead to a delayed reaction. Belfort suffers from what he describes as 'the cerebral palsy stage', flailing around on the floor without control of his limbs or his speech. His long journey home is the most laugh-out- loud example of drug-fuelled ineptitude since the ether scene in Fear and Loathing in Las Vegas (1998).Of course, the film's morals are questionable, and Scorsese has suffered the same narrow-minded criticism he did from his 'glamorisation' of the mob in Goodfellas (1990). Yet I like to think that Scorsese trusts and respects his audience enough to allow them to think for themselves, to get a laugh from the on-screen antics whilst understanding that this is not the behaviour of a sane or ethical individual. Refreshingly, the movie stays away from any moral preaching or underlying messages, and simply tells a story because it's entertaining. Although it doesn't quite justify it's 3 hour running time, this is the most fun I've had watching a comedy for a long time, and proves that there's plenty of life in Scorsese yet.www.the-wrath-of-blog.blogspot.com"
rlamybarlow,"Dec 30, 2013",8/10,"Rated R Post... within the first 5 minutes, Leonardo Dicaprio snorts cocaine off a hooker's ass. The rest of the movie is just as excessive. A spectacular orgy of excess: cocaine, Quaalude, materialism and full frontal female nudity. Check your morals and you might have a good time. But DEFINITELY NOT for everyone.Scorcese directs in his usual High NRG style (like ""After Hours"" and ""The Color of Money"", the camera never stops moving.) DiCarpio goes all out with this character, making him human, though not heroic at all. These are awful people doing awful things, and the film might revel too much in that, without showing the consequences of it.A definite GUY film, probably could complement with Pacino and DiPalma's ""Scarface""."
crimsontide12367,"May 20, 2014",10/10,"Why Leonardo DiCaprio didn't win the Oscar for best actor, I will never understand. Matthew McConaughey must have put on an absolutely indescribable performance in Dallas Buyers Club. I have yet to see Dallas Buyers Club, so I can't say Matthew didn't deserve it.The Wolf of Wall Street is insane though! It is a very well directed movie by my favorite director of all time, Martin Scorsese. This movie shows what it was like as a stockbroker in a very unique way as a comedy. However, if it wasn't a comedy, it would be a very boring movie. Well done by the writers.This is definitely my favorite movie of all time now. Even at 3 hours long, I wish the movie continued. I would recommend seeing it, but children should NOT see this movie."
dggeorges_2000,"Jan 7, 2024",6/10,"This was a well-crafted film, but the numerous raunchy scenes ruined it for me. I normally like Scorcese films, so I gave this one a watch.The most annoying thing about this movie was the gratuitous nudity and sex. Completely unnecessary. Yes, I get it that these scenes are supposed to give us a more realistic glimpse into the excesses of the main character's hedonistic lifestyle, but it was just too much.The other annoying thing was the narration. Just not needed.Pros: Amazing direction Acting was over the top, but still goodCons: 3 hours of tedious voice overs Numerous unnecessary raunchy scenes, bordering on soft-core porn."
jaysub,"Jun 9, 2023",10/10,"Such a shame no oscars were given even though 5 oscars were nominated,could watch this film over and over again!!!Still cant believe this was a true story as so much comedy in this! Scorsese worked so well on this with di caprio,not too mention jonah hill bringing his comedy side to it.Seriously,how are people giving this a 1/10???They must be watching another film,its a true story with a twist if comedy.sometimes i just dont get it,yea everyone has an opinion but a 1/10 is too harsh!Even though its 3 hours long,it doesnt feel like a long film as there is so much creativity involved.🙌🏾🙌🏾🙌🏾"
Leon-55,"Feb 15, 2014",1/10,"This movie is so offensive, so filled with endless drug and sex fueled debauchery, so full of rot, squalor, and porn that I am almost loath to even spend time writing about it. There is virtually no conversation – simply hundreds of expletives that are connected with inconsequential words in a doomed attempt to fake dialog. And drugs-porn.Most of the shallow characters portrayed, show such a gargantuan lack of class that it leaves you breathless. A moneyed common lot that act on virtually every debased animalistic urge that their festered brains can come up with. And everybody is screaming at some point or another – one of noisiest (non-disaster) movies I have ever been tortured with. And drugs- porn. (Drugs are even snorted out of a woman's assh*le. So classy ) After this, what can possibly be the next level Mr Scorsese? Scenes of child rape? I really expected a bit more class from you. But hey, we are all in it for the money hey? It is our right. And it is your right to shove this rubbish down the audience's throat.As true as the sun rises in the morning, this excruciatingly-three-hour-long-stretch of bawdy, very noisy and lewd porn-vomit, can never be called art."
jhonnylin,"Sep 5, 2019",10/10,"This is the most enjoyable film that both Dicaprio and Scorsese have collaborated on together. Full of great dialogue, outrageous humor, raunchy sex, and it's all based on a true story!"
rddj05,"May 28, 2014",9/10,"Wolf of Wall St. is a fascinating film by a master filmmaker, bringing 40 years of skill to the table; from casting, to shot selection, to how he pulls you into that world. And a guy who just plain having fun. The 3-hour film, traces the rise and fall of Wall St con man Jordan Belfort. A tightly constructed film, I wasn't bored for a minute.There were some people who kicked up a fuss about the film and its glorification of these slimy characters, their materialistic lifestyle, and their treatment of women as nothing but sex objects. Some have said that the film glorifies that lifestyle, but to me, Winter (screenwriter) and Scorcese went out of their way to show the reality of it. The film focuses on how animalistic and primal people can become when greed takes them over. The obsession with money and power becomes a pathology. This, of course, is what many Wall St people will loathe about the film.As for accuracy, I'm sure Jordan Belfort (who the film is based on and worked as a consultant on the film), embellished a few things, but according to one of the FBI agents who worked on the case, many of the more outrageous aspects depicted in the book and film were accurate.The sad part is that even though there will will many Wall St workers and finance people who will watch the film and think, ""That's a bunch of crap. They're painting with a broad brush. It's not fair,"" there will be far too many young (and not-so-young) Wall St up-and-comers who will ignore the whole last hour of Wolf of Wall St., and simply look at the first 2 hours as an inspirational tale of the American dream."
mahad-livid-se,"Dec 18, 2014",8/10,"This movie was interesting,educational and at the same time very very funny. Great performance by Leo as expected!! In my opinion this movie was one of Leo less better movies especially when you consider titles such as Blood diamond, Inception, Catch me if you can and last but not least Titanic. Which was a great movie.One of the things that stood out to me the most in this movie was how Leo' character went from a humble, down to earth and loving individual. To a corrupt, self loathing criminal. It really shocked me what money can do to people and how much you can downgrade the people around you.All and all great movie! 8/10."
Pratyush003,"Sep 15, 2023",10/10,"Martin Scorsese's ""The Wolf of Wall Street"" (2013) is nothing short of a modern cinematic masterpiece, deserving every bit of a perfect 10/10 stars. This film is a relentless, audacious, and electrifying rollercoaster ride that leaves an indelible mark on the world of cinema.Leonardo DiCaprio delivers a tour de force performance as Jordan Belfort, the charismatic yet morally bankrupt stockbroker whose rise and fall is the core of this exhilarating narrative. DiCaprio's portrayal is nothing short of mesmerizing; he immerses himself fully in the character, capturing every facet of Belfort's complex personality. His magnetic presence alone makes this film worth watching.The supporting cast is equally exceptional. Jonah Hill shines as Donnie Azoff, Belfort's unhinged partner in crime, providing a perfect counterbalance to DiCaprio's character. The chemistry between these two actors is palpable, and their on-screen interactions are electrifying. Margot Robbie is a revelation as Naomi Lapaglia, Belfort's seductive and fiery wife, bringing depth and complexity to her character.Scorsese's direction is nothing short of brilliant. He fearlessly dives into the dark and morally bankrupt world of Wall Street excess, portraying it with unflinching honesty and a wicked sense of humor. The film's pacing is relentless, and Scorsese's use of music, especially the iconic ""Gimme Shelter"" sequence, is a testament to his mastery of the craft.Terence Winter's screenplay is a work of art, seamlessly blending humor, drama, and social commentary. The dialogue crackles with wit and satire, and it keeps the audience engaged throughout the film's epic three-hour runtime.Visually, ""The Wolf of Wall Street"" is a feast for the eyes. The cinematography by Rodrigo Prieto is stunning, capturing the opulence and decadence of Belfort's world with breathtaking precision. The film's use of practical effects and seamless editing further enhances its visual appeal.What truly sets this film apart is its unapologetic exploration of greed, corruption, and excess. Scorsese holds a mirror to society's obsession with wealth and power, and he does so with razor-sharp wit and intelligence. ""The Wolf of Wall Street"" is a scathing critique of the American Dream gone awry, and it doesn't pull any punches.In conclusion, ""The Wolf of Wall Street"" is a cinematic tour de force that deserves every accolade it has received. It's a wild, exhilarating, and thought-provoking journey that showcases the best of filmmaking talent. With DiCaprio's unforgettable performance, Scorsese's masterful direction, and a screenplay that crackles with brilliance, this film stands as a testament to the power of cinema. If you haven't experienced it yet, do yourself a favor and watch this modern classic. It's a 10/10 star triumph that will leave you both exhilarated and contemplative."
haydenluz,"Jul 7, 2020",10/10,"The Wolf of Wall Street was directed & produced by my favorite director in Martin Scorsese, who's directed popular titles like Goodfellas, Taxi Driver, The Departed, Shutter Island, and my god, the man did it again! By taking authentic source material, while slightly deviating it from the truth, he created this MASTERPIECE, inspired by Jordan Belfort's real story, and his autobiographies.Terrance Winter & Martin Scorsese did a PHENOMENAL job telling this story. The narrative has so many memorable scenes, amd tremendous layers, that holds so much rewatch value! After watching countless videos on the true story, and what the real Jordan Belfort (who was also on set for the production) thought; all of these seemed to be fantasy's, were almost all true, and immaculately presented! According to Belfort, Scorsese & Winter's dumbed things down! Not only was this the best paced out, three hour film I've seen, but probably one of the greatest films I've seen, in general - I was so intrigued from minute one, all the way to minute one-hundred-eighty!The screenplay by Winter's was super creative & and so much fun! He added so many great layers to each character, giving them their own distinct personalities. The script was so vulgar, yet very witty, while still being ridiculously funny.Even though Martin Scorsese & Terrace Winter's flipped some of the names, and some being made up completely, due to secrecy reasons, this A-list cast had such inspiring charisma, and displayed all the real actions, tremendously! I have seen A LOT of films, and more than a few Dicaprio films, but this was hands down the best acting I've seen across a cast, but giving tremendous credit to Leonardo DiCaprio, who got snubbed for an Academy Award for his performance! His anti-hero swagger, with such an engrossing personality, brought an abundance of charm, wit, and tons of comedy to this film. His love life was also nailed to a T! Margot Robbie's character development in the third act compliments the tone it was going for. The way Scorsese displays their relationship was pretty accurate, almost all the way down the line. Dan Porush, named Donnie Azoff in the film, played by Jonah Hill, is Jordan's second in command. Jonah Hill put on a FANTASTIC performance; definitely my favorite performance of his. I also thought Jonah Hill was snubbed for an Academy Award. Jonah Hill embodied Dan Porush to a T, down to his wife, his ambitions attitude, and everything else around it. As far as the strattonites go, in Henry Zebrowski, Kenneth Choi, Brian Sacca, Jon Bernthal & P.J Byne, they had the most chaotic roles out of everyone, on the side of Leo. Every character knew their role, and played it to perfection. I loved Rob Reiner in this film, even though he wasn't that important. His crazy dad attitude was displayed clear as crystal, and was an overall great addition! Matthew McConaughey had another small, but important role in Jordan Belfort's character development. After doing further research, McConaughey had a lot more of an impact than his screen time allowed. One of my favorite additions to this film, was Bo Dietl, playing Belfort's PI. Bo Dietl was the actual PI of the real Jordan Belfort. His character was just another small, but necessary addition, with such an effortless performance, due to Dietl playing himself.The editing by probably one of the most credible editors in the game, in Thelma Shoonmaker, who edited all of Scorsese's films, had a tough task at hand. This film was 3 hours long, so I can only imagine how many deleted scenes there were, and what the run-time would've actually been, without so many cuts, and mashes. Shoonmaker did make some scenes a little obvious that they were two scenes mashed together, or shot at different times, but it's hard to fault someone with that much on their plate, with that much of a hefty resumé.Overall, this is in my top five FAVORITE films of all time, and I HIGHLY recommend this film. Another film you MUST see before you die."
rajatdhameja,"May 29, 2014",9/10,"Leonardo DiCaprio is such a Brilliant actor. Everyone in this movie performed nothing short of excellence. Martin Scorsese has done wonderful work in this movie as in all his others, in bringing out the best in all characters. I have watched several movies that have won accolades for various performances. At the very least,The Wold of Wall Street is as remarkable as other great works. I watched the movie on blue-ray but wish the experience in the the theater would have taken the experience to a new level. Prior to watching the movie, I watched the trailer and read about the plot which provide a glimpse only. Watching this movie has been gripping, enthralling, captivating and a good learning experience."
hkauteur,"Jan 26, 2014",7/10,"Martin Scorsese's latest is based on the memoirs of Jordan Belfort, a New York stockbroker and founder of Stratton Oakmont, a company which engaged in securities fraud and corruption on Wall Street during the nineties.First off, the performances are top-notch. Leonardo DiCaprio has managed to find new depths by playing a character that is even debatably worse than the racist plantation owner in Django Unchained. DiCaprio has done more than enough to win his Oscar, and winning for The Wolf of Wall Street is as good any of his other roles. My favorite DiCaprio performance is still Howard Hughes in The Aviator. Though my vote goes to McConaughey for Dallas Buyers Club this year. Speaking of which, McConaughey has a great cameo as Jordan's mentor, who gives Belfort the inspirational push. However, Jonah Hill is the standout as Belfort's psychotic sidekick Donnie Azoff, delivering an even more impressive performance than in Moneyball.At a 3-hour running time, the film is too long and it easily could have been shorter with less party scenes and throwing midgets into giant dartboards at the office. As a rise-and-fall story, it has too much 'rise' and not enough 'fall'. I wanted the story to move on and inform us about the financial damage this all caused and all the lives it hurt in the process, but Scorsese does not seem interested in the forensics. Overall there are some very good party set pieces and funny scenes, but after a while, I was just numb.The story is essentially told from the villain's point of view. Extending this idea to the classic children's storybook The True Story of the Three Little Pigs, which is told from the Big Bad Wolf's perspective. The Wolf retells the Three Little Pigs story and asks the reader to consider his side of the story. The Wolf was simply trying to bake a cake for his grandmother's birthday while nursing a bad cold, and things got out of hand. Therein lies my criticism: there is nothing redeemable from the Jordan Belfort character in The Wolf of Wall Street. Or at the very least, the filmmakers do not seem interested in showing anything beyond the surface.The breaking-the-4th-wall story device of having the villain narrate his story to the audience is raunchy and creative, but Scorsese totally forgets that it is supposed to be ironical. The premise of the black comedy is that we're supposed to laugh at how vile and putrid these people are. But by the nth orgy scene, the characters are matted into two dimensions and we never get beneath the surface. The morality play tips over to the other side and it mistakenly justifies itself. Just because this a tale about self-indulgent shallow people doesn't mean we have to tell their story in a self-indulgent shallow fashion.The bad taste left in my mouth at the end is not the film's self-indulgence, but out of worry that The Wolf of Wall Street is so unclear about its cautionary message, that there are certain viewers that will admire this lifestyle and become inspired to become a stock broker. For the rest of that find the Belfort character repugnant will feel empty wondering what justified the three-hour running time.For more reviews, please visit my film blog @ http://hkauteur.wordpress.com"
juulgroenen,"Nov 12, 2021",10/10,"This movie has everything a guy likes. I watched it over 10 times I guess. Enjoy the acting, from both Leo and Jonah. It's a shame they didn't receive an Oscar. And yes I watched Dallas Buyers Club too, but this is too good."
CanSteve3,"Jan 12, 2014",7/10,"It's comforting to imagine that everything Martin Scorsese touches turns to gold, but it's not true. The same rules of thoroughness that apply to every other filmmaker also apply to Scorsese. If he rushes through a compressed editing schedule to meet an Oscar-friendly release date – as he did on The Wolf of Wall Street – his work suffers. Scorsese's latest clocks in at 180 minutes, not because its characters or narrative demand that kind of exhaustive treatment, but because Scorsese didn't have time to find a more focused, impactful shape for the film. Exploring the personal and professional corruption of notorious stockbroker Jordan Belfort, The Wolf of Wall Street has several memorable sequences, but it plays like a clumsy, repetitive work-in-progress.Praise has already been heaped upon Leonardo DiCaprio and Jonah Hill for their charismatic performances, but it's important to note that this is wacky comic acting more concerned with eliciting shock and amusement than any deeper human truth. This miscalculation of emphasis also infects the storytelling in a more general sense. Scorsese and screenwriter Terence Winter focus nearly all of their attention on the excesses – sex, drugs, greed – that drive these characters, rarely placing them in a context that might reveal complicating texture or shading. It's perfectly logical to portray these characters as one-note imbeciles with an absence of inner life, but this also makes for stifling, unsatisfying drama.The Wolf of Wall Street never finds its bearings, but it becomes more tolerable in its second half when Belfort finally encounters some resistance (in the form of FBI agent Patrick Denham, played by Kyle Chandler) and sees his warped life of excess start to unravel. But even then, the film is dragged down by its reliance on Belfort's moronic perspective – the film is derived from his self-mythologizing memoir – which gives an Animal House frivolity to his constant misbehaviour, a smokescreen that distracts from the devastation of his professional crimes.Simply recycling sensibilities from Goodfellas and The Departed may seem like a logical strategy, but there's a crucial difference this time around. Whereas gangsters generally do harm to other gangsters, Belfort's victims are relatively innocent, draining this film's lawlessness of charm and fascination. Scorsese's ability to find humanity in reprehensible characters has always been one of his greatest strengths, but he doesn't even attempt to humanize the characters in The Wolf of Wall Street. This wilful oversight results in one of the director's most disposable, nihilistic films, a half-hearted effort that abandons the complexities of his own world view in favour of Belfort's clueless primitivism. This might have made for a uniquely compelling Todd Phillips (The Hangover) movie, but in the hands of Scorsese, this mildly entertaining diversion feels hopelessly erratic and insubstantial."
littlane,"Jan 11, 2021",1/10,"I never understood why it's highly rated in comparison to other films that are much more interesting. I was super excited to watch Wolf of Wall Street so you can imagine the disappointment when I watched the film and dialogue that was becoming even slightly interesting, was overrun with vulgarity. Ew"
foehrenbach,"Nov 11, 2021",10/10,"I saw nearly all of the top ranking movies on IMDB and I love a lot of them, but this one is my favorite. Although this is a drama and not a comedy this is the funniest movie that I have ever seen. The lines and how they are beeing portrayed just makes you smile for the whole movie. The acting and the wiriting are brilliant and although it is pretty long the pacing is never too fast or slow. Even after watching it five times it still just gets better every single time.By the way Leo was great but Jonah Hill gets underappreciated."
khandelwalkartik-87733,"Jan 17, 2021",10/10,With a good acting has a special direction and a screenplay
