user,date,rating,content
lorenzosfarra,"May 3, 2014",8/10,"I'm very far to be an expert, so my opinion is just the one of a ""common person"" who watches movies in the night to have fun / enjoy some time. My opinion is that the movie is very attracting, it's fast and you don't get bored. There is a good plot and when you can get lost or bored, there are some scenes that make you laugh or, anyway, catchy enough to catch again your attention. Anyway, after 2 hours, I have to say that I've started to look at the watch, because I was tired. That's it. It was absolutely enough, without removing anything special to the plot, to have a 2 hours movie. Di Caprio is absolutely great, but the other main characters are great, too. My vote would have been 9 without doubts."
Honeysuckle143,"Aug 26, 2021",9/10,This movie is great!!!! & had me laughing my butt off! Didn't know leo could be so hilarious!!
kosterjason77,"Mar 26, 2014",7/10,"I'm sorry to say but for the first time, the critics were pretty spot on with this. The acting performances of both Leonardo DeCaprio and Jonah Hill were top notch and most definitely worthy of the accolades they have received, but the movie it self seemed like it was on massive quantities of drugs. It was a great story, but it was told in such a choppy manner, some of the scenes were so over the top I felt like I was watching another Tucker Maxx movie. I was really hoping for more. Great acting (Rob Reiner deserved an Oscar nomination too)...OK movie...and it was WAY too long!!! I don't know how he did it, but Scorsese managed to drag this out for almost 3 full hours. He couldn't do a 3 hour version of Goodfellas or The Departed, but managed to extend the life of this for 3 hours? Again, I was really hoping for more."
AkKrock,"Dec 23, 2018",10/10,"Biographies are booring most of the time. But this movie is different. Full action with best acting, this movie will take you places."
cguldal,"Jun 3, 2014",7/10,"This is one of those films that will make the smart consumer think about what it means to ""like"" a piece of art work (if you can call Hollywood filmmaking that). Is the film glorifying the horrible crimes that Belfort and his cronies committed, and if so, can one still judge the film and the actors based on their performance and not on the morality of its subject matter? It's difficult, and I respect both types of opinions.Just looking at the film as a fictional story (which I am sure it is, mostly, since Belfort seems to have a knack for embellishing the truth and making a seemingly uninteresting thing the most exciting thing in the world to sell it as best as he can), the plot is rather formulaic for Hollywood standards. Character development is not the main point here, as the characters are larger than life caricatures, even down to the ""boy scout"" FBI guy who has it in for the bad guy (whose motives and story are almost entirely unknown to us, since the story is narrated by Belfort). DiCaprio is in top form, but the rest of the actors and actresses take the prize in genuinely thrilling performances. The acting is probably the best aspect of the film (apart from the glimmer and shine), as every single main and supporting role is played to full potential and perfectly to fit the caricature written out for it.Perhaps the most interesting character is Belfort's number 1, Donnie. We see more character development here, where the nerdy and greedy guy rises to the top and lives a very large life. His morals seem even more lacking than Belfort's, but this is perhaps because Belfort is telling the story.The other interesting, though not novel, part of the story is the role of drugs in Wall Street. Drugs and inevitably sex. It is perhaps alarming that the markets that can ruin our lives by crashing, etc. are run by people who abuse drugs all the time. Belfort is not the one to say this first, and I am sure he won't be the last, either.All in all, the film is ""entertaining,"" if not cringe-worthy. Some moments that are absolutely hilarious in their absurdity can make you cry if you lost a lot of money in the market or lost your job in the recent economic crisis, because in reality, they are not funny. That a company can make billions within hours of a launch, well, that is just sickening no matter what your world view is, unless you are the guy who is making all the money (in which case it is kind of sickening, still, but in a different way).Moralistically, the film is like any art work that deals with humans who commit crimes. I did not find it more glorifying than mafia films where the godfather orders people's deaths ""for the family."" The truth is most humans have a moral understanding and ways to justify their actions according to some moral structure, no matter how twisted or unorthodox the rest of the people might think their structure is. Belfort justified his actions in some ways, and his actions hurt people (including his family), like any other criminal. I did not come away with a message from the film that said ""What Belfort did was awesome!"" It was certainly something more like ""Belfort was successful. His success hurt other people and helped some others. In general, he was an asshole, who did not care much about anyone, but himself and for anything, but getting rich.""The real message is: don't invest your money in the stock market unless you are filthy rich. And even then, don't invest too much of it."
Paul Day,"Jul 12, 2014",1/10,"Two and a half hours into the film and I was non the wiser on where I was being taken. Character and storyline development was sidestepped for a vulgar expression of the American psyche - overt sexuality, the glorification of the abuser with no reference at all to the abused, excess without meaning.Many seem to believe that this is the crowning achievement of both Leonardo DiCaprio and Martin Scorsese. DiCaprio clearly lacks the depth of character that he has shown in many of his previous movies. He seems to have taken a step backwards, yelling, screaming and over-acting at every instance. As for Scorsese, more and more over time I am missing the point of his movies. They are - dull and lack the intelligent treatment of characters that he had in his early films.There are times when you seriously question why directors going off on major tangents in their careers, and why some wonderful actors continue to follow those directors. It is certainly time for DiCaprio to get out from under the shadow of Scorsese who seems to be slowly losing the plot.I did not enjoy the film in the slightest."
RyanCShowers,"Dec 31, 2013",N/A,"When The Wolf of Wall Street first begins its nearly three hour running-time, you aren't exactly sure when the opening studio titles end and the film begins because of Scorsese's stylized letterboxing academy ratios with certain scenes, emphasizing a television type framing as opposed to the rest of the film's widescreen cinematography. The questioning doesn't stop there; after the entire year of anticipation, the story of Jordan Belfort unfolds for the first hour, I continued to wonder when the real The Wolf of Wall Street was going to start.I follow numerous accounts on Instagram, on Christmas morning I came across a screenshot someone took on their iPhone of an elderly female critic reviewing The Wolf of Wall Street. With rotten icon from Rotten Tomatoes and the preview of her review stating, ""Too much sex and drug use,"" I rolled my eyes in agreement with the Instagram account of the unfair criticism. Then I saw The Wolf of Wall Street and realized it was not just a senior citizen compliant, I think Scorsese crossed the line of fun and entered an area of repugnance.I may be the only member of my age group (18-24) who complains about the overuse of sex, greed, and drugs, call me an old man, but after a three hours enough is enough. If The Wolf of Wall Street had some sense of a moral compass that drove the narrative, I may not criticize this aspect so harshly, but neither Scorsese nor the screenplay has anything to offer the audience to latch onto in selfish, unlikable, pathetic characters.Scorsese had to tell the story of Jordan Belfort and I'm sure his life was as unruly as the film paints it to be, but he abandons any sense of class. This is not the Scorsese we all have been enamored with the past. The Wolf of Wall Street is the type of film to be enjoyed by the same audience as The Hangover, not award voting Academy members or critical film analysts. I kept having the feeling I had seen this exact same film in May with flashier costumes, called The Great Gatsby. Wolf is not that far off from it, a few steps above Gatsby in terms of quality filmmaking, but the empty feeling it gives off to the audience is no different.Leonardo DiCaprio and Martin Scorsese's fifth collaboration has been brewing in the minds of everyone who enjoyed their previous films and hope that one day they can finally ""click"" the way Scorsese did with Robert DeNiro back at the apex of their careers. The best thing The Wolf of Wall Street has on its side is Leonardo DiCaprio's eminent charm; he melts his audience and hits some of the greatest highs of his acting career. Certainly deserves to be included in any of the Best Actor races this award season.The Wolf of Wall Street's problems do not stem from the technicalities of filmmaking. Though the storytelling half of Scorsese's job that could have been executed much better, at least he forms the shell of a quality movie. His films typically have a masterwork of film editing; the editing for Wolf is no exception. It is like DiCaprio is snapping his fingers the whole for the three hours. The look of the film is another strength. The juicy cinematography looks as if it was painted with the infinite money made my Jordan Belfort.Some of Scorsese's past film successes find themselves drilled into The Wolf of Wall Street. The first person point of view from Goodfellas and Casino is put to good use, it even grows in this film. DiCaprio not only narrates the majority of the film, but also pulls a Woody Allen and looks directly at the audience and speaks to us like we are having a private conversation with Jordan Belfort. His obsession with wealth and drugs damaging his life and family echoes from Raging Bull, but this works against Wolf. In Raging Bull we saw Jake LaMotta beat his wife, but we also felt his guilt. There's a scene in Act Three that feels like a direct homage to Raging Bull, but Wolf lacks the humanity of that film. Scorsese wanted to isolate us from the world in Wolf like he did in Taxi Driver, where we understood the violence Travis yearned for, but here Wolf fails to tug at the same cords with greed as Taxi Driver did with loneliness.At the end of the day does the greedfest of The Wolf of Wall Street matter? No. If it were not so hollow, it could have been a fun movie, but I didn't even buy into the ""enjoyment."" People around me were laughing at the slapstick comedy, but I did not find most of it funny, not even DiCaprio's raved physical comedy scene in the last section of the film. I shrugged my shoulders after the first thirty seconds and then the scheme continued for five more minutes. Not a bad film, a bad narrative, and a poorly communicated film. If I retitled the film, it would read: The Disappointment of Wall Street.Grade: B-Rating: 6"
vikinikk,"Sep 4, 2021",10/10,3 hours and not even 1 second of boredom. I was fully invested the whole time!
constance22,"Jan 4, 2014",8/10,"I walked out of this movie after 1 1/2 hrs. and I love Leonardo above all actors.This was such an empty movie and Leo was handsome as ever but vacant.Really Mr. Scorcese, why? And then Leo, why??????I was forewarned by many reviews but went ahead because it was Leo starring. Thank goodness there are so many excellent films of his to offset this bomb. I will watch ""The Departed"" or The Aviator tonight.I understand that this is taken from a true story about a soulless man who is now some kind of coach. But why did Scorcese and Leo make a film about such an unimportant person and even a vile person. Movie full of drugs, sex and violence and not in a good way. Compared to American Hustle it's truly a loser. I can't believe people are suggesting that Leo should get an Oscar for this garbage."
ronakkotian,"Feb 18, 2021",10/10,"The collaboration between Martin Scorsese and Leonardo DiCaprio is a pairing that I don't want to end. I believe The Wolf of Wall Street to be their best collaboration to date.The Wolf of Wall Street shows us the life of Jordan Belfort from his rise to a wealthy stockbroker to his fall involving crime, corruption and the federal government.Out of all the Scorsese films I have seen, The Wolf of Wall Street might be the most fun and entertaining. I've seen this film multiple times and I'm still not bored of it. Scorsese's direction is impeccable as always. He manages to capture the high life and excess of Wall Street brokers so perfectly without holding back on anything. The structure is very similar to Goodfellas but I didn't mind it because I felt it was an appropriate choice for this story. The editing is on point despite the 3 hour runtime. I was having so much fun with this film that I couldn't believe how quick 3 hours went by which is a testament as to how good the Thelma Schoonmaker's editing is. There is such a level of insanity and adrenaline to this story that gets me excited each time I watch it. This is most likely Scorsese's funniest film. The dialogues and dark humour are absolutely hilarious. Scorsese loves to have actors improvise scenes and it amazed how many scenes are actually improvised which goes to show the talent these actors possess.I consider Leonardo DiCaprio's performance as the sex-crazed, drug addicted Jordan Belfort to be his best. As much I loved Matthew McConaughey in Dallas Buyers Club, I honestly think DiCaprio deserved the Oscar for this film. The insane energy he brought to the character of Belfort is incredible. This is also Jonah Hill's best performance to date. There are quite a few moments where he completely shines. A particular scene where Hill and DiCaprio take drugs and enact the effects of it is enough to show fantastic their acting is. This is where I discovered Margot Robbie for the first time and she blew me away with her performance. She nailed the accent and surprised me by how great of an actress was. Matthew McConaughey appears for a short time but is easily one of the most memorable parts of the film. It was nice to see Rob Reiner back who is so funny here. Kyle Chandler and Jon Bernthal do a marvellous job as well.Some would say the film glorifies the lifestyle Jordan Belfort lived which I totally disagree. I think showing the excessive drug use and sex is important for this story so you can really get an idea as to how these people lived. There is no sugar-coating of any kind and it's important to remember the consequences of living such a life.The Wolf of Wall Street is easily one of my favourite Martin Scorsese films. The fast-paced frenetic energy of the story is so exhilaritating to watch. The performances all round are amazing and I don't think I'll ever get bored of The Wolf of Wall Street."
preppy-3,"Feb 9, 2014",9/10,Movie based on the life of Jordan Belfort (Leonardo DiCaprio). He was a poor man who joined Wall Street in the late 1980s. He slowly built his way up to the top--making his own company and doing anything (legal or illegal) to come out on top. He also became addicted to drugs and sex and it slowly destroys him.A VERY good but not great Scorsese film. Let's get the negatives out of the way first--it's far too long at 3 hours (this could easily have lost 30 minutes); Jonah Hill is TERRIBLE and annoying in a supporting role; the constant swearing and screaming gets tiresome; there's WAY too much female nudity (while a scene with male nudity was cut down to nothing) and there's no real ending...it just sort of stops. Still I loved it a lot more than I hated it. The acting was great by everybody (save Hill). DiCaprio was brilliant in the title role. Who knew he could do comedy as well as drama? He anchors this film and he's never less than mesmerizing. As I said mostly everybody else is good but special mention must be made for Margot Robbie (as his second wife Naomi) and Joanna Lumley who is incredible as Aunt Emma. The story moves fairly quickly and there's a great use of period music. So this is excellent but not great Scorsese.
jbondoc-60420,"Jan 31, 2021",9/10,Honestly only came back to watch this because of the gamestop stock getting hype. Will forever be a great film.
ivorhighley-12825,"Aug 19, 2021",7/10,"Strictly for those adult enough to accept the dialogue of strong language throughout, also littered with many sex/drug references.Not a Scorsese great, but still was a hit in which it's lead of Dicaprio (whom the director legend used in the aviator) performs at a high level in a corporal enterprise."
tanmoypapairoy,"Oct 24, 2016",7/10,"""The Wolf of Wall Street"" paints a very decadent picture of the financial sector and its corrupted denizens, perverted by money and greed. A multitude of insatiable degenerates are depicted participating in an unending array of grand parties, laced with copious drugs, alcohol, and prostitutes, splashed across the screen in unabashed opulence. Overall ""The Wolf of Wall Street"" is a full on adrenaline ride that never loses momentum. It's directed with a lot of flair and energy and has an incredibly well written script that gives it depth and a ton of laughs. The cast is fantastic and DiCaprio gives his best and most fun filled performance to date."
93we2i,"Jan 4, 2014",1/10,"This movie should be rated x. Still impressed the American public is so desirous of porn and drugs use...and thinks it is funny. Congratulations to Scorsese for knowing his audience. Interesting to see so many people under 18 laughing at the drug abuse. IMDb requires 10 lines of text to issue this review, but really, how long was Scorsese's outline of this movie. I doubt it was that long. Let's see, show lots of naked bodies, throw in continuous offensive language, snort all the cocaine off the naked bodies, villanize stockbrokers...yep, that is a great formula for getting high ratings and making lots of money."
khigggs,"Dec 28, 2013",N/A,"Love porn as much as the next guy maybe more,but other than sex, plenty of it and drugs not a whole lot to this movie, Leonaro does do a terrific job as do a few others,but no much plot development especially for such a long movie! basically we got rich,cheated other people, laughed about it,do lots of drugs have sex,do lots more drugs, have more sex with pros,do more drugs have more sex and on and on with women everywhere we go,and repeat that for about two hours. Couple of memorable scenes .....sell me this pen .......scene with FBI on boat..country club scene....but I'd wait for the red-box $1 to see....send wife and kids out when watching"
nomodusproject,"Mar 8, 2020",8/10,"Perfectly executed in almost all aspects. Great script, great acting, especially Jonah Hill and Leonardo DiCaprio, their chemistry is spot on."
TdSmth5,"Jan 22, 2014",8/10,"Jordan Belfort arrives in Wall Street and gets a job selling stocks over the phone. The environment is vulgar, brutal, ruthless. One of the senior guys takes him to lunch and gives him the lessons to survive. The main point is to put money from the customers in their pockets, not so much enrich their customers.When Black Friday hits, Belfort is out of a job, and ends up working at a company of amateurs selling penny stocks. He does so well that he ends up opening his own firm ripping people off. He hires friends and shady characters. One of them introduces him to drugs. They are so wildly successful that they pretty much don't know what to do with all their money. He becomes addicted to money, power, and all drugs he can get his hands on. His wife divorces him and he marries the gorgeous Naomi.As the feds start snooping around his business, which involves everything illegal under the sun, he decides to move his money to a Swiss bank and Naomi's English aunt helps in the process as well as various carriers who transport millions of cash by hand. Eventually, the government catches up with him as his life unravels.The Wolf of Wall Street is your typical Scorsese ""rise and fall of a bad guy"" movie. It's a bit different in so far as Belfort is nowhere near as likable as the other Scorsese main characters. Here you are not wishing for Belfort to escape and get away. You want him to face justice. And violence has been replaced with comedy. Much of this overlong movie is made up of comedy skits basically. There's DiCaprio on drugs, DiCaprio having deranged sex, there's DiCaprio fooling his wife into doing naughty things in front of a hidden camera, there's the company jerks throwing little people at a target, etc, etc. This movie could have easily been cut by at least half an hour. There's also not nearly enough drama.Most disappointing is the lack of any sort of moral message, if you will. It shouldn't have been difficult to point out the insane misantrophy of Wall Street folks. But there's only very little of that. Given that the finance world still gets away with murder, or perhaps these days even more so, it's not clear why Winter, Scorsese, the producers, anyone, was not interested in taking the opportunity to scold the finance world.Acting is OK. DiCaprio is strong except for the scenes where he's motivating his employees. There are too many scenes of those and DiCaprio doesn't convey the charisma necessary. Margot Robbie is the revelation here. I'm not crazy about the rest of the cast- Hill in particular doesn't convince.Like all stories about larger than life personalities written by themselves, much probably didn't happen as told. Nevertheless and despite the excessive lengthy, Wolf of Wall Street is entertaining yet surprisingly and unnecessarily superficial."
aguss_the45th,"Dec 14, 2020",8/10,"Pelicula vista hace años, pero recuerdo que esta pelicula no exageraba con el humor y no lo explotaba. Es graciosa de principal a fin."
HabibieHakim123,"May 2, 2021",10/10,"""Scorsese at his finest spirit, yes, 3 hours biopic movie, tells a life story of Jordan Belfort, Dicaprio great perfomance makes this movie really really work well, becoming one of the most entertaining 3 hours movie i've ever watch, very well writen, great cinematography, all Scorsese stuff that i'll never get bored, The Wolf Of Wall Street is simply a long must watch movie, i highly recommended"""
mm-75687,"Feb 16, 2021",9/10,"This movie is so funny. I can't watch it enough. I don't know how true to history it is, but it is fun to watch. It is hard to imagine any financial office could be that kind of insane asylum. Great acting and a funny concept."
stevieb10019,"Dec 26, 2013",6/10,"I saw the trailers. I was all in. The movies was going to be bigger than life: ride the tail of a major swindler, see what life was like among the obscenely rich and luxurious. The film is uneven: it's bigger than life, but it's also sad and painful to watch, and it's also funny. There's lots of great scenes, but it just doesn't hang together. I was willing to bet on a winner by Scorsese. Lots of amazing performances. Leonardo DiCaprio has never been better. He's in great shape. At times, he reminded me of a young Jack Nicholson. Jonah Hill is great, and steady through out. Some wonderful small gems of parts played by Matthew McConaughey, (who doesn't seem fully recovered from the Dallas Buyers Club), Rob Reiner, Joanna Lumley and the French handsome leading man, Jean Dujardin. The film made me feel as though I'd been taken for a ride, and it's too long ride at that, at 3 hours."
kew5953,"Dec 21, 2013",N/A,"The story has been told before. The style has been used before. There is nothing new here. ""The Wolf of Wall Street"" is not a badly mad film, rather the movie is stale and tired 5 minutes into its 3-hour run.That Scorsese cannot find a more mature subject matter than greed, sex, and drugs is a little sad. With those themes for a plot, why not just make porn. The audience would be wider, and the profits greater.As for being a dark comedy, that might be a tough sell, give that comedy tends to be more individualized and subjective than drama. Perhaps I am just getting too old to find humor in debauchery. However, I did laugh out loud once during the park bench scene between Leonardo DiCaprio and Joanna Lumley. Now *that* woman knows how to deliver a comedic line.I did not hate the movie, but I did not love it. It was okay. If you have nothing better to do on a winter's day, go see it. There are worse ways to waste your time."
