user,date,rating,content
mom_ash,"Jul 17, 2010",9/10,"When I first saw the early 2009 trailer of this movie I was intrigued because I knew this time Nolan will not repeat himself in a brilliant breathtaking action movies like he made before in his new Batman or the deep thriller he represented in ""The Prestige"" or the mind-blowing ""Memento""No, This time Nolan will make his crown jewelry his own masterpiece.This time Nolan will teach us how to make a thriller-action-psycho-mind blowing with intelligent science tricks movie .And when I saw ""INCEPTION"" yesterday I wasn't disappointed. In the first few minutes you will be bolted in your chair trying to get the grasp of what is going on around you. I can only describe it as the same reaction when you first saw ""The Matrix"". There is certain rules going on you can't understand, which will begin to reveal its meanings after a while.Cobb ""Dicaprio"" is a strange character-reminds you of ""Teddy Daniels"" at his last "" Shutter Island""-his job is stealing the ideas from the industries' pioneers by tricking them in their dream state to reveal their secrets.This is the main character the film is all about, around him a clever cast of Joseph Gordon- Levitt, Ellen Page, Tom Hardy, Ken watanabe, Dileep Rao and Michael caine to support him in his new ""mission impossible-like"" job.The job is instead of stealing an idea is to put a new one in the mind of a rich industry heir ""Cillian Murphy"" by putting him in a deep three level dream in order to reach to the core of his mind to plant this idea.During the film you will discover the danger they put themselves into by doing so, and that Cobb ""Dicaprio"" is hiding a secrets of his own. Also a several shift between different dreams happening in the same time away from what is happening in reality with a time perspective change which was a surreal experience.A twist of brilliant camera,visual,action & science tricks is the main theme of this movie, you can't trust any of your senses, you can't make the difference between dreams and reality, you are caught up in-between all the time. I can't describe it really only by that you don't know if you took the blue pill or the red one as like in ""The Matrix"", and maybe it is much worse because during the movie you won't know whether you are dreaming or watching a movie in a cinema - or maybe its just me - :)The final words that Nolan has answered the question of why the cinema won't die, by showing us that there is still a huge creative space waiting to be discovered."
tykjen-1,"Feb 15, 2014",10/10,"Dear Christopher Nolan.Like Lenny feels compelled to search for the murderer of his wife in Memento considering even when he realizes the truth, as compelled have I been to write to you about a personal catharsis I've had and still am going through that you indirectly have contributed to help me define and following changing myself after immersivly enjoying Inception on a level I never thought possible.The playful ending with the top in Inception and the following endless discussions is simply reminded me of The Prestige; ""They want to be fooled"" and the mass audience are showing some weird and funny theories of reality and dreams regarding Inception. Incredible how a movie can mess with someones mind. Shame is that people don't discuss the brilliance of the movie as much as its ending. But perhaps thats what you aimed for, I have a radical notion. In some years to come perhaps the mass audience will look past the top and truly recognize the simple, yet powerful truth.Life now feels like a dream, I gotta be asleep to believe it. These past 9 months..so much have transpired. And I've been on and off about sending this letter. I could write a novel about what more has happened, and I think I will end up doing that someday. Its just hard as hell to remember where to begin. Im most happy my sister returned after living abroad for 10 years. And she and my mom have been my Ariadne's in the wake of this awakening. My sister reminded me of SO much from my childhood, helping me put a lot of the puzzles back and see the real truth.The Batman trilogy has ultimately led to me understand that my brother has truly been a father to me more than my father ever was. He has been my superhero through my youth. I just did not understand the value in that he was carrying a mask to protect and shield his dearest ones. And am forever grateful for him, and I cannot delve into his soul like Bane did, because taking his mask off will most likely be catastrophic for everyone around him. I believe firmly he will endure it, and be the same protector and father for his son.Thank you Christopher. Im looking forward to a new beginning to this old soul.You are for me, the Tesla of filmmaking.-Kjetil."
Shzh-demaoong,"Aug 15, 2022",10/10,"The director is a real genius. The point is, he's young. This is a film that is close to perfect in every detail, from the writers to the actors, from the cinematography to the score."
MGabbard,"Jul 17, 2010",9/10,"Many people are saying that Christopher Nolan may be the best film maker of his generation. I thoroughly enjoyed Memento, thought Batman Begins was great, thought The Dark Knight was fantastic, and after watching Inception I think the man is a cinematic genius and can't wait for his next project. But I will have lots of enjoyment watching Inception many times over until then.He supposedly honed this script for 10 years and it definitely shows. The story is quite complex and has not a plot hole in it that I was able to observe. It has everything - loss, redemption, amazing action, great character development, mind-blowing effects that serve the story and not the other way around as many films do nowadays, and at the core is a love story not too unlike Orpheus and Eurydice. But unlike the myth the underworld is a damaged soul. And when it looks like the story is wrapped up, there's a last second twist that will throw you for a loop.What the Matrix did for virtual reality - Inception does for dreams and takes it even deeper. This is a film where spoilers might ruin your sense of wonder and discovery watching this film for the first time so I won't give you any. But what I will say is that if you took What Dreams May Come, crossed it with the Matrix, Mission Impossible, and threw in a good measure of a Phillip K. Dick quality science-fiction story - you would be heading in the right direction.The hype is real. You will not be disappointed. Go see this film!"
ammar456,"Jul 17, 2010",9/10,"I haven't done a 'movie review' in a while, basically because we've had quite a lot of rubbish recently. Well, either rubbish, or clichés. Gone are the day's of the 90's, with great movies that were actually intelligent, like Fight Club, Pulp Fiction, Sixth Sense, and so on. Now all we seem to get is more of the same dumbed down movies, over and over again, and so on for the past decade (sure, there have been a few good movies here and there, but that's all they are, a 'few').This year seems to have made a comeback, though; is this decade going to be a good one for movies? Shutter's Island at the beginning of the year with it's crazy multiple psychological twist, trailers for Salt showing a clever WTF plot line, and just yesterday, Inception.Wow. It's not often I sit and watch a movie in the cinema gripping the edge of my seat, dreadfully anticipating the next few seconds. Not often that a movie ends and everyone in the cinema starts clapping.So what is this Inception business? Well, to actually review the movie without spoilers is kinda tough, and even though it's kind of immune to spoilers (telling you the ending would not take away from the story, as it's the point of 'how they got there', and even if I tell you 'how they got there' it would probably make you more confused) so if you haven't watched it yet, read until the ---Spoilers--- tag below. The movie has a cast that basically drove it to perfection; Michael Caine, Joseph Gordon-Lewitt, Marion Cotillard, and stars the lovely Leonardo DiCaprio, who got famous from the cheesy ""I'm the King of the World"" scene in Titanic (well, that and getting it on with Kate Winslet in the back of a steamy car). Let's just say back then he was a little, what's the word, soft.But over the years, he's gone from some young and pansy romantic actor into my top 10 list (along with Al Pacino, De Niro, Brad Pitt, etc), and again that's partly through his mind blowing performances in movies that again, blow your mind; from Gangs of New York, to The Departed, to the recent Shutter's Island, and now this? I must say, we're far off from that little kid back in Titanic.Inception is basically about dreams, how you can actually enter someone's dreams (through a physical connection while you both sleep), and from there steal hidden ideas and thoughts from their subconscious. DiCaprio plays an expert thief at that game, and along the way is forced to take a pretty tough mission (details of which I can't discuss, see spoiler part below).The acting was high quality, graphics amazing without making it seem over-done, and the plot-line way above anything you've seen in theatres over the past few years. This being said, it's not a movie most people won't get, but if you are a dumb viewer who can't grasp more than your typical straightforward storyline, don't bother watching this. I counted at least 8 people leaving the cinema half way through the movie. Many others would probably want to watch this a second time due to the complexity and number of levels this movie hits.I've always had a fascination with dreams, and how the dream world works in comparison to the real world; dreams within dreams, the time aspect of it, controlling your own dreams, or even being aware that you're actually in a dream - I wrote about this a while back, read it here (http://www.ammaro.com/2007/08/dreams-reality.html)It does raise multiple questions about your life, dreams, what is real and what isn't. I would go as far as say that it brings about that same feeling you get when you first watched 'The Matrix'. Everything in the real world seems kind of blurry for a while. And this movie makes you think, oh yes it makes you think. I couldn't find much to fault with it, except that even though the whole thing lasts about two and a half hours, I felt a few parts were rushed, and probably needed a little more development, while others dragged on a little. Overall, this didn't deter much from the enjoyment, I give this a 9/10, a definite must watch and so far the best movie of the year!Continued with spoilers at http://www.ammaro.com/2010/07/inception-2010.html"
Glock_Boy,"Jan 24, 2011",5/10,"Alright folks, I saw the same movie you saw. My wife and I both went into this with great expectations. Visually, the movie was interesting. Beyond that, it was ho-hum for us. I felt myself fidgeting in the seat several times wondering when they were going to get to the point. The film was about 45 minutes too long. The concept is very interesting, but there are so many loopholes and unanswered questions and illogical contrivances that we both just shook our heads and enjoyed the scenery. I have to wonder where all of the high ratings for this flick are coming from. I am not buying that as many people loved this thing on the same par as Lord of the Rings and Godfather. This movie was so pumped up that I was hoping for something brilliant like The Matrix. I feel like I got something more similar to ""The Happening""."
Michael_Elliott,"Jul 23, 2010",N/A,"Inception (2010)*** 1/2 (out of 4)The ""kiss"" platform of recent years to keep it simple and stupid has pretty much ruined movies to a point as it's rare when one can walk into a movie and have a real workout on your brain. Sure, our eyes and ears are treated to amazing sites and loud noises each and every week and some would say this causes the brain just to lose any type of reality, which might be the reason certain people (cough Lohan, Hilton and countless others) are able to be hot stories while better, more worthwhile events are simply overlooked. If one doesn't want to use their brain then it's best to stay away from this thing. It's best not to know too much about the story but it deals with a troubled man (Leonardo DiCaprio) who has made it a job to break into people's dreams and steal their ideas. However, due to a personal tragedy, he is forced to take a job doing the opposite, which is breaking into a man's dream to plant an idea. That's pretty much all you need to know, storywise, as director/writer Nolan will deliver the rest and while the end result wasn't a pure masterpiece to me, there's no way you can deny the power it does contain. Dreams have always played an interesting part in movies but no other has taken you this far into them and delivered such incredible ideas. Not only does the screenplay deliver a lot to think about but we also get plenty of action and amazing scenes of destruction. The trailer showed people just a little pinch of a city turning upside down but seeing the full sequence was something truly amazing. Other amazing sequences was the entire final hour when our group of dream breakers must enter a multiple layer of dreams with one damaging effect after another. If you're familiar with Nolan then you already know what he can do and there's no question the man has talent but it is something special that a film like this could be pulled off at all. When you're dealing with multiple characters in multiple spaces and in multiple dream zones it would be easy and common for things to just fall apart under their own weight. It's very difficult to keep you guessing from one moment to another without things either falling apart or getting so complicated that the viewer simply gives up on the film and moves on. The amazing thing is that Nolan never lets up on the gas and instead just delivers one more bit of story on top of the next and I thought it was amazing that he could keep the viewing coming along for the ride and never lose us. I think some people are going to not understand what's going on or be able to figure out the multiple levels but when you kick back and think about what you've seen I think most will see that the maze had an entrance and an exit and nothing came as a cheat. DiCaprio delivers yet another wonderful performance but he's got a terrific cast around him including Ellen Page, Michael Caine, Joseph Gordon-Levitt, Marion Cotillard, Cilliam Murphy, Pete Postlethwaite and a great return from Tom Berenger. Each actor does fine work in their roles and certainly help the story move along. The nature of the story is a very good one but the visual effects are just as good. Looking at all the action and amazing effects makes one really appreciate the acting, directing and story even more simply because they didn't get lost behind everything else that was going on. I don't think there's any question that one needs more than a single viewing to catch everything happening here but that's certainly not a bad thing since each viewing will deliver bits and pieces that will probably take the film into directions that you didn't think were there."
ivaylo_tsalta,"Jan 17, 2015",10/10,"This is not Sci-Fi Movie It's REAL and the director of that movie know this very well. Its Dream Walking State. And what is funny that This happened to me before 5 years. The Dreams are not just Dreams. this is My DRAM Short:I dream very interesting dream before around 5 years So what i dream exactly is I was in one place with my Uncle and my Father. And we speak different things, also after a while i quarrel With my Father and after this i just Wake up.So when i wake up drink some coffee and after few minutes i was going on my Uncle Home to see what they do etc.. like normal. When i come at his Home.. he look at me and told me.. ""What you dream Ysterday"" and looking me strange, for few seconds i just was totally shocked and i was sure that he know about my dream. After this he explained me without to know anything before, he told me what i TOLD to him and what i told to my Father every single word.. and also he remember the position of everyone.. like you was here i was there you told me this, he told me that and etc..So its very wired that he was on the same time, on the same place in the Dream and also know what exactly i told to him and remember it.. i remember the whole dream also..was like real i can feel the air the bird everything. And that not all after around 4-5 days later I saw my Father and YES he had absolutely the same DREAM and yes he remember too every word what i told to him what he told me and the position of eveybody...How is possible 3 Peoples to dream exactly the same Dream on the same time and also to have conversation of this dream and everybody to remember the conversation and etc!?Thats it.Is well know as Dream Walker and the therm mean that for example YOU can conect with everybody you want no matter how far is he/she and to do whatever you want with them u can talk with them you can take them with you and create a different world.After the dream one day i watch ""Inception"" and i was shoked because everything inside the movie was like my dream i mean they just show in the movie that they are Dream Walkers and i was sure that the producent of that movie know very well for what about is this movie is not just a Sci Fi movie its a real deal but the people will not understand it only the few who know and have this experience already. And all the people say well super stupid movie we don't understand anything at all how to explain them that this is REAL and the movie is not a Sci Fi and the same happened to me in the real life."
pavis22,"Jul 16, 2010",10/10,"I went into this movie with low expectations and once this film started, it took my expectations, strapped it to a rocket and took off. This film was by far one of the most creative, mind-blowing, drama driving, thrillers that I've seen in at least 5 years. The acting was very solid on all parts when it came to fear, solving problems, chemistry, and action. The score was magnificent, dark, deep, suspenseful, and very escalating. You find yourself at points of the film on the edge of your seat hoping that all the characters make it through okay, especially with their own unique talents and the actors made these characters seem so real that you'll have to pinch yourself and make sure that you are not the one that is in the dream world. I will see this movie at least 2 more times and I will not be surprised if it wins one or two Oscars at least."
LeightWinst,"Jul 16, 2010",9/10,"Don't read a single iota of plot about this. Watch it. What I will tell you is that DiCaprio may not have been better and is getting better the older he gets, the rest of the cast are amazing (especially Tom Hardy and Gordon-Levitt), the cinematography is at times breathtaking, Hans Zimmer's score is intoxicating (with Johnny Marr on guitar), and it travels across continents like a Bond movie. Oh yeah, and it's really, really loud in parts. But this is about Christopher Nolan again. He has crafted a serious adult thriller that happens to have exhilarating action sequences that, importantly, don't detract from the emotional content and a plot you will have to sit and think about. It's amazing that in a time of remakes and sequels that a director is given carte blanche to do what he wants and returns something as gratifying as this. Stunning. Why are you still reading this? Go! Watch! Now"
poovendhan07,"Jul 17, 2010",10/10,"This is not only the best movie ever made about dreams, it is also one of the best films of 2010, and certainly one of the most entertaining pictures I've seen in a decade.A groundbreaking, intriguing, exhilarating and brilliant sci-fi thriller that's destined to become a timeless classic. Mark my words: It will be remembered for years to come. Inception is elegantly realised.DiCaprio powerfully embodies a tortured soul while Gordon-Levitt has all the fun in the best action sequence. This is a drama built around ideas and images; it is a cinematic maze that Nolan makes his audience traverse in order to follow, understand and appreciate his world.It makes 'The Matrix' look like a Dick & Jane book. The final half-hour alone is a miracle of clockwork-precise showmanship.IF you are going to vote less than 10...too bad......I'm really disappointed. This Movie Deserves 10 and The NO.1 Spot....."
gilmanwalker,"Aug 17, 2011",8/10,"It went too big. Personally there was just something wrong with Nolan's interpretation of the whole dream thing. I got uber bored and i thought most of the stuff was too predictable. People were freaking out saying this was the best film ever and it was mind-blowing and all that jazz. i FELT THERE WERE TO MANY PLOT HOLES AND GOT SICK OF THE FILM ABOUT HALFWAY THROUGH. It was truly not even remotely as good as it was made out to be. 1. It wasn't as good as it was supposed to be. 2. I didn't end up liking any of the characters that much. 3. Nolan's fan-boys get on my nerves. 4. I have a friend who obnoxiously is obsessed with Nolan, and that makes me biased. 5. I had higher expectations based on Nolan's previous films."
and_mikkelsen,"Mar 30, 2023",9/10,"This movie never gets old! Of Christopher Nolan's movies, it is the one i have watched the most outside of The Dark Knight! This really feels like a movie that only he could make! A mind bogling mix of ideas and creativity, as the concept of dreams are told to the viewer in a way, so that it never becomes too much! This is one of those movies that hooks you from beginning to end!The plot is engaging and you never know what to expect as the movie builds up and becomes more and more intense and thrilling! This is also a journey of guilt, confronting yourselves and learning to move on! Directing is amazing with some truelly iconic scenes such as the hallway fight which is expertly made and filmed! Soundtrack is equally great and iconic!Great actors who all does a great job! Lots of talent! The ending still remains one of my favorite movie endings of all time! This is a once in a lifetime experience that you dont wanna miss!"
joachimvnilsen,"Jul 13, 2021",10/10,"This movie is an absolute masterpiece. The story is incredible paired with amazing acting, unforgettable music and beautiful cinematography. This movie really deserves everything. Easily one of the best movies of all time."
evanston_dad,"Jan 11, 2011",5/10,"""Inception"" might have been a better movie -- and would certainly have been more entertaining -- had writer/director Christopher Nolan not made his premise so complicated that the film had to spend its entire 2:25 running time explaining itself to its audience.Seriously, the exposition Never. Stops. There were literally moments during action sequences where one character would pause and explain what was going on to another character, which of course was a ham-fisted way of explaining it to us. But even with all of that aggressive exposition, the movie never does make a lot of sense. The result is a lot of busyness -- oh, there's always plenty of stuff going on -- that's nevertheless pretty boring because it's never clear what all of the busyness is for.Nolan has done this to us before. Who the hell came out of ""The Prestige"" with any clue what that movie was about? And even his more narratively coherent films (like ""The Dark Knight"") suffer from a lack of humor and a burden of philosophical pondering that the premises can't support. ""Inception"" is no exception (ha!). The movie is junk trying to disguise itself as something important and significant. How much more fun it would have been if it had just been content to be junk.Grade: C-"
Farhad_Aziz,"Dec 25, 2019",10/10,"From the starting till the end, it was dream and dream. At the ending for sure everyone will sit breathlessly and ask himself.... How a movie can be this good."
chintusrikanth-58753,"Jul 7, 2021",10/10,Until now it is no 1 in my list. I want share experience after watching this movie. I feel different no movie got this feeling for the first in my life .I can't explain my feeling but I know my mind can't think for few minutes.i see this movie in regional language that why I understand in first watch after watch in english.then I more understand about movie first time I watch I went with the story at end I feel like mind blowing experience in my mind.
parrot007,"Jan 5, 2020",9/10,"Inception is a movie you just have to see before you judge it. Maybe you should even see it twice. There are a lot of complex ideas here, and the movie spends a good chunk of time explaining them in the opening act.
That main idea though, is something very unique and creative that is brought to life by outstanding filmmaking, everything you'd expect from a Christopher Nolan film. Writing and performances are also great across the board. The only problem with Inception is in ones own interpretation. Some may says it's pretentious and the ideas presented acctualy aren't fully understood by the creators and/or don't make sense. But I think that's a terrible angle to approach the film. It's Sci-Fi, you're not supposed to over-anylasie it in that way. It's meant to plant thought provoking ideas in your head, which I beleive it does very well, not be a perfectly logical and plausible idea. Yes, it does have a few questionable sequences and scenarios, esspecally at the end, but it doesn't drag the rest of the movie down at all to me. It's a must watch"
Arcanjo93,"Dec 22, 2019",10/10,"Amazing movie.
I was fascinated with the idea of controling our dreams the I even looked up on lucid dreaming. But I just get no results :D"
