user,date,rating,content
ItsRobinTV,"Nov 9, 2022",9/10,I've watched this movie because it has a great rating and because I love Christopher Nolan and in my opinion it totally deserves this great rating...it could maybe even be a little bit better...There are tones of great stuff in this movie like the concept of dreaming which the whole movie is about and this is one of the greatest concepts I've ever witnessed. It just makes soo much fun watching these Characters do their thing...On top of that the movie has such a great soundtrack. Hans Zimmer has once again topped himself. The actors also do their best to make the emotional scenes hit hard and they've done their Job really really well...This movie is one of the greatest of all time in my opinion and you should probably watch it if haven't already.
sherylchilders82,"May 21, 2024",7/10,"Like all Nolan's films, it's mind-bending and original, and incredibly entertaining. But, sorry, they're not as brilliant as people think. There's always so many holes in the writing, as mentioned by others, like how Matthew McConaughey went inside a black hole to communicate with his daughter on Earth in Interstellar. Is it creative? Sure. But for those of us who like our writing to be tidy, it's more than a little annoying. Furthermore, it has no real twists or intrigue.For a person who is deeply interested and well read in psychology, I enjoyed the journey into the psyche through dreams. It's accurate in many ways that a dreamer does not control their subconscious, and theoretically, one could hijack it. In fact, people do this all the time, but one does not need to be asleep and dreaming. It's called brainwashing. No dream within dreams within dreams necessary.I liked the levels of action - it is a fun watch. And all the actors are adept in their roles. I really don't even mind when writing is not based in reality, as long as people realize that it's not. There's really nothing particularly bad about Inception - it just doesn't live up to the hype."
mikealike,"Nov 1, 2010",N/A,"Call me ""dumb"", I do not care, because I have my own mind and experience and I know by now that I am not. My only reserve is that maybe I should see it twice, or that this is not the moment for me to have seen it( As is with reading books, today one can't stand it , tomorrow it makes perfect sense). Apart from this, a movie being an experience destined to consume itself at the maximum in one ""kick"", after this Inception experience, I feel that something is really missing here. What is the idea of this movie? What is it trying to express? In what system of beliefs is all this taking place? Because, apart from the famous cast, the good performances, the special effects that are everywhere and the incessant and disturbing gun noises, I do not see what am I supposed to get enriched with through watching this movie? OK, the idea of conscious dreaming is centuries-old, so is the idea of ""staging"" the life or the universe(no need to mention the link to Matrix, etc), but who would be the ""dreamer"" if we extrapolated to our lives? Because the thought of a world meant just for corporations and ""important"" individuals, I do not like. So, in a person's life, any person, how are the Inception ideas fitting in? Are we to look and see who ""dreams"" for us, and the movie couldn't put this idea bluntly? Are we dealing with an explanation for wave function collapse, controlled consciously by some skilled to do so and implementing during our sleep? I feel the need to say, ""please explain yourself"". One cannot mount such a giant of a movie (publicity, effects, cast and so), and in the end leave you with a bigger blur than before such ideas occurred. I would say it is either a case of snobbish commercialism that is not backed up by enough understanding and research, or a case of intricate mind and ideas that have no clarity in expressing themselves. It is an exercise for the brain, I give it that. But in the light of too much gratuitous violence, too less contoured universe of the movie, too crowded action, too soapy emotional effects (the passed away wife, the uncommunicative rich father) and too high praise that it deserves (c'mon, this is the new Matrix? Are we going back as the time goes by?, I feel deeply not pleased."
zkonedog,"Mar 11, 2017",9/10,"Inception contains the narrative intrigue genius of Memento, though not executing it quite as well. Inception has the human conflict of Interstellar, if again not quite up to that snuff. Inception also has the panache of The Prestige, but you guessed it: not quite as perfectly paced as that tremendous film. But Inception is just a step behind all those 10/10 star films in the Christopher Nolan canon.For a very basic overview, Inception deals in a world where shared dreams are now possible. Of course, such a process has been weaponized to extract information from the mind of a dreaming individual. But can an idea be planted (incepted) instead of removed? That's what an inception team led by Cobb (Leonardo DiCaprio) aims to find out. Working for a life-altering paycheck, the team must go deeper (multiple levels of dreams) into the mark's head than ever before.The hallmark of Inception is its grandiose, mind-boggling concept. Much like Memento's narrative-in-reverse that never fails to intrigue, Inception's levels of dreaming are similarly stunning. The scope of the picture is often staggering. Helped by the visual effects from Wally Pfister and the Hans Zimmer score, Inception is a treat for all the senses. Truth be told, it may be Nolan's most well-balanced film in terms of action/adventure, intrigue, and human drama.Surrounding DiCaprio is the usual crew of Nolan thespians: Joseph Gordon-Levitt, Elliot (as Ellen) Page, Tom Hardy, Ken Watanabe, Cillian Murphy, Marion Cotillard, and Michael Caine (amongst others). This assures that the more human, nuanced moments of Inception are given the proper acting greatness.The two reasons Inception isn't quite top-tier Nolan:-As mentioned above, it is a step below the classic status of Memento, The Prestige, & Interstellar. One wonders if perhaps the ""Jonathan Nolan touch"" (Christopher's brother & oft-writing collaborator) on those screenplays are what push them over Inception a bit (Jonah does not have a writing credit here).-The ending (which I won't spoil here) is creative, to be sure, but not my favorite Nolan closing thought. The whole ""what is truly real, and does it matter?"" concept was executed better in, say, The Matrix than in Inception.Despite perhaps not living up to the Nolan uber-high bar of filmmaking excellence, Inception easily comes close enough to be extremely entertaining all the way through. In the end, Inception is (I think) a ""concept movie"", and that concept never fails to keep viewers emotionally and viscerally invested through the entire two and half hour runtime."
blehnk,"Aug 18, 2022",9/10,"I vaguely remember the time i watched this movie (which was a long long time ago), but i definitely remember being blown away by this masterpiece. I would love to experience something similar again."
joe_raja,"Nov 29, 2019",9/10,"Repeated views to understand a movie! That is what I call a MOVIE and this one of those. If you can, just watch in theaters.Dream in a dream in a dream in a dream! Amazing concept and how they executed also marvelous.Must watch !"
mahadevwala77,"Jun 25, 2019",10/10,Brilliant technical wizardry Heady at least apparently so A ride more than a movie but a movie none the less Chris Nolan is rapidly becoming the director of his generation and i m longing to find out what is he trying to say He has established his technical power again and again but if I think of Memento for instance I remember the gimmick but not what the story was really about I suspect the same will be said of Inception I m not putting down I m just wondering I left the theater full of questions and nobody could actually give me any answers I m not talking about the plot but at the way Christopher Nolan chose to tell the story Leonardo Di Caprio is acquiring some extra gravitas as an adult presence on the screen Loved Cillian Murphy I always do Riveted by Tom Hardy Enchanted by Marion Cotillard
rusi-nikolov,"Feb 10, 2015",9/10,"I'm a big fan of Christopher Nolan's work and according to me Inception is the masterpiece of it. Everything in this movie is perfect as per my requirements. There is enough mystery, action, drama, sci-fi and effects. The plot is perfect and Nolan did great in the development of that fantastic idea. I could not want nothing more from the script and the realization of it. As it comes to the cinematography Nolan was exceptional in what he have done in this movie. The final is a bit different and unexpected but perfectly made and all of the people who watch the film will be asking themselves the question: ""What happened?"".The actor's play is great too, I think that Leonardo Di Caprio and Joseph Gordon-Levitt are awesome in their roles. It's not strange that Nolan is working with some of the supporting actors in more than one of his movies. Despite the most attention went to Di Caprio and Gordon- Levitt the others should not be passed. Ellen Page, Ken Watanabe, Dileep Rao, Cillian Murphy, Tom Berenger, Pete Postlethwaite and Michael Caine did great too. I want also to mention Tom Hardy. I didn't know him before Inception, but he is one of the actor who won my attention and I enjoy his acts in other movies too.As it comes to the soundtrack, I think that just mentioning the name of the Hans Zimmer should be enough for the movie fans. According to me Zimmer is the best in the business. Once I checked his biography I was more than impressed with the fact that he made soundtracks for more movies than I could though. The most impressive part is that he did it for great ones, not just for some mediocre films. The soundtrack of Inception is one of the little that I listened after watching the movie.According to me it is quite normal that Inception won Oscars for cinematography, visual effects and sound, but still it is very strange that the academy awards for best movie, best actor and best writing were not given to Nolan's masterpiece. I really think that Inception is far better in every aspect than King's speech and I know that this topic is widely discussed but Di Caprio was great and deserved the award more than Collin Firth.As a conclusion I will definitely suggest to everyone who didn't watched Iception to do it as far as he could, because he missed on the greatest movies ever.I gave 9/10 because 10/10 is waiting for the movie that is still not done."
kboool-05834,"Jun 14, 2019",10/10,One of the best movies out there I highly recommend it
throad-90112,"Aug 22, 2022",9/10,"Genius from start to finish. Unbelievable. I've been a fan of Christopher Nolan since Memento, but this takes his immense talents to the next level. I wouldn't trust this film in the hands of any other filmmaker. Truly."
rahul_prasad_01,"Dec 28, 2025",8/10,"Christopher Nolan's Inception takes audiences into a thrilling and perplexing world where entering and manipulating dreams is not only possible but central to a high-stakes mission. At the heart of this world are 'Extractors,' individuals skilled in entering others' dreams to steal valuable information. Dom Cobb (Leonardo DiCaprio), the most skilled Extractor, is hired by the powerful Japanese businessman Saito (Ken Watanabe) to perform an even more daring task: implanting an idea into someone's mind, a process known as inception.The target is Robert Fischer (Cillian Murphy), the heir to a powerful business empire. To accomplish this seemingly impossible task, Cobb assembles a team of experts, each bringing a unique skill set. Arthur (Joseph Gordon-Levitt), Cobb's loyal partner, is responsible for researching and understanding their target. Ariadne (Ellen Page) is the architect tasked with creating complex dreamscapes. Eames (Tom Hardy) is a shape-shifting forger who plays a crucial role in the team's manipulation of Fischer's mind. Finally, Yusuf (Dileep Rao), the chemist, provides the sedative necessary to ensure the dreamers remain asleep long enough to execute the plan.The strength of the film lies not only in its high-concept premise but in the ensemble cast, whose performances elevate the material. Each character is distinct and brings their own charm, adding depth and relatability to the story. While Saito and Fischer initially appear as secondary characters, their roles prove to be integral to the plot's unfolding. Watanabe's Saito remains central to the narrative throughout, while Murphy's Fischer is far more involved than initially anticipated. Gordon-Levitt's Arthur adds humor and lightness to the film, his quirky demeanor providing some of the movie's most memorable moments. Ellen Page's portrayal of Ariadne is particularly significant, as her character serves as the audience's entry point into the dream world. As someone new to the concept, Ariadne's questions help explain the intricate rules of the dreamscape, making it easier for the viewer to follow along.Written by Christopher Nolan, Inception benefits from a brilliant screenplay filled with twists and turns. The film's constant ability to surprise keeps viewers on edge. One of the film's most effective narrative devices is its shifting portrayal of Cobb's wife, Mal (Marion Cotillard). Her character's role and the complexity of their relationship are revealed gradually, keeping the audience guessing about her true nature and the nature of Cobb's grief.Nolan's world-building, particularly the design of the dream environments, is visually stunning. The dreams are multilayered, both figuratively and literally, with the team diving deeper and deeper into Fischer's subconscious, each level more precarious than the last. These dreamscapes are not only visually engaging but also play a crucial role in the narrative, representing both the characters' personal struggles and the overall mission's stakes.Despite the film's near-perfect execution, there are minor issues that detract from the experience. At times, the clarity of dialogue suffers, especially in scenes featuring Saito. His lines, though critical to the plot, are sometimes difficult to understand, leaving the viewer feeling disconnected from key moments. Additionally, Saito's promise to Cobb-his ability to resolve Cobb's legal troubles with a simple phone call-remains vague, with no clear explanation as to how such an action would be possible. While these questions may initially seem like plot holes, the ambiguity may ultimately be beneficial, allowing the film to retain its sense of mystery.The final scene of Inception has become iconic for its open-ended nature. The conclusion leaves viewers questioning the nature of reality and whether Cobb has truly returned home or remains trapped in a dream. While the ending has divided audiences, it is a fitting conclusion to a film that thrives on ambiguity and cerebral engagement. The unresolved final moment is both a satisfying and frustrating choice, as it invites ongoing debate about the film's deeper themes.Inception is a masterclass in filmmaking, blending high-concept science fiction with emotional depth and intellectual complexity. Christopher Nolan has created a film that is not only visually stunning but also intellectually challenging. Its multi-layered storytelling and unique narrative structure make it one of the best films of the decade, requiring multiple viewings to fully appreciate. Inception is a bold, thought-provoking experience that has set a new standard for modern cinema."
nelliebell-1,"Jan 9, 2011",4/10,"Inception is a lie and like all legitmate hollywoods irregardless of who is doing what to whom there is only the technology that allows this hysterical calculator(that is all this film represents) in this motion picture to perhaps make money.There seems not much more to suggest and that would be if this film made money,? Well did it ? This is what is a most unusual point to all this,and that would be if this particular film did not make money what else is this film doing if in fact it did not make money? What is required to know better or perhaps to truly know well what the viewer is looking at when as a viewer,the viewer as it were watches the motion picture ""Inception"".There is as well another consideration and that is if in fact the very participation in the watching of any motion picture is such an experience as to be a unwholesome experience. I believe it is that(unwholesome) and even more so provides for a disguise so to mislead any who might be drawn for what ever reason to watch such a film or for that matter to watch such are the films of Hollywood,California.There is no degree of involvement in the making of this film that is in fact authentic and as illegitimate that that might sound like it is an illegal search and seizure which allows a thief to be masqueraded as the man with the candy.This film is not new nor is this film what it appears as is as well.The result when viewing such a film is that there is no time that is real nor is there a place as to any particular event is concerned and if that isn't enough there is no definition as to not if there is a capacity to dream but how do we provide the ability to interject another ability that could pass as a dream.This is the handiwork of a masquerade with any here who believe believe not in this motion picture as there is no dreaming there is only the ability to transmit the stimulus with the image that is what masquerades as a ""dream"".It is as well imposed upon the body of the human race so to provide a unmistakable influence.The influence as the film provides such a witness has a goal of influence pure and simple this film is merely more of the same as the same has meant since as it were its inception.It is its invention that is at the source of this worlds ability to influence anything with merely more of the same being all that the viewer will ever be looking at.The inventor as well as the inventors many inventions are all patented and do it is believed remain so.There were some 700 separate inventions with which this unwholesome day in this world occurred when one Nicola Tesla discovered how to bind energy across wide open space many many miles from nowhere including even deepest darkest space.This is the field of regard it is as well the ability to network with many disparaging elements so to influence even say Adolf Hitler(I kid you not).Though 1920 is the year of radio's invention and 1921 the year Berlin radio started to broadcast it was a good time before this point in time that Tesla's inventions and subsequent patents were in place.The better premise would be to know through Tesla's own words as to what capacity does what he invented provide and without to much trouble Tesla's's own misgivings provide for the very problem of being under the influence of a lie.Though this lie was not meant to interfere with the human race that is exactly what has occurred.The money men of Teslas's own day are at the root cause as to the necessity to influence anything outside of an antenna.They remain as perhaps a cog in the wheel that very nearly saw to its conclusion not to long ago.This wasn't Tesla's design this was there influence on his attempt to bind energy that it was not to be unless of course they could extract a measure if you will of revenge upon humanity.This is the masquerade that there is a profit motive in this foreign power as well as an aggression not to be deterred in its inability to be regulated properly.This is an imperfect science which has meted out suffering through this field of regard.(network field)It is this thief in the night and it is as well the exploiter of human flesh that this film is providing the viewer with.This is what this film is up to and it has been such since it inception."
adlion944,"Nov 17, 2010",N/A,"Inception is right up my alley. I was expecting a thinking person's thriller with a bit of sci fi. C Nolan is well known - I loved the Dark Knight and Batman Begins. He's quality and tells a slow boiling story that pays off a concept. But whew, Inception... wow what a stinker.There's no question that this production staff and the cast took this project and themselves very seriously. It oozes production values. Too bad it lost me in the first 10 minute when I had no idea what was happening. And not in a good way, like other thrillers. I had absolutely no desire to understand the clap-trap these unlikeable characters were spouting. The kid from Third Rock, wow he thinks he's quite the bad boy. Fail.Anyway, instead of something that held my interest, this movie simply frustrated me. Inception is a ponderous, self-important, vacuous movie. It's empty, all presentation, no flavor. It makes no sense and I didn't even want to keep straining to figure it out. It doesn't unfold like ""The Game"" where you're dying to know how it comes out, clue by clue. I even stuck with Shutter Island and didn't really like that one, but it was way, way, way better than this movie. And it's not because I don't have patience for high-concept. It's not ambiguous or thought-provoking it just ends.Still, I would recommend others see this film and judge for themselves. Others seem to find this movie very intense and deep. I just don't get it. Personal preference, but there are quite a few like me where metaphysical pseudo sci-fi speeches, and lots of rules about what you can and can't do are just frustrating and not a nice evening's entertainment. I think I'll go watch The Game or Matrix again. It's been a while and I need to get the sour taste of this movie out of my mouth."
3xHCCH,"Jul 15, 2010",8/10,"What drew me to watch this film on the very first day of theatrical showing was the cast, which was an incredible array of some of the most intense actors in Hollywood today. We have Ken Watanabe, Cilian Murphy, Marion Cotillard, Michael Caine, Tom Berenger, Pete Postlethwait, and in the lead, none other than Leonardo di Caprio. The director and writer Christopher Nolan also comes with a very impressive oeuvre behind him, with ""Memento,"" ""The Prestige,"" and most recently, ""The Dark Knight.""This film is one of the most complicated films I have seen. A fair summary is almost impossible to put into words. It is challenging to follow all the jumping into and out of dreams, in dreams within dreams. I won't be surprised if you do not completely understand everything that was going on by the end. However, the visual experience of being in this multi-layered dream world is unmatchable in any recent films.I thought of ""The Matrix,"" and even Leo's latest (excellent) work ""Shutter Island,"" as this film proceeds to disorient you about what is and is not reality. However, ""Inception"" goes several levels higher in the hierarchy of convolutions in film. There are at least four levels of simultaneous dream upon dream happening at one time at one point. Amazing film editing work!Then there are technical aspects which were mind-boggling indeed, as Nolan's bizarre script required. The audience is brought inside buildings, rooms, elevators, even entire cities where you lose the sense of space, time, gravity and logic. It is a dream world--you need to see it to fully appreciate what I just wrote. The musical score of Hans Zimmer was strong and dramatic. These are definitely contenders by Oscar time.This film is not for everyone. There are those who would dismiss this as impossibly pretentious and pointless. But for me, ""Inception"" was very stimulating and challenging -- a film well-worthy to spend two and a half hours of our valuable time. Be ready to face this challenge when you go watch it. I won't be surprised if you feel you need to watch it all over again."
new-old1,"Jul 16, 2010",10/10,"I watched the first day first show of the movie, it was amazing !!!First of all the story was brilliant and unique. It is actually very difficult to implement such complex story because there are so many characters and so many explanations of how things are going on and so many levels in the movie.The concept of dreams and dreams inside dreams was unique. All the action sequences were very well done.I think such complex stories only great directors can tell because there were so many small pieces in the movie which needed to be connected.I expect this film to be nominated for Oscars because of being unique and very well made movieOnly the directors like Christopher Nolan would dare to implement such unique concepts .VERY GOOD !!!I would give this movie Rating : 10/10 , and it is a MUST SEE !!! ( Please watch it in theaters )"
