user,date,rating,content
kayteecee,"Aug 1, 2010",7/10,"I went into this movie expecting one of the best movies of all time. However, that is not what I saw. The runtime is extremely long and I found myself checking the time several times throughout the film. It was an interesting film to see, but it definitely does not belong on a list with the likes of ""Shawshank"" or ""Godfather"". The story was very confusing.There seemed to be plot holes and loose story lines that were never really tied up. The concept of the film is very intriguing and you will leave the theater wondering what it was all about. However, the atmosphere of some of the scenes felt very similar to Shutter Island for me. I almost felt like Leonardo DiCaprio did not really have to act much as he was basically playing a character similar to that of Teddy Daniels. Hope he isn't going to spend the rest of his career playing that same character. It was also nice to see Ellen Page in something besides Juno. She can be more than a snarky, pregnant teenager. Also, The visual effects are extremely well-done.I am not a fan of Nolan's work. The Dark Knight was a film that I could never understand why there was so much hype. It was average to me, at best. Inception, however, is much better than Memento.It is a film that you must see just because the concept is very interesting, but it is not something that you can watch over and over again."
dick-sanders,"Aug 2, 2010",4/10,"This is a tedious and boring movie that begs you to NOT suspend your disbelief and, instead, to wad up your popcorn bag and throw it at the screen. Okay, I exaggerate a little. But...Read the insightful reviews dated 19 July: You Don't Get It. And 20 July: Boring, Too Long, Awful Dialogue. And 21 July: Not Bad But Definitely Not Genius. And 29 July: Dumb, Dumb, Dumb. And finally, for a little fun, 23 July: Blah.Rather than rehash the insights of those helpful reviews, I'll try to add something useful...Inside of 30 minutes I was squirming in my seat, tapping my fingers, and checking my watch. Why? No character development. No sense that a good story had been started. And thus no engagement. As time wore on I found I really didn't care about any of the characters, or their plights, or what they were trying to accomplish, other than thinking Ellen Page was kind of cute.In an EW interview, Nolan says about his film, Memento, that he was ""trying to transcend the tyranny of linear narrative."" Really? A tyranny? We live in a linear narrative, Chris, but now that I know you feel that way about life, I'll remember not to pay to see your films. In the same interview, Nolan says that he was worried that his audience wouldn't be able to follow his brain-bending movie because of the complex dream-within-a-dream plot... until he lit upon (drum roll) the ""heist-flick model,"" in which the hero-thieves explain their scheme. Yes, Chris, but that's not a very good model. And what's more, it only works if the ""explaining is minimal"" and the director is skilled enough to show and reveal more. It's a moving picture, remember?Yes, the action here is pretty cool, better than the Dark Knight. The camera and stunt work are very good. The music is the same gloomy heavy-handed kind used in Dark Knight (same composer, Hans Zimmer). But the characters are essentially two-dimensional because everything is secondary to the plot, which in spite of its complexity you can understand well enough because it's all explained to you, endlessly. Even Dicaprio wasn't happy with his character and worked with Nolan for two months ""adding layers"" for more emotional depth (see the Rolling Stone interview). But apparently the complexity and ridiculousness of the plot buried that, or Nolan just didn't know how to deliver it (come to think of it, this may be a problem with all of his films). Plot over character. Cool factor over emotion.You think of the great work DiCaprio did in The Aviator. And the brilliant work by Gordon-Levitt in The 500 Days of Summer. I wasn't much of a fan of Juno, but Ellen Page ""made"" that movie. And of course Michael Caine has made many great movies, including the recent Harry Brown. Also, Ken Watanabe in The Last Samurai. And finally, let's not forget Marion Cotillard's stunning Oscar-winning performance in La Vie En Rose. But they're all struggling mightily here with Nolan's tedious script, and their immense talent is wasted.But of course, I'm all wrong. The movie is a huge hit. It's sure to rack up $500 million or more in worldwide box office sales. Whew! That's good news. Because then Nolan can go on ""transcending the tyranny."""
eastcoastguyz,"Oct 1, 2011",N/A,This movie is high energy but the problem with that is that it never stops. There is no contrast to it. High tension the entire time. No release and it wears out quickly to the point you don't even want to finish watching it. Too much repetition was included in this movie. Action sequences were too long and added nothing to the story. It needed a film editor to cut about an hour of it just to make it watchable.Then there is the plot. A plot which was thinning wrapped around all the action and special effects. You got the feeling that you were watching a computer video game and not an actual story. Far too much distraction and time spent on the lead character's personal life problem and he trying to deal with it.
varuunchaudhry,"Jul 19, 2010",10/10,"Just when u think that Chris. Nolan cant come up with a movie of the same league as the dark knight, he comes up with inception. 148 mins of pure genius. an instant classic. it is well on its way to be the movie of the decade or maybe even more.From start to finish this movie just holds your attention and you witness something that u cant even dream of.Every single thing in the movie seems to be picture perfect, each and every character has been well portrayed and justified in its own way.The only problem i had was that i didn't want the movie to get over, i just wanted to be a part of his dream world. to conclude i would just say that Chris Nolan is on his way to be recognized as one of the very best the world has ever seen."
dlhunter_1999,"Jul 24, 2010",8/10,"It seems like Leonardo DiCaprio is really going for these Psychological thrillers lately, which is good, as he seems to pull it off quite nicely.As usual, Christofer Nolan has created another great movie which is well shot, superbly acted and grips your attention from scene 1 - although at that point you really have no idea what is going on! My one point of criticism on an otherwise amazing movie is that he takes the concept one step too far. Towards the end keeping up with what's happening where becomes a full time task and although I don't want to come over as stupid, one less would have made the film flow much smoother.Enjoy!"
hassan-a-k,"Mar 1, 2021",10/10,"Christopher Nolan is probably the best film maker the world has ever known, he can take a wild imaginary fiction idea and reconstruct it to be realistic so the audience can almost see it in the real world without loosing the excitement of this idea!
I can't count the number of times that I have re-watched this movie, and it still gives me the same amount of the ""wow"" feeling every single time, it is my all time favourite movie."
smilingbharat,"Jul 16, 2010",8/10,"Christopher Nolan is a Genius.Nothing new in that.But the new thing is that he had paired with DiCaprio this time.DiCaprio already has gem this year with Shutter Island and now the count increases to two.The first hour of the movie tells you everything and you wonder what is left in the next hour and here comes the action.What was told in the previous hour was shown practically.This Movie contains 3 layers and a surprising and revealing 4th layer.The concept is brilliant, direction top notch and acting sufficient.The music by Hanzzimmer is haunting.I earnestly hope that this movie bags few Oscars.Let this movie be honored.One surely remembers MATRIX during the movie.Though the concept is quite different,the in differentiation between reality and dreaming reminds you of Matrix.Anyways this is quite original.hats off NOLAN.But definitely if you expect some real mindless action you'll be disappointed.This is Brainy thriller which keeps the viewer thinking and guessing.So all you people who just wants a movie for entertainment.Stay out.The remaining just enjoy this movie with your heads on.Film Making at it's Best. I gave it 8 on 10 only because I saw it just twice.My rating might get higher on repeated viewings."
xNecRosex,"Jan 4, 2021",10/10,"Movies of this calibre come seldom to never.This could be a once-in-a-lifetime motion picture to behold.If you could only watch 1 film in your life, it should be this.'nuf said.A truly remarkable achievement Nolan hasn't yet eclipsed, even though Interstellar and Tenet came pretty close, I feel like this one is still the best.It's an absolute grandiose spectacle on all fronts, music/score, editing, visual effects, acting, cinematography, writing, direction, and most imporantly THE VERY CEREBRAL CORE of the movie, the urge to engage with it, to grasp it fully by watching it more than once, the sheer scale of the movie... 10/10
*LOUD APPLAUSE*"
kashvyasrude,"Jul 17, 2010",10/10,"inception ........it begins with confusion ...the movie ends with standing ovation.....in between there is a dream of Nolan that bounds n mesmerizes you .....dark knight , batman begins n memento.......are piece of fine craft but this movie brings Nolan in bracket of Cameroon's Spielberg's n lean's.......hope you enough i.e..dream of Nolan's master craft acting DiCaprio's in lead enough said .......hans beats, chills you out......11/10 for this movie.... hope after inception....it is only inception of further great works from NOLAN..Oscar who gives a damn.......carry on but please make movie every year ........"
Dane88,"May 20, 2011",4/10,"First, let me say that the acting was good, and that Leonardo DiCaprio is a good actor. The bad rating I gave this movie has nothing to do with the actors' performances.I gave this a bad rating because the writing was just bad. The CONCEPT of the movie was excellent. When I first saw the trailer, my imagination went wild. The scope of where you could go and what you could do with a concept like inception in people's dreams is almost endless.But, where did they run with it? Guns? Explosions? Grand Theft Auto? Matrix wannabe? These are the words that came to mind when I watched this.And the plot, if that's what you call it, is nothing. It's convoluted minus the imagination, mystery, and intelligence. It's like they made it complicated so it could SEEM intelligent. But trust me, it's not! About 1/2 to 2/3 into the movie, the ending became VERY predictable. Even so, I thought, ""It's about the journey not the ending. Right?"" Except the journey sucked. How come everybody in this movie only dreams about automatic weapons? I know, I know. There are a bunch of explanations in the movie, but the explanations are terrible and not thorough enough to be believable. For example, the characters explain the assault weapons in the dreams by saying the subconscious had been militarized.What kind of stupid explanation is that? Am I supposed to take that seriously? It seems like the movie is just asking for an excuse to become a pseudo-Matrix action flick. Except the Matrix was much better than this.Well... What a waste of a good concept... but mindless action flicks can be fun, even when they continuously, pretentiously claim to be thought-provoking..... But then there's the looooong drawn out mushy ending that breaks up the action and isn't befitting an action flick at all.So, congratulations Hollywood. You managed to take a good concept of a movie with a great cast, remove all imagination and intelligence, while simultaneously turning it into a mediocre action flick with a terrible ending.Hollywood fails again... 4/10 stars"
goneishe,"Oct 15, 2013",N/A,"There are movies that I love initially. Then, over a period of time, it dawns on me that I have been manipulated royally. And then the 'love' I had for the movie turns into dislike, then hate, and, depending upon the intensity with which I had initially loved the movie, it turns into utter disgust.Titanic tops my list of such movies. Inception comes a close second. Christ, what was all that about? Dreams within dreams within dreams, come on! Tops spinning/not spinning? People getting into each others' dreams? Visually breathtaking it may have been, but a great story it certainly wasn't. I think the true test of a classic movie is in its repeat viewing. I realized Inception was nothing when I sat down to watch it again. I couldn't go past the first 10 minutes. It was that boring. Somehow, my brain refused to suspend disbelief and seemed to yell, 'switch the damn DVD off!""And I did.(BTW, Chris Nolan tops my list of the 'most overrated directors'. I still can't forgive him for those utterly dull climatic fight scenes in The Dark Night Rises.)"
kishan-25422,"Jan 5, 2021",10/10,Definitely one of the best movies ever made. Hats off to the God of cinema - Christopher Nolan.
dave-hayden4,"Jul 18, 2010",10/10,"It is very rarely that I would feel strongly enough to write a movie review but after I saw inception I felt so captivated by the movie that I decided to write one.In this film Nolan has delivered a truly spectacular film which deals with the concept of dreams and the possibility that our dreams could somehow be invaded and secrets could be extracted from them. The film is centered on the possibility of instead of something being extracted from a dream could an idea be planted in our dream to change our perception on an aspect of our life.It is through this brief story outline that Nolan delivers a multi layered masterpiece which sees a group of extractors led by Leonardo Di Caprio try to plant an idea into a dream which leads to some of the most surreal environments seen in a film since the Matrix. Even Nolan's excellent use of architecture serves to immerse viewers further into this dreamworld.Nolan's casting once again is flawless in this film just like it was in the Batman films and Memento. Leonardo Di Caprio delivers a very strong and emotional performance as a man who is struggling with his past and there are also stellar performances from Joseph Gordan Levitt, Ellen Page and Tom Hardy.I will admit that this film is for the thinkers among us as it requires a lot of concentration throughout the film to keep up with the films layered storyline and I am sure there will be more than a few people who will not get it. However those of us that like films that push our imagination to the next level will definitely not be disappointed.This is Nolan's masterpiece and I hope that it gets the iconic recognition it deserves."
krzysiektom,"Jul 25, 2010",9/10,"An amazing thing happened to me with this film. Never before have my views on a film shifted so dramatically as with Inception. In fact it is my second review of it, I edited the first which was very unflattering. What happened? Well, by chance I read an eye-opening analysis at chud.com, and then I went to see it again, this time in IMAX and with better sound. Chud's piece on this is quite brilliant and profound. I also shows that sometimes it is not enough to see a film, especially such an ambitious one, it is important to read about it, for example what the director says about it. Chud explains that in an interview Nolan reveals this is kind of autobiographical film for him, in a metaphysical sense. It is about... making films, about creative process! Yes yes, not about Matrix so much. DiCaprio confirms it, he says it is much more like ""8 and a 1/2"" was for Fellini than it is another Matrix. Cobb's team is like a film crew: a director (Cobb), producer (Saito), screenwriter (Ariadne), actor/ actors (Eammes, Fisher). And then there's Mal: a director's or artist's fetish or obsession, something that an original artist usually tends to bring into his work, for better or worse. That is why some good directors should not write scripts, like Cobb, you see? Chud then explains that seen this way, the ENTIRE film is a dream, Cobb's dream. We cannot be even sure that his wife is dead in his ""real life"", maybe she has just left him? The purpose of such a film for Nolan: analysis of why films work for us or not, why we identify with characters and feel for them or hate them, even if we know that what we r watching is unreal (a dream?). Chud brilliantly writes that some people can shed a tear or two during sad moments of the animated ""Up"" (or Toy Story), which does not diminish their emotions and does not make them untrue, even though they r reacting to pure fantasy. I for one was deeply moved when the young Fisher discovers what's in the safe and has a catharsis. I was moved with him, and I think Nolan tried to show us that such is the worth of good art and performance. Plus he included in this film elements from melodrama, heist movies, Bond movies etc., all in one. He could not include much of a comedy because it is supposed to be a dream of a sad character, someone who has apparently lost his wife. And when we know the entire film is a dream, many of its apparent inconsistencies or unlikely events do not trouble anymore, because it is Cobb's subconscious we are watching. And if Nolan says Cobb is like him we can guess Cobb is a film director in ""real life"", dreaming like a film making and about his wife that left him. Details start to make sense: bad goons cannot hit good characters - like in a dream or a bad action film, Cobb attaches the rope onto a chair in which Mal is seating though he has said he could not trust her, Mal is seating on a ledge opposite their hotel room and that room is like a copy of their room, the children look exactly the same and are dressed the same during the ending as before, the narrow alley moment in Mombasa, the explicit names like Ariadne (Greek mythology, the maze) or Mal (evil in French and Spanish), Ariadne asking Cobb what's in the snow castle FOR HIM when it was allegedly Fisher's dream... So I upgraded this film from weak 4 to a very strong 9 after that, for originality, ambition and high production values. Thanks to Chud, the film critic. I do not give it a perfect 10 because I still think the first hour is a bit flat and they talk too much in it."
kickall,"Jul 20, 2010",9/10,"With all the big budgets and technology Hollywood can get, what did we the audience get? Many sequels (And I dislike Dark Knight, being just a little better sequel).Since the Matrix was released more than 10 years ago, what did we the Sci-Fi film fans get compared with a decade or two before that? Chris Nolan delivered on these two accounts, and fewer and fewer directors in Hollywood can really master in commanding a complicated project and a good story telling, at the same time. I want more films like ""Inception"" coming to theaters here, which spent a lot of money making one as well as taking us to experience something other media, such as TV, games, can't offer. That is what we trade for paying the ticket to get in a theater.There is also a philosophical angle for the audience, I think. When we moviegoers are used to be overpowered by technology hard to distinguish among themselves, like computer graphics, animation, special effects, ..., unavoidably we find ourselves attracted to those with a ""FORM"" standing out among all, on top of such as acting of any particular roles, words of power of any particular scenes. ""FORM"" of this film will be something many to follow. If the derivatives of ""FORM"" to this film lead to a new spectrum for film makings, then that will be something interesting for us movie lovers to know first.The only thing I don't get it though - why did Saito and Fischer not recognize each other when they both waked up in the airplane? Aren't they supposed to know each other, being major competitors in the business they are respectively in?"
MasterGuns2077,"Jul 16, 2010",10/10,"I really don't want to talk at all about the plot or the characters too much, as it's impossible not to give something away. It's really best if you go into this movie knowing what the trailers tell, and that's it. The performances are absolutely superb. The acting is simply wonderful, Page and DiCaprio steal the show. You must go into this movie on a full stomach with your thinking cap on though. I do not advise eating or drinking during the film as one bathroom break will wreck the whole experience for you. The film making here is absolutely top-notch. The special effects are tastefully rendered and do not take away from the film at all. 10/10 from this movie-goer. I've yet to find a significant flaw that could motivate me enough to drop it to 9."
vampyrecowboy,"Jan 5, 2011",7/10,"This is just an average big budget Hollywood movie.Don't expect any complexity or depth from it, it is simple and quite shallow.Technically it's well done, the plot is OK, the actors are fine, the FX are good and hopefully you will have a good time watching the characters running and jumping around, ducking bullets and explosions and so on while a VERY SIMPLE AND QUITE SHALLOW psychological-scifi plot unfolds.But you won't get much else from it.I'm giving it a 7. So folks, don't believe the hype about this thing being a fascinating and revolutionary piece of art, because IT'S NOT. It's just another Hollywood commodity out to make big bucks. If you want some enlightening psychology read ""?"" and don't watch this, for ***ck's sake.There are some really cool effects to this film, but the story is so convoluted that it detracts away from the story."
H-x-mon,"Dec 6, 2010",N/A,"Some reviewers have given this movie a single star where's other have rewarded it 10. There's very few in-between. I think 4 stars is apt. It's really not that bad but certainly not a ""movie of the decade"". Such a disparity is probably due to the overrated expectations the Hollywood movie industry and IMDb hype has created. I've heard it being compared to the Kubrick's ""Space Odyssey 2001"". Not surprising some film-lovers overreacted. As much as I liked ""Memento"", I must say Mr. Nolan ain't no Stanley Kubrick. As for the people who rated the movie as the best thing that has happened to the American cinema since ""The Sixth sense"", I can only enviably wish their bliss.The biggest disappointment was probably the plot. Somewhere 45 minutes in the movie I figured the second twist was for the main character to discover it was actually him locked in the ""limbo of his own dreams"" (a.k.a. Hades in the world of Plato a few thousand years before the idea of our lives being mere reflections of grand ""pure forms"" landed on Mr. Nolan's forehead) and the rest of the gang was trying to drag him out to the light under a masterful orchestration of his beloved wife. Unfortunately this second twist never happened. The director rather awkwardly tried to pull a Lynch-style finale of letting the viewers to decide whether this entire movie was real or not. This is a hard trick to pull, since all fictional films are not real and we (the audience) are quite well aware of it. Although Mr. Lynch sometimes gets to pull it but he's, well, an actual artist. Anyways, it was about as entertaining for the next 115 minutes as watching a barrel of brandy mature.I can't resist just one more barb to the lavish display of plot holes - many reviewers have mentioned the utter failure of the storyline to construct anything resembling a solid structure but I really hope to point out a previously overlooked nonsense (my apologies for anyone who has already done so). How is it that one of the most feared ""brain hackers"" who can mastermind a ""cerebral heist"" of all times, can't arrange for his kids to move some place safe where he can quietly meet up (or even live) with them? Or forge the documents needed to enter the country? I mean there are literally thousands of people illegally crossing the borders into the land of the free every single day and some of them can barely read English! And somehow this is a major roadblock for the man who has the power to peek into other people's brains and even plant his ideas in there. For Pete's sake! What a nonsense.P.S.""Once Zhuangzi dreamt he was a butterfly, a butterfly flitting and fluttering around, happy with himself and doing as he pleased. He didn't know he was Zhuangzi. Suddenly he woke up and there he was, solid and unmistakable Zhuangzi. But he didn't know if he was Zhuangzi who had dreamt he was a butterfly, or a butterfly dreaming he was Zhuangzi. Between Zhuangzi and a butterfly there must be some distinction! This is called the Transformation of Things""4th century BCE"
farzamniloo,"Mar 1, 2021",10/10,Best movie and director ever i hope see more movie from this director
