user,date,rating,content
Leofwine_draca,"Mar 13, 2014",6/10,"An epic-length movie sure to test the patience of most viewers weaned on modern, short-attention-span fare, IKIRU is a very different change of pace for Akira Kurosawa in comparison to his period samurai action films. It's a slow, poignant and utterly heartfelt tale about a bureaucrat who discovers he has terminal cancer. The film takes that as a starting point and we the viewer proceed to watch as he undergoes a journey of discovery.The story takes inspiration from the likes of Goethe's FAUST in places, but elsewhere it's all it's own. It is admittedly very slow in places - an entire hour seems to consist entirely of men sitting in a room while they drink and argue - but at the same time it's oddly watchable. It helps that Kurosawa is a master of his form, and that he elicits a painfully human performance from his long-time regular star, Takashi Shimura.Come the end, I was most reminded of Frank Capra's IT'S A WONDERFUL LIFE, the classic starring James Stewart. However, IKIRU is the more realistic of the two films, stripping back the fantasy and the sentiment to reveal a starker truth entirely, but one equally as profound."
aislinndragon,"Dec 1, 2005",10/10,"I first saw Ikiru during Japanese-my teacher would often have us watch movies to try and pick up on some of what was being said. I instantly fell in love with the film: it's symbolism and the way in which the subject matter was held. It really captures that government dead-end, run-around that see far to often when trying to get something very important done, while also dealing with the let-downs and triumphs that we sometimes see in our own lives. This movie was so wonderful that I borrowed it from my teacher to show all my friends, and even my parents (my dad needed to see in particular as he was a state worker vaguely resembling Wantanabe). I found this to be a very touching, very inspirational, yet also sad and cynical movie. I think that anyone who watches it would understand what I mean. I would definitely suggest everyone see it!"
ma-cortes,"Apr 29, 2020",7/10,"One of the Great Films of Our Time and heartbreaking drama dealing with a humble civil servant (Takashi Shimura , who is superb in the central character as an intrinsic noble public official) who suffers cancer , following a drunken bout of panic , aimless wandering and odd encounters on learning that he is dying ; eventually discovers a meaning to his empty life patiently pushing through a project to become a city dump into a kiddies' playground , though at the end the sense of desolation remains complete .What can a heart filled with despair grab on to? This isn't it. It isn't here either. I want to do something. There is something I must do. Frivolous human beings who only contemplate the meaning of life when suddenly faced with death.Akira Kurosawa's Masterpiece easy to patronise as a classic movie about a clek who finds out he is dying of cancer and he then decides to build a children's playground and give something of himself back to the world . An intensely stirring picture all the same elegiac and sometimes quirkishly fun in the manner of kurosawa style , and following in the wake of his admired John Ford . A classic film about humanism , a celebration of human nature holding an intrinsic nobility , well paced in real sense and great sensibility . Concerning truths of a lifetime bring out the beauty in a person, and move the heart like a tender poem. A sensitive and moving film , including the crucial and wonderful shot of the sick man sitting huddled alone in the park on a kid's swing , while the snow falls and he croons happily to himself as he waits for death .The motion picture was compellingly directed by maestro Akira kurosawa possibly his most Eastern movie .A great achievement in Kurosawa trumphant avoidance of happy end uplight . The usually restrained Kurosawa was one of the films directed of the film history .After working in a wide range of genres, Kurosawa made this awesome film . The previous years saw the low-key , touching Living (1952) , the epic The seven samurais (1954), the barbaric , fascinating Shakespeare adaptation Throne of blood (1957) , a Macbeth's version , a masterful rendition that transports the story to Medieval Japan , and a fun pair of samurai movies Yojimbo (1961) and Sanjuro (1962) , and Rashomon , often credited as the reason the Academy created the ""Best Foreign Film"" category. When this film was released internationally to rave reviews, many speculated that Akira Kurosawa was influenced by Citizen Kane (1941) in the element of flashbacks that ultimately provide conflicting accounts of events. However, Kurosawa didn't even see Orson Welles's film until several years after . Rashomon won the top prize at the Venice Film Festival, and first revealed the richness of Japanese cinema to the West. The successful ¨Yojimbo¨ influenced in the known film Leone¨For a fistful of dollars¨is mainly cribbed from this Japanese samurái action classic Yet , there was a quieter side to Kurosawa's nature , expressed most succinctly on Living , The Lower Depths and especially the medical drama Red Beard . After a lean period in the late 1960s and early 1970s, though, Kurosawa attempted suicide . Other important movies were : The idiot based on Feodor Dostowieski , Drunken Angel , Scandal , A quiet duel , Tiger's tale , High and low . He survived, and made a small, personal, low-budget picture with Dodes'ka-den (1970), a larger-scale Russian co-production Dersu Uzala (1975) an epic tale of adventure in turn-of-the-century Siberia and , with the help of admirers Francis Ford Coppola and George Lucas, the samurai tale Kagemusha (1980), which Kurosawa described as a dry run for Ran (1985), an epic adaptation of Shakespeare's ""King Lear"" . He continued to work into his eighties with the more personal Akira Kurosawa's Dreams (1990), and Madadayo (1993) and Rhapsody in August , among others ."
ebossert,"Jul 6, 2007",4/10,"This review continues my recent assault on particular cinematic themes that annoy me incessantly, and therefore require a therapeutic purging via an extensive (and scathing) IMDb review. The topic in question here is Akira Kurosawa – hereafter referred to as the ""lesser"" Kurosawa, primarily because when one hears the name Kurosawa one should immediately think of Kiyoshi Kurosawa, who is superior in almost every respect to this ""lesser"" Kurosawa, a director artificially propped up on an undeserving pedestal by a group of disillusioned followers. Sure, he had one solid film in Seven Samurai (1954), but every time I see his other movies I wonder how the hell anyone could think that this guy was a great director. It befuddles me, even though I am a huge fan of other directors from the same time period.My primary problem with the ""lesser"" Kurosawa is his indisputable ability of getting the absolute worst out of his actors and actresses. In Ran (1985) Tatsuya Nakadai (who played Lord Hidetora) contributes a series of embarrassingly overacted moments during any and all scenes where strong emotion is required. In Hidden Fortress (1958) Misa Uehara (Princess Yuki) gives one of the worst performances of the 1950s. Even Toshiro Mifune had a truly inept performance in Rashomon (1950). In Dreams (1991) almost everyone stinks the place out. Ikiru (1952) continues the track record for this ""lesser"" Kurosawa, because Takashi Shimura (who plays Kanji Watanabe) is quite simply horrible in this film. He basically has three modes of facial expression:1. Wimpering Crybaby Mode. 2. Sad Puppy Dog Mode. 3. Hallucinogenic Mode.I'll leave it to the viewer to identify the specific instances where each of these modes are employed by Shimura, but I simply cannot help but comment on #2 above. During Sad Puppy Dog phases, Shimura's face lengthens and his eyes bug-out to make even fruit-flies jealous. Basically, he looks like a 3-year-old after being scolded, not a person of sufficient maturity enduring pain or suffering. He doesn't react to situations like any grown man would. In fact, the Watanabe character is so devoid of basic humanity that he comes off as a stand-in for Invasion of the Body Snatchers. I'm not kidding when I say that Shimura's facial expressions make Ikiru both unintentionally hilarious and infuriating. I literally wanted to strike him with a blunt object or stick needles in his eyes just so he'd stop staring pathetically at me through my television screen.This whole situation ruins the entire film. The crux is that even a mediocre director should have prevented this by instructing Shimura appropriately. This ""lesser"" Kurosawa was apparently incapable of understanding the concept of ""overacting"", so he let Shimura ham it up for 140 minutes. You can almost hear this ""lesser"" Kurosawa behind the camera:""You're a puppy dog, Takashi. You're a puppy dog. Show me those puppy dog eyes!""It's no wonder why George Lucas found ""inspiration"" from the ""lesser"" Kurosawa's works, since Lucas practically perfected the ""art"" of getting the absolute worst out of his actors, regardless of how good they perform when not under the ""influence"" of good ole George.Like many of the other works by this director, Ikiru is about an hour too long. Watching Watanabe go clubbing for 60 minutes was totally unnecessary. The very thin premise was stretched out for so long that I was reminded of Peter Jackson, who needed 600 minutes to tell one of the most basic, formulaic stories in the history of cinema. The ""lesser"" Kurosawa could have trimmed the first half, but in all honesty it would have only made this agonizing cinematic experience shorter, not better. Since the lead protagonist had the reason and intellect of a 3-year-old, there wasn't much in the way of potential development, and what little occurs comes from out of nowhere. The entire maturity of Watanabe is expressed in a segment spanning a few measly minutes, when he goes to work with zeal and runs out the front door to help the people. Kurosawa – in his infinite stupidity – then chooses to cut the sequence off completely, only to then shoot ahead half a year in time to show a bunch of politicians reminiscing about Watanabe's tasks for 45 minutes. There is simply no way that the viewer can relate to the revelatory happiness of the main character through the third-person conversations of characters that had a combined screen time of only a few minutes previously. It's a total miscalculation on the part of the director who takes the cheap way out with an abhorrently overrated ""swing"" scene in the snow. Yes, the scene is pretty, but it simply cannot substitute for a lack of character development that essentially occupies 5 total minutes out of a 140-minute film. And no, I refuse to count 30 minutes of puppy dog glances as character development.The mediocrity of this much-loved ""lesser"" Kurosawa is even more evident in the fact that other, greatly superior dramatic directors like Yasujiro Ozu were making fantastic films like Early Summer (1951) and Tokyo Story (1953) – films that make Ikiru (1952) look like amateur hour at best, because they have everything lacking in this film – great acting, storyline, and character development with believable, realistic performances. It's a travesty that exceptional directors like Ozu must live in the shadows of a lesser director who is, quite frankly, incompetent.It's almost humorous that the ""lesser"" Kurosawa came out with Ikiru in the time period in-between Ozu's films mentioned above. We can safely call this a crap sandwich."
PIST-OFF,"Sep 6, 2007",10/10,this movie made me go a big rubbery one. this was way more emotionally resonant than Kane. when happy birthday swells....how do i explain this to friends? how do i recommend this to the derelicts and scumbags i proudly call my friends? i'm not even sure what to say to recommend it. it's something intangible but raw. i can't really refer to anything in particular except the movie was just strong. well worth the $10 criterion disc. this may be one of my new favorites. maybe it's all the cold medicines talking. or maybe that this is kind of like Kane in reverse. the big emotional pay off right in the middle. or maybe it's because unlike Kane our protagonist Watanabe is actually a sympathetic character. is it even possible to watch this movie in groups of people?
kosmasp,"Aug 11, 2010",10/10,"Still let me begin with maybe one of the things that seem to work the least. The ending or should I say ""the endings"". I'm not going to spoil the ending of course, but if you thought Lord of the Rings (3) had too many endings, you could be excused feeling the same (or worse) with Ikiru here.But if you really think about it, even this minor flaw is necessary in the eyes of Kurusawa and therefor as he deemed it rounded up the story, agree with him or not, but it does take the movie to another level. If you are willing to go there and still have the strength to go there, you will be rewarded.But then again, the whole movie is a great experience. And while in other hands this could have become a very muddled affair, trying to push on the morals. A true masterpiece."
mike_peters,"Apr 29, 2004",10/10,"yes id just like to add to the database a little extra information for non-japanese speakersnamely about the nice song the film takes as its theme, as u will notice there is a break in the subtitles when ""our hero"" is singing it in the night club, i think some translation has been left out because it would not make sense exactly without explanaition ( or being japanese )the song is called gondora no uta , which is kinda like ""the gonola song"" and it was released around 1915 if my memory serves me.at that time in japan men and women were not allowed to ""date"" or be seen together alone in public, so basically the song is this guy singing to his sweetheart, come, take my hand and come on this boat etc etc, so that they wont be seen and they can be alone without being frowned upon.just thought ppl might like to know, as for my opinion of the film, bloody marvelous, one of the very very best :)"
gga,"Apr 5, 2000",10/10,"There's no doubt that Kurosawa was one of the best storytellers of the 20th century, appreciated by critics and audiences alike. Still, when mentioning his greatest achievements, most people place ""Rashomon"", ""Ran"" and ""The Seven Samurai"" as his most notable pieces.  Only a few will remember this little film that has so much more significance than those others. ""Ikiru"" is a movie that can bring you to tears with very little manipulation.  It's a movie you will not forget, a life lesson.  It's a movie that will forever change how you think about movies.  It is a social criticism.  It is a discourse on bureaucracy. Improving on Rashomon's non-linear way of storytelling, this is a film that forces you to pay attention.  There are no samurai fights here.  There are no melodramatic dialogues where characters scream at the top of their lungs. There are no forced tears in the character's cheeks. This is a movie of very subtle, inner conflict, with a very simple premise: What would you do if you had three months to live? Kurosawa's answer is so devastatingly powerful, smart and original that it will change you forever.  Or maybe, it won't, proving that the director's pessimistic view of humanity was correct."
bjcwrite-1,"Jul 24, 2005",10/10,"""Ikiru"" is Akira Kurosawa's greatest film. Ikiru in Japanese means ""to live.""And the film tells the story of a man who, upon learning he is terminally ill, doesn't just realize he has lead a meaningless life  but that he hasn't lived at all  a story of a man who begins to live only after he learns he is dying.The first part of the film shows us Watanabe's ""life"" before, and after, he learns he has stomach cancer, and has only three months to live. He realizes he has never really lived.The film informs us that Watanabe thrashing his way through empty efforts to live, to find some meaning to his life. At the end of the film's first half, he finally sees something that opens his eyes to how he must spend his remaining days.The film then takes us to its second half  which begins at a wake held in honor of the late Kanji Watanabe. The rest of the story, how Watanabe spent his remaining days, is told in the flashback recollections of Watanabe's former workmates.Ikiru opens with Watanabe, a widower, at work stamping papers in his dreary civil servant job at Tokyo City Hall. He hasn't missed a day of work in 30 years, and never takes vacations. He lives with his callous son, and his inheritance-obsessed daughter-in-law.The film begins with a group of women arriving at his department to complain about a cesspool in their neighborhood. They want it filled so the site won't be a health hazard; it should be filled in so the site can be a playground for their children. Watanabe dismissively tells them they must take their problem to the engineering department. Off they go, shuffled from department to department until they end up back at Watanabe's department, empty-handed.When Watanabe discovers he is terminally ill, he fails to show up for work. No one at the office sees him for days.He wanders the streets, until one night he is at a bar and begins to talk to a novelist about his fading life. The young man takes Watanabe on a tour of Tokyo's night spots. Maybe a little frivolity is the missing ingredient in Watanabe's life.At one of these places, Watanabe kills the festive atmosphere when the piano player asks for song requests. Watanabe mumbles that he wants to hear an old song, ""Life is Brief.""As the pianist plays the sedate, lovely, tune, Watanabe tearfully sings the song:Life is brief, Fall in love, maidens; Before the crimson bloom, Fades from your lips; Before the tides of passion, Cool within you; For those of you, Who knows no tomorrow.It is a beautiful scene, which will be revisited in a different, more memorable way near the end of the film.Night turns into morning, and Watanabe doesn't want to have another night on the town. He then encounters a young girl who used to work at his office, and they eat lunch.He begins to spend a lot of time with her, and is able to laugh with her hoping part of her liveliness will rub off on him. However, the girl tires of the dour old man, but agrees to meet him for one more dinner. Watanabe tells the girl he is dying and was hoping he could somehow discover from her how to live.During the dinner, she does something that gives Watanabe his breakthrough. He now knows what he must do. He goes back to his office, and digs out the proposal to fix the cesspool and build a park at the site. He immediately takes the proposal to another city department to shepherd the proposal to completion.Next, the movie takes us to the wake, where we learn the park was completed. The women who stormed city hall at the beginning of the film arrive to mourn for Watanabe. And they really mourn, while the opportunistic deputy mayor  who tried to kill the park proposal, then later took credit for it  silently watches. Tellingly, the women have nothing to say to the deputy mayor or the other city officials present.Kurosawa's camera focuses close-up on face after face, the embarrassed expression on the face of each city official reveals they know the truth they won't admit: It is Watanabe who deserves credit for building the park.Later, Watanabe's former co-workers debate his dogged dedication to building the park. The officials, by now drunk, recall his final successful struggle to create the park, but cynically misinterpret everything he did.The fact that they fail to grasp the simple kindness of Watanabe that redeems his otherwise wasted, unhappy life underscores something the funeral party does not comprehend: that Watanabe, not any of them, was the true victor and happy man.The last person to see Watanabe alive, a policeman on patrol, comes to the wake to honor Watanabe. Watanabe's body was found in the park the night before. But the policeman describes, what seemed to him, an eerie site.The film's last flashback shows us what he saw: Watanabe is at the park late at night, using the park's swing set while snow gently falls on him. While slowly swinging, he sings ""Life is Brief."" This scene is one of the most beautiful, memorable experiences in all of cinema. Try watching it without tears welling up in your eyes.Ikiru is a masterpiece -- It doesn't call attention to itself. It is only afterward that Ikiru's brilliance becomes plain  the perfection of style and the dignity and sorrow of Shimura's acting.By Brian Cole"
THE-BEACON-OF-MOVIES-RAFA,"Jul 1, 2021",8/10,"Life is temporary, but we all seem to forget it as we go through life. It sometimes hits you though. And usually the first thing to come to mind, especially in case of lives as Watanabe's, is our regrets. It is good that even one action can undo all those regrets. The film is painfully real. Also it is unbelievable to see that the political regime has not changed even after all those years. Therefore, with all its reflection on human nature and political criticism, the film manages to stay very modern to this day."
