user,date,rating,content
spenrh,"Jan 9, 2019",7/10,"I've read that Lee Ermy's sergeant in this movie is not an exaggeration from how many sergeants have acted towards their recruits during basic training, the only difference is now sergeants are no longer allowed to put their hands on the trainees. However, all the verbal action and style in how they push them through training is spot on.Ermy, as Sergeant Gunnery, has the hapless Private Pyle as his favorite target due to his overweight, lazy, slacker yet smug attitude he had, well he started out smug before Gunnery broke his spirit. And he made sure to keep any of Pyle's laziness, his wiseacre tendencies, and his spirit away for good if he could help it. Much of the first half of the film is centered around the basic training and Ermy's constant belittling and bullying Pyle.In the real life military basic training, most trainees like Pyle would've been discharged or dropped out before Pyle went anywhere. Ermy seemed to have had a special need for keeping him there as his punching bag. However, it could also be argued that maybe also he felt underneath that through enough pushing, he could eventually have made a real soldier out of Pyle. He was wrong about that, with the top climatic showdown of the movie (which was not near the end like in most movies) between Gunnery and Pyle, along with his famous ""what's yer major malfunction!!!?"", and the surprise (well, the surprise for someone not like me who seen this movie many times).Other great moments during training including Pyle's reprocussions for sneaking in a donut (and the other recruits with the socks full of metal locks), the obstacle courses (particularly with Pyle's struggling through them), and the always tense introduction of the recruits with the Sergeant when standing down (along with the line copied from ""Officer and a gentleman"", ""Only steers and q****s come from Texas!! I don't see no horns!!"").All above being the first half of the movie which was much better than the second. The second part took place in Vietnam, minus the two biggest characters from the first half, and was basically just another cutout copy of films on troops in Vietnam. And, there have really been better movies about troops fighting in Vietnam such as ""Platoon"", ""Good morning Vietnam"", and even in ""Forrest Gump"".Arlis Howard was one of the main characters in the Vietnam section, who I remember from ""Plain clothes"" where he played an undercover cop posing as a highschool student to help solve a murder of one of the teachers. And there was that talked about prosritute scene in the Vietnam part which I didn't find that great. I honestly have on several occasions only watched this movie to see the basic training half, and have only seen the movie all the way through about half the times I've seen it."
SmileysWorld,"Apr 10, 2002",8/10,"First,let me state,that this is without question the nastiest movie,in terms of language,that I have ever seen.I am normally a person,who, though I rarely use bad language myself,am able to tolerate it when I hear it.With this film,however,I found myself blushing at the language used by Gunnery Sergeant Hartman (they could not have picked a better actor to portray this man than R. Lee Ermey,by the way).Not only is war hell,preparing for it can be just as bad,if you don't have a healthy state of mind to begin with.This is the case for Pvt. Pyle (Vincent D'Onofrio,who really packed on the pounds for this role).You can almost feel him cracking throughout the first portion of the film,leading to a violent showdown with his tormenting commanding officer.The second half of the film is a basic display of the horrors of war itself,and very well done.Excellent direction by Stanley Kubrick,who always seemed to have a knack for not repeating himself a director,in terms of the types of films he directed.This was his ""war"" film,and it's an absolute masterpiece.Must see film."
corceiro,"Apr 26, 2019",7/10,"""Full Metal Jacket"" will always be judged by the shadow of previous Kubrick's movies. And that's why I think it could be much better. I watched it ten or more times and I always ask myself why Stanley Kubrick chosen this script. You can't forget that his previous movie was ""The Shining"" back in 1980 and he was desperate for a good story (not a statement about Vietnam war) and this option came as a surprise for everyone in the industry. The movie is build around characters and there wasn't much space for the attention for that little tiny microscopic detail, so important to Kubrick's work, that's why I consider it an atypical movie in his directing career. That care for the visual detail would return with his final and baroque movie."
AnusPresley,"Dec 14, 2018",2/10,"FFS - Full Metal Jacket. Re-watching it because it's on teevee (can't even be bothered to steal it)I told myself to never watch a Kubrick twice, except for Strangelove. What a tedious repetitive prick. Every shot is a replay of 2001/Clockwork Orange.Want reality? Sam Peckinpah. Crap free grit you can smell.The clown is not an auteur, he is a technician. ""Specialisation is for insects"" - Robert Heinlein. He's a cockroach. No wonder Nicole Kidman and Tom Cruise grovelled at his feet. They're imbeciles.Footnote: after the movie resumed after an ad break, I thought it was a mobile phone ad. Except it ran for more than 30 seconds. That's how good Kubrick actually is."
TheMovieDiorama,"Mar 9, 2018",8/10,"A smart move from the legend that was Stanley Kubrick. We've all seen many war films, a genre that is well explored from a variety of different conflicts. Full Metal Jacket however chooses to go behind the scenes and focus on the training process that changes well intentioned men into trained lethal killers. You could easily split this in half and have two separate films, the first half being more psychologically charged whereas the latter showcasing the brutality of warfare. A ridiculously serious drill sergeant practically bullying a trainee marine so harshly that it slowly turns him into an unstable psychopath. That right there, was some really good psychology and made the film so much more interesting. Sure the Vietnam War scenes were depicted with a substantial amount of fire, blood and guns but it was the first half that really captivated me. Vincent D'Onofrio was the stand out for me, both convincing and expressive through his face. Matthew Modine was good, probably his best performance. Lee Ermey deserves recognition just for somehow managing to not lose his voice from all the shouting. Characterisation was present, perhaps not fully fleshed out as I would like but was just enough for me to care about them. Yet again though, it's the technical marvel that wins...Stanley Kubrick. His directing style is so damn flawless. The nice clean long takes, actors looking directly into the camera, slow motion deaths (particularly in the sniper shootout)...he is just phenomenal. Script was sharp as well. A great section of dialogue where our lead character wears a peace badge and a helmet that says ""born to kill"" for which he describes represents the duality of man. That really stuck with me. So whilst it might feel like two separate films (due to that ridiculously quick transition), it's hard not to appreciate everything that's shown to us. Another hit from Mr. Kubrick."
Cinemaniac1984,"Jan 1, 2023",10/10,"Based on the novel ""The Short Timers"" by Gustav Hasford, Full Metal Jacket is one of the best war movies about the Vietnam War along with memorable performances from Matthew Modine, Vincent D'Onofrio, R. Lee Ermey, Adam Baldwin, Arliss Howard, and Dorian Harewood. Having returned after being away since The Shining (1980), Director Stanley Kubrick showcases his brilliance once again bringing Full Metal Jacket to life on the big screen which was met with critical acclaim and also a hit at the box office. It was also nominated for an Academy Award for Best Adapted Screenplay.Full Metal Jacket is divided into two parts. The first half of the movie takes place on Parris Island where recruit training takes place. Gunnery Sergeant Hartmann (the late R. Lee Ermey) is the senior drill instructor who ruthlessly puts the new recruits through a brutal boot camp transforming them into Marines with the intention of producing Marines ready to go into battle. Private Joker (Matthew Modine) is the main character in the movie and we meet him alongside other new recruits such as Gomer Pyle (Vincent D'Onofrio) and Cowboy (Arliss Howard). Gunnery Sergeant Hartmann is verbally and physically abusive to the recruits though he sees himself as hard but fair. The second half of the movie takes place in the city of Hue in Vietnam. Joker has since been promoted to Sergeant and is now a war correspondent unlike other recruits who have gone on to join the infantry. While in Vietnam, Joker befriends fellow war correspondent Raftermann (Kevyn Major Howard) who are both assigned to cover the war. Joker also meets fellow marines including Animal Mother (Adam Baldwin), Eightball (Dorian Harewood), Lieutenant Touchdown (Ed O'Ross), and the sadistic doorgunner (Tim Colceri). Joker also witnesses the horrors of the war first hand but his sarcastic and dry humour have never gone away. As well as meeting many marines with colourful personalities, he finds himself caught up in the middle of combat as well as the Tet Offensive and the climax where a sniper targets the Platoon.Matthew Modine shines alongside Vincent D'Onofrio, Adam Baldwin, Arliss Howard, Dorian Harewood and Kevyn Major Howard. The standout in the movie is the late R. Lee Ermey as Gunnery Sergeant Hartmann. He is foul mouthed and full of colourful and derogatory insults and is seen striking the recruits. Though he sees himself as hard but fair, he is seen as a vicious bully who he has the single minded task of moulding the recruits into US Marines ready to kill the enemy.The late Stanley Kubrick did a brilliant job as writer and director. Though the movie was meant to take place in Parris Island, South Carolina and Vietnam, the entire movie was filmed in England.Full Metal Jacket was one of many movies released in the 1980's depicting the Vietnam War. It's captivating, disturbing, dark, and brilliant. Full Metal Jacket is still regarded as one of the best war movies of all time.A well deserved 10/10."
allmoviesfan,"Mar 23, 2023",9/10,"Whilst Full Metal Jacket is two hours of stunningly graphic, no-punches-pulled Vietnam War drama, whenever I think of the Stanley Kubrick masterpiece, all I can think of is the first forty-five minutes: the infamous Parris Island basic training sequence with (real life soldier) R. Lee Ermey as Gunnery Sergeant Hartman and Vincent D'Onfario as Private ""Gomer Pyle"". It is brutal. Disturbing and wholly unforgettable.The second stanza of the film, combat in Hue City around the time of the NVA's Tet Offensive, is good, and in a different film might be lauded even more than it already is, but is kind of a let-down after the events that have preceded it. Ermey's performance was all the more chilling because you get the feeling he probably wasn't doing all that much acting. The scene where Hartman is lauding Oswald and Charles Whitman as determined Marines with rifles was pretty disturbing. But oh so well done.A gritty, honest Vietnam portrayal. ""The Green Berets"" this certainly is not."
aciessi,"Nov 8, 2017",9/10,"Believe it or not, this was considered a flop and a disappointment for Stanley Kubrick back in 1987. Many of his fans were expecting a war epic along the lines of Apocalypse Now. But the thing is, Kubrick already made his war epic, in Paths of Glory. Secondly, it's clear by watching the film that Kubrick's intention was not to talk about the politics of the war, or even stage big budgeted action sequences. His goal was to encapsulate the overall feeling many had about the Vietnam War on and off the battlefield. A pointless exercise of human slaughter. Vietnam, for many, was the definition of man's inhumanity to man. That is what Full Metal Jacket is truly about. The unforgettable first 45 minutes of the picture has us see the ways in which these soldiers are desensitized. The loud-mouthed, profane Sgt. Hartman humiliates the new recruits to their core and as a result, mentally destroys the most vulnerable of the recruits in Leonard ""Private Pyle"" Lawrence. Once we enter Vietnam, Kubrick shows us the casualties of war, and man's inability to show humility towards each other. In the end, Vietnam is a killing field and some of those fighting it ultimately enjoyed the killing. Full Metal Jacket doesn't resolve like a novel, nor do any of the characters receive any kind of redemption. You can say that it's in the tradition of all of Kubrick's films."
namashi_1,"Jan 12, 2010",10/10,"Based on the novel The Short-Timers by Gustav Hasford, comes 'Full Metal Jacket', which undoubtedly is one of the finest films ever made in the history of cinema! Incredible!!! Stanley Kubrick takes us back to a squad of U.S. Marines through their United States Marine Corps Recruit Training and depicts some of the experiences of two of them in the Tet Offensive (1968) during the Vietnam War. 'Full Metal Jacket' is a so-so-so good, that I was left awe-struck. The first 40-minutes shows as how 'Maggots' turn into 'Heroes'. The rest of the 80-minutes is on the war-back-drop. The climax is epic, beautifully thought & executed.If given a chance My Review for 'Full Metal Jacket' would never end. An outstanding film, where any praise seems UN-Fulfilled.Miss anything, I mean anything, but watch 'Full Metal Jacket' right now. 1,000 Thumbs Up!"
kat-315,"May 27, 2006",N/A,"i was not overwhelmed by gunfire. i had time to know a little about the people. that made this most clever a film to me. it was focused on a small group and fewer battles, true of many films i suppose but i had much more feeling for what was going on via the visuals (thanks mr. kubrick) and the characters. especially like adam baldwin as animal mother, crazy killer with courage and comradeship. this to me is one of the most revealing and thought provoking pieces created about war apart from 'all quiet on the western front' (the novel)and for me that's really saying something. the journalistic approach works and although my friend said in the other post he felt the movie to be split in 2 i did not. the mickey mouse theme is most telling"
sue-webb-319-519,"Aug 5, 2017",7/10,"First of all I love Kubrick's work, so I came into this with a bias. However I have seen a lot of action and war films, and this one, to an individual who never went to war, seems the most true-to-life, taken as a whole. This IS how you have to look at this film, incidentally; trying to break it down into two or three parts and say which was better is missing the point of the film, I think.In the same way that ""Trainspotting"" was an anti-drug film that did not gloss over anything, ""Full Metal Jacket"" is (for me) an anti-war film that stares straight at the ugliness of war and the potential for violence within almost all people, especially those trained, conditioned, even twisted, into military roles, without preaching even a single time. Less allegory and more applicability! Wonderful!The camera work was superb. I felt like I was walking through the movie with the Marines, from the barracks to the battlefield scenes.I have seen others criticize this film for the voice over, but I felt that it was used sparingly, and was helpful, not overdone. The narrator doesn't say anything that seems out-of-place.Others have commented on the music, the acting, and so on, so I won't add my repetitive comments, except that the drill sergeant is perfect!The combination of the demented treatment the recruits receive in boot camp with the combined ""hours of boredom, seconds of terror"" feel of the Vietnam scenes is intense and not for everyone, but feels REAL.10 out of 10, perfect."
ethlaid,"Apr 13, 2021",9/10,Full Metal Jacket really highlights the effects and bizarreness of war incredibly well. As well as the duality of man and the different people in war. A Kubrick Masterpiece.
secondtake,"Jul 6, 2010",7/10,"Full Metal Jacket (1987)An extremely straight forward, funny, and tragic Vietnam War movie, going from the excessive rigors of boot camp to the hard core horrors of hand to hand combat.Stanley Kubrick shows the bare bones of it, without romanticizing, and without making heroes out of anyone. There are two main emotional turning points, one at the end of boot camp, and one near the end of the movie, and both are about the madness of war and about death. And both are pulled out of the mainstream thread of the story with a jolt. It's sensationalism, really, but made with Kubrick rigor.A balance to all the horror is the humor, not as insane as, say Dr. Strangelove, but with a similar dry wit. The first forty minutes of the film are justly famous for their almost campy but still believable scenes of the sergeant training young Marines. (And this sarge is a real Vietnam vet who did this kind of training.)Compare this movie to Platoon and you'll see a much more restrained movie, and without the jungle warfare we usually associate with Vietnam. Platoon makes people out to be larger than life, and Kubrick intends more to say, hey, this is the real deal, whatever cinematic tricks are showing.But compare this to Apocalypse Now or Deer Hunter and you might start to wish Kubrick hadn't played it so straight. Full Metal Jacket lacks, above all, imagination, and as a movie, it needs it."
jlmmjm26,"Mar 18, 2020",10/10,"Like i said, best Vietnam movie ever made. It is right there with Platoon. I always liked Platoon better as a youngster but you cant go wrong. Ermey is genius as the hard ass D.I. Very true to the period. My Dad was a Vietnam Marine so i have it on good authority. Enjoy the movie"
kingofdanerds,"Feb 23, 2021",9/10,"Stanley Kubrick is certainly a great filmmaker. Most of his films are more of an artistic creation and that is very evident in films like 2001: A Space Odyssey and The Shining. In 1986, the film Platoon was released and won Best Picture. In 1987, Full Metal Jacket was released and while it recieved positive reviews, many people compared it to Platoon and it is not hard to see why. Full Metal Jacket was based off of the 1979 novel, The Short Timers. Again, the film recieved positive reviews. I think the most famous negative review was from Roger Ebert on his TV show with Gene Siskel. Essentially, Full Metal Jacket is the first Kubrick film of my knowledge to not be so divisive amongst viewers. The film was a commercial success making well over it's budget of $16 million.The film is split into two parts. The first part follows new recruits at boot camp under the command of a very (and I mean very) abusive drill instructor Hartman. The second part sees a platoon moving through Vietnamese cities during the Tet Offensive.I remember the first time I watched Full Metal Jacket and I remember that I absolutely loving the film. Years later, I don't love it as much. Let's start with the first half of the film, Boot Camp. Many many people agree that the Boot Camp part of the film is the best part of the film. And it is. Right away, we see these new recruits lose their individuality and are starting to be molded into killing machines. This was something that was not entirely touched upon during Platoon as it did not have a boot camp scene. Come to think of it, I cannot think of any Vietnam War movie with a boot camp scene. (At this point I have not seen Apocalypse Now or The Deer Hunter). The first half is very memorable thanks to great performances by R. Lee Ermy and Vincent D'Onofrio and they perhaps the best actors in this film. There is a lot of in depth stuff that one can read into with these characters and it is really interesting. As we switch over to the second half of the film, the film somewhat loses me. The message of individuality is somewhat lost in the second half. The lead of the whole film has more focus but is not as interesting and the performance is mediocre at best. Yes, I want to see fighting in a war film and this film delivers and plays it rather well here. There is some suspense amongst the gunfire. A difference with this film when comparing it with other films is that the fighting is in a city and not the jungles. The sets look great and do look really believeable. One thing that was really interesting was the use of music. Most of the music was really cheery and happy which serves as a great contrast to the war going on. The characters in the second half are not really interesting and really the only thing I know about them are their names. To me, they are a bunch of nobodies. Things that both parts of the film have in common is the cinematography. There are some truly beautiful shots in this film. To be honest, the only way I can truly identify this as a Kubrick film, is through the camera work.For me, Full Metal Jacket is still a nice film to watch but has some flaws that keep it from being the great masterpiece that I see everyone calling it. It's message is very apparent in the first half but is easily lost within the second (and weaker) half of the film. Memorable performances from Ermy and D'Onofrio and great cinematography and effects keep me from giving this a lower rating."
stanleyhiggins,"Jun 23, 2013",10/10,"As a young man of 17, I entered Boot Camp at MCRD San Diego in July 1967. The Boot Camp segment of Full Metal Jacket is the most accurate portrayal of Marine Boot Camp ever committed to film.The Boot Camp scenes are filled with dark humor, irony, and satire, but nonetheless, this is the way Boot Camp was.Drill Instructors could be both brutal and comical, but God help you if you ever laughed in formation, no matter how comical a Drill Instructor might be while doing his best to correct a recruit's attitude.Both Gustave Hasford, a former Marine and the author of the novel, ""The Short Timers"" from which the film was adapted, and Stanley Kubrick used some literary and cinematic license, which is to be expected, but were still true to the actual experience.The accuracy was enhanced by Lee Ermey's performance as GySgt Hartman, as he was Marine Drill Instructor during his ten years in the Marine Corps.Due to having been singled out for Vietnamese language training before going to Vietnam, I missed the 1968 Tet Offensive, which was depicted in the film.While the film also takes some license with the Vietnam scenes and relied as heavily on stereotypes as in the Boot Camp scenes, those stereotypes like all stereotypes, being grounded in reality, illustrated war as it really is and remained true to the actual events of the 1968 Tet Offensive.I arrived in Vietnam in August of 1968 and I guess a bit ironically, I was wounded during the 1969 Tet Offensive, which if you haven't heard of it, don't feel bad.The Leftist media got what they wanted by depicting the 1968 Tet Offensive as a victory by the Communists, when it was actually a huge and costly failure for the Communists, and hardly mentioned the '69 offensive, which was as massive as the '68 offensive and an even more devastating defeat for the Communists.""Full Metal Jacket"" is a monumental film in the classic Kubrick style and even if Kubrick meant the film to be anti-war and anti-military, it is in truth a tribute to those who served their country during a time of war when the majority of that generation sided with the enemy, refused to serve, rioted in the streets and campuses and denigrated, disparaged, and ridiculed those who answered the call of duty."
dougdoepke,"Jan 6, 2014",N/A,"Unfortunately, Metal Jacket shows the brilliant Kubrick in decline, and a long way from his anti-war masterpiece Paths of Glory (1958). All in all, and despite some telling episodes, this 2-hours adds up to a rather pointless exercise in wartime experience. Certainly, the first half is undeniable in its powerful expose of Marine Basic Training and the dehumanizing effect. At the same time, contrasting its honest depiction of combat training with the heavily sanitized depictions from such 1950's counterparts as Take the High Ground (1953) or Battle Cry (1955) shows how much truth-telling in the movie industry movie had improved in 30-years. Still and all, the movie halves do not match up well.I see the problem as lying with a script, and its inability to etch its characters strongly enough (excepting the ill-fated Ermey and Pyle) to bridge the gap and pull us into their battlefield predicament. At the same time, we only get a sporadic picture of the one continuing character, Private Joker (Modine). Perhaps, the best Vietnam part is listening to how the head of Stars and Stripes skews journalistic coverage in a propagandistic direction. So, it wasn't just folks at home being misled by their media, but troops in the field by theirs, as well. Anyway, the visuals are hellish in their fiery depiction of the battle for Hue. Then too, it comes as a real surprise that the sniper is a woman, the embodiment, I guess, of what the North meant by their motto ""People's War"". Looks to me, also, that Kubrick and co. had little idea of how to end the 2-hours. So we get a strident male chorus of a children's song, no less, as the platoon stumbles through a twilight world. Whatever else, that imagery does manage to symbolize the war in general.All in all, however, the movie suffers in comparison to such other Vietnam flicks as Platoon (1986) or Apocalypse Now (1979). Too bad Kubrick wasn't 20-years younger when he made this two films in one."
