user,date,rating,content
adtoner,"May 27, 2007",10/10,"This movie was a masterpiece. It just touched my soul when I watched it because it had such great symbolism which is hard to see at times but, when you see it, you feel as if your in a different world. Now your probably wondering why i was crying and laughing and crying again and it was because the movie was bad then good and then bad again, no no no...don't get me wrong this movie was absolutely a masterpiece through-and-through. The reason why i was crying and laughing and so on was because the movie made me feel so many different emotions at one time and it changed so quickly but, the way they changed it was flawless. I may be saying this in a really complicated way but i think that anyone at any age should be able to watch this. I know it says rated R on the front but all the partial nudity and innuendos are adult stuff and younger children would not understand...and no there is no sex. In conclusion, I've been writing in a mashed up manner and that is only because i can not explain how much of a moving, touching, and just flat out unbelievable movie this was...PLEASE WATCH IT..."
ardyjim,"Oct 18, 2003",N/A,"You know, the longer you live, all your past memories and experiences seem to boil down, summarize, distill and purify into some perfect, elegant essence -- We remember only the beautiful, moving and inspiring while the dross falls away and is forgotten. The original version of Cinema Paradiso is that magical condensation of Toto's life, only the life remembered late in life --- but perfect. The director's cut is tempted into inserting the mundane and tedious that in real life would not make the ""Rememberer's Cut."""
zlx_zjlq,"Mar 28, 2020",6/10,"From young to old, the film accompanied Dodo throughout his life in different forms. Efrido is right. If he is not aspked to left, he will never grow. Because no matter how far he haswalked, Dodo's soul will return to that small and short Paradise Cinema. Averydo and Elena have been embedded in his life."
carlp-imdb,"Feb 3, 2005",10/10,"Not many movies make me cry- but this non-formulaic story works. The last 5 minutes are not to be missed by any classic movie fan.Lessons to be learned about the different ways movies and movie theatres and their denizens have been enjoyed throughout the decades. And the practice of censorship in a small Italian town.A homecoming, a funeral, and a heartwarming gift, and a terrible disaster. A story about a young boy striving for work in the glamorous movie theatre.Don't miss it.The Italian version with subtitles is excellent, and the soundtrack is amazing."
aushro,"Dec 18, 2023",10/10,"Ah, ""Cinema Paradiso""! A true masterpiece of Italian cinema as well world cinema. Set in a small Sicilian village, the film is a nostalgic coming-of-age story that explores the power of cinema and the enduring bonds of friendship.The main character is Salvatore ""Toto"" Di Vita, played by Salvatore Cascio as a boy and Marco Leonardi as a young man. Toto is a young boy who develops a deep love for the movies after being taken under the wing of the local projectionist, Alfredo, portrayed by Philippe Noiret. Alfredo becomes a mentor and father figure to Toto, teaching him about life, love, and the magic of the silver screen.The film beautifully captures the themes of love, loss, and the passage of time. It showcases the transformative power of cinema and how it can shape and influence our lives. It explores the complex emotions of nostalgia and the bittersweet longing for the past.The review of ""Cinema Paradiso"" would be incomplete without mentioning its deeply emotional tone. The film has a certain melancholic beauty that resonates with viewers. It leaves a profound impact by depicting the innocence of childhood and the sacrifices we make for our dreams. The ending, in particular, is a poignant gut-punch that leaves many viewers in tears.One scene that always brings tears to my eyes is when Toto watches a reel of censored kisses that Alfredo had cut from the films over the years. As Toto sees the powerful emotions displayed on screen, he realizes the depth of Alfredo's love for him and the sacrifices he made for his happiness. It evokes a mix of sadness, gratitude, and a longing for lost moments.The most iconic quote from the film is Alfredo's wise words to Toto: ""Living here day by day, you think it's the center of the world. You believe nothing will ever change. Then you leave: a year, two years. When you come back, everything's changed. The thread's broken. What you came to find isn't there. What was yours is gone. You have to go away for a long time... many years... before you can come back and find your people. The land where you were born. But now, no. It's not possible. Right now, you're blinder than I am.""One of the important lessons viewers may miss is the idea that life is fleeting and we must cherish the moments we have. The film encourages us to appreciate the simple pleasures and relationships in our lives, as they may not last forever.""Cinema Paradiso"" touches on the philosophical concepts of nostalgia, the passage of time, and the role of art in our lives. It invites us to reflect on the impact of film and how it can shape our perceptions and memories.If you enjoyed ""Cinema Paradiso,"" you may also appreciate other Italian films such as ""La Dolce Vita"" and ""The Great Beauty."" Additionally, books like ""The Dreamers"" by Gilbert Adair and ""The Film Book"" by Ronald Bergan delve into the power of cinema and its effects on our lives.Overall, ""Cinema Paradiso"" is a deeply moving and visually stunning film that will leave a lasting impression on anyone who watches it. Its exploration of love, loss, and the magic of cinema is a testament to its enduring appeal."
thinker1691,"Jul 8, 2016",9/10,"It isn't often, we as the audience are able to accompany someone in a films which not only entertains us, but often allow us to share their lives through their entire progression. This is our reward as we view a very young boy named 'ToTo' (Salvatove Di Vitoe). As he becomes enamored with early films shown in his tiny Italian Village. The Projectist is an old man who tolerates his visits. Day after day the boy not only becomes a help to the old man, but soon develops a love for films, but learns to appreciates them throughout his life. His own life is filled with love with a young beauty and events which effect his town and it's people. As these events parade through his life and his family, he never loses his life for movies. Through each event his own life takes it's toll as we see him age, while he learns the value of love and friendship, plus the price each has on him. 'Alfredo,' The old man (Philipp Noriret) Gives the boy some advice which doesn't always pan out. Still the film garners many awards from around the world. Interesting enough it is rated R and after seeing the film twice I can't see why. There is nothing in the film which promotes all the objections such as overt nudity, sex or violence. And yet, the village priest see's to it that not even Kissing is allowed to be viewed by the audience. Never the less, it wins many awards and is worth keeping as a movie. The actors have given us a view of their lives and we can't see an reason why the family shouldn't see it as well. ***"
Quinoa1984,"Jun 7, 2008",8/10,"Cinema Paradiso works very well because Giuseppe Tornatore, for all his schmaltzy moments with his characters, loves cinema incredibly and especially the communal and personal act of going out to see a movie. It also works because for all the sentiment, he makes it a story essentially about a boy, Toto, without a father after the war who finds a surrogate-cum-mentor with Alfredo, the projectionist at the theater. Their bond makes for the emotional core of the film, as the grown-up Toto comes back to the town he left so long ago for Alfredo's funeral, and looks back on his childhood and adolescence in this small down of Giacardola.The clips of the films are one of the strong-points, and just the scenes inside of the Paradiso, where there's lots of warm human comedy coming out of the fun poked at the 'old-days' of repression (i.e. ringing the bell for a kissing scene), or just the reactions to the different genres and styles (everything from Visconti to Chaplin to Bardot is screened). And there's a whole host of characters Tornatore has that makes a lot of the first half of the picture pretty special.It's maybe in the second half that it got a little too 'adorable' for its own good, or just too much of a similar one-track kind of narrative with the teen Toto falling in love with a girl whom makes it his first real roller-coaster of a relationship. But, as mentioned, Tornatore keeps it simple, particularly with respect to Toto and Alfredo (the latter actor, Phillipe Noiret, is incredible in the part, even when blind for half the running time). It's also a given that maestro Ennio Morricone delivers up the goods and makes this really rousing, the sentiment not false for a lot of the time as one of his best scores.If I didn't find it overall a masterpiece for some of its sappy bits and occasional over-the-top performance that doesn't click (most of them do, it's Italy after all), it's an exceptional effort for what it tries to accomplish and what many films end up being simply sappy can't quite reach. The film earns its keep by making it very relatable, and reminds us why some of us love movies and movie-going very much. It's the 'shmoopy' of Italian cinema lovers everywhere, and its worth the view even in the truncated Harvey Weinstein cut that played at the Rialto theater near my town; a fond goodbye at a fondly remembered theater. 8.5/10"
Troy-24,"Feb 26, 1999",10/10,"If you love movies, this film is a ""must-see!"" It is pure poetry -- an homage to movies, friendship and life. One of my top three all-time favorite films."
imdbfriend,"Apr 14, 2008",10/10,"Cinema Paradiso is a cinema must for everyone who wants to fall in love with movies or re-ignite their lost passion. A movie about movies cannot get any better than this masterpiece in every sense of word. Simple characters build around a theater only source of entertainment for people in a small province of Italy during WW II period, and a love story of main character first with movies, then with a girl, is simply beautiful, especially the passion of the kid with movies, is simply astounding. Another relationship depicted in the movie that of Toto and Alfredo is beautifully developed and equally well played by actors (3 played Toto, kid, young and mature old). The Kid artist who played Toto is amazing and played the role with equal panache as does the Alfredo. Other various artists are good in their roles, well suited. Music is very good and blends with every scene very well. Direction is superb and the photography too is top-notch, dialog's too are very well written. Watching crowd in the theater watching cinema is a pleasure moment for me as a viewer, it takes me back to old days when I use to enjoy a movie so much in theater, now its usually on TV, DVD, theater magic is not like that anymore. 10/10, must watch, irrespective of foreign language. I myself don't know any Italian and yet enjoy these movies completely. I, a passionate fan of Cinema sees no boundary in languages."
Khalid B,"Mar 12, 1999",N/A,"The thing I liked most in this Italian production is its sincerity. A grown man (Toto) looks back on his childhood he spent in a peaceful little village in southern Italy. We can see young Toto growing up without his father. Alfredo (the local cinema operator) watches over Toto and provides him with advice in love and life. The phases in life we all go through allow us to relate easily to the young Italian struggling while growing up. The score by Ennio Morricone could not have been more breathtaking. The changes from happiness to grief and from joy to pain are accompanied with exactly the appropriate sounds. The movie succeeds in dealing with issues like: hope, yearning, disapointment, love and loss without being sentimental. For me without a doubt one of the best movies I've ever seen."
g-96059,"Apr 19, 2020",7/10,"This is a movie about relationships. No matter the mother for duo duo and sister's affection, for the war dead battlefield father's life only love; Or maybe it is the forgetful friendship that evert has for duo duo is more like family affection; Or more for ailena love at first sight after clinging to the love. These feelings are idealized, and tonadore should be a strong believer in human frailty."
gga,"Apr 12, 1999",10/10,"What can I say about this movie?  It is one of the greatest jewels and homages of the cinema, both American and Italian.  Highly emotional and packing a punch at the end that won't leave you for several days, it is full of laughs all along the way.  The more you enjoy and love movies, the more significant this movie will be for you.  It is simply amazing that it is Tornatore's first film.  If Italians were wondering what would happen after Fellini's death, I would tell them to nurture this young filmmaker."
SpelingError,"Jul 18, 2016",6/10,"My reaction to this film when I watched it a few years ago was that its first hour was great, but the second hour made a couple poor choices which reduced it to a good film. I had a feeling my opinion would grow this time around, but unfortunately, it remained the same and, if anything, this rewatch solidified my opinion of it even more.In spite of my issues with this film though, I don't consider it to be a bad film by any means, The aforementioned first hour, in fact, is about as entertaining and moving as any film has the right to be. Tornatore crafts such a humorous and vividly detailed film which is packed with a few different types of greatness. For example, some of the humor involving Alfredo and Toto resonated with me quite well, like the touches of humor thrown into some of their tense encounters in the first act or Toto helping Alfredo cheat on a test. These bits made their building friendship a blast to watch. I also enjoyed the emphasis given to multiple side characters who either attended the theater or were frequently seen outside it. There's a priest who orders Alfredo to cut all the inappropriate scenes from the films (kissing scenes, typically), a tramp who believes he owns the town square outside the theater, a man who spits on people from the upper balcony of the theater, a man who frequently gets pranked for falling asleep during the movies, and the general rowdiness of the crowd that attends the theater. It's clear that the theater is the centerpiece of the town and the main (well, the only) pastime for many of the town's citizens. Finally, I liked how the film saved most of its sentimentality for the ending. Complimented with Morricone's terrific score, it's almost impossible not to be moved during the final montage.While the film's first hour is strong, the second hour makes some odd narrative choices which fail to capitalize on that potential. Since Alfredo's and Toto's friendship is established for most of the first hour, I found it strange how the second half shifted so much focus away from Alfredo. Instead, we get a romance sub-plot between Toto and Elena. Though I've yet to watch the extended cuts of this film, I've read a decent bit about them and my understanding is that they provide a better thematic significance for that sub-plot, so I may enjoy this film more if I watch those versions. Who knows. With the international cut though, that sub-plot took time away from what I liked the most about the film. To top it off, I also found certain elements of that sub-plot creepy, like Toto waiting outside Elena's house for (I think) 100 days in an attempt to get her to like him. After the focus finally gets back to Alfredo, he only stays onscreen for about five more more minutes and, while I found their conversations during those five minutes powerful, they ultimately left me asking for more. Granted, the final act is kind of effective and the aforementioned ending is terrific, but the middle act was a huge misstep and left me very cold. And it's a real shame, because the film had a lot going for it with the first hour. The second hour failed to follow up on that potential though.In spite of my issues though, I'd still recommend the film. The strengths of the first hour and the ending were more than enough to save the day, so I did enjoy the film. Just like my first viewing though, I wasn't so crazy on the second hour. I'll likely check out the longer cuts in the future though to see if this film finally clicks with me."
grantss,"Apr 18, 2015",9/10,"Wonderful, emotional movie.The story of growing up, discovering what you love (with a bit of help along the way)...and not looking back. Simple yet powerful story, well told.Not perfect - a bit uneven at times. Some events are overdramatised and some scenes are less consequential than the attention given to them. Plus, the apparent moral of the story (Alfredo's philosophy) is possibly not such a great philosophy.However, you will easily forget the flaws once the movie is over. The final few scenes are incredibly moving. Filled with nostalgia and genuine sentimentality.One of the greatest movies of Italian cinema."
thepetshopboy,"Dec 18, 1998",10/10,"The most gratifying piece of film making I have ever seen, ""Paradiso"" is one of the few films that I can watch time and again.  Director Tornatore brings a passion to the film which seeps out of every frame and invites the viewer to revisit their youth, their hopes, their dreams and the crushing truth of reality.  You will not see a more beautiful, haunting film than this. Phillipe Noiret gives the performance of his life (one which he played a subtle riff on in "" Il Postino"") and Ennio Morricone's score ranks right up there as his best.  For true junkies like myself I would highly recommend getting a hold of the director's cut in which an additional 50 minutes of material is added.  While as a whole it is not as good a movie (Tornatore clearly needed a forceful editor) it does provide insight into what happeneed to Toto's beloved Elena and surprises viewers with a heart-wrenching plot twist which was cut from the original."
robs-2,"Nov 12, 1998",10/10,Charming lovely warm - avoiding all the Hollywood pitfalls but yet sentimental in its own way this is quite a unique wonderful movie. An absolute must for all serious movie lovers and with  the most huanting enchanting score by Ennio Morricone. Dare you to watch this and not shed a tear!!!
MOscarbradley,"Aug 12, 2007",10/10,"You should approach any movie with the term 'director's cut' with caution. It can mean that we are now seeing the film the way the director intended it to been seen before the studio hacks got their hands on it or it could simply mean a lot more of the same, the unchecked ego of its creator. When ""Cinema Paradiso"" was first shown here it ran a very serviceable two hours and told the story of a boy, Toto, in Sicily whose love of cinema is instilled in him through his relationship with the elderly projectionist in the local movie house. The movie was told in flashback as the boy returns, a grown man and now a famous director himself, to his home town for the funeral of his friend and mentor. A sub-plot involving the girl he loved and lost to someone else was completely jettisoned.Now the film has been re-issued with this sub-plot restored to its rightful place and rather than detracting from the film's main theme it adds to it and deepens it. Now we can see that the boy's life was not only influenced by Alfredo, the projectionist, by making him aware of the joys of cinema but more directly, in a much more personal fashion. In a way it's like seeing a different movie but a much more rounded and mature one.Both versions are, of course, superb but while the shorter version plays heavily on the sentimentality quotient the longer version is a darker and sadder affair and allows Jacques Perrin to fully develop the character of the grown Toto, (in the shorter version we can only guess at his motivations). In this version Perrin's performance is just one in a trio of brilliant performances. As the child Toto, Salvatore Cascio holds the cuteness factor at just the right level while the great Philippe Noiret is perfectly marvellous as Alfredo. The shorter version will, of course, appeal to anyone who loves cinema, even remotely, (and Alfredo's 'gift' to Toto is director Giuseppe Tornatore's gift to us), but the longer version is a masterpiece that engages us on a much more profound level. However, neither of them should be missed."
llcaldeira,"Aug 20, 2010",10/10,"As any cinema lover, Cinema Paradiso is on top of my list. This great Italian movie takes us on a trip through the life of Salvatore (aka Toto). Salvatore recalls his childhood when coming back to his hometown for the funeral of Alfredo, the theater projectionist. The relationship between Salvatore and Alfredo is the center of the story and we can't help to be warmth by it. Alfredo also passed to Salvatore all is knowledge about traditional cinema helping him to make the first steps in cinematography.Salvatore also remembers his first love, Elena, and tries to understand why they didn't stay together. When he finally understands it, he is devastated.The movie give us also a hint of the beginning of cinema for masses, church restrictions on cinema and changes in cinema through time. The last scene is one of the best ever made: emotional and beautiful. I always feel my eyes wet.After the movie, I only could think: Do we really have to choose between two lives? Does someone have the right to choose a life for us?http://movieadviser.blogspot.com/"
SamLowry-2,"Mar 18, 1999",10/10,"""Cinema Paradiso"" is the rarest of rare gems: a film in which the script, cinematography, acting, music, scenery and directing come together flawlessly to move the viewer in a profound way. As you watch, you constantly realize the perfection of each little scene, the graceful way the camera moves, the simple and natural facial expressions of the actors, the drama of each character's personal journey. The film builds to an emotional climax that will thrill cinema buffs. Alberto's gifts at the conclusion of the film are really just the final frames of Guiseppe Tornatore's amazing gift to the world of cinema. ""Cinema Paradiso"" is flawless film-making."
Goboy,"Jul 7, 2003",N/A,"I can't but reiterate that this is simply one of the most magical experiences I've ever had watching a movie. The idea that this film is filled with clichés is reviewers being familiar with the tropes but not being able to, or not trying to understand the film on anything but a completely superficial level. CP is homage to the power of movies and a lyrical riff on formula. The story has elements of magical realism that inform the narrative with an almost surreal quality at points. Man, I love this film. The denouement at the end never fails to bring me to tears. I have seen thousands upon thousands of films, and believe me this is as good as it gets... Though not as playful, or clever as Ameile Poulain it is cut from the same cloth. It's seems important to note in lieu of some of the other comments that I have not seen the director's cut."
elbeer,"Oct 10, 2020",6/10,Its called vizon tele and its almos the same in turkish
JulioATorres,"Jan 22, 2019",10/10,"Cinema Paradiso is everything anyone needs to fall in love with the art of making a heartfelt movie. Inspires to do good for others, to always follow our passion and be strong regardless the circunstances. I saw it a few years ago in class and I tried very hard not to cry, but in the end, it was too late, I was already on the road to become a screenwriter. There´s something for everyone in this movie and once you discover it, it will change your entire life."
briancham1994,"Sep 22, 2021",7/10,"This film is one of the most touching works of nostalgia out there. It starts off showing the life of a young boy in an Italian town who befriends the projectionist of the local cinema. This part of the film is very sweet and is full of little moments like the town bonding, the boy sneaking into the projection room, the projectionist talking about his life and more. This all gives a well-rounded view of the boy's life and environment, which feels warm and true to life. The acting of the boy and the projectionist must be commended for a sense of genuine warmth. After a time skip, the young boy becomes a young man who takes over the projection booth. By this point, the repetition of the extended director's cut really starts to show badly. His desperate attempts at romance come across as annoying to watch. This really leads to confusion by the next time skip when she happily reunites with him. It seems that not only the past is presented as a fantastical fairytale, but also the ""present"". No amount of nostalgic rose-tinted glasses can resolve this incongruity."
bendon45,"May 12, 2007",10/10,"This has to be one of my favorite movies of all time and you love movies as much as I do than I'm sure you'd feel the same. The story takes place in a small town in post WWII Italy. With television not yet invented the town's only mean of entertainment is the movies. Every night the Cinema Paradiso movie theater is packed full of towns people who come to laugh, cry, and cheer. The story is told through the eyes of a boy called Salvatore. At an early age he falls in love with the movies and the theaters projectionist, Alfredo. Above all it is about the everlasting magic of the movies and the different affects it has on different people. I recommend this movie to anyone who is a big fan of movies, modern or classic."
