user,date,rating,content
etro,"Oct 15, 2006",4/10,"Very disappointing. This film is highly over-rated. The story is set in the war-torn Austrian city of Vienna, just after the Second World War, and is told from the point of view of an American pulp western author, Holly Martins, who is searching for a college friend, Harry Lime, who had offered him the opportunity to work with him in Vienna.At the beginning of the film, Martins discovers that his old friend Harry Lime, whom he had not seen since before the war, has been killed in an accident under mysterious circumstances just prior to Martins' arrival in Vienna. The deeper he delves into Harry's death, the more Martins finds that there was more to Lime than he knew and that Harry has been accused of being a black market racketeer, trafficking in adulterated penicillin.The only interesting angle to the film is the way in which Martins sort of becomes the heroic advocate of justice that he writes about- only this time the setting is post-war Vienna (which is fairly wild and untamed) not the wild west- a rather intriguing parallel, but not enough to save the film, which suffers from a generally lack-luster plot."
klaw-2,"Mar 1, 1999",10/10,"When I think of this movie, I can't help but compare it to Casablanca...this is almost the anti-Casablanca.  Everything is contrapuntal and played against one another, but with such playfulness that the music hits so perfectly.  The great man of the movie, Lime, is nothing but a scoundrel, and the anti-hero Martin is a complete sap, the love interest Anna oblivious and self-absorbed.  Truly a remarkable story, played with great heart and really probably the darkest humor you will find in a movie.  Orson's blitz of a rationalization for his insensitive evil is one of the funniest and well written speeches you will ever hear."
Lamanai,"Oct 10, 1998",10/10,"The Third Man is classic film noir.  Combining the genius of Welles and Greene, the film tells the story of Holly Martins (Cotten), a writer of pulp western arriving in post-war Vienna, discovering that his school-boy friend Harry Lime (Welles), has met his end.  Martins' curiosity into the events surrounding Lime's death are well founded as he seeks to find the truth surrounding Lime's death.  What he finds about his friend Lime is the catch. Classic Welles, classic Greene...don't miss this film."
u_torre,"Oct 19, 2006",10/10,"Brilliant performances from Howard, Cotten, Valli, and of course Welles even though his camera time was limited. Orson Welles speech on the ferris wheel to Cotten is truly memorable as he shifts from warm and affectionate, to a very cold and chilling character.Orson Welles cohorts in his crimes are perfect character actors in their roles as impoverished Austrians scratching out a living in post war Europe.Camera work is true film noir, and the music from Anton Karas is pure magic.I have watched this film over and over for 40 years and always enjoy it."
dataconflossmoor,"Mar 13, 2008",10/10,"This film has been noted as one of the best films ever in the history of the American cinema!!! While this website ranks it 48th best movie out of the top 250, and AFI (American Film Institue) has ranked it as high as the 14th best picture out of the top 100 American films ever made, something even more significant looms on the horizon!! Many intellectual spawns of the American film academy have ranked this film in the top five films ever produced!! One prominent critic from Boston ranked ""Third Man"" the number one movie of all time!! So!!! What justifies such critically acclaimed praise anyway? Start with the fact that the intellectual complexities to the plot in ""Third Man"" are intensely riveting!! The esoteric demeanor with which this film carries, has a deliberately convoluted line of logic!! The derivative responses from so many of the characters in this film spark a necessary ambiguity with regards to the prevailing circumstances for whom the third man must relinquish his mystique to!! The conversations pertinent to any kind of plausible resolution to the core issues in this movie were always philosophical!! Joseph Cotten and Orson Welles are a highly classic and highly talented duo of actors (As demonstrated in ""Citizen Kane"") who immediately necessitate a lofty aura of academic concepts. This detailed and contemplative cerebral quandary invites the movie audience to a very noteworthy ideological rumination of the story line in this film. Whether it be ""Citizen Kane"", ""The Third Man"", or any other film, the indisputable mark of the majority of intelligent actors ( Including Orson Welles and Joseph Cotten) is one where they convey the understanding of a situation, and instantly establish whether this situation is really complicated or very simple!! This is about the seventh time I have seen this movie ""The Third Man"" and, I believe, that finally!! I have a grass roots recognition of what this movie is about!! The visceral components to this film induce a correlation to an adamant political passion, as well as, yes, what else? love!! The trials and tribulations of espionage became a form of mutual vindication, thus establishing a kindred spirit for emotional devotion!! Set in Vienna, this film was very identifiable to me, as I have been to Vienna, and I recognize a lot of aspects of splendor to this city. All of it ignited an auspicious recognition; the Gosser Beer signs, the Sacher Cafe', the Mozart concertos with the players wearing wigs, ( I saw a production of this nature while in Vienna!!), and, of course, the cobblestone streets where a cross section of dubious walks of life perennially congregate!! Vienna is a city which is proverbially known to be a hotbed of political malcontents!! Just by virtue of the copious number of summits and dignitary gatherings it has hosted suggests that Vienna is a city which vicariously straddles the political fence!! With the intransigent aftermath of WWII, and the world almost ready to go to war again over the conquest of Berlin in 1948, central Europe had become totally dissected!! By 1949, when ""The Third Man"" was made, the overall infrastructure, which was ruined in Vienna, from confrontational combat during WWII, was ubiquitous!! The city was divided in four sections, belonging to four nations, the American, the British, the Russian, and the French. The center of the city was international, and for Joseph Cotten's character, Vienna presented itself as a mecca for diplomatic intrigue!! I loved this movie!! Based on the screenplay by Graham Greene, this film erupts with talent. Carol Reed ( Known for ""Oliver"" and a remake of ""Mutiny on the Bounty"") does a remarkable job as director with his efforts in the making of ""The Third Man""!! The acting in ""The Third Man"" was utterly superb, basically second to none !! Orson Welles and Joseph Cotten are an unbeatable combination, and Alida Valli, who plays Anna, is flawlessly disconcerting with this role!! The speech Orson Welles made was one which he wrote... the gist of it being (I am paraphrasing)"" War, terror and bloodshed are adversities which brought on greats such as Michaelangelo, Leonardo DaVinci, and the Renaissance, Switzerland has had 500 years of peace and democracy, and all you have gotten out of them is the cuckoo clock"". I thought this little doggerel of Welles' was very impressive!! Orson Welles is a lone rebel cynic who raised the bar on directing and acting excellence, not only in Hollywood, but also, in New York and London Theatre!! Orson Welles has the same birthday as I do, I guess this day was earmarked for brilliant byproducts of unprecedented genius!! (My personal vanity in this case is totally in kidding of course!!) The Hawaiin music in this film served as an aside for anachronistic flippancy with this picture!! The cinematography and lighting in this film were spectacular!! Accomplished actors, directors and producers prefer a movie to be filmed in black and white, as it exudes the absence of distraction!! The film ""Third Man"" is a must see for virtually every movie aficionado on the face of the earth!! I agree with the discerning movie critics, THIS IS ONE OF THE BEST MOVIES EVER MADE!!"
OzuKurosawa007,"May 19, 2004",N/A,"There are so many things that one can say about a movie this good. The acting is great. It's fun to watch again and again. There's great composition in every shot. It's a great story with great characters. I'm really partial to the Joseph Cotton performance as Holly Martens. The character is set up for adventure from the start. The inviting voice-over describes Vienna during the ""classic period of the black market"" and proceeds to introduce us to Holly Martens. He arrives in Vienna with a certain sense of starry-eyed excitement to see and work with his friend.For me, this set a very inviting tone for the rest of the film. This is appropriate because, in a sense, we look forward to meeting Harry Lime just as much as he does. Soon, we learn of Harry's death and are on our way to the funeral. Here, we catch the first glimpse of the mysteriously beautiful Anna (Alida Valli) as well as Major Calloway (Trevor Howard).Throughout the rest of the film, we'll meet new characters and learn so many new things about the recently deceased (or so we think), Harry Lime. The final character we meet is the one we feel we've known all along. Harry Lime (Orson Welles) makes his dramatic entrance on a dark street when the light from a disturbed tenant in a second story apartment comes on. It is my opinion that the only entrance that comes close to the drama of this scene does so, but with thrill factor. That's the first time we see the shark in Jaws. Call me crazy, but that's what I think.To reveal any more about this film, in my mind, would defeat the purpose of telling someone to watch it. There are many key elements that make it a great film that I want people to experience for the first time as I did. But it's a great story of friendship, love, greed, trust, and murder. Sir Carol Reed directed many a fine film. I thoroughly enjoyed Odd Man Out, Fallen Idol, and Trapeze. His musical, Oliver!, is something that belongs up there with West Side Story, Singin' In The Rain, and even The Sound Of Music."
claudio_carvalho,"May 22, 2012",9/10,"In the post Second World War, the unemployed pulp fiction writer Holly Martins (Joseph Cotten) arrives in Vienna to meet with his old friend from school, Harry Lime (Orson Welles), who has offered him a job. On the arrival, he learns that Harry has just died hit by a truck in front of his building and he goes to his funeral. Holly Martins sees a beautiful woman, Anna Schmidt (Alida Valli), and a friend of Harry and sooner he learns that Anna was Harry's lover.Maj. Calloway (Trevor Howard), who is commanding the investigation, offers the ticket to Holly return home, but while waiting for the trip, he talks to two friends of Harry that tell that they had been the firsts to help his friend. However, the porter of Harry's building tells that there was a mysterious third man that helped Harry and Holly Martins becomes intrigued with the inconsistency and decides to investigate further. Sooner he discloses that Harry Lime was the leader of a gang that robbed penicillin from the military hospital to adulterate and resell it, and has caused the death and anomalies in many children. He continues to investigate and he has a great surprise when he finds who the third man is.""The 3rd Man"" is an unforgettable masterpiece of mystery and thriller by Carol Reed. The fascinating story has no flaws, with witty dialogs; the acting is perfect and the cinematography is wonderful with the perfect use of black and white and shadows to show the environment and corruption in Vienna in the post WWII. The manhunt in the end in the sewage system of the city is one of the most impressive that I have ever seen. My vote is nine.Title (Brazil): ""O Terceiro Homem"" (""The Third Man"")"
enselic,"Feb 7, 2007",6/10,"I admit that it is hard to believe that this movie was made in the forties, because it is an extraordinary movie by the standards of that time. But by today standards (which I believe all movies should be compared with when compared on an entertainment basis) this movie simply don't cut it. Acting performances is nothing special, the script is nothing special, the directing is nothing special.The only thing that I believe is worth mention is the black and white photo; it is truly great, but apart from that, this movie is nothing special, no matter how good it was when compared to movies made at the same time."
MattBrady099,"Aug 1, 2015",10/10,"Harry Lime: ""Don't be so gloomy. After all it's not that awful. Like the fella says, in Italy for 30 years under the Borgias they had warfare, terror, murder, and bloodshed, but they produced Michelangelo, Leonardo da Vinci, and the Renaissance. In Switzerland they had brotherly love - they had 500 years of democracy and peace, and what did that produce? The cuckoo clock. So long Holly"".The Third Man is about Harry Lime who has died in a car accident. Previously he had invited one of his closest friends to join him. His friend now must find out if the story is true and the mystery behind it.The Third Man or best known has Orson Welles second best movie with Citizen Kane still at number 1. This time Carol Reed takes the directing chair and not Orson Welles but I got to be honest here I actually thought that Orson Welles directed this movie just by the way it was shot and acted it looked like his kind of film, because while watching the movie I didn't do any research on the film so I just watch the movie without nothing about the film and while watching the movie I was wounding if Orson Welles directed it's not until the end credits when I find out that Carol Reed directed it. Orson Welles and Carol Reed are both genius when it comes to movies and The Third Man isn't anything different as this is one of the best movies ever made.Carol Reed directing in this movie is absolutely magnificent and pure cinema gold. At times I felt like I was watching a Orson Welles movie just by the way it was shot and how it was acted and how it was executed made it feel like another great movies all together in one. Carol Reed was a fantastic director for this movie as he made a brilliant mystery thriller like The Third Man. Nice work Carol Reed.The movie has this gloomy but yet a wide cinematic feeling to it that made this movie truly special then it is. With every shot in this movie that's both stunning and dazzling to my eyes. The famous scene in the sewers with that ionic image of Orson Welles is cinematography at it's best. Excellent work Robert Krasker the Cinematography of the movie.Joseph Cotten and Orson Welles both did a outstanding performance in this movie and so did everyone else in the film. Everyone in the movie delivered so much to they characters and to be honest I didn't find anyone else in the movie that did a terrible job. You can tell while watching the movie that these actors put a lot into they characters and it paid off brilliantly.Now for the problems that I had with this movie: I honestly didn't find a single thing that was a problem to me or even a flaw in this movie. You could say that it might be perfect, do I think it's perfect? well yeah, I do.Overall The Third Man is a movie that's absolutely worth checking out. These some other things in the movie that I could have brought up but to be honest and I do bring this up a lot and for good reasons. I want you the viewer to watch this movie like I did by not knowing much about the movie but only knowing the praise the movie got, I'm telling you to do this so you can experience what I experience. The Third Man is a classic at it's best."
hollis56,"Oct 31, 1999",7/10,"This was a film I saw many years ago, and without a vivid memory of the film in its entirety, I felt another viewing was in order before I wrote any comments. It was probably over 25 years since I had seen The Third Man, which would mean I was under 18, and at that age, I was really more interested in films that provided surface entertainment, rather than social commentary or a visual impact.With that in mind, I wanted to absorb everything this film was reputed to contain. What I found was a film with tremendous cinematography, several extremely powerful images, and a few memorable exchanges of dialog. However, it was not able to create an overall mood of other films typical of the genre. This may be due to my dislike of the score, which interrupted the growth of tension or intrigue, rather than enhancing it. Overall, the acting was pedestrian.As a mild excuse, the copy of the film was poor, and the sound quality substandard. I would like to see this film again, in a theater if possible, but certainly, a better print couldn't hurt."
denizov,"Mar 13, 2018",4/10,"I expected much more from this film, as usually they claim it to be a classic movie, one of the best in history of cinema etc. But in my opinion it isn't. It has too many shortcomings. First of all -- the music is totally inappropriate for such a thriller, it is mocking and amusing, which does not fit with the whole story at all. It makes it all look like a light-hearted comedy, not to be taken seriously. The dialogues are presented in a mechanical, artificial way: normal people do not respond so quickly to surprising and unknown information. The plot fixes too much attention to the girl, rather than to the complex and confused story. The good things are the cinematography and the atmosphere of postwar Vienna, where the action takes place, but even they should have been given more attention."
alandodds04,"Oct 8, 2005",10/10,"I was aged 7 when I saw the film in 1949. It has haunted me throughout my life and I still regularly watch it at home. The strong storyline backed by believable characters, shot in black and white in a bombed Vienna mostly at night where stark lighting created deep shadow's created for me one of the most atmospheric film's I have ever seen. Behind all of this and adding to the atmosphere was the haunting theme tune 'The Harry Lime Theme' played on zither by Anton Karas. I was continually whistling this tune as a child. so much so that my parents took me to our local theatre when Anton Karas appeared there in 1950.Probably the best film ever made and no computer gimmick's!"
meet_the_feebles,"Dec 18, 2002",10/10,"﻿The Third Man is one of the best movies of all time. It's a far cry from any other Noir film, ever. Alfred Hitchcock on his best day (North By Northwest) didn't even come within a million leagues of The Third Man. I read a review that had the nerve to compare The Third Man to The Usual Suspects! This would be a grand example of what movies today are doing to people.The reviewer who stated this said that they lost interest in The Third Man about half way through? What? Here is a film that puts it's audience in a trance the second Joseph Cotten enters the screen. In fact it's ONLY flaw was the seemingly pointless narration at the very start. The rest of the movie is perfect.The Third Man was perfectly shot, edited, directed, acted and told. The music stays familiar from the opening credits until the end. The score helps keep the movie from confusing itself, the score shows us that this movie had it's own personality and own flawless flaws. It lives and dies as it is. It doesn't try to put in songs of it's past, (the songs from the Billboard's Top Ten) that may make a feeling of nostalgia and confuse the viewer into believing they're watching a great movie, but are indeed being tricked with clever magic of the emotions. (i.e. Casino and the worst yet Forrest Gump). These movies aren't sure what they are, other than they are.Not mention, here is a movie that holds a climax of words and still finds the time to put one of the best chase scenes (if I can lower the standards of the film to say CHASE SCENE) at the end. A double climax? Yes, one for the high brows another for people who think Usual Suspects is a movie to compare other movies with. (If your wondering, I believe the ""Coo-coo Clock Speech"" is a definite climax).The Third Man is magic. Magic! MAGIC! There will never, in a million years be a better Noir movie than this.**** (out of ****)"
Elizabeth-328,"Aug 16, 1999",10/10,"This movie is incredible!  Orson Welles and Joseph Cotten once again create magic together on screen.  And this is one of the greatest suspense dramas! Even though Orson plays a really despicable person, I love him anyway.  He's so carefree...he fakes his own death without thinking about the consequences.This really is a true film-noir movie.  And the dynamic duo Cotten and Welles really are great together.  ""The Third Man"" is a must-see!Rating: 10/10"
crowdkiller,"Dec 16, 2003",10/10,"This film is perfect.I've just finished watching it and I was blown away. The direction is stunning with a war torn Vienna providing plenty of beautiful shots. The acting is stellar, Cotton is amazing and Welles further shows his genius here the cuckoo clock speech being but one high point. But the story itself is what makes this film so good i will not go in to any detail so please watch it. I highly recommend this film to all film fans.I'd go as far as to say after one viewing its in my top ten favourite films its really that good. Peace."
aeaston,"May 19, 2004",N/A,"Seeing it again recently on a crisp DVD made me realize just what a beautifully crafted film this was. I can say that the final cemetery scenes stick in my mind as the most beautiful and effective rejection I have ever witnessed. A timeless classic of which I could never tire. How Orson Welles could so completely dominate a movie in which he occupied the screen for so few minutes, the superb sequencing on the giant ferris wheel, the haunting theme played on a zither and co-ordinated so beautifully with scenes of danger and tenderness, all combine in what I feel was Carol Reed's finest effort. If I was stuck in solitary for a decade and had a couple of movies like this to pass the time I would come out a better person."
docp,"Oct 9, 2000",10/10,"It has the most wonderful photography, the most haunting music, tremendous atmosphere, riveting personalities, historical interest - just simply, everything.  No more need be said except that if you haven't yet seen it, then fall in love with it as soon as possible; you are missing pure magic."
euplay1220,"Aug 14, 2019",6/10,"Classic movies often take me by surprise because they have so much substance, so much more to show than many of the recent Hollywood eye-candies do. Older movies like Metropolis (1927), Modern Times (1936), and To Be or Not to Be (1942), to name but a few, are all very engaging throughout their runtime.Unfortunately, The Third Man is a disappointing ""too little, too late"" movie. The movie should be cut down to 1 hour because it doesn't really get started until the last 30 minutes. The first 1 hour is a long, melodramatic nothingness. Storytelling is clumsy. Scene transitions are awkward. True, the background and characters need to be developed before Lime shows up; but the job can be done in 20 minutes, 30 at most. The movie gets more dull than suspenseful if it takes too much time showing too little. The music doesn't help, either.In my opinion, this movie doesn't stand the test of time as other classics do. It may have been ahead of its time when it came out, alright. Is it worth watching now? Not really."
