user,date,rating,content
tom-1203,"May 20, 2005",2/10,"I really don't understand how this film got to be so famous and widely recommended. Two hours of clumsy sentimentality, in which nothing happens; a coming-of-age tale which tackles none of the problems of adolescence; characters who spend most of their time simpering over each other, yet they never bother trying to make them connect with the viewer; child acting so dreadful a wooden puppet with its strings cut would have been a better replacement...I resent the laziness of the film, they thought they could rely on its magic formula of nostalgia, saccharine and being foreign so they thought ""we don't need to bother building up any genuine feeling for these characters"". The story starts with an incorrigible young tyke (who i found extremely irritating) befriending the local projectionist. That's about all you need to know, what there is of a plot that develops from there doesn't really matter - it doesn't offer any interest, it doesn't put any of the characters in a dilemma, it all just dissolves into the steady flow of sap. With a plot development occurring every twenty minutes or so, thank God that we're anchored to the motif of the cinema by lengthy footage of people sitting around in it, making entertaining comments which make us just resonate with the warmth of the Italian people. More sugar anyone? Perhaps if I had a very fragile and elderly relative - I mean several centuries old - for whom trying to follow a plot that wasn't totally linear might get their blood up, who was too mentally impaired to take a character at anything but face value, for whom nuanced was just a seven letter word they weren't sure how to spell, then I might recommend to them Cinema Paradiso. Although the possibility that their heart might stop mid-way through, making me culpable for their death, would make me think twice. In fact I think I've got it, Cinema Paradiso might be a very good film to die to. Especially if you've been incapacitated waiting to die for a very long time, and would like to assure yourself that other people have been subjected to something of what you're going through.The Spirit of the Beehive (La Espíritu de la Colmena) is sometimes presented as Cinema Paradiso gone right, again centred on a cinema in a small town and a child's reaction to it. Sure it's slow, and makes no concessions to commercialism, but it is beautifully directed and in an understated way develops the viewer's empathy for the characters. Exactly the opposite of the crass tedium of the film I've just had the misfortune to see."
whpratt1,"Apr 30, 2006",10/10,"This film touched my very heart and soul from the very beginning to the end. As a young boy I went to the movie theater with my Mom every Friday afternoon at the Lefferts Theater on Liberty Ave., in Richmond Hill, N.Y. and grew to love all the films just as the young boy in this film. It is very easy to see why this film received so much wonderful praise and awards. There was plenty of funny comedy when the Roman Catholic Priest censored all the films shown in the theater that showed any form of kissing or physical contact between a male or female. It was a great down to earth film which words cannot describe fully, and can only be appreciated by people who love to escape into the World of Film and stories. The Actors, Producers and Directors out did themselves with this great masterpiece of JOY. By the way, when I attended those Friday afternoon showing of films with Mom, she also received a free plate or dish to go with her set of matching dinner dishes."
ahmed-samii,"Apr 21, 2024",10/10,"""Cinema Paradiso"": A Cinematic Journey into the World of Memories and ArtThe film ""Cinema Paradiso,"" produced in 1988 and directed by Giuseppe Tornatore, is one of the remarkable cinematic works that leave a deep impact on the audience. Blending drama, romance, and nostalgia, the story offers a unique cinematic experience that takes viewers on an emotional journey filled with sentiments.The film tells the story of a boy named Toto, who grows up in a small village in Italy during the post-World War II era. Toto discovers his passion for cinema through his friendship with Alfredo, a worker at the local cinema theater, Cinema Paradiso. He learns the art and magic of cinema with Alfredo's guidance, whom he considers his mentor and spiritual guide.The story evolves over time, showcasing Toto's relationship with cinema and his career path as a filmmaker. At some point, Toto realizes that cinema is not just a means of entertainment but also a way to express deep emotions, memories, and human sentiments.From an artistic standpoint, ""Cinema Paradiso"" is distinguished by its exquisite cinematography and impactful music that enhance the story's effect on the audience. The film presents a series of beautiful cinematic scenes that embody the beauty of memories and the power of human connections.However, the true aspect that sets ""Cinema Paradiso"" apart is its ability to reunite viewers with their own memories, evoking various emotions and thoughts about life, love, friendship, and art.In summary, ""Cinema Paradiso"" is not just a cinematic work; it is a cinematic experience that leaves a mark on the hearts of the audience, much like it did with Toto and Alfredo in their magical world of Paradiso."
j_movie,"Aug 18, 2021",10/10,"From the small window of the cinema, you can see all kinds of life."
eloincinema,"Sep 25, 2025",10/10,"""Life is not what you see in movies, life is much harder""
I'm stuck in every moment of this movie, utterly mesmerized, regretting every day I delayed watching it. One of the greatest and most impactful movies I've ever seen. Every detail lingers in my mind, the people, the places, the music, the unique bond between Alfredo and Toto, the small moments, Elena, and finally... Paradiso. I'm certain I'll revisit it again, and I'll keep recommending it over and over. Cinema at its purest form."
m1_pierogi,"Apr 7, 2024",10/10,"I will start by saying that this is now one of my favourite films, and you will quickly find out why.Before I say anything: do not be deterred by the long runtime. The pacing is done so well that you will not feel it at all.It isn't as much how the film is made (even though that is still amazing), but what it is about, which I'd say is especially these things: life in general, how a love for something can bring about great dedication, and of course, traditional cinema. While this might be quite cliché, it does bring about a feeling for 'simpler' times, although only really at the start when Toto is a young boy and a little less when he is a teenager. In fact, this illusion is shattered when Toto returns for Alfredo's funeral - he says that he doesn't recognise anyone or anything and has experienced life to be hard and complicated, like Alfredo told him. His initial dream as a boy was to work the projector, but as he grows up, he realises he can do a lot more - and he does.Even the most minor of characters are well written. Each scene with the cinema is amazingly lively, punctuated by an interesting action done by some unnamed member of the village: the man who falls asleep with his mouth agape, the man who spits onto the people below him from the balcony, the man who went to see the film while leaving his sick wife in bed. With just one simple action, they are each given more life than if the camera were to pan to a variety of people simply watching the films, even if they were to each have a unique look on their faces. These scenes also add some excellent comedy that even seems realistic. No doubt, after years of being spat on, the men below would retort with what is at its nicest a chocolate mousse to the face. Of course, these kinds of action would be viewed as hooliganism if done in a cinema today, but this liveliness from all of the audience makes every one of these scenes enjoyable. The two biggest characters are Toto and his mentor Alfredo. Even though we know Alfredo isn't the smartest of people, he is kind and passionate when teaching Toto how to operate the projector. This is returned by Toto when he helps Alfredo as a teenager, but now he has also outgrown his status as a student, and is now more like a friend, while Alfredo is more like a father too.This film is also emotionally moving. You could go from scenes of deep sadness to intense comedy and your facial muscles feel compelled to move as if controlled by external strings. This is done throughout, although near the end there is more of a melancholy feeling, with nostalgia scattered in.Just to make this a fair review, I will include some things that were flaws. The clearest of these is the differences between the actors/actresses playing Toto and his mother. I'd say the best of the ones playing Toto was Salvatore Cascio as child Toto, he was incredibly skilled for his age. Another is a lack of focus on Toto's sister, who doesn't do much except hang around in a few frames and speak a few words even though she should have been much more influential in Toto's life. Arguably, this would have added extra runtime and maybe thrown off the pacing, but that's just something I noticed.Overall, this is a wonderful film that is emotionally moving, well made and certainly makes you think about life, and what you want to dedicate yourself to. I'm sure plenty of us could do with someone like Alfredo, or even just his advice."
aleowen,"Dec 10, 2025",10/10,"It's hard to describe a movie like this one, but I feel like I can best sum it up with this question: why can I not stop crying? I'm joking, but I'm also not. This film consistently hits you right in the feels on so many different levels, and you'll never know when or why you'll be crying next. Truly one of the greatest movies ever made, and I implore you to see it if you haven't. There is some theme in this film for everyone. Whether it be love lost, or leaving home, or the love of a father figure, this movie is truly special and absolutely in my top 5 ever."
anonymous124,"Mar 18, 2006",N/A,"Sometimes a film comes along that moves us in ways we don't see coming. Films like Imitation of Life, and Cinema Paradiso. I cried during Cinema Paradiso. There. I said it. Happy? I'm not going to say it again. And mind you, I didn't cry a lot, just a little bit at the end.Just try and watch it yourself and not cry. Because nostalgia is the saddest thing in the world.It has a happier beginning though. Cinema Paradiso begins sometime in the 40's in a small Italian town where the priest censors out kissing from all the imported Hollywood films (he calls it ""pornography""). The theater projector, Alfredo, is the one in charge of cutting the scenes out. And a little boy named Salvatore visits often to ask if he can run the projector himself and maybe steal a few of the edited clips. A bag of them in his room catches fire and nearly destroys his home. His mother instructs Alfredo never to let Salvatore near the theater again. At first, he does. But the boy's love of the movies brings him constantly back, and Alfredo's heart warms to the boy.In one of the more magical scenes in the movie, a small crowd gathers outside the theater when the theater is full, asking to see the movie before it gets too late for them to stay up. Salvatore watches as Alfredo removes the back of the projector and uses a mirror to reflect the movie onto the wall of someone's house, where the audience brings chairs and watches contently.Salvatore grows older. As a teen, he mainly runs the projector, (the theater is no longer censored by the priest - now it occasionally shows porn), takes photographs and falls for a wealthy new girl in town. The film is predictable in plot, but not predictable in the way it makes us follow it s storyline eagerly. The film is scored by Ennio Morricone (who reuses a theme or two from ""The Untouchables"") and is directed by Gieuseppe Tornatore. After a stint in the army, Salvatore comes home and finds the town lonely, desolate. Alfredo tells him: ""Living here day by day, you think it's the center of the world. You believe nothing will ever change. Then you leave: a year, two years. When you come back, everything's changed. The thread's broken. What you came to find isn't there. What was yours is gone. You have to go away for a long time... many years... before you can come back and find your people."" Alfredo tells him to leave and become a movie director...and never look back. Salvatore does so, and we cut to him in his 40's or 50's, when he learns that Alfredo died. And so he returns home.Some films are great because they are filled with nostalgia for a forgotten era. Like the popular teen films ""American Graffiti"" and ""Dazed and Confused"" which were homages to eras the directors hadn't forgotten when everyone else had. Cinema Paradiso is so filled with this nostalgia that you feel as if you had lived in this small Italian town yourself. You can almost smell the sweaty theater in summertime. The ""Cinema Paradiso"" screens Jason and the Argonauts, Humphrey Bogart films, and plenty of small, mostly forgotten Hollywood romances. It also screens joy, love, disappointment, sadness, nostalgia, friendship, laughter, and magic.""Cinema Paradiso"" is a film for the ages, and for all the ages."
frankde-jong,"Oct 6, 2023",7/10,"""Cinema paradiso"" is a film about (memories of) a youth in which cinema plays a major role. In this respect it resembles ""The last picture show"" (1971, Peter Bogdanovich) and ""The long day closes (1992, Terence Davies).The first two pictures are situated in a small town and film is not so much an escape from the real world, but much more a window on it (and this not only for the little guy but for the village as a whole).In the film the little boy grows up and leaves Sicily for mainland Italy. At the end of the film he returns to his native village to attend the funeral of the man who had been his father figure. Such visits are unavoidably a disaoppointment, in this instance not in the last place because the cinema turns out to be in total decay. Two years later director Giuseppe Tornatore made ""Stanno Tutti bene / Everybody's fine"" (1990). In this film it is not the son from mainland Italy who visits his father(figure) in Sicily but the father from Sicily who visits his children in mainland Italy. In both cases the visits turn out to be a deception.""Cinema paradiso"" won an Oscar for the best foreign language film. The film is all about nostalgia, but it treats this feeling in a very pleasant bittersweet way."
Soumyadeep9190,"Aug 4, 2025",10/10,"Cinema Paradiso isn't just a film. It's a memory you didn't know you had. Giuseppe Tornatore's masterpiece is a deeply moving tribute to the magic of cinema, memory, and the people who shape us. Set in a post-World War II Sicilian village, the story follows a young boy named Salvatore (Toto), who falls in love with movies and with life through the flickering screen of the village theatre, Cinema Paradiso.What begins as playful curiosity soon turns into a lifelong passion. We learn how films were projected back then - hand-cranked projectors, burning reels, celluloid magic. Through Alfredo, the old projectionist, Toto finds not just a mentor, but a father figure. Their relationship is filled with wisdom, warmth, and deep emotion.Toto also experiences first love, heartbreak, and departure. Alfredo, knowing what the world has to offer, tells him, ""Don't come back here,"" urging him to chase his dreams without looking back. That line, simple as it is, carries a lifetime's weight.Years later, Salvatore returns to his hometown and walks through the crumbling remains of Cinema Paradiso before it is demolished. That scene is more than nostalgic - it's devastating. It's as if a whole generation's memories are being torn down brick by brick. And finally, when he watches the reel Alfredo left for him - a montage of all the kisses and love scenes that were once censored - we're reminded why we fell in love with movies in the first place.Cinema Paradiso is about the beauty of letting go, and the ache of holding on. It's about childhood, love, loss, and the immortal glow of the projector's light.It's not just a film. It's cinema itself."
Philaura,"Aug 27, 2001",6/10,"Not as fabulous as so many reviewers brought me to expect.  I loved Malena and thought that Cinema Paradiso would be a good follow up choice as I had not seen it yet.  I found it difficult to really get behind the characters. Though cute, the young lead did not endear himself to me.  The cinematography was breathtaking, but the story fell short for me and it was slow.  I didn't make it to the end. Maybe it was my mood."
djbeardpaperclip,"May 11, 2025",3/10,"I watched the director's cut of this movie and like most director's cuts, the director's version spoils the film.It's as if they can't bear to leave deleted scenes on the cutting room floor. They add them back and story becomes convoluted, too long, and loses focus. In this case the point of the film is that the main character goes away to pursue his career having lost contact with the girl of his teenage dreams, and he never gets over her. In the revised version the hero rediscovers his lost love living in his home town now married with kids. After a snog in her car she goes back to her new life and all is resolved, which devalues his lifelong idealism.This revised version seemed to go on forever.It took too long to tell a story that didn't quite seem to know where it was going."
Xuelicious,"Aug 2, 2024",10/10,"Giuseppe Tornatore's classic Italian film enthralls the senses with its charming style and deft use of storytelling. The movie is set in a small Italian village where Salvatore, a little child, develops a strong love for movies thanks to his connection with Alfredo, the aging projectionist at the theater.Its capacity to arouse intense nostalgia and admiration for the history of cinema is what really sets it apart. Ennio Morricone's stirring score and the film's stunning visuals combine to create a magical and poignant ambiance.""Cinema Paradiso"" is a beautiful story with well-written characters that will make both young and elderly cry. The movie serves as a great reminder of why we adore going to the movies-it's a place where we can fantasize, think, and feel in addition to being entertained. A film such as ""Cinema Paradiso"" is an exceptional find that lingers in the mind long after the closing titles strike.This is more than just a movie; it's a love letter to the film industry and a poignant reminder that our most treasured moments are frequently the ones we spend with those we love most. ""Cinema Paradiso"" is a wonderful experience that should be enjoyed again and again."
petesmal,"Jul 9, 2024",10/10,"This has to be the best foreign film of all time. Everything about this film is perfect. The screen play, the cast, the performers, direction, photography. It is genus. Why do some people miss out on masterpieces such as this is because as soon as you say it's a foreign film with English subtitles they won't watch it! So miss out. I've seen many a foreign film and some have been classics. But what I witnessed with this film left me in tears. Much emotion throughout the film and at the near end a scene that leaves you weeping with joy and sadness at the same time. No spoilers here. Enjoy for yourself. If you have never watch a foreign film ever. This is where to start. Long as 3 hours but so beautiful you won't notice the time scale. You will be encapsulated and transported to a little village in Italy."
Facundo_Coria,"Jul 6, 2022",10/10,"Cinema Paradiso is one of those movies that mark a moment in life, in my case it was my childhood. I saw it without expecting too much in a small movie theater in my hometown, since then its soundtrack and its story were engraved in my head."
bulbulshakib,"Sep 10, 2023",10/10,"I don't know how to describe my feeling for this cinema. Yet, I'll try.Why do we watch cinema? To me, I watch cinema, because it has a story in it, a story of a different life more precisely. We get to live only one life for a short period on this planet. Its cinema that lets me explore different lives through its portrayal. I simply know that I love cinema and I love every bit of it with all my life.Cinema Paradiso is such a relevant film to me because I think I and Toto truly share the same love for cinema. Every cinema is like a new wonderful adventure. Like him, I too have memorized numerous dialogues of different films all over my life. Cinema simply works like magic on us.The film not only shows Toto and his love for cinema, it also portrays his complete life. It's also so much relevant, because it's an ordinary life. ""Life isn't like in the movies. Life... is much harder.""- Life lessons, taken from the cinema, just like Alfredo.I just finished watching this film and sat to write this review. It's getting longer than expected. I think this somewhat explains why it's so special. Stopping it here (may edit later)."
lago-38811,"Jan 12, 2024",10/10,"I rarely cry when watching films, but Cinema Paradiso invoked so many emotions upon viewing that I was helpless when it came to stopping the tears that rained from my eyes. This is a film about love, passion, and time. It beautifully and tragically conveys how life waits for no one, eventually, everything you hold dear becomes a ghost of the past, and all you have left are memories, as Toto's mother so eloquently puts it. I just viewed this with my elderly father, and I couldn't help but see myself in Toto and him in Alfredo, we share a love of films and have watched countless of them together throughout the years, so watching this really made me emotional.This truly is a masterclass in filmmaking, I've always considered that for a film to be great, it must have the ability to make you FEEL, and Cinema Paradiso does just that. I know this movie is hard to find, and if you're not fluent in Italian, it may feel like a turnoff to have to read subtitles the entire time, but I implore everyone who reads this review to watch this movie if the opportunity arises, the ending (which I won't spoil) will leave you stunned, and I guarantee that you will have a viewing experience that changes the way you view life, if ever so slightly."
CinemaClown,"Oct 11, 2013",N/A,"Films like Cinema Paradiso (also known as Nuovo Cinema Paradiso) perfectly exemplify why so many of us cinephiles devour films as if it's an integral & essential part of our lives and covers the fascination, excitement & joy we experience when a fictional story unfolds itself for the next few hours in front of our eyes. And this gem from Italy is simply as nostalgic to every ardent film lover as it is to cinema itself.Paying tribute to the evolution of movies as well as movie theaters over time & parodying the existence of censorship that restricts its viewers from experiencing a movie the way it is meant to be, Cinema Paradiso is a beautifully crafted tale about love, loss, friendship & movies and recounts the childhood of a filmmaker when he fell in love with movies at his village's theater & formed a deep friendship with the theater's projectionist.Evoking genuine emotions with its heartfelt narration, directed by a passionate film lover who infused a part of his own life into its story, aided by brilliant performances from its entire cast, exquisitely photographed, elegantly edited and featuring a wonderful, soul-stirring & truly heartwarming score from legendary composer, Ennio Morricone, Cinema Paradiso is a remarkable work of pure craftsmanship from start to finish that hasn't aged a day.An absolute delight for all film lovers around the world, this cinema about cinema is a splendid reflection of how movies have & will continue to play its subtle role in influencing the smallest decision of our lives and with its expertly balanced story that promises loads of smiles with few tears along the road, viewers are sure to rediscover why they love cinema so much in the first place. A timeless masterpiece. Delightfully recommended."
desislavasav,"Oct 1, 2022",10/10,"'Cinema Paradiso' is a lettera d'amore to the cinema and filmmaking, to the movie theatre as a sanctuary rather than a place with the sole purpose of entertainment, to Italy, to life.It brings us back to times, which I, as a Gen Z, have never had the pleasure to actually know. Better but forever gone.""The cinema has become a memory""It's a story about love. But not just some representation, the movie has a life on its own. It breathes, it excites, it's everything one could expect and want. And with arguably the most profound movie ending of all time. A must-watch for everyone!Grazie! Ti amo!FINE."
RIK-22,"Mar 16, 2003",4/10,"So, 2003, and I hadn't seen Cinema Paradiso, then I noticed it was on TV, so I gave it a go.I heard a number of good things about this movie and tend to like more non main stream films more and more as I am getting older, but to be honest I was very disappointed with what I saw.Cliché after cliché.  Stupid unbelievable characters and then a fairly tame soap opera story.  Where was the depth, where was the profound message, basically there wasn't one.In the end this could have easily been produced by Hollywood.  There was a real sense of passion missing.  Toto wanted to be a film maker, but didn't really demonstrate his passion for films other than wanting to be a projectionist.  Tag on a predictable love story and a bit of sentimentality, that seemed out of place.  What was the big deal, yes people liked the cinema house, but I can't say they felt any true love for it.  Then at the end you see this scene of great nostalgia, which seemed out of place.I'm sorry I didn't like it, I genuinely thought I would, but the film really missed any maturity and lacked any real sentiment."
