user,date,rating,content
werefox08,"Apr 11, 2012",10/10,"The Third Man is a great movie. The four principle actors...Orson Welles, Trevor Howard, Joseph Cotten, and Auda Valli are fantastic. The story and screen-play by Graham Green is superb. The music by Anton Karas is perfect. The photography by Robert Krascer is brilliant. The direction by Carol Reed is innovative and faultless. This is the original noir classic. Its Vienna after WW2 and racketeering is rife. The naive Holly Martins (a small time novelist from the U.S.A.) stumbles into town. He has to get smart quickly as he discovers that fact can be stranger than fiction....and much more deadly. Made in 1949 it remains an exemplary film in all ways. To-days ""special effects"" and CGI are what movie goers now want....which is a real shame. It means that the writers can get away with murder----by coming up with poor scripts, again and again. This is an INTELLIGENT movie....it requires full attention. They really cant make em like this anymore. This is a movie which is rightly celebrated by anyone who loves high class motion pictures."
stensson,"Nov 22, 2002",8/10,"Being in Vienna, you must of course see ""The Third Man"" if you have the chance, especially when it's shown with the original soundtrack. I did so.There aren't many pictures in film history having that splendid photo, in the sewers as well as out of them. But the charm of it is in the way people are behaving, like a glimpse from a lost paradise, although the plot is frightful.It is a beautiful story about friendship between men, one good and one evil, and of passionate love for a woman, which only grows into despair. The background is the bombed Vienna, which make things very special, like destiny looking over your shoulder. The film is probably more sensational now, then it was in 1949."
perfectbond,"Jan 15, 2004",9/10,"I recently saw this on the fantastic Criterion Collection DVD and like countless other was greatly impressed. I'm not sure I can add anything new but I must say that the the feeling of post war Vienna was captured so perfectly and that the cinematography of said setting was a star of the film as much as Cotten or Welles. What I like a lot is that there is no neat or even very poetic ending. Events transpire in a naturalistic fashion full of all the frustrations, disappointments, and unfulfilled expectations that make up life for so many people as they often fruitlessly struggle for some sort of contentment. My only quibble is that the soundtrack is somewhat overrated but that is only my individual opinion. Still a true classic, the film, and our first look at Lime, 9/10."
tomsview,"Feb 26, 2016",10/10,"Filmed as though the camera had one tripod leg shorter than the others, along with zithers, seductive shadows, echoing sewers, ferris wheels, cuckoo clocks and a magician's touch, this film is more of an experience than a movie. Impossible to remake, it also captures Vienna at a critical time just after WW2 when it was still occupied by the Allied powers.Even after 55 years, ""The Third Man"" has a compelling story, superb performances and enough style for ten films.And that story by Graham Greene stands up even when compared with all the brilliant mystery films over the intervening decades as well as literate crime series on TV such as ""Lewis"", ""Wallander"" and ""Vera"" etc.Holly Martins (Joseph Cotton), a rather nerdy, and slightly annoying writer of paperback westerns, arrives in post-war Vienna to discover that his good friend Harry Lime (Orson Welles) has supposedly been killed in an accident. He encounters suspicious British policemen (Trevor Howard and Bernard Lee), and also Harry's enigmatic and beautiful girlfriend Anna (Alida Valli). Eventually Holly learns things about Harry that trouble him deeply. It all leads to a confrontation in the cavernous sewers under Vienna.The film also features one of the most unexpected endings ever. I won't spoil it in case one of the five people who haven't seen the film happens to read this.Suffice to say that the original script had a more conventional ending and it was actually David O Selznick who came up with the one used in the film. It was always assumed that it was director Carol Reed's, but Charles Drazin in his fascinating book ""In Search of the Third Man"" pretty well pins it down to Selznick, who attempted to interfere with the whole production. Although ostensibly a British film, Selznick had money in it with Alexander Korda - before the inevitable falling-out.There is so much to observe and enjoy including Orson Welles' famous monologue, and the stunning Alida Valli. She was so beautiful, ""head-swivelingly beautiful"" as Martin Scorsese once said. Even the shapeless raincoat she wears for most of the film only makes those luminous features even more striking. She had already made a couple of Hollywood movies including Hitchcock's ""The Paradine Case"", another film where her mystique is caught if a little chillingly, and she wasn't even a Hitchcock blonde.Carol Reed went on to make other movies including ""The Man Between"", which tried to recapture the spirit of ""The Third Man"", this time set in Berlin. It even foreshadowed ""The Spy Who Came in from the Cold"", but it didn't have that self-contained, indefinable magic of ""The Third Man"". Maybe it's only one true masterpiece per customer, although Reed's batting average was always strong.Whatever the case, ""The Third Man"" has lost none of its lustre and more than lives up to its reputation. I'd have to say it's a desert island disc for me."
andyrogers,"May 24, 2001",N/A,"Ever since I was a boy I can remember my mother commenting on the end of the film with the words "" ooh grandad hates the end with Orson Welles' hands poking throogh the drainhole"".  Sorry Mum and Grandad, I love this film despite the corny ending. Everything about it is masterly - the pace never lets up, the suspense likewise and there are some wonderful set pieces, even more so when you consider that the clever mr Welles wrote the ""cuckoo clock"" speech himself. The settings are drab and austere and into this world steps our hero Holly Martins played by my all time favourite actor, Joseph Cotton.  Why doesn't he make more of a play for the girl in the same way as he doesn't give chasing the elusive Lime?  This only becomes apparent after watching the film a few times because initially you realise she is besotted with the black marketeer Lime. All the supporting roles are superb - even down to the snotty little kid who puts the finger on Martins.  There are darkly suspicious European characters drifting in and out of the scene and a very dodgy ""little dawg"", as Cotton refers to it. You really build an affinity with Lime even though he is a criminal mastermind and into very dodgy dealings and it is a shame that it has to end in tears, in a sewer of all places - well, where do you expect rats to end their days?? Perhaps the star of the show is Trevor Howard playing a laconic army official who seems rather weary of the whole nonsense.  The punch on the nose from his sergeant is most probably what Howard ordered for the loud American nuisance! Don't miss this one - I put it on when there's nobody else around the place and escape into that monochrome world of postwar Vienna. Who needs pearl Harbour or Bridget Jones??"
Thanos_Alfie,"Jan 30, 2015",7/10,"""The Third Man"" is a mystery movie in which we have a novelist who travels to shadowy, postwar Vienna because of the death of one friend of him. When he arrives there though he finds himself trying to investigate the mysterious death of his old friend.I liked this movie because of the plot and even though it's an old movie it had a good storyline. Also the direction of Carol Reed was equally good. I have to admit that I did not expect to like this movie at first but after the first ten minutes of the movie I was surprised. About the interpretations, I have to say that I liked Joseph Cotten's who played the novelist Holly Martins and of course the beautiful Alida Valli who played as Anna Schmidt.Finally I have to say that ""The Third Man"" is a really good movie with nice plot and I believe that if you are a fan of mystery movies then this will be one of your favorite movies."
merrywater,"Apr 22, 2015",10/10,"There are some movies that simply are so captivating and well-crafted that you might, for a moment, doubt their very existence: This is such a movie.Based on a great novel, there were still lots that could have gone wrong when adapting the story for the screen.(1) Casting: I have practically no complaints. Even the animals (a cat and a parrot) were great. If there would have been one remark, it would consider the janitor at Lime's place and his shifting knowledge of the English language.(2) Directing: so solid that it has to be reckoned as one of the pillars of golden age cinematography. Welles apparently wanted to take credits from Carol Reed. That says quite a lot.(3) Setting: Brilliant! Wienna as a lugubrious and damp ghost town filled with odd people, mostly viewed in close-ups - silent, tormented faces.(4) Plot: Believable enough. Actually a bit of a MacGuffin; the emotional drama is the true story, but it wouldn't have worked without the detective hyperplot. The title itself could be given almost a double entendre with respect to the famous final scene: the female protagonist has lost the first man, ignored the second, and eventually walks towards the third. Well, a bit over analytical, but...5) Soundtrack: Very unusual. A Hungarian zither player got international reputation merely out of this movie. The producer thought about everything, as it seems..."
Nick-57,"Oct 14, 2003",10/10,"A masterpiece from all aspects. The black and white cinematography depicting each detail (and wow what shadows), the cast of splendid actors and actress, even those playing minor roles, not sparing any facial details!!   And oh what  background of Zither music. They surely do not make such movies any more."
neilhumphreys-55732,"Dec 18, 2022",4/10,"I felt so disappointed with this film. People built this up to be a classic and I was upset when it did not fulfill expectation. The cinematic photography was top notch and the acting was first rate. The setting was fantastic and seeing old parts of Vienna was a ""look back in time"" for anyone. Unfortunately for me the story just did not cut the mustard. The film noir gene is an acquired taste and I am truly sorry but it is not mine. To me the film was vastly overrated and the stars it gets are given people who are rating it for other things other than the actual plot. Yes other aspects of the movie are great but you cannot look past a bad script."
RossLikesMovies,"Oct 23, 2005",10/10,"Their really isn't much more I can say about the Third Man. It is an amazing film and was a landmark in the history of cinema. Its an inimitable piece of film making in every way. Robert Kraskers photography was groundbreaking, amazing and in my eyes still the most beautiful, perfectly photographed work in history. The unique blend of creeping shadows and spectacular filming angles are one of the main standouts in the film.Rarely has a film had a better cast. Joseph Cotten is perfect in his role as Holly Martins. Orson Welles almost steals the whole show with his almost cameo like performance as the elusive Harry Lime.The story in the Third Man is intriguing and ultimately satisfying. It isn't the strongest point of the film, but is still admirable. The story is really just a basis for the excellent character interaction and dialogue on display.To conclude, the Third Man is an essential film, one that should be seen by everybody. It is cinema at its most sub-lime!"
MissRosa,"Oct 4, 2000",10/10,"NOTES ON THE THIRD MANThe Third Man -- it's Freud! it's Kafka! it's Hitchcock! It's Conrad! It's Fellini!  It's Nietzche! It's Machiavelli! It's all the above and more: it's Orson Welles... and the Notes on the GREATNESS of THE THIRD MAN.Two's company, three's a crowd. The title hints of a character who has surpassed the ordinary; who has defied conventional restraints; an outsider; a modern Kurtz [Heart of Darkness]. No coincidence that a sinister, cynical Kurtz actually exists in the film.Of what is Lime guilty anyway? How guilty is he?  What has he done? Does it even matter? For a long time, he is nowhere in sight. We don't know where he is, if he even exists, or if the terrible rumors about him are true. So why do we so desperately want to meet him and hear his side of the story? We begin to identify with this mystery man, we want to side with him.Only one thing is certain as the story unrolls: Harry Lime has gone too far and he must pay the price.Joseph Cotten plays an artistically-compromised American writer, who is too naive -- in his charming American way -- to realize it. Can he even begin to offer the insight and integrity needed to evaluate Lime's guilt or innocence, the evidence we long to disavow?Then there is Harry's American girlfriend. She is depressed by Harry but is mentally loyal to his ""memory.""TouchPointsThe transcendently evil character to whom a genuine, yet inexperienced character is inexplicably and irrevocably drawn through a long, convoluted journey toward absolute darkness. (Conrad)Vienna, the city of intellect, intrigue, and ambition with its dark streets, gothic shadows and subterranean sewers providing the ultimate metaphor for the mind (Freud) Life as a dizzying carnival of dizzying perceptions of good and evil, sin and salvation, and the relentless need to make choices. (Fellini)The investigation of murder, and the subsequent surprises, secrets and thrills that unveil character and motive. The use of creative sound, light and cinematography to embroil the viewer in the hunt. Tall buildings and dizzying heights. The propensity to fall from grace. (Hitchcock)The presumption of guilt as a foundational assumption of  modern life. The chaos, frustration, loneliness and deep fears occasioned by endless and inescapable and endless bureaucratic and architectural webs, mazes, and tangles. (Kafka)This is certainly one of the top ten films of all time -- if not, in fact, number one. It's complexity continues to fascinate, amaze, entertain, awe. It is perfect."
goldengoose21,"Jul 11, 2004",10/10,"do you guys think that anyone in the third man is truly innocent? and do the characters take advantage of the ""innocent"" people because innocence is a weakness? or is it because they are loyal and have morality etc, like martins? i am of the opinion that the porter is the character that is the most innocent, but then he did hide the truth from the police to protect himself... and then holly could be innocent, but going by one of the dictionary definitions of innocent, he is by no means foolishly trustful. and how do you feel about the ending, the anti-Hollywood factor, where anna walks straight past holly. that i feel was the only way to end the film. anything else would have been untrue to the story. also, i've seen 2 spellings of popescu- popescu and popesco. which is correct?? and one more thing... how good is the zither!"
palmiro,"Nov 16, 2003",10/10,"Just a few notes on exceptional scenes, what's in them and what's not: 1) the ending, the framed shot that lingers for 50 seconds as Anna advances down the esplanade of the cemetery towards Holly and beyond; 2) the hospital scene: not a single shot of the children, but the tattered teddy bear was enough; 3) the wait for Harry to show in the cafe`: the close-ups of the faces of the military men waiting in ambush were straight out of Leni Riefenstahl's ""Triumph of the Will"" and with the same dramatic impact; 4) the total absence of sizzling sex scenes, profanity, & gory violence (with one exception, none of the men killed is seen being killed, and in that one case there is no gore, only a quick hitting sadness); 5) and couldn't it have been just possible that Anna was wanted by the Soviets as a war criminal? Here's where Graham Greene's screenplay was strictly Cold War boilerplate: The Russians were necessarily the ""bad guys,"" prepared to harbor a scumbag like Lime and persecute a sensitive soul like ""Anna Schmidt"" (maybe she'd been the lover of a high-ranking Nazi commander of a death camp and had shared in his sadistic delights). And, finally, the bozos in this column who disliked the music because it had an ""Hawaiian sound"" must have thought they were listening to Arthur Godfrey on the ukelele rather than Anton Karas' zither. Cold War boilerplate or not: 10 out of 10."
cataldoa,"Jan 12, 2004",N/A,"Finally, I saw it.  I bought the DVD and watched it two days ago. It's a very good movie.  A very good story, with very good performances and an excellent direction.I don't like to compare movies or to make rankings of them.  Why we have always to compare things?  Is it important if a movie is the best or the 50th in any list ?The most relevant thing (in my opinion):  a movie is a good one if I remain thinking on its story and its scenes for a long time after seeing it.  It seems to be the case with ""The Third Man"".The highest points: a) in the final chase, the fingers on the street; b) in the child hospital, no child is seen.  There's no need of it.  It's good direction. c) the final scene, of course.  If Anna had walked to Holly, we probably would not remember the end of the movie for a long time.No doubt: it's a very good movie."
Prince-P,"Jan 5, 2023",7/10,"In the film, a young American writer arrives in postwar Vienna. He has been promised a job by his friend Harry Lime, but soon discovers that the friend was killed in an accident. But is Harry Lime really dead?In the autumn of 1949, the English director Carol Reed was at the peak of his career. He had in fast pace made three films - ""Odd Man Out"", ""The Fallen Idol"" and ""The Third Man"" - all of which would come to be regarded as modern classics. Carol Reed continued to direct movies for many more years (he even won an Oscar for ""Oliver"" in 1968) but would never make a film of that stature again.In 1940s England, most movies were shot on the companies' sound stages. But Carol Reed had other ideas. ""Odd Man Out"" was filmed in Belfast, while he brought his crew to Vienna to make ""The Third Man"". Where Reed got into trouble. The film's star, Orson Welles, refused to go down into the city's foul-smelling sewers for the dramatic chase sequence. Instead Reed had to use a body double, dressed in Welles' clothes for the scene.One evening when Carol Reed wandered around Vienna, scouting locals, he heard street musician Anton Karas playing outside a bar. Reed was immediately fascinated by the zither player, and decided to use his music as the theme of his film. This, in turn, made the unknown musician famous. After touring all over Europe, Karas could open a nightclub in Vienna in the '50s, aptly named ""Der Dritte Mann"".""The Third Man"" is filled with lots of unusual angles where the camera is tilted so that the horizon line is not horizontal at all. This is because Carol Reed wanted to create a feeling of uncertainty in the audience. After seeing the film, director William Wyler sent a spirit level to his good friend Reed, with a note attached: ""Carol, the next time you make a picture, just put this on top of the camera, will you?"""
joezelja,"Jan 8, 2026",6/10,"I really like the idea of setting the story in Vienna. Europe is an unusual and refreshing location for a black-and-white noir film, we're so used to this genre being rooted in America (with Casablanca as a rare exception), so this was a genuine surprise and, on paper, a great choice.That said, I feel the film had much more potential than what it actually delivered. Despite its strong reputation and high rating, I honestly don't think The Third Man fully deserves it. The story feels thin and not nearly detailed enough for this type of film. Everything moves too fast, as if the narrative was rushed, and I think it should have been handled with far more care.The supporting characters initially seem like they will carry some real weight, but they quickly lose their importance as the story progresses. While I truly appreciate the post-war Austrian setting and the atmosphere it tries to create, the film ultimately left me disappointed. The ideas are strong, but the execution falls short."
IceQueen99,"May 14, 2022",5/10,"The cinematography is wonderful, but I fail to see the attraction of the ordinary story. And the gawd awful, relentless mind-numbing music makes it almost unwatchable."
Charles Foster Kane,"Feb 5, 2002",10/10,"As we all know, Citizen Kane is often lauded ""Greatest Film of All Time"". Whilst I would never dispute this, keep in mind that ""Best"" doesn't mean the same as ""Favourite"". Kane is influential, important and is required viewing for anyone with even a cursory interest in film. However, it can be a difficult watch if your not in the right mood. The Third Man, on the other hand, is a joy from start to finish. From the (perfectly) cast to Robert Krasker's outstanding cinematography, the film persists in staggering me every time. Technically speaking, The Third Man is on a par with Citizen Kane and rarely gets the credit for it. The reason for this is simply because,  whatever skill,craft and/or effort was displayed for the film, it is unobtrusive. All the composite elements (photography,design,editing etc) seem so perfectly suited to eachother, to the point where they're rendered almost ""invisible"". However, whilst watching Citizen Kane, you're always conscious of it being such a (staggeringly) well put together film. Which seems, to me, to run counter to the whole ""Magic of Cinema"" thing. The ""Magic of Cinema"" thing being where you can let go and enter the world you're being presented with. Which becomes increasingly more difficult, the more you're aware of the technicalities of filmaking, however impressive they may be. So, sit back and enjoy quite the finest example of ""Romantic Thrillers""........ The Third Man. My favourite film, though not necessarily the best."
Mr Yu,"Jun 25, 2002",10/10,"The perfect ending, the great theme that will play in your head for days afterwards, love, post war Vienna, black market scams, a faked death, a friends betrayal for what is right and Welles. If you have any doubt about how good this genius was, check this movie out. He's on the screen for about 10 minutes, yet steals the film from the brilliant performances of Joseph Cotton, Trevor Howard etc. The classic bad guy that somehow you can't bring yourself to hate.Check it out and see if you can hate Orson when he flashes you that smile."
hypnosexray,"Dec 15, 2000",10/10,"I Say SO! The angles, the lighting, the beauty of the black and white it is just perfection. Dont get me wrong I Love Citizen Kane but i think that this one is better. Just something bout it. And to all DVD fans i recommend purchasing Criterion's Special Edition got old radio shows that Orson Welles did in the 50's as Harry Lime."
cosmicly,"Oct 11, 2004",N/A,"I must dismiss my bias, up front, by telling all of you that this is my all-time favorite movie. For me, it crystallizes the ultimate Hamletiam predicament, the tearing apart that occurs that when your best-loved best friend turns out to be a rotten scoundrel. An opportunistic person whose lust for wealth tramples on the medical needs of wounded soldiers, pregnant women and suffering children. This movie is filled with comic relief moments, but what makes it excel is the ultimate test of the moral dilemma. What do we choose, an amazingly and seductively appealing friend who happens to destroy lives with his greed, or an obnoxious bureaucracy that just happens to be morally right in this case?One comment on the moral cloudiness of the current generation. I would bet anything that more viewers side with Harry Lime, today, than against him..."
