user,date,rating,content
*DATo*,"May 16, 1999",10/10,"Whether you are a professional or an amateur it is always wise to avoid superlatives with regard to a movie critique ... but I cannot. 'Cinema Paradiso' is simply the finest movie I have ever seen. Like many who have posted at this site before me I have seen it many many times. It reaches within me to places other movies have never reached and I have often wondered why. Perhaps it is because of it's simplicity. It contains no expensive special effects, it has no gratuitous sex or violence, it has no ""multi-millon dollar per performance"" actors that I know of, it is arguable whether it even has a story line, and yet it soars far above the nonsense that film makers are producing these days. It's characters are portrayed by each and every actor in award winning style and the music is not only beautiful but absolutely perfect for this film.It is quite simply the story of a human life and it's tragedies and triumphs within the context of a vocation. A young boy matures and gradually learns the lessons of life, cultivates his passion for the cinema, and is rewarded with professional success; however, he remains unfulfilled for true love has escaped him only to return in the form of a gift of love which transcends time, space, and death to reveal at the closing of the film Toto's one true mistress.A staggering triumph of both the cinematic art and of story telling and yet there may be found people who do not like this movie .... I tend to keep such people at arms length and  maintain a wary eye fixed upon them at all times."
darkside2003,"Jan 30, 2005",10/10,"I seldom watch Italian movies, (i saw it today for the first time) being Italian maybe i'm biased, but this one really stands out. A real masterpiece; i can't remember another movie so moving like this one, maybe Schindler's list; it makes you laugh and it makes you cry, yet it is so simple and straightforward. Maybe there lies its magic: no Hollywood superstars, no special effects, just pure emotions and feelings, love, fear, grief and regret, nostalgia for childhood and youth, memories of places and times that will not come back, memories of the loved ones. Some movies are there to entertain, some to scare, some to question. This movie is there to affect your feelings. Definitely to be seen."
rappy-68741,"May 25, 2021",10/10,The final scene is probably the best in the history.
michaelsjmurphy,"Nov 29, 1999",10/10,"Movies can wield a strange power over those who sit in the darkened seats of a theatre.  The truly great ones manipulate your perception of reality, suspend your disbelief, and ultimately either alter or affirm your view on life.  NUOVO CINEMA PARADISO is just such a movie.  It is the near-perfect melding of direction, acting, script, sound track, and cinematography. Phillipe Noiret and Salvatore Cascio give the kind of performances usually associated with much more recognizable actors.  The supporting cast looks like they could all be full-blooded Sicilians.  The location shots add depth and realism to the entire production.  Ennio Morricone's music is simply the most appropriate and emotive I have ever had the pleasure to hear in a theatre.  Tornatore's script and direction are a joy, a breath of fresh air.I will not spoil this story by repeating it, nor will I give away the ending, although it matters not a whit.  I could disclose fully everything in this movie, and in seeing it, all my words would evaporate.  There is nothing like the experience of sitting through it, becoming engulfed by it, and in the end, being changed."
ccthemovieman-1,"Mar 21, 2006",8/10,"After seeing this special edition DVD which shows the entire 174-minute film (in addition to the 121-minute one that most of us had seen over the years,) my rating of this film was elevated. This review is of the longer ""director's cut.""Most of the new footage involved the main's character's romance while he was a young man. The story then is continued years later when that character comes back to his hometown for a funeral and runs into the woman he was in love with but never was able to get for his own. It turns out to be a somewhat tragic love story.The first part of the film, with Salvatore Cascio as ""Toto"" a young boy is a love story about two people sharing their love of movies: the kid and an adult ""Alfredo"" (Phillpe Noiret) who runs the local movie theater. Their love of film bonds them for life.The word ""love"" is used repeatedly in this review because that's the dominant theme: the love people had for others and for the world of film, something all of us on this website share.The second and third parts of the film are the above-mentioned love story of Toto (Marco Leonardi as an adolescent and then Jacques Perrin as an adult) and ""Elena"" (Agnese Nano/ Brigitte Fossey). The first third of this director;s cut edition is much livelier and interesting, frankly, than the last two-thirds. Although not boring, it does drag in a few spots but the longer version is better in the long run because it makes the whole story much more meaningful.It's very nicely filmed and you get a real feel for the Italian people and their little town. The director of the movie, Giuseppe Tornatore, went on to make other great visual films, two of which I also like: Malena and The Star Maker.....but Cinema Paradiso, I believe, is considered his ""masterpiece."""
rdmcflyers-95247,"Aug 7, 2019",10/10,"Absolutely one of the most beautiful, touching movies I've ever seen. Superbly acted by everyone and totally touched my heart. When he's watching the movie reel at the end I felt an overwhelming feeling of nostalgia, love and happiness for a time gone by when movie theaters were special places to go to lose yourself for a short time to something wonderful. A must see film."
boblipton,"Mar 19, 2020",10/10,"Is there any way for someone who has chosen the movies over life to write anything sensible about this movie for an audience who have made the same choice? I could talk about the way that Philippe Noiret's performance dominates the movie, but he is the only actor who plays his role from start to finish. Certainly, if Giuseppe Tornatore had set out to make a feature intended to win a Best Foreign Picture Oscar, he couldn't have plotted more cannily.It is, after all, a movie about how we start out as small children, trying to make sense out of the world, with nothing to guide us but stories in the dark.... and in the end, we end up that way, nostalgic for a time when we were confident that some day all would be revealed.Well, it hit all my buttons. Still, as I noted at the start, I chose the movies over life."
paul2001sw-1,"Oct 8, 2012",7/10,"To those of us who live in places less beautiful than Sicily, and which have lost connection with their peasant heritage much longer ago, there's a natural appeal to stories from that island. 'Cinema Paradiso' provides a nostalgic look at post-war Sicily, and also of Italian cinema during that era; in the story of how progress led to television, the death of the cinema as a social institution and the individualisation of people's lives, it recalls 'The Last Picture Show'. There's similarity as well in the conflict between attachment to one's community and the desire to escape, although it lacks Peter Bogdanovich's film's sense of overwhelming claustrophobia. Indeed, the emotional temperature of the film is actually quite muted, in spite of the surface colour and vigour. I enjoyed it, but (especially in a setting with such a complex historical and political backdrop) it could have benefited from a shade more intensity."
PIST-OFF,"Mar 14, 2021",9/10,"This movie is wonderful. It really captures a sense of nostalgia many of us harbor in our own lives. I don't know why I put off seeing it for so long. A little boy grows up loving movies (movie people in their narcissism love movies about movies) and is mentored by an older guy who sees big things in the kid's future. A rose tinted view of youth, love, and times that never seem to stop changing is what follows and a wonderful story it makes for. One of the few movies to get a grasp on childhood along with Stand By Me, The Sandlot, and a few others. Another movie that could benefit greatly from an English dub, as too many people are too likely to avoid subtitles at all costs."
Falko_h1,"Jun 7, 2024",7/10,"""Cinema Paradiso,"" directed by Giuseppe Tornatore, is a heartfelt tribute to the magic of movies and the power of nostalgia. The film follows Salvatore, a successful filmmaker, as he recalls his childhood in a small Sicilian village and his relationship with Alfredo, the projectionist at the local cinema, Cinema Paradiso.The story unfolds through a series of flashbacks, capturing Salvatore's formative years as he falls in love with the art of filmmaking under Alfredo's mentorship. Philippe Noiret delivers a touching performance as Alfredo, while Salvatore Cascio and Marco Leonardi beautifully portray the young and teenage Salvatore, respectively. Their on-screen chemistry is both endearing and poignant, driving the emotional core of the film.Ennio Morricone's evocative score complements the lush cinematography, enhancing the film's nostalgic atmosphere. The narrative is a bittersweet reflection on the passage of time, the evolution of cinema, and the impact of cherished memories. While some may find the pacing leisurely, the film's charm lies in its affectionate portrayal of a bygone era and its celebration of the communal experience of movie-going.""Cinema Paradiso"" is a touching homage to the transformative power of cinema, leaving viewers with a warm, wistful feeling and a renewed appreciation for the stories that shape our lives."
ali-38,"Dec 21, 1998",N/A,"I have seen this film at least a dozen times and each time I am carried away to a small village in Italy, where the dreams of a small boy come true and we can join his spellbinding journey.  The Italian language (it is subtitled) adds to the film's beauty and music, the characters are so real you can almost smell them.  I am absorbed into ""Paradiso"" each time I watch it, so that when it is over, I am shocked into the realisation that I haven't actually been anywhere except right there, in my theatre seat. I am not a huge ""art house"" film fan or indeed enjoy subtitled films (it is hard on the old eyes!) but ""Paradiso"" is a gem and is worth seeing again and again."
caspian1978,"Feb 12, 2005",10/10,"Giuseppe Tornatore's Nuovo cinema Paradiso (Cinema Paradiso) is everything good about the movies. It is a story about love. The love between a Father and Son, an Individual and his home, and the love for the movies. Even if this is not your favorite film, if you are a filmmaker, you have no choice but to say this is your all time favorite film (if not one of the greatest films ever made). If only for the movie's ending, this is a great film. The ending answers all of your questions and completes the story. The missing love from a Man's life. The missing pieces to all the stories (movies) found and made into a whole. The final message from beyond the grave, the ending is perfect. If the musical score doesn't put you in tears, the amazing visuals will push you over the edge. This is what all movies should be about. Terrific."
stevelivesey67,"Feb 7, 2021",10/10,"Genius, masterpiece, (insert superlative here).
Tornatore's finest achievement is nostalgic and romantic in equal measure.
Watch the long version, it adds a more perspective to the heartbreaking ending."
preppy-3,"Jul 1, 2002",10/10,"This 1988 Italian film (released in the US in 1990), is back with a full 51 minutes added on. This seemed like a stupid idea...there was nothing wrong with the original. The directors cut (which was 1/2 hour longer) was considered a mess. Also, for this release, an extra 1/2 hour was added! I expected the worse. Well, I was pleasantly surprised that this 3 hour version is better than the 2 hour one.This story follows the life of Salvatore. He's born in a tiny Italian village and we see him as a little boy in the 1930s, an adolescent in the 40s-50s and an adult in the 80s. It basically is about his love of movies and the one true love of his life--Elena. They are in love but she comes from a rich family and he lives in poverty. How can they be together?POSSIBLE MINOR SPOILER IN NEXT PARAGRAPH!!!!The cut movie in the US excised a lot of the Elena subplot and concentrated on Salvatore's love of movies. There's nothing wrong with that, but Elena disappears quite suddenly. This full version explains what happened between them and fleshes out the characters more. It also reveals a crucial surprise at the end.The performances are all fantastic--especially by the gorgeous young actor playing Salvatore as a teenager. Elena is also stunning. The film has beautiful cinematography and a haunting music score. The 3 hours flew by for me. I didn't want it to end!So...beautiful music, attractive stars, good acting, compelling story and some incredible romantic sequences. A must-see!!!!Bring plenty of Kleenex though--I cried a least 5 times!"
phaneendrakumar,"Feb 5, 2005",10/10,"This movie definitely is one of my all time best movies. Director Giuseppe Tornatore placed himself in the list of the best directors. The usage of an excellent background score is a trademark of his movies and this movie is not at all a different case.He is also a master in getting best performances out of children and adolescents. Marco Leonardi was the pick of the whole cast. Also watch Melena for those trademarks of Tornatore.The character of Alfredo is one of the most unforgettable characters. The way emotions captured in a camera is way beyond naturality.Overall, this is a great movie with ultimate teamwork with everyone contributing. I just loved the movie very much."
Xstal,"Jan 10, 2023",8/10,"The centre of attraction in the town, a screen where everybody gathers round, showing films in black and white, bringing joy, pleasure, delight, as the reels rotate, the story is unwound. Toto's mesmerised by all he sees and hears, the picture house is where he flees and cheers, getting in Alfredo's way, mischievous eyes so full of play, Father Adelfio, still collars him for prayers. As he gets older more distractions then appear, conscription, briefly ends all premieres, a girl captures his young heart, sends his pulse right off the chart, then comes the time, when he moves on, goes overseas.Toto's growing up in a small town in Sicily, with the joys of cinematic adventure, amongst a group of characters destined to remain as set in their ways as those captured in Pompeii. But there's always someone to help you change direction, point you at the stars and help you on your way, you just need to find them and then listen.Still as beautiful and as elegant as it ever was."
ma-cortes,"Mar 5, 2014",7/10,"Colorful and moving flick dealing with a wonderful friendship between a little boy and a solitary projectionist . However , being overly nostalgic , too sentimental and overwhelmingly sweet . Attractive and sensitive picture with stirring drama , ravishing cinematography and enjoyable musical score . A filmmaker (Jacques Perrin , he subsequently became a notorious director) recalls his childhood (Salvatore Cascio , Toto , who celebrated his eighth birthday during filming) , when he fell in love with the movies at his village's theater and formed a deep friendship with the theater's projectionist (Philippe Noiret who said all his lines in French) at Cinema Paradise . The director goes back home to his Sicilian village for the first time after almost 30 years and is reminded of his first love (Antonella Attili) .It is an interesting celebration of youth, friendship, and the everlasting magic of the films . Nostalgic and sensitive picture with thought-provoking drama , ravishing cinematography and moving musical score . The picture contains drama and nostalgia completely wrapped in an agreeable story between a lone man and a boy . The flick relies heavily on the relationship between an older man and a kid , subsequently teenager , but this does not get bored or spoils the tale . Slightly overrated but excellent all the same time , the picture is enjoyable and entertaining , but overlong . The story is narrated with great sense and sensibility , the intelligent screenplay was written by the same Giuseppe Tornatore . Giuseppe's intention was that this movie should serve as an obituary for traditional movie theatres and the movie industry in general , after the movie's success he never mentioned this again. This excellent and enthralling picture ¨Cinema Paradise¨ was starred by extraordinary actors such as Philippe Noiret , Jacques Perrin and Marco Leonardi . Good acting from remaining cast , just like Antonella Attili , Enzo Cannavale , Leopoldo Triestre , Agnese Nano , Pupella Maggio, among others . Glowing cinematography with scenarios colorfully and stunningly photographed by Blasco Giurato who reflects splendidly the cinema , streets , square , village and many other things . Rousing as well as insistent score musical , including a continuous leitmotif from the beginning to the end ; being efficiently composed by the veteran master and prolific Ennio Morricone . The film won several nominations and awards , Oscar included .This weeper picture was very well directed by Giuseppe Tornatore . He is a writer and director, known for making similar nostalgic films including good actors , such as ¨Malena¨ with Monica Belucci , ¨ The star maker¨ with Sergio Castellito , ¨Baaria¨ with Raoul Bova ; and ¨La Leggenda del Pianista Sull'Oceano"" (original title) or ""The Legend of 1900"" or ""The Legend of the Pianist on the Ocean with Tim Roth . Being his English-language debut feature titled ¨The professor¨ with Ben Gazzara . Cinema Paradise Rating : Better than average, well worth watching for exceptional cinematography , first-rate acting and marvelous score ."
Atreyu_II,"Aug 13, 2010",7/10,"This Italian motion picture achieved notorious fame, comparable to the equally famous and more recent Italian movie 'La Vita è Bella'.Like that one, this one is also very good in its first half, but after that it becomes a movie of bad taste. That's really too bad, because this movie (and 'La Vita à Bella') had potential to be something big.'Nuovo Cinema Paradiso' can be considered a homage both to cinema and films. It shows us the pinnacle of the cinema as an industry of entertainment and as an escape for those who go there to watch the movies, making them forget the hard reality of poverty and war. Besides the cinema's success, it also shows its progress, its bankrupt, its decadence and its sad ending.This is a very simple film. However, simplicity doesn't necessary mean something bad. Plus, the brilliant and memorable soundtrack by Ennio Morricone adds lots of emotion to the film, particularly in its first half, which is without a doubt the best part of the movie.One of the biggest charms of this movie is the fascination and enthusiasm of Salvatore (whose nickname is ""Toto"") on the cinema and the projectionist job. He wins the friendship of the local projectionist, Alfredo, who also teaches him all about that job. As you can tell, ""Toto"" is a very intelligent kid and a very quick learner. Plus, he is mischievous, cute and hilarious.Of course, even the first half has its minor faults, such as the pranks of bad taste - for example, that pig who spits to the audience and the prank with a bug on the sleepy guy. Pranks aside, I also don't like at times the behavior of Salvatore's mother: she slaps him a number of times.As for the good of the first half, well, just about most of it. And this without forgetting Salvatore's dumb classmate. He's a poor dumb kid who doesn't know what 5x5 is. Whenever he answers that question is hilarious, as each answer is dumber than the previous one. In the 3rd time, he goes as far as replying «Natale!» (which is ""Christmas"" in Italian) - when he said that, I practically died of laughter!As for the 2nd half of the movie, most of it is wrong and seems quite rushed and forced. Salvatore is no longer charming as a grown up. The love story between Salvatore and the girl of his dreams is frustrating in all ways, not to mention that it's ridiculous that Salvatore spends entire months waiting for her to open the window as a sign that she fell in love for him. There is no comedy or charm as in the 1st half. An animal is stabbed. Salvatore joins the army. And Alfredo's attitude later is puzzling: forcing Salvatore to leave that town forever, never look back, never return (not even to visit, going as far as saying that if he returns he won't receive him in his house), never let nostalgia hit him and never to even write or think about them.I clearly prefer ""Toto"" as a child than as a teen or as an adult. ""Toto"" is far more charming as a child. In fact, the moment he grows up, for some reason the movie looses its initial greatness.Phillipe Noiret gives a great performance as Alfredo, but little Salvatore Cascio steals the show as little ""Toto"".I never saw the Director's Cut version. And frankly, I've got no interest in watching it. It's about 30 minutes longer, making it a too long movie and it certainly makes one view the film differently, as many of the mysteries are revealed (which might not be a very good idea). I saw the shorter version which isn't even that short, as it is nearly 2 hours long. But I can handle a movie of 2 hours."
evilmatt-3,"Sep 3, 2001",4/10,"I appreciate what this this film was trying to do, but I think it's entirely to big, clumsy, and sloppy to be of any real value.  I actually sat through this monster twice and I can say that it doesn't even get any better the second time.The theme of the movie (that is, maturing and allowing yourself to move on with your life, as opposed to the pretty picture movies portray) is admirable and comprehensible.  However, there are some major problems that overwhelm this strength.  First, the film is entirely too long.  It feels like the director just tossed in every single ""growing up"" cliché he could think of and the result is that the movie takes up waaaay too much of your life.  Second, in spite of the first problem, this film has huge story gaps that took place as a result of massive editing (as I understand it, this film was originally well over three hours).  Third, the film makes no real attempt to establish empathy with the audience.  It instead makes the erroneous assumption that we will just see Alfred and Toto and be instantly smitten with these lovable characters.  Wrong again.  I too often found them annoying and ridiculous (especially Toto) to have any real emotional bonds with anyone.The ending is decent, but it would have had more effect had all of the previous clutter not been strewn about the film.  All in all, this was just way to mushy and bloated for me."
Boyo-2,"Oct 4, 1999",N/A,"This movie is very sentimental, so if you are proud of your cynical side, stay away.If you are scared of foreign movies and start foaming at the mouth at a subtitle, stay away.For the rest of us, this is a masterpiece!  Enjoy the movie and enjoy yourself!  The end is so beautiful that it is almost unbelievable."
vuktom,"Jun 16, 2021",10/10,I have seen this movie a dozen times and I've loved it more for every time I've watched it. Today I saw the full version for the first time and I love it even more.I will not spoil it by telling the story but if you have a romantic disposition you will love it. Maybe the music is better than the movie - it's mr Morricone so it is a masterpiece in another masterpiece.I envy you all that will see it for the first time. It's as sweet as true love.
strokemp,"Jan 8, 2020",10/10,"Excellent movie, very funny and emotional at times for all true movie and cinema fans.
Beautiful Italian scenery and spirit, good positive characters, music of Ennio Morricone, good acting...I never watched the movie which grab you so fast and really connect with the characters, incredible how todays movie lacks of that.
The end is very emotional, last scene is superb, thanks to the music, acting of main actor and beautiful mix of romantic scenes from the other movies like a great tribute to the movies itselfs.There is standard (shorter) and directors cut version. My opinion is that the shorter version is way better, not because added scenes are not interesting, it is more like the added scenes ruin the magic which is maded between main two characters and the last scene then doesn't look natural."
myrtols,"Apr 3, 2021",10/10,One of the best films ever made... And of course one of the best soundtracks ever.
TheLittleSongbird,"Jul 17, 2011",10/10,"As a big lover of film, I am still kicking myself for not seeing this masterpiece any sooner. To me, Cinema Paadiso is one of the best films of the 80s and also the most moving, particularly in the final hour.I have seen many visually stunning films, and Cinema Paradiso is up there as one of the most visually ravishing films I've seen. The cinematography and editing are outstanding, and the scenery still looks gorgeous with an epic feel to it. Cinema Paradiso, alongside The Good, The Bad and the Ugly and Once Upon a Time in the West, also contains one of Ennio Morricone's most haunting scores and it is also one of my favourites of his.Cinema Paradiso is immaculately directed, has an touching, beautifully-written and honest script and a rich, compelling story that while it has an elegiac feel moves swiftly by draws you right in until the ending, which breaks my heart still after 5 times of seeing it.The characters are very well defined, particularly Alfredo, and the acting is outstanding with Salvatore Cascio, Enzo Cannavale, Marco Leonardi and especially Phillippe Noiret particularly impressive. All in all, a masterpiece. 10/10 Bethany Cox"
