user,date,rating,content
daryopeek,"Apr 28, 2019",10/10,"A great picture. Ikiru leaves me in silence when it ends, a genuinely moving film. The depiction about life and death, in any genre possible, has been done in so many ways, but who thought that a simple drama could change it all?What makes this picture perfect lies in the main character with his physical gesture and his voice, able to speak hope in his dying moments. Some of the subplots feel cruel (his son and daughter-in-law whose always talking about inheritance, the ignorance from co-workers), but to justify them at the wake scene, it's a feeling that I never encountered before when watching a film. It shows after all, that people are indeed have their lifetime, but at what cost we start to live it?The drama brought many issues that relevant to our problems in living. At what cost we start to dwell in a stagnant lifestyle? At what kind of situation we begin living in it? The question about life has been trying to answer in the movies to confirm that ""living life"" is a must. However, this film able to goes beyond a tale with a simple message to a heart moving act that I recommend to see it once. Who knows what Ikiru can affect you?"
kris-oak,"Oct 9, 2006",10/10,"Simply one of the best movies ever made.Every time I see this movie Im stunned by the fact of its sincerity:the sincerity of Kurosawas vision, and his courage to without compromises follow it through.Embedded in a story of an old man, civil servant, who one day gets the information from his doctor that he suffers from stomach cancer, are all the the big features of great storytelling: allergorism truth, symbolism-take any choice from the dictionary. And its all told by the great humanist Akira Kurosawa, in his downplayed, earthy and somewhat warm ironic way. If you ever wondered about what Kurosawa was all about, watch this one.It is a true catharsis.Watch it!!"
alessandronuel,"May 25, 2019",10/10,"Only Kurosawa can turn a drama to be a compelling, moving investigation on our reason to live.To live means to serve other people and our source of happiness."
ElirGuigs,"Jun 9, 2015",10/10,"I don't mean to sound cold or insensitive when i say that Watanabe's death isn't the problem. He is going to die, it was told to the viewers back at the beginning through a remarkable use of narration (Pay attention, Hollywood). The sad part is that he didn't really live all the years his heart beat. I, also, don't think this movie is meant for everyone. It's pretty old (Almost 65 years) and has subtitles. The character isn't that connectible if you weren't in his position a long time ago and the plot develops pretty slowly. But, actually, none of these are flaws. They make the movie as good as it is. They make ""Ikiru"" the masterpiece it truly is. Back at the beginning, when we first meet Watanabe-san in his daily work routine, we may feel sorry for him (if you've been at his place) or even something that remembers pity. Because, and this is a sign of how brilliant Kurosawa was as a director, with a single take we can understand most of the character. Shimura acts brilliantly, as usual, as a every-day-man who has nothing really special. I don't think i've seen character development as amazing as this one in any other movie, not even a Kurosawa one. The way the character grows around it's own core and, in a amazingly shot and directed scene, has it's peak. He, after all, did live. And, of course, life is brief."
taonemozilchhm,"Apr 11, 2019",N/A,"Wow, I'll remember this movie for the rest of my life!"
iquine,"Jul 28, 2020",7/10,"(Flash Review)Citizens are looking to cover up a stinky sewage area with a new kids playground park and to get that proposal approved is difficult due to all the red tape. The request ultimately falls to a man at the desk with stacks of unprocessed papers. He has lived without joy for many years for reasons, which will be revealed, is a key cause to all the red tape. This man has also just been diagnosed with stomach Cancer and reflects on his life's past choices. Will he be invigorated to change his ways in his short time remaining? What downstream effects will his decision have? This was certainly directed with an experienced hand, was a very noble story, well-acted yet the pacing could have been a bit more briskly paced in the second half...coming from someone who loves Barry Lyndon. The film slowly reveals a substantial character arc and watching the impact of those around him is inspiring."
SAMTHEBESTEST,"Aug 9, 2020",8/10,"IKIRU (1952) :
Brief Review -A Japanese Classic blended by TWO Great stories on Life. In the first 30 minutes i thought Ikiru is about a changed perspective of one man on his life but then in the the second half it had another great story unfolded about other people's perception on that man life. That's Incredible! We have seen many films on similar storylines but always two different films made individually on any of either topic, not one film having two stories combined. That's a Great thing for any film released during 50s because even half of the film is an influence to make One Solid Film. Ikiru is about an old man Watanabe, who lived his life half-dead and without any meaning discovers that he has a stomach Cancer and got only 6 months left in hand. Here begins a journey of him to find the meaning of his life and do something that he hasn't done ever. It influences corrupt government officials but what difference does it make? Find out in the film. The story is inspiring and very innovative considering the human genre and may be that's why it is little slow. In the first and last 30 minutes the screenplay feels slow paced but otherwise the middle portion is entertaining. Dialogues are meaningful and i think should be treasured for Vocabulary. This dialogue by Novelist in the film hit me so hard, ""We only realize how beautiful life is when we face death. And even then, few of us realize it. The worst among us know nothing of life until they die"". Takashi Shimura in the lead role is so fantastic and amazing that I don't anything else to say. This is the 4th film of Akira Kurosawa in my watchlist and this is his 4th Classic as well which means i am gonna see more and more from his filmography. Kurosawa is A Legend and it feels like an understatement to me, he's something more. Overall, Ikiru is a Classic from Japan Cinema that will change your perspective about Life.RATING - 8/10*By - #samthebestest"
Prismark10,"Oct 5, 2016",7/10,"Set in post war Japan, we see Tokyo's bureaucracy at play. A group of women have been on a runaround being sent from one department to another with no resolve.They are complaining about a cesspool where they live. No one wants to do anything about it. In fact these bureaucrats shuffle paper but do little of consequence.Watanabe is an elderly bureaucrat who has worked for 30 years without taking a day off. He has got a nice home and accumulated a good pension. His son and daughter in law lives with him. When he is diagnosed with stomach cancer, he realises that he has little time left. It dawns on him that he has accomplished little in his life.There have been lots of movies contemplating the meaning of life but not by 1952. Akira Kurosawa examines a life unfulfilled.If you are a viewer over the first blush of youth, you could understand what Watanabe is going through. You might have built a home, raised a family, loved a woman, have a pension to look forward to, but have you really made a difference?Watanabe delves into the Tokyo nightlife including a sequence where a woman dances the Jitterbug in a nightclub and he sings a sad old song.This is not enough for him. Eventually Watanabe meets a young woman who resigns from their workplace as the job is boring. He sees in her a zest for life which is infectious. He spends some time with her.The last third of the film is set after Watanabe's death as a wake his held. His son never found out that he was dying. His work colleagues finally guessed that he was dying.In his final months Watanabe wanted to zealously accomplish something. Turn that cesspit into a children's playground and he went from one department to another cajoling and not taking no for an answer.Watanabe withstood threats and faced humiliation but showed a steely, determined side of his character.Kurosawa has made an intimate film that is moving and life affirming. About making a difference. Kurosawa made this in between Rashomon and The Seven Samurai.There is an added resonance as Kurosawa tried to killed himself in 1971, despondent that his career might have come to an end.Ikiru was remade in 2022 as Living, where it was set in post war England."
giveantake,"Aug 22, 2007",1/10,"Over 3 hours of sheer boredom, with elderly Japanese guys mumbling every line that comes out of their mouth. It was hard to tell who the main character was at times. The cinematography was absolutely awful and the old Japanese men are simply not interesting to enough to make a 3 hour movie about. How am I supposed to connect with the characters when I can't even understand what they are saying? even with the subtitles on it was impossible most of the time. The story is about a guy who lives a boring life, well the director sure managed to project that onto the presentation of the film. Hands down one of the slowest moving films ever made, this crap was made in 1952. maybe people then found enjoyment in this tedious wreck."
Steffi_P,"Nov 22, 2007",10/10,"The majority of film directors seem to have more trouble getting to grip with directing emotion than they do with acting, and often ability to convey poignancy is a sign of a director's maturity. Kurosawa however fully developed the emotional content of his pictures with Ikiru before he became a fully fledged master of the action genre with 1954's Seven Samurai.Ikiru is one of many great films in which an at-first-glance dull, faceless character is humanised and made sympathetic. Similar examples include William Wyler's Dodsworth, in which Walter Huston's ageing factory owner is rejuvenated by romance, and of course Welles' Citizen Kane, which also resembles Ikiru due to its flashback structure. These films set themselves monumental tasks, but they end up all the more powerful for the depth they give to apparently shallow characters. Ikiru sets up this conundrum from the start, announcing the dowdy bureaucrat as ""our hero"" and informing the audience that ""whatever we say about him now would be dreary"" but that soon he will really begin to live.Kurosawa, who co-scripted all his films, created one of his most finely crafted stories with Ikiru. By showing us early on flashbacks of Watanabe's disintegrating relationship with his son Mitsuo, the audience is emotionally drawn into his life. What really works though is Kurosawa's ability to construct scenes and shots with such respect for both subject and audience. He is of course aided greatly here by what must surely be a career best performance from Takashi Shimura.Sometimes naïve viewers dismiss Kurosawa as a sappy sentimentalist, and even some of his fans dislike Ikiru for similar reasons. But these people are missing the significance, not to mention the skill involved in making a work of sentimentality. It's true that Kurosawa would overdo his humane touch years later with Red Beard, but Ikiru is note perfect, and the sentimental side of the plot is nicely ballanced out by the satirical comedy on bureaucracy.For the final word, as with so many Kurosawa films Ikiru ends with a simple yet brilliant image of optimism. We finish with two children playing on swings in the playground; they jump off when their mother calls them indoors, and Kurosawa holds for a few more seconds on the swings going back and forth  an apt and poignant metaphor for an individual's work living on after they have died."
nrolett2,"Mar 12, 2000",10/10,"Truly one of the most beautiful films I have ever seen, Ikiru left me breathless and pondering the meaning of my own existence. The story cuts across all boundaries of race and culture to address the one reality that all human beings must face.  The cinematography is stunning, and the acting is brilliant.  There is a flashback scene in this movie that may be the greatest sequence ever filmed.  If you are an American who is ""foreign"" to foreign films, this one would be a perfect introduction to Japanese cinema and the genius of director Kurosawa."
Dark Eye,"May 20, 2001",10/10,"Anyone who is lucky enough to watch this beautiful masterpiece and not be touched must be made of stone.  Such is the genius of Kurosawa who didn't held anything back, as he shot every scene lovingly and truthfully.  A truly profound experience."
sigmundson,"Apr 8, 2020",10/10,It's a shame that this movie will not likely be widely appreciated by today's moviegoers. It is an amazing film in so many ways!
GManfred,"May 10, 2011",N/A,"... and a masterpiece acting job for Takashi Shimura for his incredibly moving performance as Watanabe, a dying bureaucrat who realizes he has squandered his life in his unrewarding, dead end job. What to do, now that he is facing death? That question is the key to IKIRU, perhaps Kurosawa's best picture and one of the best I have ever seen.Action fans, there is no action, no fighting, no battle scenes. This is an intense character study which hinges on Shimura's bravura acting job, who was himself an action hero in other Kurosawa films. I thought his ability to plumb the depths of sorrow and despair was astonishing, and he was able to sustain the overall impact despite the fact that he was in virtually every scene.I don't think IKIRU could be made today, or if it were it would have a very limited audience. It moves slowly for its length and requires too much involvement with its characters for modern audiences with their abbreviated attention spans. Movies for grownups are such a chore in 2011."
njdaisy,"Jun 28, 2018",6/10,"Ikiru is a film about life, Constantly complex Kanji Watanabi is a quiet I consider Ikiru to be Kurosawa first truly excellent film I can safely say that I have seen no finer film than Kurosawa true masterpiece In short. Ikiru is easily one of the greatest works committed to film I truly mean that this is one of the greatest movies of all time"
arefvakili,"Jul 27, 2020",10/10,What would you do if you know death is approaching to you fast and you have nothing to protect yourself or nothing to satisfy with. IKIRU depicts this challenging experience in the best way with a great narration and story.
churl-2,"Mar 24, 2002",10/10,"IKIRU is an amazing movie that should be on everyone's must-see list. The story is masterfully told, especially in the second half of the film, which gives the viewer a new perspective on the unfolding story.Although people can debate which of Kurosawa's films is the best, I think that IKIRU must always be mentioned. Its compelling story matches the somewhat cynical reality that it addresses.Watanabe, the protagonist, is masterfully played by Takashi Shimura, who brings the pitiful clerk character to life with his heartfelt portrayal of a man facing the end of a life not truly lived.This is my favorite film of all time. I suggest everyone should watch it, if not for the fact that it is an amazing film, then for the self-examination that will undoubtedly follow."
lowellhill,"Apr 9, 2002",10/10,"Ikiru (To Live) gets my vote for movie of the century.  If you can tolerate an older, slow-paced B&W film with subtitles, give it a try.  It's set in urban Japan, around 1950, so it's less ""foreign"" than some other Japanese films made around that time.  I've seen it in several video rental stores over the years, both dubbed and subtitled.In order not to spoil the plot, let's just say that as a result of a series of events, a bureaucrat approaching retirement age realizes that his life to date hasn't amounted to much, and, given an opportunity to reflect, tries to do something about it.  Then, just as you find yourself thinking ""Gee, that sure was a short, sweet movie!"" there is the bonus of a long and fascinating denouement.  As movies go, it's a two-fer.Now I'm firmly in the camp of ""keep your expectations under control and you'll have a better chance of enjoying the film.""  But, much as I believe that another Kurosawa film, Rashomon, illustrates human truth (one truth per person), I think Ikiru illustrates, in a wonderful story with no preaching, the meaning of human life:  it's what we put into it."
roni-usiv,"May 18, 2020",N/A,It is a story of leaving a meaningful legacy about the existence of an ordinary person.
DLochner,"Mar 11, 2024",7/10,"A film explores the search for meaning and fulfillment in life.What makes this film so remarkable is Kurosawa's masterful ability to sensitively portray his protagonist's inner turmoil and loneliness. A man who suddenly realizes that his life seems meaningless.Not only is it a simple film about mortality, but also a profound meditation on the nature of life itself. Kurosawa cleverly uses various narrative techniques, including flashbacks and unconventional narrative structure, to take viewers on an emotional journey. The moving score by Fumio Hayasaka reinforces the melancholic mood of the film and contributes to the overall effect.Overall, ""Ikiru"" is a masterpiece that captures the essence of life in all its complexity. It is a thought-provoking film that makes the viewer think about their own priorities and the meaning of their life."
jebous,"Feb 2, 2004",10/10,"The film's structure alone is masterful. The storytelling techniques used by Kurosawa are still unmatched. Also worth mentioning is the acting-Shimura Takashi proves himself as one of the greatest actors of all time with his portrayal of Watanabe Kanji. You may recognize him from his role as the wise leader Kambei in Shichinin no Samurai, but this is his greatest achievement. Several of Kurosawa's core group of actors are also in this movie, such as Fujiwara Kamatari. I would recommend this film not only for film buffs, but for anyone interested in powerful, intelligent cinema."
thinbeach,"Jul 21, 2019",1/10,"So a mans lifetime work is ridiculed, and we're supposed to believe instead that he would've been better off ""living"" - defined as skipping work for numerous days, drinking copious amounts of alcohol and visiting strip clubs, all based on the advice of a random stranger met in a bar? I can only assume the high rating of this film is due to sensitivity towards the irreproachable topic of cancer, which maybe, just maybe, the filmmakers were using to leverage more sinister social ideas."
sc8031,"Jul 6, 2008",8/10,"This is a good film, though extremely slow. There are no real spoilers: the film is told in two parts and we understand that the protagonist is going to die within the first few minutes.Takeshi Shimura is pretty good as the reserved protagonist. Perhaps something of a character actor, his demeanor works well here. Kurosawa actually hired the same acting company for most of his well-known films from this period, so you'll see all the familiar faces from Seven Samurai, Rashomon, The Lower Depths, The Bad Sleep Well, etc.The film relies quite a bit upon the ability of the actors and actresses above all else. Much of the film takes place upon a couple of sets. The only problem here, as one reviewer pointed out, is that few people will be willing to sit through a long movie about an old man who gets stomach cancer. Especially when they already know the ending from the beginning!But still, this is classic polemic yet heart-warming Kurosawa. A little long-winded, but certainly relevant. Watch it if you got the time or are a bad guy with an icy heart."
ssssgelojun,"Aug 11, 2020",9/10,"""Maiden, let's fall in love and not waste time.""
In every corner of the earth, there is a terrible and precious thing, that is time.
Everyone has it, but everyone wastes it!
We put off doing what we want to do for survival, career, family. In the end, we ask ourselves what have we gained? Only to find that we had wasted our time with empty hands.
Do what you want to do and don't give yourself any excuses.
Love thyself, not for thy son's sake;
Don't stop for fear of losing your place;
Don't let work stop you from enjoying yourself.
""Fall in love now, maiden.""
Now is the best time to let your fears stop you.
Right now, do whatever comes to mind!"
filmboy-4,"Apr 15, 1999",10/10,"A council clerk finds out that he has Cancer and has a matter of months to live. After a series of experiences he realises that he has never truly lived and only starts truly living when he is dying. Realising he should live every moment as if it his last. A film that questions the way we live our own lives and at the end has a twist, after the wake and all the promises have been made to change you go to the same situation at the beginning and rather than learn they simply carry on as usual, forgetting the promises they had made. The film manages to capture human nature perfectly and some of the techniques to convey this were absoloutley brilliant. A truly remarkable film from arguably the greatest film director, Akira Kurosawa."
macey,"Feb 27, 2002",10/10,"The most painfully beautiful movie I've ever seen. It's a Japanese film made in 1952, yet I've never felt a movie speak to me more clearly than this did. It touches on a subject we all face - Death, and how to live life under it's shadow. And it deals with it in a beautiful and profound way. Takashi Shimura gives the performance of his career. And Kurosawa is more personal than he's ever been. The themes dealt with here have more recently been seen in the modern classic 'American Beauty' revealing just how timeless this story is. Give it time, it gets better every time I watch it. Kurosawa's most enduring work."
