user,date,rating,content
Uriah43,"Mar 27, 2025",8/10,"This film begins in the early 1960s with a Marine Corps draftee named ""James T. Davis"" (Matthew Modine) reporting for duty at Parris Island, South Carolina, to commence basic combat training. With him is a particularly slow individual named ""Leonard Lawrence"" (Vincent D'Onofrio), who constantly gets the entire platoon into trouble due to his inability to follow the commands of his drill instructor, ""Gunnery Sergeant Hartman"" (R. Lee Ermey). This prompts the platoon to confront him physically one night, underscoring the seriousness of the situation for everyone involved. It works, and he immediately adopts a more serious attitude. What nobody realizes, however, is that Private Lawrence is now mentally unstable, and this will eventually lead to severe repercussions for the entire platoon. Now, instead of revealing more, I will note that this film is one of the better portrayals of the Vietnam War, as it shows the human carnage up close and personal. There are, however, a couple of minor flaws that most people who have never served in the military may not notice. For instance, in a specific scene, Sergeant Davis is questioned by a Marine Corps colonel about a peace symbol he wears on his uniform. The issue is that such a conversation would likely never occur, as no field-grade officer would attempt to reason with anyone regarding a uniform violation; they would simply order him to remove it. To be sure, the rules regarding the wearing of the uniform were quite relaxed during this particular time and place, and it is entirely possible that something like this would go unchallenged. However, if it were challenged by such a high-level officer, no philosophical discussions would be involved. That aside, I thought this was an excellent film about the Vietnam War, and I have rated it accordingly."
paul-87,"Sep 9, 1998",9/10,This is possibly the greatest war movie ever made. I have seen Platoon but I do not think it is quite as moving. This movie contains a lot of adult language but the story in this makes up for it totally. I have seen many of Stanley Kubrick's works but this one is truly my definite favorite.
Theo Robertson,"Sep 1, 2002",7/10,"FULL METAL JACKET has one of the most bizarre structures in film history. The first half of FMJ is rightly regarded as being one of the great segments of cinema . Kubrick/Herr/Hasford`s razor sharp script takes us on a blackly comical tour of the horrors of basic training with Sergeant Hartman , private Joker and Leonard Lawrence being the central characters , but then the film cuts to the battlefields of `Nam with only a couple of characters like Joker and Cowboy linking the two segments . Also disappearing is much of the first half`s wit with only the irony of American firepower bringing down tower blocks in retaliation to a sniper being the only real clever and knowing aspect to the script . It`s confusing too because with the exception of Joker and co. the rest of the film doesn`t really tie in with the basic training segment , perhaps the film would have worked a lot better if the entire film was taken up with the basic training ? And I can`t help noticing that much of the terrain doesn`t really resemble the jungles of South East Asia , as everyone knows FMJ was filmed in and around London and it often shows. Still it`s a film worth watching if only for the basic training scenes which are certainly more convincing than those seen in HEARTBREAK RIDGE . A couple of questions though ...If there`s any former USMC men out there could you write in and tell us how realistic the training scenes are ?I used to be in the army myself ( Royal Engineers ) but we never EVER called instructors "" Sir "" . In fact if someone in the British army made that mistake they`d receive the reply "" Don`t f****** call me sir . I work for a living "" along with a few other choice insults .  Is it a common practice for American recruits to call their instructors "" Sir "" ?"
freethinkingworld,"Dec 15, 2022",8/10,"So I have finally found a Stanly Kubrick Film I like and have not had to rewatch it a bunch before I end up liking it! I doubt after finishing a full watch through of his films that this will be my favorite, but it was really good and definitely deserves the reputation of must watch for war films and just in general. I do think the view that the first half is stronger than the second half is true. But both parts of the movie are well done and brilliantly acted. Obviously the performance of R. Lee Ermey and Vincent D'Onofrio were the highlight of this movie. But I found every performance solid and well done."
Robert-53,"Oct 31, 1998",6/10,"This is really one of the most disjointed films ever made--the first half of the men going thru the Marine Boot Camp is truly the finest depiction ever made--the drill sgt. used to be a real one which really adds the authenticity. But when the movie shifts to Viet Nam, the whole movie falls flat--the whole audience is bored listless wondering what the point is. A few vague references to ""the duality of man"" are made but never explored, the characters are shallow and cardboard. The movie was taken from a short story, ""The Short Timers"", but if that story had a message it's completely lost in the movie. In short, see the first half which will hit you like a ton of bricks, then get ready to read the paper or just skip the whole 2nd half entirely."
Michael_Elliott,"Aug 30, 2010",N/A,"Full Metal Jacket (1987)*** 1/2 (out of 4)Stanley Kubrick's film follows a Marine (Matthew Modine) from his basic training with a brutal Sny. Sgt. (R. Lee Ermey) to a final showdown in Vietnam where a group of soldiers are being picked off by a sniper.Kubrick's return to the cinema after a seven year break came with a film genre that has pretty much played itself out in the past eight or nine years considering we got films like THE DEER HUNTER, COMING HOME, APOCALYPSE NOW as well as PLATOON. Many critics panned the film for being too familiar while others called it a masterpiece that showed the war unlike any movie before. I've always had a love-hate relationship with FULL METAL JACKET and it's probably a film I've seen more than any other Kubrick even though I think it's one of the director's lesser films. There's no question that the first hour is a masterpiece but I've never warmed up to the second half for several reasons but as any Kubrick fan knows, the more you watch his films the more you notice different things.This latest viewing of the film had me enjoying the second half of the picture a lot more than any previous time. I think one reason was that I got to see it theatrically on a very large screen and it brought out certain elements that I had never really picked up on before including the incredible cinematography. The camera-work has always been a strong point to every Kubrick film and I really loved the way that the camera pretty much just floats around during the second half picking up the action as it moves along. This really gives the viewer a first-hand look at everything that's going on and it really does put you in the middle of the action and this is especially true during the final portion where the marines are going up against a sniper.I still have some problems with this sequence including the interviews that are done by the film crew. I can understand why Kubrick would include these scenes but to me they really don't add enough to warrant their inclusion in the film but who knows... Perhaps my next viewing I'll see them in a different manor.The first half of the film is probably the most unoriginal as the training camp sequence has been seen in dozens of films going all the way back to the silent era yet Kubrick shows it in a way that makes it an unnerving thrill that will wreck each of your emotions. Kubrick paints some very dark humor in the film and most of it at the expense of Pvt. Pyle (Vincent D'Onofrio), an overweight idiot who gets tortured not only by the drill Sergent but also the men in his group. I've always seen the first half of the film as a portrait of how much a man can take before finally cracking up. The picture shown here certainly needs to give credit to D'Onofrio but the main credit goes to Kubrick and that amazing vision.The way the camera glides around much like it did in THE SHINING brings the same claustrophobic sense of dread and one can't help but get caught up in the story. This portion of the film has some very funny moments but it's also incredibly disturbing simply because of the abuse Pyle takes and you can't help but feel sorry for him but at the same time you too want to hate him because of how stupid he is. The scenes are quite shocking in a way because of how raw Kubrick makes them and its this rawness that really makes this stuff seem fresh even though we've seen it before. Kubrick was a master with the camera and it's just amazing to see how quickly our emotions can change as one second we'll be laughing only to have that quickly go away as something darker happens.This first hour can easily be called a masterpiece because of how raw and powerful it is and in the end there's really not another basic training sequence that can compare. The second half has certainly grown on me with this latest viewing but I still think there are just a few too many flaws here for me to call the film a masterpiece or even a great movie. With that said, for countless viewings I said the same thing about THE SHINING but now that's on my list as one of the greatest movies ever made."
AlexMedario,"Apr 7, 2020",9/10,"Sorry that I cannot include the whole sentence, that summarizes very well the bottom line of the movie. This movie is full of memorable sentences, so is that that I remember a few of them even now after so many years. I watched the movie first time when it was released and a couple of times recently. It has aged very well, I'm glad of having watched it again and my high opinon about the film remains the same."
FromRiches2Rags,"Mar 19, 2025",10/10,"I was in my teens when I first watched this. Like most films from the 80s and 90s I thought it would be unwatchable now that I'm in my late 40's.However that is not the case. This and The Shining are the only Kubrick films I've seen as I could not watch his other popular films for various reasons.Stanley Kubrick manages to make the viewer feel the pain of certain characters in a situation that they did not want to be in up to the point when the soul of that person leaves their body.No other movie comes close to the way that Kubrick achieved this. Add the political message that this film oozes and you have one of the best war films ever made.Platoon and Apocalypse Now are not on the same level as this. I cannot watch them again despite watching them multiple times in the early nineties.There is something beyond the limits of time constraints that this film surpasses. I appreciate Stanley Kubricks message. I wish he did one on Iraq, who knows he may have done had he been alive.Looks like he tried to expose a lot more with Eyes Wide Shut so he was unalived and his vision for that film was butchered. Haven't seem it nor would I want to watch his cut either but look at the Hollyweird situation today and you will realise what Mr Kubrick tried to do regardless of the majority voice without a moral compass stating otherwise."
mdf-87936,"May 30, 2022",8/10,"I absolutely love the first half of FMJ. R Lee Ermey knocks it out of the park. His performance is both hilarious and terrifying. At first you wonder how he could be so cruel, yet slowly understand why he is doing what he's doing. He goes from calling the recruits ""worthless"" to ""maggots"" to finally ""Marines"". He sees their growth and that's why he was so strict. I've heard that many DI's during Vietnam would check the daily death notices to see if anyone they trained was killed. I can only imagine that Hartman would do this as well and his heart would sink had he recognized any of the names.As for the second half of the movie...meh, it's OK. It is no where near as memorable as the beginning. Everyone I know who has seen it can quote the basic training scenes almost word for word. The Vietnam scenes kinda go by the wayside."
Hidden,"Oct 13, 1998",10/10,bets movie ever made and if you don't think so i'll test you to see if you are a v.c.
ronbell-23984,"Feb 12, 2021",6/10,"The first half of the movie was excellent throughout the soldiers training, culminating in the drill Sergeant getting shot / private pile suicide scene. After that when the troops were in Vietnam it got boring. Yes it's a movie about war which is a serious subject but I switched off as I lost interest. Could have been brilliant after such a great first half."
endoflongshot,"Jun 23, 2005",10/10,"A very disturbing film about the Vietnam War, much darker than any of Kubrick's other films. The Music stands out as a major contributer to the film's mentality. Kubrick likes to use music of the time his films takes place, and it made perfect sense for Full Metal. The film really gets into the minds of the soldiers. What Apocalypse Now was for the Air Cav, this movie is for the Marines in Vietnam. The film's major point is the Duality of Men, and the beauty of Kubrick's shots helps instill a feeling of Victory even though all you see in the film is defeat. This is the most beautifully shot war film I've ever seen, even better than Terry Malick's Thin Red Line. Shots are crisp, perfect, colorful and each scene has its own embrace and feeling, paired wonderfully with the music. All in all, a beautiful war film that delves deep into the psyche of a solider in the Vietnam era. The perfect blend of Tragedy and Energy. the perfection of Stanley Kubrick."
jyanagi,"Aug 18, 2002",2/10,"This movie has always been a real disappointment for me.  While its portrayal of the Marine training sequence is powerful and memorable, Kubrick continues to do a less-than inspiring portrayal of combat in Vietnam. Approaching the diaspora from a different angle than Stone, Kubrick hits upon some of the classic themes left (appropriately) untouched by Platoon. Yet, in some cases the ubiquitous slow-motion violence is needlessly gratuitous and the round-the-body one liner reflections and face-the-camera montage interviews are cheesy, if not reminiscent of other great 'camera-focused' escapades like Kevin Pollak's ""Opposite Sex"" and the recent ""that 70s show"".Pop music is played too often as if FMJ begins to lean towards a self-indulgent glorification of the 60s, even in inappropriate and distracting places.  Who can forget Joker and his colleagues (the few bright spots of the film: character development), but the movie fails to depict the subject matter in a realistic or subdued matter when needed.It seems as if to Kubrick, Vietnam is not a war where Americans were forever traumatized, but rather just another stage for pop culture to spotlight the trite 'duality of man' in an 'animal setting'.  I hated the movie.  This movie does little justice to the memory of those who were in Vietnam.  The movie immediately strays and wavers, becoming an uncomfortable hybrid between 'popular nostalgic war formula' and 'psychological thriller' and proceeds to do both very poorly."
austin0731,"Jun 8, 2019",8/10,"Kubrick's Full Metal Jacket is celebrated as one of the best depictions of the Vietnam War and perfectly captures the dehumanizing process of war. The movie is essentially split up into two halves, the first half set in a bootcamp and depicting the main characters being humiliated and hardened into killing machines for the US marines. While the second half focuses on the soldiers after they have been deployed in VIetnam and now the war has a dehumanizing effect on the soldiers.The performances are great, from Vincent D'Onofrio's pvt. Pyle to R. Lee Ermey's Sgt. Hartman to Matthew Modine as Pvt. Joker, all of whom delivered stellar performances that indicate the great machine that is the military boot camp system and war as a whole, its effects on the human psyche.Over the years there has been countless analysis and breakdowns of Full Metal Jacket, its themes and what it all means. I think that just goes to show the brilliance of Kubrick, to him it isn't about giving audiences a question and an answer but to present us with a rhetorical question that we can sit with and discuss amongst each other. I really enjoy the ambiguity of each key scene yet it is presented in such a way that as an audience you wouldn't just take for what it is, there is a sense that everything means more than face value and thus, is the beauty of Full Metal Jacket."
DontReedIntoIt,"Jun 20, 2021",8/10,"As someone who was born in the late 90s, I wasn't privy to what life was like during the vietnam war but just hear brief anecdotes it's seems like while most average individuals were openly against the war, big corp., industry and government kept silent. So being able to look back and place a film that openly went against the big gov. Agenda is awesome! I hope more writers, directors, producers and creators alike take notes and remember that values DO have a place in art and media. Great work, thoroughly enjoyed the mix of comedy and darkness that came with this piece. Kind of felt like 2 different movies but one in the same simultaneously? Don't know what to make of that but I definitely enjoyed watching!"
GOWBTW,"Jun 10, 2006",10/10,"Stanley Kubrick has put up another fine masterpiece about the USMC getting reading for the Vietnam War. ""Full Metal Jacket"" shows how Marine life is not child's play, and the Drill Seargant from Hell(R. Lee Ermey, aka ""The Gunny"") really performed well in this movie. It is set in Parris Island, S.C., were the main Corp was locate to whip these civilians into shape. Gunnery Sgt. Hartman(Ermey) is one heck of a bad-a$$ Drill Sgt. who takes no crap from anyone. He didn't discriminate anyone, he treated everyone like an equal. However, he tortured Pvt. Pyle(Vincent D'Onofrio) so bad, he went over the edge after the training. He marched with his pants down, sucked on his thumb like a little boy, and had to endure a very brutal beating from the other Privates. Socking a drill Sergeant will call for a discharge or time in confinement, shooting him will result in court martial, and a dishonorable discharge. Of course, Pyle discharged himself with the same gun. The other went on and the brutal battle is ensured. The Marines don't play around, and they really show the sign of brotherhood of the Corp. The chants the Gunny made was a classic. ""This is my rifle, this is my gun..."" is the one song I think should be shared to only the military. It's always lock and load. This movie is a must for all members of the USMC. Whether they are recruits or vets, I this this movie a major SEMPER FI! CARRY ON! 5 STARS, OORAH!"
FredTipp,"Feb 4, 2021",7/10,"I use to love this movie but after a watched it again on TV last night (for the first time in 20 something years) I realized that time has not been kind to it. (As it seem to happen to a lot of Kubricks movies).First half with the boot camp, drill Sargent Hartman (R. Lee Ermey) and arrival in Vietnam is still great, but as soon as they hit battle it all becomes just embarrassing and disappointing display of mediocre acting and strange directing. No realism at all from a military point of view, not even a little. And the soldiers behavior in battle are completely unreal, all the time.Poor acting or poor directing? Maybe a little bit of both. Kubrick was clearly looking for something else than realism when he made those city battle scenes, but whatever it was he though he caught (and brought) to the silver screen it's all gone now. Well, except for the score (not soundtrack) that is still top notch. Still, I'm lowering my grade to 7.There are a bunch of way better (even older) movies to watch that explores the Vietnam war tougher, rougher and definitely more realistic."
UniqueParticle,"May 31, 2019",10/10,"Shockingly intense especially the first half! I'm sure Vincent D'Onfrio struggled to maintain sanity during filming being how authentic everything was, and R. Lee Emery was so menacing! The second half is outstanding war perfection with an excellent soundtrack to go with it. I'm usually barely a fan of war films but this is among the best."
