user,date,rating,content
vernonbejarx,"Dec 6, 2024",10/10,"Kanji Watanabe discovers that he has cancer, and tries to seek some sort of meaning in his final days, he becomes aware that he's operated as a cog in the giant domestic machinery, and fights against the system.I've been working my way through The Kurosawa films, and thus far I've been impressed with the lot, I'll be honest, I expected a Samurai film, and when it became apparent that that wasn't the case either, I thought it may have been a mystery, it wasn't that either, instead it turned out to be a rather intimate, absorbing character study.It shows that despite being essentially part of a machine, Kanji has a very human side, only he realises it too late.This film moved me to tears on occasion, it had me laughing, it certainly had be captivated for the whole running time. That moment where Kanji explains what's happening to his son, it was phenomenal.I am learning more about Kurosawa with each film I watch, but I must admit, this one threw me totally off guard, it wasn't what I was expecting, it further enhances my realisation that Kurosawa was a genius.Remember all work and no play! There's a really meaningful message in this film."
benprichardsdotcom,"Feb 14, 2024",9/10,"With brutal honesty I admit that despite loving Japanese cinema that love hasn't extended much beyond Ghibli and some early Manga (Akira) but I've read quite a few Japanese novels and I've had the pleasure of travelling around Japan for 5 weeks.There's something wholly cleansing about the childlike honesty and purity of Japanese culture that's an antidote to the excesses of western consumerism. This heartfelt tale Watanabe and his coming to terms with the vagaries that confront him will enrich your life.Kurasawa is a proper film maker, unapologetically hegemonic and all the better for it. If you're sick of Hollywood watch this."
atlasmb,"Dec 13, 2016",8/10,"""Ikiru"" is the story of one man--Kanji Watanabe (Takashi Shimura), a government bureaucrat with a boring and meaningless job. He keeps his head down and never questions the status quo or his place as a cog in the machinery of local government.When he realizes he has little time left to live, he thinks of death, then the choices he has made in life. He is absent from work for the first time in thirty years, lost in reverie and unable to cope with what he sees as his failure to achieve anything of value.The viewer, guided by a voice over, knows Watanabe is having an existential meltdown, and wonders how this character can ever find redemption in his own eyes.He tries a variety of new experiences (shades of Ferris Bueller). But he still feels a failure. Eventually, he returns to his job and attempts a new strategy.""Ikiru"" is a tribute to those who get things done. Other films have celebrated the kind man (""It's a Wonderful Life""), the principled man (""12 Angry Men"" or ""To Kill a Mockingbird""); ""Ikiru"" celebrates the man with a vision and the determination to carry it out, especially in the face of bureaucracy.Director Kurosawa called ""Ikiru"" his greatest work, perhaps because he valued its universal themes. Shimura--a Kurosawa favorite--acts with minimal expression. Watanabe is a sponge soaking up his environment. He is a blank slate upon which we paint our own faces and confront our own truths.This is a film that deserves to be seen."
ayckara,"Jan 11, 2024",10/10,"""Ikiru"" is undoubtedly a masterpiece that showcases a mastery of defining the boundaries between life and death; there is no need to debate this. However, it also documents this characteristic by prompting the audience to embark on a quest for ""judgment."" When you see this film, you cannot help but reconsider the reasons for your life (or living). The pivotal moments in our lives, guided by right or wrong choices, become unavoidable to recall. Although this may lead us towards disappointment and despair from one perspective, it also opens the door to questioning whether it is ever too late. ""Ikiru"" conveys the message that preventing the monotony of a perspective that trivializes details is within our control, reminding us not to become mere ""living dead."" It emphasizes the necessity of living a life open to risks."
pranabchaudhury,"Jan 7, 2026",9/10,"Kurosawa gently asks, with a soft but firm tap on the shoulder, ""So... what are you doing with your life?"" What begins as a bureaucratic drama turns into a surprisingly tender, ironic, and life-affirming punch to the gut. With heartbreaking simplicity, dry humor, and a deep undercurrent of sadness, the film proves that meaning isn't found in grand gestures-sometimes it's just a swing set in the snow. Quiet, cheeky, and devastating in the best way. By the end, it doesn't preach; it simply sits with you long after the film is over. Probably my favorite Akira Kurosawa film."
Bibliophile100,"Jul 29, 2024",9/10,"I've recently dived into the history of one of the most amazing, prolific, and legendary Japanese film men of all time: Akira Kurosawa! I've started his filmography with this movie, Ikiru (To Live), and what a touching film it was!Mr. Kanji Watanabe is an apparently ordinary, uneventful man, having been working the same job for the past 30 years. Nothing ever really happens for, or to him in his life...until one day, he receives an unexpected medical diagnoses: stomach cancer! With less than one year to live, Kanji summons up his inner desire to try and enjoy something truly memorable, make as many memories as possible, and perhaps leave something behind for everyone to remember him by, once he ascends to Heaven.I was very engaged and focused with Kanji's predicament, watching as he tries to find some excitement and joy to satisfy him before he dies, telepathically encouraging him to not give up. He meets two different people who attempt to help him find some excitement. One person is an eccentric writer, but he mostly just takes Kanji to bars and clubs, which don't seem to be satisfying him. The other person, is a woman named Toyo, to whom Kanji finds himself attracted to. I personally liked their chemistry and relationship much better; their interactions seemed to be much more eventful, and Kanji seemed to be engaging more and more in life each time he and Toyo meet. Toto eventually shares a fun fact or two with Kanji, and Kanji reveals his cancer to her. I'm glad the two didn't actually become lovers, just friends, because friends are usually one of the best things to cling to if you soon will be leaving the land of the living, as is the love of family, though Kanji's family don't show too much love and support for him, partially because they are unaware of his cancer, but also because they are fixated on inheriting Kanji's money and other belongings. Had Kanji and Toyo became lovers, I suspect that may have created more conflict between the two, and that conflict may have spread outward, and affected Kanji's family and employees, whom he works with.What a gentle, moving, touching, and adventurous movie Ikiru was! I enjoyed it a lot! Take this movie as a reminder to always embrace and enjoy life the best you can! Make as many friends and memories as possible, and most of all, take the love your family and friends give you, and give your own love to them, for none of us know when exactly, our time will come, to leave life, and enter eternal life..."
mejiajohnlester,"Aug 2, 2024",10/10,"This film is an extraordinary blend of creativity and technical excellence. The story is both engaging and thought-provoking, offering a fresh perspective that resonates long after the credits roll. The characters are richly developed, and the actors deliver performances that are both heartfelt and captivating. The cinematography is nothing short of stunning, with each frame meticulously crafted to enhance the overall mood and theme. The film's score is evocative, perfectly complementing the narrative and heightening the emotional stakes. The pacing is expertly managed, ensuring that each plot twist lands with maximum impact. From its impressive visual effects to its insightful storytelling, this movie stands out as a shining example of cinematic artistry. It's a compelling watch that is sure to leave a lasting impression."
bonjsumio,"Sep 22, 2024",10/10,"Ikiru is a deeply moving and introspective film by Akira Kurosawa that explores the meaning of life in the face of death. Takashi Shimura delivers a masterful performance as Kanji Watanabe, a bureaucrat who, after learning he's terminally ill, searches for purpose in his final days. The film's delicate portrayal of regret, mortality, and redemption is profound, offering a poignant reflection on how we spend our time and what truly matters. Kurosawa's storytelling is both subtle and powerful, and Ikiru leaves a lasting emotional impact, urging viewers to live with intention and compassion. I love the film."
JCR-7,"Jun 27, 2001",10/10,"This is the ultimate film. the story is just magnificent, the acting is out of this world and Akira Kurosawa's directing is stamped with virtousity. I just can't say too much about this film, it's just divine. Akira Kurosawa masters the retrospective technique brilliantly as Kanji Watanabe's fellow colleagues memorises his last months. Akira Kurosawa is my all-time favorite director (along with coppola and QT) and I consider this film as one of the greatest films ever madeDo and see it, and be amazed.."
truemythmedia,"Jun 27, 2019",10/10,"About halfway through the movie I still wasn't entirely sure how I felt, but by the end it had won me over completely. This is a brilliant film from an incredible filmmaker and I honestly can't recommend it enough. It's a celebration of life alongside death, for the two cannot exist without each other. This is a film that preaches one of the greater truths I've seen displayed in cinema: live a good life and your death won't be meaningless.
For our full review of Ikiru and hundreds of other reviews, articles, and podcast episodes visit us at True Myth Media!"
psilt,"Jul 3, 2002",10/10,"Kurosawa tells story with timeless arguments, people having their success, choices and failures within society. As his style is, Kurosawa paints excellent pictures towards viewer about humanity, beaurocracy and values of human life. This movie must be viewed with though, and it will raise ones, too. Most moving and entertaining story."
ShamimH,"Feb 4, 1999",10/10,"This film is a reminder to all of us, that our stay in this life is finite. One of Kurosawa's early film, it brilliantly portrays the story of an ordinary bureaucrat who suddenly finds the meaning of life, but at almost the very end. This movie will refocus your priorities, in a way very few movies ever can!"
pasanmadhusankha,"Aug 5, 2020",10/10,"One of the best and the deepest movies I have ever watch, and have to mention the song at the restaurant. That song has the ability to open eyes toward the purpose of life."
poe426,"Jan 15, 2002",10/10,"The remarkable Takashi Shimura takes center stage in this bittersweet tale of a minor official whose life in microcosm is the drudgery of maintaining the status quo. In the capable hands of the greatest filmmaker of the twentieth century, Watanabe's story slowly unfolds and we are along for the ride. It's a one way ride, to be sure (there are no easy answers here, and Watanabe is cast adrift like a man stunned by the hammer), and Kurosawa never loses focus, never flinches; never opts for an easy out; we FEEL for this man who must come to terms with his own mortality (which he does, in break-your-heart fashion). There are lessons to be learned here, for all of us must (at some point in our lives) learn ""to live..."""
ebrown2112,"Oct 21, 1998",10/10,"One of the greatest films ever by arguably the greatest filmmaker ever. Watching it, I did not feel as if I were viewing it through a cultural or temporal filter.  It seems as relevant in modern America as it does in 1950's Japan."
Chaser923,"Jul 13, 2021",9/10,"Wow, what a great story. I think I barrrrely liked this more than Seven Samurai. But anyway yeah this movie was actually really deep. The lessons in this movie are actually very important: Don't waste your life. Live a little, don't try to just pass the time. I know it's a ""sad"" film, but by the end I couldn't help but feel very satisfied and happy. The only thing holding this movie back for me is (I'm sorry for this) it's AGE. Old movies (<1965) like this just aren't as impactful on me as newer ones. I know many people would disagree with that and defend these older films with their lives, but I just find more entertainment in newer movies. But I cannot deny this films greatness. A great ending, amazing moments throughout, amazing character arc for the main character, just all around a very well made film. Akira Kurosawa really knows how to make movies."
Norwegianheretic,"Aug 30, 2023",10/10,"I could say that it's Kurosawa's greatest (which it is), I could say that Takashi Imura, the star, gave the greatest performance in all cinema history (second only to Chaplin's in the closing moments of City Lights), or I could say that the structure of the script was astonishingly innovate (which it was) - but the thing this film did for me was to save my life in the sense that before I saw it, I never realized how valuable my life was, the things that I could do with my life, and the same is true for all living humans. Kurosawa's contribution to film with Ikiru was much much greater than making an astonishing motion picture, as the title says 'To Live', he has taught me what it means to live and brought newer meaning to every day I have left to live and Kurosawa himself lives on in the soul of everyone who has seen and been so deeply touched by Ikiru."
MlleSedTortue,"Aug 18, 2020",10/10,"Any praise one can give to Ikiru is an understatement. In a filmography composed of masterpieces, I find Ikiru to be one of the most heartfelt and poetic works from the master Kurosawa.Takashi Shimura is Kanji Watanabe a committed bureaucrat in post war Japan. For decades there was just one constant in life, work. In an instant this reality is shattered as Watanabe discovers he little time remaining. And thus Watanabe sets out to live life, to discover the intricate beauties of the people and world around him.Shimura gives the performance of a lifetime. He disappears completely into the role. Every action, every expression, is portrayed with so mach heart I cannot imagine the film without him. This also holds true for the rest of the cast. Each character is given such life and unique subtleties that work well off of Shimura. Kurosawa's direction here is some of his finest, the film being so beautifully shot and composed. And the end, so heartbreaking yet so hopeful. The film is truly art in every sense of the world and stands as one of the finest films ever made."
jaredtonsfeldt,"Mar 23, 2022",10/10,"This is the kind of movie you watch to reinvigorate a love for life. Kurosawa's most intimate and most moving work, especially when you consider other works where he lets his nihilistic views take center stage. Just a powerful movie with a stunning Lead performance."
Spondonman,"May 25, 2008",8/10,"Over the years I think I've devoted nearly half a day of my valuable time watching and re-watching this multi-layered masterpiece. One of its main messages to me is : what would I do in a similar position to the protagonist of the story? Most of us belong to the wage slave class and are in work roles utterly useless to the greater humanity, what would we do if told we had a few months to live (disregarding the fact that even 100 years/1200 months is an infinitesimal fraction of a geological eye-blink)?Watanabe-san is the buck-passing rubber-stamping Section Chief of the Public Affairs Dept. in City Hall, never having had a day off in 30 years until told (in a roundabout way) that he has terminal stomach cancer. He goes AWOL, does a little drinking and flirting and finally comes to the conclusion that he needs to leave something constructive behind him. It all unfolds in Kurosawa's usual inimitable fluid story-telling style  he left behind a beautiful b&w Japanese film languidly but constructively dealing with terminal illness that can still hook people in to this day. Favourite bits: In the bar where Watanabe-san mournfully groans out his requested song Life Is Brief to the suddenly electrified patrons  and us; the stark contrast between him and his confused state and the young and healthy flibbertigibbet he spends a few days with; the flashbacks of him doggedly pursuing his pet project at City Hall; the culmination of everything on the playground swing at 11:00 pm on a snowy night. No good doing that here  the park would be full of losers instead of winners like him.To the impatient I suppose it would be pretty slow at times, but in the hands of this particular Master I wouldn't have minded it lasting another hour. Beautiful, poignant, elegant, thoughtful, wistful, powerful  and imho not Kurosawa's best either! In other words, a film other directors would die for."
SnoopyStyle,"Nov 15, 2015",8/10,Kanji Watanabe is a widowed bureaucrat as the city's public affairs section chief. The bureaucratic machine has ground any ambition out of him. He has slowly climbed up the ladder by doing nothing and therefore doing nothing wrong. He discovers that he has stomach cancer and probably only six months to live. He is lost. He doesn't go to work and takes out his life savings. His son is shocked. He spends a wild night with a writer but he feels empty. He spends some time with a young exuberant female staffer. Eventually he decides to make a difference through his work.This is a movie that makes one think about one's own life. It is a compelling everyman movie. The last third isn't quite as compelling without Kanji. That part does have a point to make but it could have been done in a shorter way. This is a Kurosawa classic and an important one.
MarcoParzivalRocha,"Oct 4, 2020",10/10,"Kanji Watanabe, a bureaucrat workaholic, tries to find his purpose in the world after discovering tgst he suffers from terminal cancer.Master Kurosawa's most emotional and moving film, and his best work besides the samurai theme. Everything in this film flows the way it is supposed to, with no boring moments, with the right pace since the initial exposure to the climax, fabulous interpretations and such an authenticity only at the level of the best in the industry.I see Ikiru as the most sentimental and beautiful satirical film about bureaucracy ever made.An exemplary life, leaded by the (supposedly) right values, or a bohemian life, full of lust and the satisfaction of carnal desires, is meaningless if the heart does not have the right reason to keep beating, and that is what Kurosawa wants to show with this work of art.""I can't afford to hate anyone. I don't have that kind of time."""
angelesoviedo,"Apr 18, 2022",8/10,"This is the type of movie that will teach you about life. We follow this man that has had this burocratic boring job for thirty years, on top of thism he finds out he's terminally ill. This is why he decides to start living life a different way.Loved this film and its message."
De_Sam,"Dec 15, 2016",9/10,"Probably 黒澤明 (Akira Kurosawa)'s most realistic take on his humanism; one should try to do as much good as he/she can, but should also expect resistance at every turn in this endeavour. That goes double for the societies we live in today, were we are so interconnected you cannot accomplish anything on your own, you will have to rely on others and while it can be difficult to motivate yourself, just imagine how borderline to impossible it will be to convince those others to partake in your actions out of something as old-fashioned as altruistic philanthropy. People being too self-centred, departments more interested in maintaining their continued existence by evading their responsibilities, it all still rings true today.Yet, lest one wallow in the cynicism that pervades parts of the film, he/she should remember that individuals can still achieve meaningful feats even in the face of such adversity. Let that be the most optimistic message 生きる (Ikiru) conveys. Plus, I give it extra credit for conveying said message without even a hint of moral obligation or patronising attitude."
etg1701,"Oct 29, 2007",9/10,"It is unfortunate that Japanese television calls to mind overly elaborate mecha battles and bizarre scenes of tentacle monsters, for this film portrays an altogether different side of Japanese cinema. It tells the simple tale of a dying man, Watanabe, and how he reacts to the news of terminal stomach cancer over the course of several months. Despite its serious premise, Ikiru balances sorrow with clever touches of humor, such as an early scene demonstrating effectively the bureaucracy at which Watanabe works. Those expecting the rapid and action-packed style of modern films will no doubt find it slow and even ponderous at points, but I believe it hearkens back effectively to the days before movies driven fancy special effects and action at every turn."
Farzad-Doosti,"Mar 3, 2022",8/10,"A film that realistically deals with the social and political issues that governed Japanese society in those years.Apart from the fact that Kurosawa explores such a big issue as life and death in his film, he makes a lot of jokes about his country's administrative system. Kurosawa's film is astonishingly both funny and tragic.Seeing this movie, one thinks, life is short!"
mastergrand,"Oct 10, 2016",9/10,"This is awesome & show you the way to go. Very Powerful film. This film will motivate you to find more about your life.this is one of the few movies that might actually be able to inspire someone to lead their life a little differently.One of the most heart warming movies I've ever seen.Lead actor Takashi Shimura nailed it with his acting. And the direction of Akira Kurosawa is just perfect.One of the greatest achievements by Akira Kurosawa.The conversation with the co-workers too much lengthy & sometimes irritating. I believe If they show more about the lead actors last days more, then the conversation, it would be more enjoyable.Anyway, this movie is great in all perspective."
bobsgrock,"Dec 11, 2008",8/10,"Akira Kurosawa, the Japanese director more famously known for his epic samurai stories, takes us into the depths of post-war Japan in this very human story of a government official who discovers he has terminal cancer and only six months to live. With this new found information, he decides to start living his life, something he neglected to do for the past thirty years when he never missed a day of work.As the story progresses, we learn more as to why our protagonist is in such a conservative state of mind. This, in turn, propels him to take up a crusade for the people of the city and help them and change their life for the better. This goes to show the most human side of Kurosawa we have ever seen. The character of Watanabe is handled very delicately, never condescending or preaching. He is simply a man who struggles with meaning and definition of his own life but wants to change that forever.It is in this context that Ikiru also has its failures. The final third act of this film is mostly a group of men sitting around talking about Watanabe while drinking plenty of sake and getting very drunk. TO me, this scene dragged on for way to long and was in fact mostly unnecessary. There were also some other scenes that didn't fit too well with the narrative, but they were far and few in between.So, to be honest, this is a real underrated treasure from Kurosawa. And even though it doesn't have the sheer willpower or amazement from his other works, this is definitely a testament to humans and the remarkable changes we can make by putting our mind to something."
jamesrupert2014,"May 16, 2020",10/10,"Senior bureaucrat Kanji Watanabe (Takashi Shimura) searches for meaning and purpose in life after finding out that he has only a few months to live. Kurosawa's film is a beautiful, sad masterpiece and Takashi Shimura is excellent as the soft-spoken man who belatedly realises that his life has become meaningless. The film is structured episodically as first Watanabe and a dissipated writer (Yunosuke Ito) explore the seamier side of Tokyo's nightlife, finding no answer in there, he spends time with a vivacious young co-worker (Miki Odagiri) whose joy in life he admires but ultimately cannot be part of, and finally the development of the children's park, in which he finally finds solace and meaning. Kurosawa expertly switches from linear narrative to a flashback structure halfway through the film, and viewers move from Watanabe's perspective to those of his bureaucratic co-workers, as they drink sake at his wake and discuss the changes in the man over his dying days. The scenes of the increasingly drunk men reminiscing are similar to the director's earlier classic Rashomon (1950), as each man tells an aspect of the story from a different perspective. Kurosawa also uses the film to skewer a stultified Japanese bureaucracy, especially self-serving public 'servants' and their sycophants, the wasteful redundancy and resulting zealous turf-guarding, and the endless, worthless 'busywork'. The final scene of Watanabe, serene and satisfied, is beautiful. A flawless, timeless classic."
