user,date,rating,content
vmijic,"May 6, 1999",4/10,"Tornatore wants us to believe that Sicilian small town movie theatres screen exclusively classics like Visconti, Renoir, Ford or Chaplin. Not likely! This film is no breath of fresh air. It's the worst Mediterranean pseudo-poetic cliche, seen so many times before and after, a rip-off from slightly better films of the same kind. Some awful camera work and sloppy editing. This is no imperfect cinema, this is bad cinema."
barryrd,"Sep 17, 2021",9/10,"I watched Cinema Paradiso when first released in 1989. Seeing it over 30 years later didn't have quite the same effect but it was very much worth seeing again. Also not sure what version I saw on TCM in 2021 but it seemed much the same.The friendship between Alfredo, a film projectionist doing a job he loves, and Toto, a child with a burning desire to learn his trade, must rank as one of the most heart-warming Italian films. This is quite different than the 1940's and 50's post-war realist movies that Italy is famous for as it warms rather than breaks your heart. It also shows the raw emotions that are released when a man revisits his childhood.As the movie fast forwards to adulthood, we see Toto the man is living the good life. He is a movie director who has made the grade. When his mother calls to tell him of Alfredo's death, there is some question as to whether he will return for the funeral. His life has changed. No longer does he live in a Southern Italian village but in Rome, the nation's ancient and cosmopolitan capital. He has wealth, women and good looks. Going back home represents another time and place and not something he relishes. When he does return, he is admonished by his mother who feels he is not happy and needs to settle down with the right woman. She is very grateful for his generosity which has helped her materially but now her one wish is for him to be happy.The adult Toto takes part in the funeral, walking with the aged villagers who remember him as a child. He greets, giving handshakes and kisses but sadly, the village no longer resonates with life and the old theatre of his childhood is soon to be torn down. While in the projection booth of the theatre, he finds a surprisingly joyful reel of film that highlights moments in cinematic history put together by his old friend. What his life holds afterwards we don't know but the experience of going back home has clearly registered with him. I'm sure it also registers with viewers of this wonderful movie."
josefmillencramer,"Aug 11, 2022",10/10,"Excellent movie, one of the best ever and my all time favourite.I watched the directors cut recently and it is much more complete than the original.It's such an emotional film and tells the various love stories with such reality.The young Toto is such a good actor and deserved his BAFTA award."
santiagocosme,"Dec 6, 2014",10/10,"Generally speaking, no one can really say what their favorite movie is, but when I am asked the question, the first movie that comes to my mind is ""Cinema Paradiso"".I am not sure whether this is the movie every filmmaker wished they had made, as some people claim, but without a doubt it has to be the most beautiful movie ever made about the love of cinema! The last scene is simply scintillating. Toto, now an adult, is handed a box with film cut outs of kissing scenes that were banned when he was a kid. And Alfredo wanted him to have them after his death. When he plays the video, alone in a cinema, and Enio Morricone's music starts, you feel elevated and invaded by all sorts of emotions. I was at the cinema for the 25th anniversary of this film, and everybody was crying by the time this scene started. Me included.It's just a magical piece of film making that everyone should watch at least once. After Cinema Paradiso, you may find it hard to enjoy the majority of movies you watch. It's just that good!"
alva,"Oct 2, 1998",10/10,"As a film student I am often asked ""What is your favorite movie?""   For the last several years my reply has been, ""Cinema Paradiso"".  It is a wonderful movie that inspires the soul to reflect on our past, our fathers, and the journey we take in life. The movie succeeds on all levels of film-making and it will be tough to replace this one as my number one pick."
stephen-357,"Jan 24, 2005",N/A,"There's something magical and timeless about the movies. The stars that inhabit them are like fixed points in a firmament created out of the imagination; ageless reminders that despite the fact that our bodies deteriorate during the passage of time, in our minds we are forever young. Images projected across the distance and onto a screen like ghosts from far off memories have the ability to take us back through time like bookmarkers for important events in our lives. Giuseppe Tornatore's glorification of the movies in CINEMA PARADISO is really a celebration of life and the limitless possibilities for the individual with determination and imagination. There are really three protagonists in this film; Salvatore, the principle character who's story is told primarily through flashbacks; father figure persona grata, Alfredo, projectionist and Salvatore's mentor; and the theater itself, Cinema Paradiso, that refuge for the weary. A place where dreams, if only for a couple hours, can be found. A place where, laughter, sadness and joy can be shared. Paradise! Salvatore is fatherless and Alfredo childless. The two will form a special bond and remain virtually inseparable until Salvatore is a young man. A bond forged primarily in the projection room of the Cinema Paradiso, and fired by their mutual love for the movies. The years will be marked with tragedy, love won and lost and the realization that perhaps ""life isn't like in the movies."" Alfredo, having lived most of his life through the movies, encourages Salvatore not to make the same mistake, urging him to ""Get out of Dodge"" and direct his own destiny. ""I don't want to hear you talk anymore. I want to hear others talk of you. Don't come back. Don't give into nostalgia."" When Salvatore finally does leave, making it big as a successful and respected filmmaker, it will take the death of Alfredo to bring him back after an absence of 30 years. A trip back in time that will inflame old wounds, but also provide an opportunity for them to heal, and after the final kiss of CINEMA PARADISO's inspirational last scene, any lover of the movies will find it almost impossible not to give into nostalgia."
Hildebrando_Martins_Almeida,"Feb 17, 2024",10/10,"""Cinema Paradiso"" is a love letter to cinema that transcends the screens and delves deeply into the memories of a young man passionate about the seventh art. Giuseppe Tornatore skillfully weaves a tapestry of nostalgia and emotion, guiding the viewer through a journey along the dusty streets of a small Sicilian town.At the heart of this narrative is Toto, a young man full of curiosity and vitality, whose fate intertwines with that of the solitary projectionist Alfredo. Philippe Noiret brings this character to life with a melancholic gravity, while Toto is portrayed at different stages of his life, each bringing unique nuances to his journey.The magic of cinema is captured in the profound relationship between Toto and Alfredo, a friendship that flourishes in the shadows of the Cinema Paradiso's projection booth. Together, they face the challenges of censorship and adversity, defending the art that unites them and transforming a simple cinema into a sanctuary of dreams and memories.Tornatore's stunning cinematography transports the viewer to sunny Sicily, where the aromas and colors of everyday life come to life before our eyes. Ennio Morricone's emotive soundtrack elevates each scene to new heights of beauty and emotion, evoking a sense of longing and enchantment.More than just a narrative about cinema, ""Cinema Paradiso"" is an ode to humanity. It's about the bonds that unite us, about the moments that define our lives, and about cinema's ability to transport us beyond time and space. It's a masterpiece of Italian cinema, a celebration of art, and a reminder that even in the darkest hours, cinema shines as a beacon of hope and redemption."
jamiethompson1,"Mar 27, 2005",1/10,"This is possibly the worst film I've ever seen. I'm quite a big fan of foreign language film, but this gives the ""genre"" a bad name. It's about an annoying little s*** of a boy annoying an old man, stealing things, etc. And it has boys chugging in the cinema, and a couple going at it hammer and tongs.Good films contain things that you might remember positively or which affect you. The only affect this had on me was wanting to never go to Italy and smashing the DVD into little bits with a huge hammer. It doesn't even make sense.I got this free with a newspaper and it's not even worth that. Horrific."
jpdicaterina,"Jul 20, 2024",10/10,"With more than a 100 years of cimema, sometimes you leave a gem like this aside for far too long. I feel a bit embarrassed for watching ""Cinema Paradiso"" just now, but it's better late than never!I'm constantly amazed by how movies can touch a soul deep sometimes. It doesn't need to be perfect, have cost billions of dollars to produce or have big celebrities. As long as it's made by people who cares, the film will turn out great, and this one is a perfect exemple. Nothing more than a great idea, beautifully shot and incredibly portraited by those amazing actors who brought the chacacters to life, made me laugh and cry (
a lot).The simple fact that makes this movie one thousand per cent better, is that it is italian, the language suits it so well, and the scenarios, the villages, the rich and beautiful culture brings this story to life like no other could do. It just wouldn't be the same if it were a big Hollywood production.I intend to rewatch this beauty as many times i can, i felt totally represented by Totó and his obsession that we share: Cinema.Enio Morricone, as aways a master. Did an amazing job in the tracks, got chills just by remembering.Io sono un pazzo come Totó!"
andreaslekander,"Dec 9, 2022",10/10,"I often watch movies that impresses me because of the beautiful cinematography or the great dialogue, but this is unlike anything I've ever experienced. I don't think that I will ever experience a movie having such impact on me.I adore movies that plays with your emotions and makes you feel things on a personal level.Cinema paradiso manages to do that in the best way possible. Other than having a beautiful story about childhood, cinema and love, it plays with every emotion in your body and therefore I will never forget this experience.The soundtrack is perfectly executed and makes every scene stronger and more emotional.Being an Italian movie, I had my doubts. But if this took place in any other country, this story wouldn't make sense. The atmosphere of a small town in Italy makes this story stronger and I believe that this wouldn't work if it was set in America for example.I think that this is a perfectly executed film and it has to be one of the best movies I've ever seen.Truly beautiful.Please watch this film, please experience this journey. You won't regret it."
MamoudMouhsen,"Apr 24, 2022",10/10,Is iconic and great movie that increases your love for cinema. The director is professional acting is Wonderful. The music is very appropriate. Its from my top 10 movies' don't know about Italian movies but this movie is geat makes you fell relaxing.
prevailrahman,"May 14, 2020",10/10,"Life is not a cinema but cinema influences life! 'Cinema Paradiso' is such a fantabulous movie where one can deeply engross,one can solely feel the nostalgia of his childhood and youth. It's a nice composure of friendship between a poor boy who is enthusiastic about cinema and a projectionist. Yeah! Friendship can break the shackles of age! It is a beautiful story of a cinema hall from an old village where all the villagers finds there zone to take entertainment during their leisures. After ending this movie I want to say that the world of cinema is beautiful,simultaneously our life is beautiful cause we surrounded with beautiful people here just like the projectionist.
I don't know why but I can't resist my tears after watching this nostalgia journey. It's really really worth watching. It's a kind of cinema which can make up your mind."
igorcavalcanti1313,"Jan 28, 2024",10/10,"Normally I don't write reviews for movies, because most of them don't require or compels me to. But Nuovo Cinema Paradiso I couldn't not write a review for this.Never has a movie touched me as deep or made me as cry and even laugh as this Paradiso has. No journey is as beautiful, fun and sorrowful as Paradiso. Paradiso is the greatest ode to cinema I have watched, there is no greater homage to cinema than Paradiso. I love cinema, I love the movies and big picture and movie can express this love better than Paradiso.Its character are you and me and yet they are larger than life. And the acting that brings these to life, oh they are magnificent. I cannot find the words to describe how truly good the cast is, I feel as if no praise to them and to Paradiso would be enough. Salvatore Cascio who plays young To, well shines and acts better, at such a small age, than most most actors in their life hopes to.I could go on and on dissecting and prasiny every frame and aspect of Paradiso and I still feel it would not be enough. So my final message and what I to shout to every corner of the world and to anyone who can listen to is: Please watch Nuovo Cinema Paradiso!!!"
samuelpozas,"Sep 14, 2025",9/10,"Cinema Paradiso is one of the movies that I would consider a core film. It is a slow-paced, innocent, and sophisticated piece. It is set in old Italy, which makes it beautiful to watch and hear, due to the Italian spoken being sweet and local. It leaves many things unresolved but I think that is also the point of the movie."
pct,"Oct 5, 1998",N/A,"I had tears running down my face on and off for most of the film, which then turned into a steady stream for the last 20 minutes.  A very nostalgic film but done oh-so beautifully like only the Italians seem to be able to carry off.  And with Ennio Moriconne's gorgeous lush film score, the emotional impact of the film is unstoppable."
Luigi Di Pilla,"Mar 6, 2005",7/10,If you like a story without action or bum-bum and love nostalgic/romantic movies this is one for you. There are lot of emotional scenes with lot of humor and a little love story. The music was so fine that takes your breath away and it is well tuned to each scene. Director Giuseppe Tornatore created a nice Italian and original story about a typical cinema in the 40/50ies that was located in South Italy. The little boy and Philippe Noiret did a great job here but every actor made a solid casting. Sometimes I had some nostalgic thoughts about my own country. The rating on IMDb with actually 8.3 is okay and not overrated. There was no doubt that it won the Oscar for the best foreign movie and also for many other international awards. My vote with my wife is 7/10. Go and see it.
WhatsUpManPodcast,"May 2, 2024",8/10,"The story follows Salvatore, a successful filmmaker who reflects on his formative years spent in a small Italian village and his friendship with the local movie theater projectionist, Alfredo. Through a series of flashbacks, we witness their bond and the profound impact cinema had on Salvatore's life.At its core, ""Cinema Paradiso"" is a celebration of the magic and communal experience of cinema. It beautifully portrays the way movies can transport us to different worlds, evoke powerful emotions, and serve as a universal language that brings people together. The film captures the enchantment of sitting in a dark theater, the flickering of the projector, and the collective joy and laughter shared by the audience.The performances in ""Cinema Paradiso"" are exceptional, with Jacques Perrin and Philippe Noiret delivering heartfelt portrayals as the older and younger Salvatore, respectively. Their chemistry and the genuine warmth they bring to their roles create a strong emotional connection with the audience. The supporting cast also shines, adding depth and authenticity to the village community.The film's pacing is deliberate, allowing the story to unfold gradually and capturing the nuances of daily life in the village. The narrative is richly layered, blending elements of coming-of-age, romance, and nostalgia. It explores themes of friendship, love, loss, and the sacrifices we make for our passions.Visually, ""Cinema Paradiso"" is a feast for the eyes. The cinematography beautifully captures the idyllic Italian countryside and the nostalgic charm of the village. The use of light and color enhances the film's emotional impact, evoking a sense of longing and melancholy.One of the film's strengths lies in its evocative score composed by Ennio Morricone. The music perfectly complements the storytelling, enhancing the emotions and creating a lasting impression. The iconic main theme, ""Love Theme from Cinema Paradiso,"" is both haunting and nostalgic, evoking a deep sense of longing.""Cinema Paradiso"" is a timeless masterpiece that celebrates the power of cinema to shape our lives, ignite our imagination, and forge profound connections. Through its heartfelt story, superb performances, and evocative imagery, it captures the essence of the cinematic experience and leaves a lasting impression on its viewers. It is a love letter to the magic of movies and a reminder of the profound impact they can have on our lives."
philippedriss,"Jan 2, 2024",6/10,"THIS IS GOOD. A MOVIE ABOUT MOVIES. THIS MOVIE PERFECTLY PORTRAIT HOW IMPORTANCE IS MOVIE IS IN OUR LIFE. HOW MOVIES HELP US TO ESCAPE INTO ANOTHER WORLD. JUST GREAT YES IT IS LITTLE FLAWED BUT WORTH THE TIME OF COURSE.POSTIVE SOUNDTRACK
NEGATIVE SOMETIMES IT LOSSES YOUTHIS MOVIE IS VERY WELL COMPOSED BUT THE ENDING WAS VERY SELF EXPLAINATIONARY. THIS MOVIE ALSO PORTRAIT THREE PHASES OF A ME LIFE CHILDHOOD TEEN OLD. THIS MOVIE IS STRONG RECCOMEDATION FOR ALL CINEMA LOVER. AND ITS IS IMPORANT FOR CINEMA. MY RATING OF THIS MOVIE WILL BE 6.7/10. I THINK IT TIME END TO REVIEW. OK THAT ALL FOLK FOR TODAY."
jtadams,"Mar 6, 2000",1/10,"This movie received such high and glowing praise that I was really looking forward to seeing what was purported to be such a touching and insightful window into the human spirit.  What I got was two hours of maudlin, weepy, melodramatic prattle that almost descended to the level of farce it was so bad.What the heck is the big deal with this movie?Basically there's an impish, disobedient child who befriends a rambling old man who works as a projectionist.  Then there are tons of clips from movies so old and so poor as to be irrelevant.  And that's about it.If you like pointless coming-of-age movies that meander all over the map, by all means whack yourself in the forehead with this one.  Otherwise, save yourself the time."
EvaStellaDeFilippis,"Feb 6, 2019",10/10,"This is one of my mom's favorite movies ever, I procrastinated a lot before watching it, but deciding to do it was the best choice I could ever made. This movie is a realistic and emotional portrait of Italy of the '80s, understandable by both Italians and others."
bobbiekostos,"Aug 4, 2024",10/10,"Having seen this wonderful movie probably 6 times, I watched it again and, once again, cried throughout. You tend to cry with joy and sadness, but walk away feeling so good about life. The music is phenomenal and takes you deeper into this beautiful story. Each and everyone of the cast were perfect and you find yourself loving each one. Toto (Salvatore Cassio) is so incredibly adorable. The youthful Toto (Marco Leonardi) was cast perfectly. And the older Toto (Jacques Perrin) said everything with his beautiful eyes. And, of course, the late great Philippe Noiret as Alfredo was absolutely wonderful! A true gem of a film and one to be cherished."
SarahReinhart,"Aug 28, 2024",10/10,"Good classic film. The final scene is a perfect blend of film editing and soundtrack music. Anyone whose eyes are still dry half way into that glorious scene needs to see a cardiologist ASAP. Cudos to the great Ennio Morricone & son Andrea. Many reviewers insist that the shorter, theatrical-release version is superior to the director's cut. The full-length version makes a central character morally ambiguous, in contrast to the uniformly benevolent father figure depicted in the shorter version. In the long version this character commits an act similar to but far crueler than the behavior of another character who is ridiculed early on. Most new viewers will watch the full-length film. The shorter version is more satisfying for those who secretly prefer fairy tales in which the good guys & bad guys are consistently good guys & bad guys. Great film!10/10."
lucascastaneda-56244,"Feb 21, 2023",10/10,"This film is incredible. It is hard to put into words just how emotional and effecting this work of art is. At once a gorgeous ode to film itself, it is also an ode to love and the friends we make along the long road of life. Although some decisions may seem dubious, they were made with love and hope in mind. Along with showing an incredible and heartfelt story, the film also flaunts unforgettable cinematography. The film is truly a work of art. A wonderful, heartwarming, awe-inspiring work of art. This is a film that makes you feel, laugh, cry, and love. Alfredo is more than just a friend to Salvatore, and although it didn't always seem it, he had loved Salvatore and had seen something great within him. Alfredo's final gift to Salvatore is one of the crowning achievements of cinema. It is arguably the most beautiful scene ever."
marcyfiorica,"Jan 16, 2006",10/10,"I consider Nuovo Cinema Paradiso is the most perfect film because of all three of the major ingredients in films of this century are considered important. One, the acting was exceptional good, in the way the very young ""Toto"" was very convincing in acting his age in post war Italy and then the teen-age ""Toto"" was excellent in showing a boy becoming a man in war time Italy and showing a beginning interest in the wonder and love of films, by experiencing the films shown in the town's only movie theater and even making them himself and then the adult ""Toto"" was also excellent in the end of movie when it was apparent that he has to have films to survive his everyday world of making them too. The second one is the direction and I am including the third one, the writing one here too. The director was very correct in showing us the life of this town surrounding the nightly showings of the movies in the Cinema Paradiso theater. I am very involve in this movie each time I see it, I start daydreaming that I am actuals a member of that community and seeing the movies at Cinema Paradiso movie theater in that same Italian town, in which ""Toto"" grew up in."
euplay1220,"Apr 11, 2016",6/10,"It seems there are twos aspects of this film that appeal to many people's emotions.1) Nostalgia: After thirty years of time during which Toto kept himself physically and mentally away from home, it is understandable that the memories from the distant past flood into Toto, although personally I did not feel particularly nostalgic by watching that.2) Love: According to many, the ending is meant to fill Toto with love he lost, but this interpretation is not plausible because it refers to different kinds of love. After his loss of relationship with Elena, Toto left home and had relationships with many women in search for a better heterosexual love, while the ending scene only means Alfredo's paternal love. These two are qualitatively different; the latter kind of love cannot be taken to compensate for the missing former. Considering the special emotional attachment given by Toto to Elena, it is implausible that Toto finds any true love with any other woman, which is precisely why he has had many relationships ever since he lost Elena. An interpretation of the ending scene as a demonstration of the former (heterosexual) kind of love is also implausible, because it is only a film projected on the screen, not real for Toto himself. In a shorter version of this film at least, therefore, Toto is left with Alfredo's enduring paternal love but without heterosexual love with a woman. This aspect is incomplete.These two aspects were emotionally not convincing to me. Perhaps all I need to appreciate its true value is a couple of more decades of life experience, long enough to look far back into the past and be nostalgic. For the time being, 6 out of 10."
petualangfilm,"Nov 23, 2020",10/10,"One of the best coming of age movies. impressive, Touching, surprising.
Love This Movie So Much."
wodexiaohaozi-56606,"Aug 23, 2020",7/10,"For me, the music, the story, the actors are all good, but it lacks a little impact."
hp-1868,"Sep 11, 2006",10/10,"One of the greatest cinematic works ever produced in the history of film making. This film, which is obviously one of Tornatore's, is dealing with the life of a boy who's in love with cinema. In his town there is a cinema whose operator is an old mysterious man named Alfredo. This Bloved cinema, which attracts everybody in town every night, is called cinema paradiso. and as you may guessed it's going to be some kind of paradise as the name says... the paradise of love. I'm not going to say anymore. and I propose that you better leave whatever you're doing now, go and rent it... Watch it right a away, Because It's Going to Change Your Life."
