user,date,rating,content
kgprophet,"Jun 3, 2019",9/10,"I just recently had a chance to re-watch this film in a cinemaplex. Not exactly Imax, but it was a larger screen than my home TV, and theatre audio was superb. I saw this film when it originally came out in theaters in 1998. The opening sequence gained notoriety for it's unflinching visceral photography and shockingly graphic violence. I have watched this film a few times since then, but seeing it on a larger screen, I had an appreciation for the realism that Spielberg insisted on. If it was virtually any other filmmaker, the expense of realistic production with extra attention to detail would not have happened. Instead we would have been presented something not as noteworthy.These efforts were the reason it won several Academy Awards. There is so much depth to the story. The film zips along with small set pieces that provide some kind of insight to the enigma of war. Not only are there some classic performances, there are classic faces. Bryan Cranston, Vin Diesel, Matt Damon, Paul Giamatti, Ted Danson, Tom Sizemore, Adam Goldberg, Giovanni Ribisi, Dennis Farina, Barry Pepper. Very recognizable faces.Tom Hanks, now less of an A list star compared to the 90s, gives a very natural performance. He shouts commands as a confident captain taking part in the most incredible feat attempted by our country. We get to witness these events, partially through the gun-shy eyes of Corp. Upham, played by a meek looking Jeremy Davis. He reacts as most of the audience would to the cacophonous noise and chaos. He flinches as much as anyone would with bombs going off right next to you. He also represents the humane approach to the war, which of course goes against reason at times.There are accolades to go around, including a detailed script. Capt. Miller's unknown career back in the states. Searching through a pile of dogtags. A glider landing that went FUBAR. A genuinely funny anecdote about the Ryan brothers before the war. Coherent explanation of strategies and improvised weapons. When confronted with a dilemma, the script smartly explores it to find a piece of wisdom that the audience can learn from. So we get a history lesson about the first few days of the D-Day invasion, while being entertained with believable and memorable characters.The cinematography can be considered a landmark in visceral storytelling. The use of high shutter speeds removes the normal blur when there is an explosion. In this case, the explosion particles are vividly in focus, and feel all the more real and lethal. I lost track when watching the more technical aspects of the film of how many shots were done in a single take. In the final battle, there is a shot following Upham from cowering from an explosion, tracking him to another building on another block, with a tank and soldiers approaching, returning back to the previous street, and ending with a conversation with Sgt Horvath (Sizemore). There are many more long shots like this throughout the film that go unnoticed. The shots are staged so well they feel like a documentary, with no deliberate use of shaky cam needed.Lastly, the density of the soundtrack must be noted. There is a never ending barrage of gunfire, explosions, objects flying in the air, footsteps, weapons being loaded, and on. The immersion of the sound (again with the advantage of hearing it on a well tuned sound system in a theatre) makes the experience even more intense. Such as the quiet rumble of German tanks approaching. The spare music score gives the perfect backing when the moment requires it.The 2 hour and 49 minute running time goes quickly, with each set piece as part of the journey providing something new and intriguing as the squad of soldiers encounter the war. The longer script gives character depth, and glances at small details that might have been otherwise excised for time.I give this film a 9 out of 10, and is not only one of Spielberg's all time best films, but a timeless work on it's own. How would I rate it as one of the best war films? I would put it up there with perhaps ""Patton"", but I believe, that every well made film about war can each provide a unique insight into war. Such as ""Apocalypse Now"" is one the best war films in the way it shows the perversity of war."
discoelephant64,"Feb 26, 2005",10/10,"Breathtaking. Spectacular. Incredible. Whatever words used to describe this film do no justice to what Spielberg so masterfully created. This movie is the only movie to have left me in awe, in shock, in sadness. On all levels this film was perfect. I do not know how historically accurate it may have been, but I know one thing. This is one of the most memorable films ever made, and it should be recognized as the best war movie to date. I am a proud Canadian citizen, but this film gave me a greater respect for what the Americans were trying to do in Europe. I used to protest the fact that they joined the war late, however this film has shown me that they suffered as great a loss as all the countries involved in that war.The film truly was an epic, an epic that will leave me to think for some time."
johnmschofield,"Oct 15, 2009",10/10,"I was born 9 years after WW2 finished and my father was a fireman in the midlands area of England during the war. I do not know anybody who was directly involved in any fighting so therefore the only way somebody like me can be educated in what has taken place during any war is with documentaries, books or a realistic portrayal of events in a war film. I have read numerous reputable books and watched award winning documentaries about WW2 and viewed a long list of films featuring various parts of the war but nothing I had heard about this film prepared me for the opening sequence. I doubt there is anyone on this planet who would not be affected in one way or another by it. You can get a dictionary out and list the adjectives but those 22 minutes are infinitely more descriptive than centuries of books, unrealistic films and fancy speeches. The whole film is close on three hours and is and hopefully always will be an education for anybody watching. For me this film should be regarded like a monument to all the people who have gone to war irrespective of when or where it took place or why it started in the first place. I suspect that the real thing was worse than what is shown in the film but what is shown is graphic enough. We have been killing each other for centuries but this like a select few other films lays it all out realistically. I personally thank the director and the entire cast and crew for the result of all their hard work. For anybody out there who has not seen this film please watch it and if possible stop reading this stuff I have written and lob the DVD into the machine and make your own mind up."
ciscokid1970,"Sep 27, 2006",10/10,"This is one of my favorite films of all time. I can watch it over and over again. It also has one of my favorite actors of all time, Tom Hanks. This movie should have been Tom Hanks 5th Oscar but for some reason the 'academy' has some bias against him.Many people have said that the start of this movie is the most intense, realistic capture of the invasion of Normandy beach. In addition the shooting of the first part of the movie puts you inside the action along with stunning 5 channel sound that places bullets, bombs and screams all around you.Does not stop there there is plenty of action in this movie. It shows many sides of humanity during the war and you even see the impact of all sides US forces, German forces and by standing citizens.This movie to me was the best film of 1998. Unfortunately 1998 was one of the most competitive Oscar runs in history. Titanic, Shakespeare in love, Elizabeth and Life is beautiful all competed that year. And as always the Lovey-dovey movies mostly win the Oscar races.Still this movie was so great that it spawned a HBO miniseries that was equally great ""Band of Brothers"".This is my favorite movie from Spielberg."
Angsw8,"Aug 18, 2005",10/10,"This movie is the greatest war movie ever! Tom Hanks was a perfect captain and Matt Damon was such a great Private Ryan. The beach scene was such a great scene, although it was pretty intense the way that Steven Speilburg directed that scene was truly fantastic. Another scene that was truly touching was when they had to tell the mother that her three sons were dead and they didn't know where her forth son was. It made me feel like crying and I'm sure that all the other fans out there felt the same way.The ending is very dramatic, but Steven didn't go overboard. When the old James Ryan almost starts to cry I felt the same way. When Tom Hanks died that was the ultimate surprise or scene in the movie. It was awesomely brilliant, but very sad. That's my basic overview and opinion on ""Saving Private Ryan."" -Ashley"
OriginalMovieBuff21,"Apr 27, 2004",10/10,War is Hell! This movie rocked. The opening scene of the movie was the best on the Omaha Beach. The action kicked ass and the battles of the entire film was phenomenal but not only that the plot was as great as can be. About Capt. John Miller and seven soldiers looking for just one other soldier who all of his brothers were killed and return him back home. The movie was also deeply sad and I kept feeling sorry for the soldiers and I always felt that I wanted to just go into the movie and fight for U.S. This is the best war movie of all time and it will remain the same unless some other comes up and overpass it but for now this is a masterpiece!!!10/10!!!Highly Recommend
tedg,"Nov 16, 2008",N/A,"Every once in a while, I go back to watch films that were celebrated in their time. These have to be films I saw when they were newly nested in their warm buzz, and which were conveyed as if they were a privilege. This is such a film, one that can perhaps serve even as the exemplar.It was touted as (at last) a serious film by Spielberg, chapter two of his ""real"" film which marketed the holocaust. It had Hanks, who it should be recalled was more uniquely respected then than now. It dealt with a sort of real history with direct pulls on patriotism and something called valor, in a way that would make Sinatra and Wayne blush (or at least hiccup).And its first 20 minutes was chocked full of effects that worked and conveyed a meaning of confused dread. It moved us all  how could it not?  and allowed the filmmaker to lazily move through an ordinary story, staged as if it had a different production crew.Seeing this again in my own context and with the objectiveness of distance, I am amazed at how effective that opening section is, and how typically bad Steven the rest is. That first part is tense, tight and close. It is horrible without forcing us so close that we recoil.You know, one of the biggest challenges in film-making is to introduce the audience to the world they will live in for perhaps a few hours  the film and the long tail of recalled experience afterward. Usually the filmmaker has only a few minutes. Some  especially when a strict genre film is coming  can even do it during the title sequence. We are prepared for this entry voyage; it is part of the contract we make when allowing a filmmaker to transport us. I cannot recall a film that took this much time to prepare us. Perhaps ""Pan's Labyrinth,"" but that setup was disjointed.So I have to admire Spielberg's craft in putting together a session that has impact, though it is all tone and no narrative. And I have to admire his ability to understand and exploit that twilight area where we are primed for such a thing. And then 20 minutes in, we start to ask why, why engage us? Why open us to be ready for something that matters and serve us bread?Ted's Evaluation -- 2 of 3: Has some interesting elements."
texd,"Oct 4, 1999",6/10,"Overall, this is a well made film that is not well written.  Sure the opening scenes (Normandy) are dramatic and touch you deeply, but as soon as the allies secure the beach, the movie begins to fail.Surely there is a better script for a film about WWII in the European theater that would have served as a good vehicle for the dramatic first half-hour in this movie."
stew0203,"Mar 20, 2001",1/10,"This is one of the single worst films I have ever seen.  Spielberg was, once again, intoxicated by his own sense of patriotic splendour. The first major flaw in this film struck me the first time I saw it.  I was in the theater and began to ask myself, ""How could Ryan remember the D-Day invasion when in fact he was never there?""Now, honestly, how did Spielberg expect to get away with that one? It was never explained or followed up in any way. Secondly, how did he expect to get away with portraying the Germans as mindless, blood-thirsty grunts?  ""Well they were, weren't they?"" says the blindly patriotic american.  This aspect of the film is a disgrace to Germans and more importantly to the brain-washed americans. Finally, I would just like to point out the fact that this was not a war to rescue individual men in order to preserve their family line. This film makes a mockery of WWII by completely misrepresenting it.  The only aspect that was accurately portrayed was the violence, which sadly enough drew many people to the film. Two thumbs down!"
tmacfan19,"Feb 11, 2007",10/10,"I first watched this movie when I was a young'un. It had an impact on me, more than I could have imagined. At that time (I was still a kid then) I wanted to join the Army, because I assumed that I could simply pull out a machine-gun and blast everyone to oblivion. This movie made me see the light. Now that I'm older, and can understand films better, I can fully appreciate the beauty of this film. It's gritty without being gruesome, it's brutally honest without overwhelming you, it's funny while it focuses on the drama; it's just plain brilliant. It deserved every Oscar it got, and more in my opinion. The cinematography alone is to die for.All in all, 11/10."
imseeg,"Sep 28, 2018",10/10,"Steven Spielberg's masterpiece. Tom Hanks most magnificent performance. Winner of 5 Oscars and more than 70 other prizes worldwide. Unprecedented true to life combat photography. Dynamic 3 hour long story that elevates this movie into the best tribute to all those American soldiers who died fighting for freedom in Europe during World War II. This is THE ultimate depiction of D-Day when the Americans freed western Europe. What a tragic and bleak, yet glorious epic war classic!The story is literally about the rescuing behind enemy lines of an American soldier called Ryan, played by Matt Damon in a small supporting role. Tom Hanks has to rescue the guy with a team of specially selected soldiers, among which are Giovanni Ribisi and Vin Diesel. Their journey to find and rescue private Ryan is a long, bleak and bloody one, in which soldiers are normal people with nervous breakdowns who go mental when confronted with so much cruel violence. This is not a gung ho funny action movie, this is how it really could have happened, with all the bleak and twisted soul shattering fears that soldiers have to conquer mentally, when they are in combat.The photography is stunning. Like I have never seen it before. Seen this movie many times now and it bewilders me every time how they have achieved such a level of true to life war combat photography. Even if you might not like the story, which I would find hard to believe, the action photography on itself is worthy of an Oscar, which it deservedly got.The soundtrack is dark and glorious. The sound effects were sonically blasting my ears when the tanks started rolling and the mortar shells were exploding all around. Editing is done with a fever pitch that keeps me glued to the screen. I can go on and on about the superb technical skills with which this movie was made, but the most important thing is that this movie has a got a pulsating righteous heart at it's core. This movie touches me profoundly. Only a few times during the last 40 years, have I ever been this fascinated by a war movie. Incredibly impressive!"
wes-connors,"Jul 13, 2009",10/10,"""Seen through the eyes of a squad of American soldiers, the story begins with World War II's historic D-Day invasion, then moves beyond the beach as the men embark on a dangerous special mission. Captain John Miller (Tom Hanks) must take his men behind enemy lines to find Private James Ryan (Matt Damon), whose three brothers have been killed in combat. Faced with impossible odds, the men question their orders. Why are eight men risking their lives to save just one? Surrounded by the brutal realities of war, each man searches for his own answer - and the strength to triumph over an uncertain future with honor, decency and courage,"" according to the film's official synopsis.Once again, the Steven Spielberg and his crew of filmmakers climb to the top of the mountain, and deliver a terrific motion picture. This time, it's a heart-tugging pro-war (significantly, pro-World War II) epic of astonishing power. Initially, ""Saving Private Ryan"" impresses with its violent depiction of the Allies' D-Day landing, on the shores of German-occupied France. With waves of blood, Mr. Spielberg shows the human cost of defeating Fascism - by what TV anchorman Tom Brokaw called ""The Greatest Generation""; although, honestly, every generation has its greatest, this is a fitting term.Captain Hanks and his squad - Edward Burns (as Reiben), Jeremy Davies (as Upham), Vin Diesel (as Caparzo), Adam Goldberg (as Mellish), Barry Pepper (as Jackson), Giovanni Ribisi (as Wade), and Tom Sizemore (as Horvath) - are among the few to survive the invasion; and, are ordered to save Mr. Damon's ""Ryan"" (for the reasons given above). During quieter times, the personalities of the men emerge, with Spielberg and writer Robert Rodat creatively painting human portraits. The silhouette of the ""war mother"" dropping to her stoop as the military vehicle approaches is one of the film's most simple, and effective, portraits; it supports the film's prime directive.Hanks and the men are a more complicated literary group of characters than they seem. Spielberg is obviously manipulating the story through them; and, their strongly-directed, natural performances help make it work. The film's main message is delivered by schoolteacher Hanks' ""Miller"" in his final words to student Damon's ""Ryan""; listen for them. And, don't miss the secondary message, told by Mr. Davies' multilingual ""Upham"" character; especially, watch how he pleads with Hanks to set a German hostage free, and note the consequences of their action.It's tough to rank performances in an ""ensemble acting"" film (they're all stellar), but, for literary greatness, you've got to add Mr. Ribisi's doctor ""Wade"" to most memorable list. He tells an incredibly introspective story about how he pretended to be sleeping when his mother would peak into his room; note, eventually, Ribisi goes home to ""Mama"". Also interesting is how Mr. Sizemore's ""Horvath"" serves as the ""voice"" of Spielberg/Rodat, exalting and purifying Hanks' character. He says both the film's title and tag-line (""Except this time, the mission is a man"").Spielberg's use of ""flashback"" is one of the best you'll ever see; and, he definitively defines the term ""gut-wrenching decision.""********** Saving Private Ryan (7/24/98) Steven Spielberg ~ Tom Hanks, Jeremy Davies, Matt Damon, Giovanni Ribisi"
LoneWolfAndCub,"Apr 18, 2006",9/10,"The first 20 minutes of this film is a brutal glimpse into the violence and complete uselessness of war. We see people getting gunned down, limbs getting blown off, people blown in half, guts everywhere, it is not a pretty sight. It's this, and many other things, that make this one of the greatest war films I've ever seen.Captain John H. Miller (Tom Hanks) and his men are sent on a mission to recover Private James Ryan (Matt Damon). Along the way many hardships are faced and overcome between these men.That is pretty much the plot, but the movie is more than plot. It is a journey through World War II's harshness and a journey with these men. We come to care for these men. They aren't given huge amounts of development, but they don't need it. The actors really make us care for these people, as does Steven Spielberg's skillful directing. This is definitely one of his best movies.It is also a lot different. If any of his movies contain violence, there is very little of it. This, however, contains some of the most graphic violence I've ever seen. It truly shows the violence, dirtyness and uselessness of war. It doesn't offer anything but pain and misery. John William's score also creates a very suitable mood.The only reasons I have for deducting the half a star is because of the very start and the very end. The American flag flapping in the distance was a little too sentimental for me and I found it unnecessary.4½/5."
wishbone-2,"Nov 7, 2000",N/A,"This was a decent movie but still was highly overrated by everybody. The Plot was some what weak, and although i like Tom Hanks I believe he is overrated in Hollywood's eyes and thought that all of his movies get over hyped. I think the same thing With Green Mile which was a decent movie but still overrated and Forrest Gump, I personally thought Billy Bob Thorton made a better movie in Sling Blade. However Hanks did make good scores in Big and Apollo 13. I also think Spielberg is overrated. How can people say that this is better than Apocalpsye Now and Platoon the 2 greatest war movies of all time. The Thin Red Line was better than Saving Private Ryan by a hair they were both overrated. Platoon is the best war movie ever!"
dorotka24,"Nov 20, 2007",10/10,"There are few movies in history that can deeply affect us and leave an undeniable emotional impression. This film is one such. I can remember exiting the theater on weak knees, not from sitting for so long, but from the emotional turmoil it caused.Certainly an average Joe like myself who has never served in the military nor ever faced combat cannot truly fathom the horror of war. But since a number of WWII combat veterans who viewed the film were impressed by its realism, I can safely say that my feelings in leaving the theater were more than justified.It's easy to criticize a war movie for being limited in scope, as Ryan was, but in my opinion it makes for a much more visceral, intense, and satisfying movie experience. Some films, like ""Patton,"" ""The Longest Day,"" ""Midway,"" and a number of others have tried to better represent the monumental undertaking that was WWII. While I commend such efforts, the focus therein is too broad - one cannot appreciate the individual sacrifice and emotion involved, and it's easy to get lost in the numerous characters and distracted by the overall scope of the film.Ryan focused not only on one theater of the war, but in one geographically small area. Additionally, it is seen through the eyes of a small squad of American soldiers. I would not have wanted it any other way.Spielberg has outdone himself here, spotlighting his artistic range and re-affirming why he is one of the greatest of American film directors. Be warned - this is likely among the most intense war films of all time, and is not for the weak of stomach or heart.But unlike many of the sanitized war movies of the past, this one gives us a taste, however small, of what must have been a truly terrifying and devastating experience."
