user,date,rating,content
Prismark10,"Feb 3, 2021",6/10,"Fargo is a curious wacky but dark crime thriller.The Coen Brothers build on their previous noir crime movies and play around with the conventions. They do this by imbuing it with some bizarro characters.Jerry Lundegaard (William H Macy) is an executive car dealer with a rich father in law. He enlists two wacko hoods. The talkative Carl (Steve Buscemi) and the quieter Gaear (Peter Stormare) to kidnap his wife.Jerry hopes to split the ransom money with the hoods but the plan goes awry. Carl and Gaear leave a trail of bodies behind.Heavily pregnant Brainerd police chief Marge Gunderson (Frances McDormand) investigates the murders. The victims includes a state trooper.There is little by way of background to the characters. Jerry seems to be running some kind of car scam, he is in debt and has a business investment where he wants his father in law to lend him some money. It is clear that nervy Jerry is way over his head with his mad bad plan.The snowy landscapes of Minneapolis, the mock Scandinavian accents all give the movie some distinction. Despite some humour which mainly comes from a cool kooky Marge. This is a misanthropic film.The dead bodies pile up and the killings become nastier as the movie goes on. It was an accomplished movie from the Coens who were still regarded as Independent filmmakers. It is just that Fargo is a difficult film to like."
functioningfine,"Aug 4, 2022",6/10,"So I just rewatched this movie on 8-3-22, from the first time I watched this movie in 96 I believe? I was 16 then, 42 now. I thought after time and it holding up strong on the reviews I needed to rewatch it. Well my opinion in between those years hasn't changed. It's a mediocre movie. Decent acting with the Midwestern accents and quirky ness. Story is basic. Nothing to rave about."
LuckyDay,"Aug 20, 2021",1/10,"I have watched many a Coen film over the years and never got them. Finally I watched Fargo, which was supposed to be one of their best. I swear, I'll never watch another Coen movie again."
Steffi_P,"Feb 9, 2012",8/10,"In the 1990s the younger generation of independent filmmakers gained their prestige with some odd movies, movies that were both grim and noir-ish but with an almost nonchalant twist of comedy running through all the nastiness. This was the kind of picture in which the Brothers Coen specialised. Fargo is among their purest expressions of that type, a grisly thriller set in a snowbound Minnesota that, despite its inherent darkness, comes across as humane and affectionate.While the New Wave-influenced directors showed off an abundance of technique, the Coens and their generation have tended more towards minimalism. There's an elegant simplicity to their approach, with few camera moves or obvious artifice. That's not to say the Coens were directing on autopilot. The camera may not move but there's a lot of thought gone into those static shots. We see a beleaguered William H. Macy at his desk while cars rushing by on the freeway behind him seem to mirror his nervous jitters. In the opposing shot of the indignant couple, the array of statuettes makes it look as if the whole room's ganging up on him. It's a kind of meaningful shot composition that is actually rather witty. This triumph of the image over technicality allows the Coens to really bring out some detail. Many filmmakers may attach a camera to the front of a car for a bit of high-speed action, but in Fargo we have such a shot pointing down at the road surface in the headlights, picking out every little crack and grain. The Coens have really painted a world with palpable texture.But just as character seems to live in the very landscape of Fargo, it also lives in the actual characters, brought to vividness by a cast that's at just the right level of quirky. What's neat about Frances McDormand is that she is comical without actually doing a comedy performance. Other than a slightly strained accent, its all done in very genuine timings and expressions, which stops it slipping into farce and weaves it well with the movie's more unpleasant moments. William H. Macy is full of twitches and mannerisms, but he just manages to pull it inside the realms of believability. And Steve Buscemi too is straddling that delicate line on the edge of reality. In short, the people that inhabit the world of Fargo give us this impression of normality stretched to its limits, but normality all the same.Unlike your average thriller, Fargo is not exactly a tightly-constructed ride of suspense and excitement, but this doesn't mean it's not enjoyable and engrossing. Rather than seeming to have some grand theme or focused structure, it's as if the screenplay just grew organically out of a number of elements. Like many works by the Brothers Coen, Fargo is rich with the weirdness of America, with ominous statues of local heroes and checkout girls grinning vacantly like a taxi driver from Total Recall. Brilliantly offset by a doom-laden and very Nordic score from Carter Burwell as well as a sprinkling of familiar American hits, it scampers smoothly from one mood to the next. This isn't a big movie by any stretch, but it in its constant, delightful diversity, it seems to be part of some large and tangible world."
LoneWolfAndCub,"Jul 12, 2006",9/10,"Fargo is rightly named one of the best movies of the 90's. Featuring some outstanding performances, a great script and some beautiful cinematography. Frances McDormand rightly earned herself the Oscar for Best Actress portraying Marge Gunderson, chief of Brainerd police.Jerry Lundegaard (William H. Macy) is facing financial troubles. He concocts a scheme to get more money to support a new project he is undertaking. Jerry hires two men (Steve Buscemi and Peter Stormare) to kidnap his wife so he can get his rich father in law (Harve Presnell) to pay the ransom of $1,000,000. Unfortunately things get way out of hand.Fargo is a movie everyone needs to see. It is a mixture of many things. Crime, comedy, thriller, drama and romance. The screenplay is witty and packs many delights along the way. All the performances are perfect in this movie. The movies also is extremely true to life. The characters are not overdone or inhuman. Nothing seems unrealistic. If I were to name anything wrong with this movie it would be that it was too short. I really wanted it to continue on.4½/5."
akash_sebastian,"May 19, 2016",8/10,"The ordinariness of the characters in this film are so carefully crafted, and if the scenes are carefully analysed in the light of all the information, the characters are really not simple and black/white as they seem. The Coen Brothers, being brought up in Minnesota, critique the Minnesota Nice nature - people with their plain and warm exterior with folksy speaking style, but not so empathetic or well-wishing from within; the characters are as cold and distant as the letters of the film title because the characters are as emotionally isolated as story's vast empty landscape. The accent and snow, the white and distant environment, all these things accentuate the feel of the living conditions and community of northern US. I can't testify to the accuracy of the time and place, but the Coens surely give us an intriguing character study.The film takes quite a few witty jabs at capitalism and consumerism; it explores people's (here, especially Americans') obsession with fast food, television and cars. The realistic dialogues and quirkiness do make the characters stand out, like all Coen Brothers films. Many might say Marge Gunderson is the only character with good morals, but she isn't as pure as she seems. Marge, though an interesting character who defies prescribed gender roles and becomes our lead protagonist (though she enters only after one-third the film), she is as emotionally distant as the rest, as evidenced from her murder-scene inspection and ending ride with one of the kidnappers. Her routine life and by-the-book procedure, combined with her husband's not-so- sophisticated paintings about ducks and the decor of their house, exemplify the fact how they are a regular couple in a consumerist web so blissfully content in their simplicity and mediocrity.Expectation vs what's given to us. From the opening title where it says that this is based on a true story and events are shown as it occurred, a certain expectation is set. The Coens take advantage of this liberty and tell the story in the most unusual but interesting way. But they subvert these expectations by slowly inserting scenes that people couldn't have known (if the events are being shown as they occurred). But this helps us understand the characters much better. (We now know that almost the entire thing is fictional, other than, maybe, the murder that inspired them.) The Coens do this throughout the film. Two other good examples come from the scene where Marge meets her Asian friend from college. Compared to the ways Asians are traditionally portrayed in films, Mike really stood out - not at all a clichéd, accented Asian guy, but an emotionally unstable lonely guy who still stays with his parents in his 30s. And the story he tells Marge about his life, we immediately lap it all up, just like Marge does, not realising that the story had the exact plot details from 'Love Story'. The Coens surely take other such jabs at American pop culture. It's not what you expect from a true-story-based crime thriller. It's not what you expect from a comedy. Coen Brother films never usually fit into a single genre, and the unusual blend of crime and humour makes the film stand out.And without Roger Deakins, the film wouldn't look the way it does. That parking lot scene has been praised and analysed to death by now. And yes, it's a spectacular shot and has so much to say. The acting from everyone in the cast is terrific, especially Steve Buscemi, Frances McDormand and William H. Macy. Macy gives us such a unique and memorably loathsome character - an apathetic, selfish and cowardly hypocrite, always maintaining such a cheery facade. But he represents the frustrations felt by the pawns in the capitalist system, rarely able to earn or save much to be financially or emotionally satisfied. Hence, his various schemes to collect enough money, run away and start a new comfortable life.Though just a little less than 100 minutes, the film has been assembled with such attention to detail and innovation that it can be analysed and understood in so many different ways. It's not something that seems so great in the first view itself, but the more you see it or think about it, the more it lingers in your mind. Clever to end the film with the words ""Two more months"", since we know it might be a reference to the end of winter when the snow might melt and reveal the suitcase to a passerby."
stooey4,"Jan 5, 2021",N/A,"Some terrific performances from a stellar cast.
Typical Coen Bros servings but each of the four series tells a different tale of murder/mystery/intrigue.
The frozen wastelands of Missouri and Minnesota figure in each series and the period cars are a joy to see.
Loved it!"
shadow_blade-89459,"Feb 15, 2019",6/10,"""Fargo"" (1996) is a professionally produced crime drama about a kidnapping unraveled by small-time cop Marge Gunderson, played by Frances McDormand. Jerry Lundegaard, played by William H. Macy, hires two thugs to kidnap his wife in order to ransom her to his father-in-law to pay an undisclosed debt. I really enjoy films that I can identify with, rather it's the situation or specific character, or something that transports me into a different realm, unfortunately this film did neither for me. This film seems overly silly for such a serious genre that is based on true events. I am not a fan, but I can appreciate the unconventional approach.I have never been to either Dakotas nor Minnesota, outside of the airport, to attest to how they actually speak, but if they really sound like that, I may have to bite my tongue in saying it really hurt this film. I think I would have really enjoyed this film if there were less accents to detract from the storyline. This film, for me, painted everyone that wasn't rich as some type of simpleton with the silly accents, which by the end of the film is unfounded, especially for one particular character. The storyline, for as crazy as it is, especially based on real events, is really strong and followable. Overall, that one aspect mostly ruined the film for me as a viewer but allowed me to really appreciate other nuances in the beautifully shot cinematography. My recommendation to this film is solely for those who wish to approach a genre a little different."
up2u,"Sep 10, 1998",10/10,"This delicious blend of dark drama and light comedy follows the hilarious investigation of a kidnapping scheme gone wrong. The incomparable Frances McDormand gives a brilliant performance as a sweet, incompetent, pregnant sheriff and William H. Macy is equally good as a family man whose kidnapping scheme is falling apart and is making him implode. The screenplay is see-it-to-believe-it funny, the direction great and the cinematography perfect. Those miles of snow will be forever etched in my heart."
shemarnold,"Jul 26, 2018",6/10,"Finally got round to seeing this and I was rather disappointed.
It is slow paced and sometimes that's not a bad thing but it seems the reason in this case is that the movie wouldn't be long enough otherwise and still don't know why the scene with the infatuated Japanese man was in the movie! More padding?
It's not all bad though. It's a ok movie and there are good acting performances all round, funny dialogue and good on screen chemistry between the actors. Just a little overrated. Go in with lower expectations and you won't be as disappointed as I was."
IceCream-57,"Mar 27, 2024",10/10,"Classic! The Cohen Brothers are silly! That's best way I can describe them! This film takes place in a small Minnesota town. This is a film about greed and stupidity, to be completely honest. A man that is behind with so much debt does the worst thing humanly possible- he had his wife kidnapped to fake a ransom so that he could get the money to pay off his debt. But there are so many plot twist and turns in this film due to the greed and horrible personalities of the crew involved with carrying out the plot. One thing I enjoy about this film to is how the crew is so much more intelligent in the town of Fargo then what they come off as. I definitely would recommend. Classic film."
HudsonBane,"Jun 14, 2022",1/10,"A mediocre movie about mediocre people living possibly the most boring existences imaginable. Heres the whole movie; ""blundering buffoon solves a dumb murder case."" I saved you an hour and a half of your life! Go enjoy it by doing something infinitely more interesting than what the characters in this movie do."
MaddoxMoviesnTv,"Jun 20, 2024",9/10,"Fargo is one of those movies where there just isn't much to complain about. It has one of my favorite environments for a movie, that being one where it feels relatively empty, lonely, and boring (similar to napoleon dynamite). This film, while not perfect thus getting a 9, hits home on just about every element. It has good crime, good comedy, great cinematography, great acting, and anything else you could hope for. A highlight of the movie to me was it's ability to make me feel what the character was feeling. If they were annoyed, angry, tense, or nervous the feeling was portrayed well. Solid 9."
chas437,"Jul 1, 2021",10/10,"...and its not even close. What more can be said about Fargo? Fargo is Shakespearian in its grandness, with career defining performances from the elite ranks of American actors and a brilliant insight into the human condition, from the best of what people can achieve to the lowest, most contemptable.I see a disturbing number of negative reviews on here, and it really makes you consider how fall standards in art have fallen among younger people. Back in 1997, even those who didn't love the violence in Fargo at least conceded that its a superbly constructed film.This is a top-10 film of all time."
samagramz,"Sep 6, 2024",10/10,"A lot of people consider No Country for Old Men to be the best effort from the Coens, and while that movie is A masterpiece, it doesn't really match the genius of Fargo.A lot of people forget that in 1996 the Coens weren't popularly successful. They'd had critical acclaim with Blood Simple, Raising Arizona and Barton Fink, but it was Fargo that truly put them on the map. And why not? Fargo is just about as perfect a film as you can find.The reason I consider this a step above No Country for Old Men is that Fargo offers pointed but not preachy philosophy about what truly matters in life and where genuine happiness comes from. No Country is brilliant, but it's also deeply nihilistic (which should come as no surprise, being based on a Cormac McCarthy novel).Everything about Fargo is top-class. The acting, the cinematography, and especially the writing. The entire cast gives career-best performances, Roger Deakins creates incredible visuals out of the Minnesotan winter, and the dialogue mixes tragedy and comedy so well that they're almost indistinguishable. And at the center of it all is France McDormand in her Oscar-winning portrayal of a brilliant police chief.The Coens have no shortage of classics, but this amazing film will always be my personal favorite."
Spleen,"Aug 6, 2000",9/10,"There are many incidental pleasures in ""Fargo"", but where's the structure? I recall reading a definition in one of those concepts-for-which-we-have-no-words dictionaries: ""a book in which everything is clear except the author's purpose in writing it"".  Here is the cinematic equivalent.For those who want to excuse the film's messiness as the result of being based on a true story ... well, guys, I don't know how to say this: it isn't.  That ""the events you are about to see"" opening statement is a simple lie.  They made it all up.  I don't know about you, but I'm not inclined to just shrug my shoulders and say, ""oh, well""; this is AT BEST the Coen brothers' shameful way of manipulating us into doing their work for them. They should use craft to make us accept their stories, not deceit.  No doubt they can pass it all off easily enough as a postmodern joke, but to tell the truth, I'd thought the Coen brothers were above postmodern jokes - and they are.  ""Barton Fink"" was one of the best films of the 1990s.  ""Fargo"", thanks to its shapelessness, fails to live up to the other three Coen works I've seen.  (In case you're interested, the remaining two are ""Miller's Crossing"" and ""The Hudsucker Proxy"".)And yet, and yet ... Particular plot elements, individual scenes, certain characters and aspects of people's characters, are so fascinating, so artfully drawn ... it's frustrating.  Lundegaard is a wonderful character. He's the kind of man who stumbles from one weak act to the next and would probably hate himself if he stopped to think about his actions at all.  It was very clever of the Coens to begin his story in the middle.  We're never told exactly what fraud he's trying to cover up by kidnapping his wife; but we know, we just KNOW, that he committed THAT to cover up some lesser fraud, and the lesser fraud was in turn a way of saving face after he'd done some other thing, and that when we trace the chain of events back to its source we'll find ... in all likelihood, nothing.  Marge Gunderson is also a wonderful character.  She's proof that someone can be deeply, deeply good without being dull, or getting on our nerves.  Take the superb scene where she meets her old school friend in a restaurant ... but I'm reminded of what's wrong with ""Fargo"", for what's THAT scene doing in THIS movie?  I can't make it out.  ""Fargo"" really baffles me.  So many good parts, a curiously unsatisfying whole; great throughout, good overall."
alucas-2,"Dec 7, 2000",N/A,"I may not know movies as much as your average film student, but I know literature.  With that said, I'm convinced that if Shakespeare were alive today he'd be making movies and the Coen Brothers would be his chief competition. In Fargo, every line spoken, every facial expression rendered, and every broad shot of American tundra moves me in some way.  If this movie doesn't stand the test of time then I don't trust the test of time and whoever made up the test of time should be immediately flogged for fooling us all for so long. There, now.  That's as good a review as I can make.  I hope it takes.Feel free to contact me with questions or comments."
isaiahhollister,"Jan 16, 2024",6/10,"6.1
The good: The acting is the very good. Probably not worth an Oscar good (looking at you Francis McDormand) but still it is good.You also do get the sense this is a small town area.The bad/what I don't understand:
IMDb categorizes this movie as:
Cop drama. Dark comedy. Police procedural. Crime. Thriller.I understand the crime part. And I can (barely) understand the dark comedy part. (Although there was never any moment that I even smirked because of any sort of ""comedy"")
I don't see how this is a cop drama or a police procedural or a thriller.This movie is only 1.5 hours, and I found my self checking how much time was left multiple times.This feels like a movie that ""film"" people like to like. I don't really understand why that is or why it has such a cult following.When it ended my only feeling was relieve that it was over. Other than that it did not make me feel anything.But honestly now I can check it off my list and never watch it again."
natecjohnstone,"Apr 2, 2021",10/10,"Fargo (1996) has a simple opening - a car driving on a snowy day. Carter Burwells music in the background starts soft, yet sad - we know that this is the start of something tragic. As the car grows closer, the music grows louder, and we understand the scale of the tragedy about to occur - it is all about to go down, and it won't be good. This is one of many astounding scenes that comprise this movie.I can not express my intense love for Fargo enough. This movie is just sheer brilliance. It manages to be so much at once - tragic, hilarious, dark, gritty, touching, sad, tense. Yet the tone feels consistent throughout the movie. What makes it even more unique is its separation from heist movies - it just keeps topping itself. We've all seen movies where heists don't go according to plan - Dog Day Afternoon (1975), Reservoir Dogs (1993). But what Fargo does is it doesn't stop at one error, no - it just keeps going. Things just keep going wrong to the point where you, the viewer, believe that it just can't get worse. But then, of course, it does.Each character is unique and perfectly cast. The movie is known for Frances McDormands performance as Marge - a friendly, yet good cop. However, I also think that both Steve Buscemi's portrayal as Carl Showalter and Peter Stormares portrayal of Gaear Grimsrud are fantastic. The same applies to William H. Macys portrayal of Jerry Lundengaard. As I said, each character is unique and fleshed out, separate from the rest.There is so much brilliance in Fargo to be loved. The Coen brothers prove themselves as masterful filmmakers once again with this movie. If you have not seen it, I could not recommend it more."
robh,"Jul 29, 1998",6/10,This movie does not live up to the hype. It's ok but nothing special.
karins-2,"Sep 18, 1999",1/10,"I can't for the life of me understand why people like this movie. It was TERRIBLE! It glorifies violence (even tries to turn it into a big ""joke"") and makes all the characters look stupid -- the ""bad guys"" as well as the ""good guys"". This is, quite simply, a movie without any redeeming qualities. When I left the theater, I was depressed for hours."
bellino-angelo2014,"Nov 10, 2022",8/10,"While I am not really a big fan of the Coen brothers I liked most of their movies I saw, the best being THE HUDSUCKER PROXY. Having heard for years about FARGO since they made also a TV show based on it, I knew that some day I would have seen it, and I did last March. Considering that to date there are 1,087 reviews I'll be short.Jerry Lundergaard (William Macy) is an idiot businessman that has some problems in money. For having more money he has a plan: to fake the kidnapping of his wife Jean so that his father in law is forced to pay the ransom. After the advice of a car repairman he goes to a bar in Fargo where he meets Carl Showalter (Steve Buscemi) and Gaear Grimsud (Peter Stormare) and promises them to give a car and, give half of the ransom money to both of them. Carl and Gaear succedd but Jerry didn't considered that the two are idiots: while Carl drives the car with the hostage Gaear shoots a police officer and two that were witnesses to the scene. All goes unnoticed until Marge Gunderson (Frances McDormand) comes, and she takes the problem personally while she is also waiting a baby. There are lots of twists and turns, but it's best that you see them for yourselves.I liked the performances: William Macy is perfect for the role of the salesman that plots the kidnapping of his wife, and Steve Buscemi and Peter Stormare are great as his bumbling henchmen. And while Frances McDormand looks like a supporting character, she truly deserved her Academy Award for best Actress (see the ending and you'll understand what I mean). The setting was cool in a way, and the whole movie has some sort of nostalgic feeling from the 1990s that even folks who didn't lived there like me would have.In substance, FARGO stands to his reputation as a cult movie and it's certainly a must see. Just don't have too much expectations for it."
