user,date,rating,content
keving4241,"Oct 11, 2018",10/10,"My grandfather fought in WW2 somehow surviving D-Day. He was apart of Operation Neptune and stormed the beaches of Normandy. He told us a lot of war stories but rarely ever spoke about that day. Before he passed away he did an interview with a local newspaper and detailed what he saw despite it being very difficult for him to speak about. He loved watching war movies... not sure exactly why. Some about that soldier life never really leaves them I guess. He absolutely hated Pearl Harbor cause of the horrible way they portray the military to be a bunch of toothbrush wielding babies who don't know what to do in the event of being attacked. He had a friend stationed there who lost his life and thinks that movie is a disgusting display of ignorance. Soldiers don't take girlfriends on private plane rides. And they most definitely know how to swim. Maybe I'll give that movie a good ripping one day.But Saving Private Ryan was a respectable ""I can't watch this"" reaction. He said no movie has come that close to capturing what that day was like. He said it was too realistic. Whether or not the story is based on real or fiction, that intro was 100% realistic. I'm not sure if he ever did finish watching it but he appreciated it for capturing that chaos like no other movie has before. I watched the movie a dozen times now and keep it in my collection as a reminder of my grandfather. A scene he was technically in. Which makes me appreciate how strong of a person he really is.War is hell and this movie not only shows that while being an entertaining experience but also captured what soldiers are left behind with. My grandfather was not afraid of anything. I've seen this man walk into a cellar full of black widows to get firewood and not even shake them off. The only time he ever experienced fear was when he went to bed. His nightmares of his time during the war would haunt him in his sleep. This movie helped me understand why."
j-a-julian,"Dec 31, 2019",10/10,"The first 23 minutes of this film is rated at a 12.My good friend and I took our sons, 17 at the time, to see this in a theater. I am a senior military officer who experienced combat in 1967 - 68 - 69. We wanted the boys to see the horror of war, the slaughter.I have had to pack up the personal effects of my comrade to send back to his mother after he was killed in the Viet Nam war. Those of you who have not done this cannot even comprehend.After the opening combat scenes the film was an 8. Well done.War is hell and to those of us who have been there ... well I don't know what to say.Neither of our sons joined the military ... thank God."
bigmikeh-59467,"Sep 12, 2019",10/10,21 years ago this movie was released and I finally watched it in 2019. I really struggled to watch and I cried and I wept through most of the movie. I did two tours in Nam. This movie was like being back in country. I will never watch it again. It's just eats my guts out.
dedjim,"Jun 10, 2001",N/A,"I know it's fashionable to trash successful movies but at least be honest about the trashing... Pvt. Ryan was fiction but it was pretty good HISTORICAL fiction. The details were well thought out and based on reality.There was nothing stupid about the portrayal of the German army... Rommel DID blunder in his placement of force, The high command DID think Calais was going to be the invasion spot, not Normandy. Hitler didn't wake up until noon on that day and his aides were afraid to wake him. The Rangers did come in right behind the first wave and did take a beach exit by sheer will to get the hell off the beach. The bluffs were the scene of heavy close fighting. The german defenders were mostly Eastern European conscripts from defeated areas. (note that the 2 men that tried to surrender were NOT speaking German). There WAS a young man rescued from interior Normandy after his brothers were all killed. He WAS an airborne trooper (the difference was that he was found by a chaplain and was removed from the front.)The battles inside Normandy were small actions town to town, street to street, house to house. Small actions like taking the radar station happened. Small actions like a handful of men defending a river bridge against odds happened. Small squads of men, formed out of the misdrops banded together ad hoc to fight. There were all enlisted groups and all officer groups. A General did die in the glider assault. FUBAR aptly described much of what happened that day.And there were only Americans in the movie because the Brits and Canadians were many klicks away in a different area... this was Omaha beach. The story was an American one. And Monty DID bog down the advance and everyone knew it. And as for ""American Stereotypes""... well those pretty much define America: my college roomie was a wise-ass New York Jew. My best friend was a second generation east coast Sicilian.  My college girlfriend was a third generation German. My first wife was French and English. I'm Irish, my boss is Norwegian and I work with a Navaho... you get the point?So much for it being bad history. It was in fact an excellent way to let a jaded and somewhat ignorant-of-their-past generation *feel* something of what their grandparents (LIVING grandparents) went through. It is perhaps less important that the details be exact as the feel be right. Even now the details are not fully known or knowable about that campaign... it was too big, too complex and too chaotic to be knowable. There is not even an accurate casualty count of D-Day itself.Now as to the depth of characters. What I saw there was the extraordinary circumstances into which ordinary people were thrown and what happened to them. I saw the things that would mark a generation (I have heard in my elderly male patients sentiments similar to what Cpt. Miller was expressing when he announced his ordinariness) I saw the dehumanization that occurs with war and its mitigation moment to moment, man to man... Cpt. Miller didn't know anything about Ryan and he didn't care... until Ryan revealed his humanity to him with his story of his brothers. Pvt. Reiban was ready to walk out of the situation until he discoverd his captains ordinariness and his humanity. Then he began to look to him almost as a father. Pvt. Mellish rightfully delights in his revenge for all the times he's had to take it because he was Jewish by telling German captives he's ""Juden!"" Nerdish Cpl. Upham can stand alongside his bigger, stronger, braver Ranger compatriots and describe the poetry and melancholy of Edith Piaf's song... then face his cowardice, turn around and stand up in the face of danger and finally demonstrate the dehumanization of the enterprise he was enmeshed in by executing Steamboat Willie... even though Willie had no more choice about being there than Upham did and in other circumstances would have made a friend.I could go on and on with this but enough already. OK, perhaps it is not The Best Movie Ever Made but it is still a good movie. And if one will take the blinders of fashionable negativism off they will see it. Finally, this is not a patriotic story... if anything it is an acknowledgement and thank you to all those old men still out there that did so much for us. To them I say a deep and sincere thank you."
weiz_one,"Nov 17, 1999",10/10,"I have never been affected by a movie the way Saving Private Ryan affected me.  That movie really took me out of my seat in the movie theater and practically had me believing I was really in the battle with John Miller. When somebody was dying in that movie, it felt as if you could almost feel their pain.  Speilberg did an unbelievable job of putting realism into this movie with the camera-work and everything else.  Simply amazing.  An all time great."
lc-2,"Jul 29, 1998",10/10,"It gives a million reason why no one should go to war and one very powerful reason to go to war. It is a soul numbing realistic depiction of what our grandfathers, fathers, uncles, brothers and sons have faced in humanities darkest moments. Not just in WWII but in any war. No one can see this movies without being altered in some way. No one should miss it with the EXCEPTION of those war veterans that have already been there. The surround sound puts the audience in the middle of the battle.Steven Spielberg has out done himself and effectively held up a mirror to civilization for events to which we should all be ashamed of, rather than appalled at the movie for its real life depictions. I suggest that this movie be made standard view for congress as well as the President each and every time the question of war comes up. This movie would not stop future wars but I would hope the objectives would be much more clearly defined. I say this as a US Marine."
adammfeeley,"May 12, 2015",10/10,This film is an absolute masterpiece. It shows that war isn't always glamorous. Steven Spielberg won a Best Directing Oscar for his work on this film and the film went on to win four others. It is gritty and bloody and it shows that wars aren't won by weapons but by soldiers. The cast shine as the group of soldiers tasked with finding Private Ryan. Along the way they encounter the harsh truth and real meaning of war. It boasts impressive battle sequences and the stylish cinematography makes the film truly beautiful. The opening beach sequence is possibly the greatest opening scenes in movies. Tom Hanks is spell binding as the commander who has no idea about the harsh truth of war. Overall a truly amazing film.
janesbit1,"Jan 25, 2000",9/10,"It's been over a year since first seeing Saving Private Ryan -- it's a worthy effort by Speilberg--his best since Shindler's List by far. You've probably heard about the amount of violence, blood, and gore and that's all true--it's got the Viet Nam movie style violence (and then some) but it's not gratuitous. Were it sanitized like early WWII movies, modern audiences probably wouldn't take it as seriously.The movie has that trademark Speilberg style--the structure is all tied up and unified from beginning to end, the emotional symbols abound, the music swelling when he's working at your emotions, the hand held camera that worked so well in Shindler's List to give you a feeling of participation, camera angles and periods of silence to disorient you (like Shindler), suspense techniques learned from Hitch... It's a movie that stays with you for a period afterwards.Hanks will be the early front runner for Oscar after this flick--Academy members like him AND it IS his best acting job ever. While Speilberg will likely be criticized for attempting to manipulate the audience's emotions while keeping a distance from the inner core of his characters, Tom Hanks reveals a really complex military leader in this story, and does so without overacting--somehow it comes from within. While you may not empathize deeply with many of the platoon, you will still feel something because of the relationship that is formed with Hanks.After the initial set-up, you will have the opportunity to participate in the D-Day operation and experience the horror of it. Those who have been in a real war can comment about how realistic or not Speilberg captures its chaotic horror in this scene.In my case I again feel very lucky that my draft number was high, so I never had to face Nam like many of my classmates. Speilberg reminds us brutally in ""Saving Private Ryan"" that we All have a debt to pay to the brave souls who have sacrificed so much for us. What Tom Hanks does with his performance is to remind us of this debt in a very personal way."
wheatley-20230,"May 13, 2021",6/10,"You can't fault the production or the acting. So why does this film fail to live up to its promise?I think it is perhaps the episodic nature of the story. Each episode is fine but they don't add up to something greater. Instead the initial power of the film, built on those opening scenes on Omaha beach, is gradually dissipated.The great war films - Paths of Glory, The Dam Busters, Glory, All Quiet of the Western Front - have a driving force in their plot that does not let you go.But then again - 1917 is certainly a great war film and is also episodic. But the director keeps us hooked in a way that Spielberg does not manage here."
morales123,"May 17, 2000",N/A,"To think that this movie did not win Best Picture is a crime. Director Steven Spielberg uses all of his talent and resources to give to the world the greatest war film ever made.Though it's true that this is not the type of movie you want to sit down with the family and eat popcorn, the emotional drive of the picture, the story's poignant messages, and the fantastic acting of the cast draws you into a world that is both dangerous and unpredictable.Spielberg is able to take you into action and make you feel as if you are a participant in the movie and not just a viewer. This is Tom Hanks' best movie he ever did. Forget his performances in Philadelphia and Forrest Gump (though they were also good); he should have received another Oscar for the role of Capt. John Miller, a leader who must act strong in front of his men, but must also hide his emotions from them.  It would have been well-deserved if he won again.I give this movie my highest recommendation. Saving Private Ryan is a movie that makes you realize how life is precious and how honor and duty, though they are deep philosophical concepts that are praised in war, can put you in jeopardy of losing your life for something you may not believe in."
Nazi_Fighter_David,"Oct 26, 2008",9/10,"Steven Spielberg makes a unique motion picture in regards to the D-Day invasion of World War II just in the gritty reality of the detail For more than twenty minutes he revives for us the landing at Omaha beach No one was prepared for how horrific it really was No one understood what was going on: The terror, the chaos, the maelstrom of bullets, the near-deafening explosionsYou really got a sense of what these guys had to go throughWithin that perplexity, the focus settles on six soldiers under the command of Capt. Miller (Tom Hanks) after they've survived their terrible hours breaking through the first line of German defense, they're given a strange perilous mission, to find one man, Pvt. Ryan (Matt Damon), a paratrooper who's somewhere behind German lines For them, it's an abstruse order, but they have to get it doneThroughout the film, Spielberg's attention to detail is amazing For me, the most chilling scene in the movie is the death of an American officer It's one of the most intimate It's also a slightly confusing moment because two German characters resemble each other so greatlyToward the middle, a German soldier called ""Steamboat Willie"" is introduced By the end of the film, he has become the 'bad' German Later in the movie, another German is involved in the final fight He takes part in an exceedingly painful scene of hand-to-hand combat with the American soldier The two German soldiers have similar short haircuts and black uniforms Because they looked so much alike, many of us have believed that they're one character They're not, and the distinction of the two is very significant"
ccthemovieman-1,"Feb 27, 2006",10/10,"Without looking, I am sure other reviewers here have headlined their article ""Best War Movie Ever Made"""" and I agree. However, before briefly discussing the film, let me just say if you don't have a decent 5.1 surround sound system, you aren't going to fully appreciate this movie (DVD).It's a great film to start with, and sitting in a room surrounded by five speakers with bullets flying from all directions around you - as in that spectacular 22- minute opening scene or in the final 45 minutes of action against the Germans in tanks - is an astounding movie experience. The sound in this film elevates it even higher.The visuals are outstanding, too. I've never seen so many grays, beiges and olive-greens look this good: perfect colors for the bombed-out French city where the last hour takes place, perfect for the faces and uniforms of the gritty soldiers, for the machinery, the smoke-filled skies, etc.My only complaint is the usage of Lord's name in vain 25-30 times, but, hey, when you consider it's tough men in tough times, that's what you are going to hear. In real life, the profanity probably was worse than the film.It's hard to picture the brutality of war being any worse than you see here, but it probably was. This is about as graphic as it gets. The violence and gore was shocking when this film came out in 1997 and still is when watched almost a decade later. It's unbelievable what some of the WWII soldiers went through, but that can be said for any war. I believe the purpose of this film was to pay tribute to the sacrifices these men made, and it succeeds wonderfully. Hats off to Steven Spielberg and to Tom Hanks, the leading actor in here, both of whom have worked hard for WWII vets to get the recognition they deserve, not just on film but in a national memorial.Anyway, language or blood and guts aside, this is still an incredible portrait of WWII. The almost-three hour film is riveting start-to-finish, especially with that memorable beginning action scene, probably the most dramatic in the history of film.As ""entertaining"" as those action scenes were, I found the lulls, if you will, to be even better. Listening to Hanks and his men discuss various things as they look for Private Ryan, was fascinating to me. Hanks is just superb in here and once again shows why he is considered one of the best actors in his generation.The most memorable and powerful moment among the ""lulls,"" is the shot early on of the Ryan mother sinking to her knees on her front porch as she realizes she is about to get disastrous news from the war. Moments later, Harve Presenell, playing Gen. MacArthur, eloquently reads a letter by Abraham Lincoln that is so beautifully written, so profound that it is quoted near the end of the film, too, and I never get tired of hearing it.This is a man's movie, and shows the horrors of war as few others ever have. To say it is ""memorable,"" just doesn't do it justice. It is the greatest war movie ever made....period."
TheLittleSongbird,"Mar 15, 2009",8/10,"This is definitely one of the more powerful war films out there, if not the most powerful. I will admit, when I first saw it at school, I found the first half-hour extremely upsetting to watch.The acting is outstanding. Especially from Tom Hanks and Matt Damon, and the music alongside Schindler's List is John William's most haunting score I've heard.It does drag in the middle and the dialogue doesn't always flow as well as it should, but what we have is a historically accurate, extremely well made and directed and unashamedly brutal film. I mean, in the stabbing scene, towards the end, my English teacher had to leave the room. It was like watching Frankenstein's monster tearing out Elizabeth's heart.8.5/10 for a truly emotional and appropriately sombre war-film, that is a little slow at times. But it deserves to be in the top 250, really it is that good! Bethany Cox"
helpless_dancer,"Apr 15, 2000",10/10,"The opening beach assault sequences were the most violent, realistic, and upsetting filming I've ever seen; looked as though the thing was actual combat footage. The shushing noises of rounds cutting through the air was the most chilling part of all. Perfect portrayal of the insane stupidity of war and the anguish of all who enter this most foolish of enterprises. A must see."
Xophianic,"Feb 2, 2000",10/10,"Saving Private Ryan is, without a doubt, the best war movie ever made and one of the best movies of all time. I wasn't sure what I would think of this movie before I saw it. I heard the gore and carnage was too much, and I heard the story and action was great.When I finally did see it, I loved it. The gore wasn't as bad, in my opinion, as everyone said it was. I thought the battles scenes were fantastically done. They were entertaining to watch, but with a certain sadness to it. I also think the moments of reflection among the soldiers was very good too. You got to hear their thoughts about the enemy, the soldiers and the war itself.The acting was great, especially by Tom Hanks. Tom Hanks certainly deserved the Academy Award for best actor, even though he did not get it. Matt Damon also did a great job as Private Ryan. Watch for a great cameo-like performance by Ted Danson.The storyline was interesting. Most of all, it showed what the war was like and how horrible it was. Some of the American soldiers were killed before they even entered the battlefield, some before they could even fire back, and some went down in a blaze of glory. Either way, you felt pity for the Americans and hatred for the Nazis.The mission the soldiers were on was to find a single man, Private Ryan, and bring him home, because all of his brothers were killed and he was the last male survivor of the family. You, along with the soldiers in the movie, will always be thinking about whether it is worth it to risk eight lives to save one man. Many things happen through the film that will keep changing your mind about it.If blood, guts and gore bothers you, you really should not watch Saving Private Ryan. Otherwise, I recommend going out and buying it right away. You will not be disappointed."
AnimeChica,"Mar 21, 2006",10/10,"This movie is so powerful. I couldn't watch it without crying, jumping, gasping, screaming, laughing, and cringing. It brought you through a whole array of emotion.I couldn't help but give my entire being over to each character as a stunning performance was drawn by each actor. Simply amazing. I can't describe it any other way.Easily the best war film I've seen. None was more realistic... Amazing amazing amazing.Recommended to anyone who enjoys historical fiction.LOVED IT!"
Smells_Like_Cheese,"Mar 16, 2004",10/10,"I'm starting to think that everything that Speilberg touches turns to gold. This is probably considered one of the greatest movies of all time and it is directed by Speilberg. The movie is incredable. The beginning was horrifying. I couldn't believe how accurate it was and painful it was to watch. When I studied WW2 in high school, I thought no one could ever re-create the Beach of Normady. But Speilberg did. I felt like I was there with the soldiers. I felt their fear, pride, and love for their country. I couldn't believe how much dedication our armies put into fighting and winning the war. And whenever I go to visit Washington D.C., I have more American pride then ever. I am more than proud to give this movie a10/10"
lee_a_scott,"Nov 3, 2007",7/10,"When I first saw this film at the cinema I was, like everyone else in the world, blown away by the opening scenes and then mostly entranced by what followed. Upon re-watching it these years later, the overall effect has been lessened by familiarity and, possibly, by being Speilberged out after watching Munich last week! The battle scenes are still excellent  visceral, terrifying and all too real  conveying the calamitous confusion of war in a way seldom matched in the movies. When the action slows down, so does the film, and this often leaves you feeling a little disinterested as the characters lack of back-story and overly obvious attempts at making them look good (Woo! I've saved a child! Boo! I've been shot!) seem to jar with the realism attained elsewhere. It's still a cracking film though, and the weaker bits have actually stood up better than the strong bits in my opinion (although maybe I'm just more tolerant of schmaltz as I get older)."
Hitchcoc,"Jan 24, 2000",8/10,"There's violence and there's violence. With the huge numbers of personal reviews of this movie, I'm hard pressed to add much. The first half hour affected me like no other in recent years. I wondered as the boys threw up on the amphibious carriers whether they were seasick or scared beyond belief. When one uses the expression ""cannon fodder"" so casually, do we realize that this means the second wave makes it's way to the beach over the dead and dying bodies of the first wave, like ants sacrificing themselves to ford a puddle. The ones that get through, get through because there are only so many bullets and so many people. They are exposed, disoriented, helpless--they have no place to go but ahead. I will be haunted forever by the soldier searching, then finding his dismembered arm in the carnage. I will remember those trying to get above water, only to be cut down below the surface. If anyone has a heart, his or her attitude toward war should never be the same. How can we who have never been there have a hint of what it must have been like. Like Schindler's List on the Holocaust, this should be a training film on war."
