user,date,rating,content
ackstasis,"Nov 19, 2007",7/10,"It's probably inevitable that, after hearing so much about its greatness, 'Fargo' proves something of a minor disappointment. After numerous critical successes {including their finest film to date, 'Miller's Crossing (1990)' and the Palme d'Or-winning 'Barton Fink (1991)'}, Joel and Ethan Coen apparently struck gold with 'Fargo (1996),' the ""true story"" of a kidnapping and murder in the icy wastelands of Minnesota. The film is a thematic retread of the brothers' debut picture, 'Blood Simple (1984)' {of which I was not overly-fond}, and explores how a seemingly-simple crime can escalate into the tragic and devastating destruction of innocent (and not-so-innocent) lives. The Coens would return once again to this popular theme with the accomplished film-noir, 'The Man Who Wasn't There (2001),' which is arguably one of their best efforts. 'Fargo' was the filmmakers' first real Oscar success, retrieving seven Academy Award nominations and two wins (Best Writing and Best Actress in a Leading Role {Francis McDormand}). However, the film's Best Picture chances were upset by Anthony Minghella's majestic wartime romance epic, 'The English Patient.'In a dreary small-town region of the United States, where the road is perpetually covered in frost and a sheet of ice affixes itself to your car windscreen, money-troubled father Jerry Lundegaard (William H. Macy) plots a simple, fool-proof method of acquiring funds. He hires two dubious-looking thugs (Steve Buscemi and Peter Stormare) to kidnap his own wife (Kristin Rudrüd), in order to extort ransom money from his wealthy, domineering father-in-law (Wade Gustafson). However, things don't go quite to plan, and after the two low-life criminals murder a state trooper and two passing witnesses, local Brainerd Chief of Police Marge Gunderson (Frances McDormand) arrives to investigate. She, like almost every other character in the film, has the jovial disposition and exaggerated mannerisms of typical Midwestern small-town folk, discussing a triple-homicide as though somebody has just stolen a cookie from the jar, and making frequent use of such quaint phrases as ""You betcha,"" ""Aw Jeez,"" ""Okie-Dokie"" and ""Yah.""The Coens have done a lot right with 'Fargo.' Their decision to blend a thrilling tale of deceit and murder with moments of satirical  almost slapstick  comedy creates a unique and interesting contrast that sets the film apart from most thrillers. William H. Macy is at his jittery best as a potential con-man so hopelessly inept that he can't call off the dangerous ruse because he never acquired the kidnappers' phone number. Steve Buscemi is, likewise, fantastic as Carl Showalter, a ""funny-looking"" weasel with a hot temper. Peter Stormare is suitably psychotic as the sullen but dangerous Gaear Grimsrud, even if his role just required him to remain silent and look creepy. Then we come to Frances McDormand (a.k.a. Mrs. Joel Coen), who, regardless of her talents as an actress, has annoyed me in every film in which I've seen her {which basically just covers 'Blood Simple,' 'Fargo' and 'The Man Who Wasn't There,' though to a lesser extent in the latter}.I know that Marge Gunderson is supposed to be one of the Coen Brothers' most entertaining creations, but her character somehow seemed so pointless. We spend all our time following her lightweight attempts at an investigation, and yet all I cared about was the kidnapping and how Jerry was coping with it all. Perhaps to hide the fact that Marge has almost nothing to do, the Coens toss in a couple of extraneous, dead-end minor characters who serve no purpose other than to distract me from the more exciting segments of the story. All things considered, 'Fargo' is a solid, albeit flawed, thriller/comedy that is characteristic of the Coens in every respect. Allow me to reiterate that William H. Macy was absolutely phenomenal, and definitely gives the film's greatest performance, though I did think that his character gave himself away too easily. In the grand scheme of things, 'Fargo' could certainly scrape into the directors' top five films, though my hope is that their latest release, 'No Country For Old Men (2007),' will oust it from the list."
johnny-89987,"Jan 27, 2021",7/10,"Before watching this movie, I had seen its series and I had a bag, but when I saw the movie, it was not at all at the level and size of its series, especially the first season. I saw a normal movie and of course it had bugs that were very good only in its time and facilities of that day, not for all times"
TrashcnMn,"Sep 4, 2001",2/10,"""Heh heh, they talk funny.""That's the only real reason I could even IMAGINE anybody thinking this movie is funny.  This movie is really not that interesting.  The one critical thing that I noticed about this movie is that you don't care about the characters.  The apathy is AMAZING.  I really could not care less if a friggin' nuclear missile hit Fargo and all the characters died.  Normally, for a movie to be good and have suspense, you need to feel for the characters (ie Memento, American Beauty, Pulp Fiction), but I just didn't feel that in this movie."
AvinashPatalay,"Jul 8, 2010",N/A,"Heard quite a lot about ""Coen Bros"" but never really got around to watch any of their body of work. When I watched ""Fargo"" today I was spellbound by the cinematic genius('es). Considering this movie is about 15-years old it would be an understatement to say that their writing and cinematic sensibilities is beyond expression.The characterisation of each actor leaves an impression. For instance unlike other movies in ""Fargo"" a cop is just not a character, he has a life too, a family and emotions. Unlike a cog-in-the-wheel the writing goes a bit deeper to flesh out the character more effectively thereby making them more true-to-life and connectable.Performance wise, as stated earlier every character is a gem.۩ William Hacey:: The backbone of the plot and hence he ought to have delivered good in good condition. He delivers to the utmost perfection. Perhaps the best in his career.۩ Steve Buscemi:: A hidden gem then as opposed to now. And his spark showed way back then. A very natural and gifted actor.۩ Frances McDormand:: She literally gets into the skin of the Marge.۩ Harve Presnell:: very regal and assertive performance.The dark humour is plenty and slightly shocking, which is kind of expected. The background music is paced well with the narrative and does linger in the head for a while.Watch it once and you can be absolutely certain to come back and relish the characters all over again."
yaseminturkish,"Apr 16, 2002",6/10,"The first time I saw Fargo in 1996 I enjoyed it mainly because I was hoping that it would edge out the highly over-rated snorefest The English Patient at the Academy Awards.  Now I'm aware of the fact that Fargo is also highly over-rated.  Three generations of my family grew up in Minneapolis, Minnesota and Fargo, North Dakota.  The mannerisms and speech used by William H Macy and Frances McDormand is realistic but why should I remember this screenplay twenty years from now?  Apparently it is a true story which must have all the fans of Survivor running for their local Blockbuster stores along with the fans of America's Most Wanted and Cops.  When I want to see reality that will impact me for years to come I'll rent something historically significant like Malcolm X or a documentary film like No Man's Land or One Day in September.  These movies are by the books as reality movies should be and don't look for black comedy that offends the memories of the people who were most closely affected by the tragedy.I did appreciate the effort on the part of the Coen brothers to add their usual wit to the mix.  William H Macy was hilarious as the father and husband who was more worried about money than about the lives of his family. It was a somewhat enchanting experience to watch him try to keep everything under control while slightly breaking down with every passing moment. Frances McDormand has proven herself to be talented in Almost Famous and The Man who Wasn't There but she is highly over-rated here.  Perhaps it's my bias that was putting all bets on Emily Watson's extraordinary performance in Breaking the Waves for the Academy Award.  For me McDormand was adequate and appeared to be having fun but not memorable 20 years down the road.  The always reliable Steve Buscemi (he should have won for Ghost World) stole the show here.Fargo is a film that I'd recommend to the reality-television audience and to serious fans of the Coen brothers films.  It enchants on some level but may disgust some viewers who will be perplexed that this really did happen. It suffices as a rental on a Saturday night when you want to see what all the fuss is about.  Be prepared however, if your from Fargo or Minnesota to be somewhat offended.  After all, when you see Frances McDormand, you'll be looking in the mirror.6/10"
fernandoschiavi,"Apr 15, 2023",8/10,"Masters in the art of telling a good story through cinematographic cameras, the Coen brothers tend to stand out for their very peculiar characteristics, such as their narrative economy, the hints of black humor that permeate their films and their remarkable ability to create striking scenes. All of this can be found in the excellent ""Fargo"", a feature that certainly deserves a prominent place among the countless interesting works of the Coens, which is no small thing, considering the vast and qualified filmography of the duo. Beneath the surface of a suspense thriller and police investigation, the screenplay for ""Fargo"" (written, as usual, by Ethan and Joel Coen themselves) tells the story of desperate Jerry (William H. Macy), a manager at a car dealership. Automaker who faces financial difficulties and decides to plan the kidnapping of his own wife, Jean (Kristin Rudrud). Problem is, things don't go as well as planned, and when kidnappers Carl (Steve Buscemi) and Grimsrud (Peter Stormare) commit multiple murders, determined cop Marge (Frances McDormand) starts investigating the case.Responsible not only for the script, direction and production, but also for editing ""Fargo"" under the fictitious name of Roderick Jaynes, the Coens confirm their ability to keep the viewer attentive to the intriguing events that follow, leading the narrative in a direct and efficient. Filled with interesting dialogues, the creative script opens up a range of possibilities at every moment, always brilliantly working on how chance influences our lives. However, unlike the characters who can never predict what will happen next, the Coens demonstrate total control over what we see on the screen, creating absolutely electrifying moments (which I will come back to in a moment) amidst the sea of tranquility of the peaceful city from Brainerd. However, despite all the suspense, ""Fargo"" is also filled with a lot of dark humor, featuring a series of hilarious moments that serve to break the growing tension of the narrative, such as when Jean runs away tied up on arrival at the captivity or in the funny interview of Marge with the hookers.Betting on graphic violence, as in the scene of the murder of the policeman, in the delivery of money in a hotel and in the arrest of Grimsrud, the Coens create a chain of events that only worsen Jerry's situation and, precisely because they show the tragic results of their actions, make the viewer care about the fate of the characters. However, despite working very well as a thriller, ""Fargo"" relies on dark humor to address other issues, functioning as a study on the lifestyle of that peculiar region of the USA. One of the aspects that deserves extra attention is the cinematography, directed by Roger Deakins. Jerry is normally framed at the shoulders or closer. This type of cut accentuates the intensity of the scenes: the viewer can feel almost trapped by the character's gaze or emotions, bearing in mind that the actor's proximity to the camera leaves little more space to look at, just the expression of disgrace of this man. Like him, we have nowhere to escape. One of the most visually striking scenes takes place after the protagonist's father-in-law refuses to give him the amount of money that would completely cover his debts. Jerry ends up leaving the building and sees him from above, heading for his car. The canvas is completely covered by the white of the snow and the only color is his small and insignificant figure, illustrating the solitude he was relegated to, completely abandoned to his fate. Furthermore, the vases symmetrically placed in space almost corner man in his own misery.Investing in icy colors and masterfully exploring the rawness of the neighboring regions of Minnesota and North Dakota, full of roads surrounded by snow that blend into the skyline and create a look that is both beautiful and frightening at the same time, Deakins' photography is crucial to illustrate the loneliness of the people who live there. This isolation even collaborates to increase the tension in key moments of the narrative, such as the night of the murders, where we know that the innocents who cross the path of the kidnappers will rarely escape with their lives on that cold and abandoned road. Incidentally, this chase scene is among the great moments of the feature, making the viewer glued to the chair while following its outcome.Wearing sober suits or clothes that convey an austere image (Mary Zophres costumes), the characters of ""Fargo"" represent the central force of the narrative. With his drawn accents and sharp dialogues that betray the funny way of speaking, even supporting characters with small participations become a separate attraction, as Mr. Mohra (Bain Boehlke), who delights us by telling how she heard from the drunken Carl where he would be hiding. On the other hand, this grace will hardly be perceived by a spectator who does not have at least some notion of English (it would be like trying to explain to a foreigner the grace of an accent from any region of Brazil). Also amusing is Peter Stormare's performance as Grimsrud, Carl's mute and menacing partner - who, as usual, is masterfully played by Steve Buscemi, a true expert in the art of playing criminals.Appearing fragile and hesitant most of the time, Jerry from the great William H. Macy seems unable to impose himself in any dialogue, stopping to speak at the slightest sign that he will be interrupted and stammering several times, in a clear sign of lack of confidence that the actor demonstrates it very well. This feeling, combined with the character's determination to seek a way out of every obstacle that arises (and there are many), is essential for the development of the narrative, since we can rarely predict the character's next steps. But if the entire cast has a great performance, the highlight is Frances McDormand, who gives enormous charisma and a disconcerting simplicity to Marge, a woman seven months pregnant who dedicates herself to her work and her family with the same intensity, calling her attention whenever she enters the scene thanks also to the great performance of the actress. It is she who calms the viewer with her simple reasoning and her direct way of solving problems, something that is clear, for example, in her visit to Jerry's office and in her conversation with an old college friend.Among so many great moments, it is worth highlighting the excellent kidnapping scene, in which we see Jean paralyzed in front of the image of the kidnapper looking into the house through the window. Notice how Joel conducts the scene with precision, investing in black humor to ease the tension - after all, only in a Coen film would a kidnapper calmly walk around the house looking for an ointment while the victim, after trying to hide, leaves wrapped in a curtain and hides. Crashes to the ground. Likewise, the way in which the big guy Grimsrud tries to disentangle himself from his partner's body in the third act is simultaneously comic and tragic. What is never tragic is the result of the work of the Coens, who, even when they don't get it right, manage to make great films. When they are inspired then, the result can only be spectacular, and this is what happens in ""Fargo"", a tense and fun film, which has a talented cast to become one of the best examples of what the Coens are capable of.The way the Coen brothers develop Fargo's story is wonderful. With mastery they manage to create chaos through a huge chain of lies, without making the story complicated or surreal. With a very well written script and great performances, they show how one lie leads to another until it turns into a huge snowball. In other words, they prove that if you're not a good liar, it's better to tell the truth soon because sooner or later you're going to fall.""Fargo"" is a work of impeccable script and unique execution that manages to create different reactions from the spectator, managing to bring him into the film, immersing him completely. His work with three parallel narratives guarantees a unique dynamic to the film, which is, at the same time, fast and slow without ever losing harmony. It definitely has enough material to be explored in the recent TV series adaptation, even if it's a risky bet. It is an unmissable film that leaves us wondering if those events really happened."
ElyesaDogru,"Aug 31, 2024",6/10,"Fargo leaves a lasting impression, exposing the dark underbelly of the American Dream. Jerry Lundegaard's ""small"" scam, which begins as a seemingly harmless plan, quickly spirals out of control, leading to a tragic series of events. The film masterfully depicts the deep voids in the lives of ordinary people and the extreme lengths they might go to to fill them.Marge Gunderson shines as a beacon of light within this darkness. When she asks, ""And all for what?"" we, too, are prompted to reflect: Is all this violence, bloodshed, and pain just for a few dollars? This question forces us to confront the selfish side of human nature, while Marge's warmth and moral steadfastness remind us that hope and innocence still exist.Throughout the film, the bodies buried in the snow symbolize the internal decay of each character. Jerry's seemingly insignificant scheme reflects how fragile and dangerous the American Dream can be. How easily our ""small"" desires, ambitions, and self-interests can lead to catastrophic consequences.Fargo also scrutinizes themes of family and love. Jerry's greed jeopardizes his family's safety, while Marge prioritizes her loving marriage above all else, showcasing the clash between two very different worlds. The quiet, ordinary love shared by Marge and Norm stands as a refuge amidst the film's dark and cold atmosphere.In conclusion, Fargo brilliantly illustrates the chaos lurking beneath ordinary lives, the dark sides of human nature, and the epic dramas that can unfold even in the smallest towns. It challenges the viewer to reconsider what truly matters in life and helps us find ourselves as we search for innocence amidst the darkness."
frazierandrew-63114,"Nov 5, 2020",7/10,Movie was fine. A bit overrated. I don't think anyone had a great performance. The show greatly improved the story and was much much better.
mist,"May 21, 2003",1/10,"Am i the only one that thinks/feels that this film sucks...???When i saw the film, ALL the ""great"" scenes had already been seen in trailers and review programs and the rest was pure s***.And how could Frances get an Academy Award for this?????She just waggled around like a pregnant duck and tried to speak english with a swedish accent.Check out ""Murder on the Orient Express"" and see how Ingrid Bergman did it. There´s a fine actor/actress......"
vaughans-77417,"Mar 23, 2024",10/10,"SO well done. The casting is outstanding. Each actor has found the core of the character, that solid foundation from which everything else is built effortlessly. At least that's the way the actors make it seem. The performances are organic, spun from an organic thread that runs through the performances moment to moment, scene to scene, episode to episode. You never see the strings...There's Ben Wishaw's deadly serious and morally reborn Rabbi Milligan, who will kill without hesitation in defense of a higher ethic and code. And Salvatore Esposito's clownish and wildly dangerous Gaetano, a lover of opera and a complete psycho. Jessie Buckley kills as Nurse Mayflower, a a quirky Angel of Death. Buckley proves that killers CAN be fun-nee!Jason Schwartzman deserves an award, playing a mob boss like no other you've seen before. He shifts between ruthlessness and wit with ease, between boss and pretender in the blink of an eye, and somehow manages to convince us that he is the Top-Dog Italian in town despite that he looks like he more belongs behind the counter at the local Jewish deli. One great moment-to-moment choice after another. Brilliant casting choice.And then there is Chris Rock. Hard to buy in at first, cuz. ""It's Chris Rock!"" But with each episode, you buy in more and more. Head of the local Black crime family, the more ruthless he becomes, the better it gets. No trace of the funny man here. And that makes his performance all the more revelatory. I mean, who casts Rock as a mob boss, in a drama? Well, it worked!Direction is great, sound and lighting and all production values are high. And the writing is marvelous!Really good show, and too bad we can't binge and have to wait a week."
bpw182,"Sep 16, 2005",10/10,"If you are annoyed by the word, ""yeah"" then this is not the movie for you. With that said, this movie is freakin awesome. It's great plot and storyline along with amazing performances by Steve Buscemi and Frances McDormand and it's a great thriller. William H. Macy is also really good. It shows how a small, petty crime turns into six people dying and two people being arrested. Some of it maybe be confusing, but it's still a great thriller. To add on to that, I thought it was pretty funny too. To wrap it up, I wouldn't suggest this to anyone younger than fourteen or fifteen, because you see people having sex and it drops the ""F"" bomb a lot. Also some mild violence, but still a great movie. 9.5/10. For Fans Of: THE USUAL SUSPECTS OR ANY COEN BROTHERS MOVIES"
DennisLittrell,"Jan 17, 2000",8/10,"(Note: Over 500 of my movie reviews are now available in my book ""Cut to the Chaise Lounge or I Can't Believe I Swallowed the Remote!"" Get it at Amazon.)Fargo is the kind of movie that appeals to people who have seen a lot of movies because everything is surprising and unexpected. The cop's a woman (Frances McDormand). Pregnant. The perps are psychos of course, but there are three of them and each is a different breed of psycho. William H. Macy is a car salesman who dreams up a scheme to cheat his rich father in law out of a million dollars by getting some degenerates to kidnap his wife. He's a white collar sociopath who always lies whenever his lips are moving unless there is some very good reason to tell the truth. One of the degenerates is a big silent guy (Peter Stormare) who kills people as one squishes bugs. The other (Steve Buscemi) is an ugly little bantam who lies and cheats and kills and steals and whines until finally somebody puts him out of his misery.This is Fargo, North Dakota, where people are country and it's cold and not very sophisticated. The movie makes gentle fun of the locals while guiding us to identify with them. McDormand eats a whole lot of Hardee's and Arby's and greasy dishes from the cafeteria piled high on her plate. She's eating for two. She loves her husband and he loves her. They lie in bed at night and watch TV. She's the police chief. She meets an old admirer in the big city. He's Asian. She is just curious. He is desperate. She has a self-effacing, aw-sucks, I'm not too bright (but I really am) style reminiscent of Tyne Daly in TV's ""Cagey and Lacy"" from some years back. Her husband Norm is a big guy who cooks for her and is an artist who paints wildlife. One of his duck paintings becomes a postage stamp. They all say ""Yaw"" a lot.The forlorn cold and desolate landscape of North Dakota is a Americana locale not used cinematically since I don't know when-Clint Eastwood's High Plains Drifter (1973), I guess. The script and direction are tidy without being too flashy. Everything is designed to surprise or bemuse the audience. Even the accents. There is the requisite quota of bright red blood; plenty of bullets puncture flesh and split bone. There's some gutter sex and a few shocking sights (one of the perps stuffs the other into a wood chip machine). All in all it's a slick, carefully crafted thriller with an artistic veneer, nicely photographed. It's clear that Coen and Coen have watched the movies of Atom Egoyan, Gus Van Sant, David Lynch, Oliver Stone, etc., and here pay them the sincere compliment of imitation with variation-or is it the other way around?"
dhuey,"Aug 28, 2005",N/A,"I love this film. One thing it never reveals is why the Macy character badly needed so much cash in the first place. First, this need for cash leads to the fraud with GMAC Financing (early in the film), but then, of course, it leads to the series of events in the main plot of the film.Anyone care to guess what the Macy character did to need so much cash, so quickly? We see no substance abuse or gambling tendencies. I'm stumped.One minor gripe with the film: the ""true story"" bit. It isn't. I don't understand why the Coens would feel the need to make that up, but they did."
