user,date,rating,content
deathmybeloved,"May 20, 2010",10/10,"Growing up, I knew that my family had a lot of history in the United States Marine Corps and the U.S. Army. My grandfather and his brother were soldiers in the Pacific, and my grandmother's brothers were Marines alongside them. My grandfather would often be asked about what happened over there, and he always just bowed his head, swallowed hard, and told half truths and ""beside-the-point"" stories to appease whoever asked- never truly telling any of us what he and his fellow Americans were- heroes.I had often wondered myself why my grandfather wouldn't talk about WWII, but one day in my U.S. History class in high school I got my answer. This film opened my eyes to the horrors of war. I sat in shock as the gore exploded in front of me, wondering how soldiers and Marines like those in my family lived- or whats more, were able to cope with the events that made them heroes.My point with all of this is that in this day and age, we as a society are so accustomed to violence that we don't really realize what fighting men go through in times of war. We see ""10 soldiers killed in Iraq"" on the news, but it doesn't really register to us as civilians. This was Spielburg's goal in making this film. He wanted to show all of us what fighting men go through for us- you and me. Every American Citizen should see this film to truly understand what it takes to keep us safe.As far as the film itself goes, it is absolutely amazing. No film is perfect, but the actors are incredibly convincing in their roles. The emotion is there, the battle recreations are realistic and as they were in life, and the cinematography is outstanding. It's very obvious that everyone involved with this film was dedicated to making it a tribute to the veterans and it is without any shadow of a doubt, the best war movie ever made.One thing to note is that this is NOT a film for your kids or a film to watch casually. It is intense and should be treated as such.10/10"
jpave2000,"Mar 14, 2018",10/10,"The sheer gore and brutality of war was made more real to me by this one movie. I was only in eighth grade at the time, yet I made 5 consecutive solo trips down to the local theater to see this film again and again. I was truly mesmerized by the cinematic beauty and the realistic portrayal of comradery among the main characters of the plot. This truly is one of the greatest movies of all time. To quote the WWII historian Steven Ambrose, Saving Private Ryan is ""The war movie to end all war movies."""
jack_o_hasanov,"Aug 19, 2021",9/10,"Great movie, everyone did their best. Watch this movie! Now !"
bmw1493,"Jun 24, 2025",10/10,"Saving Private Ryan delivers on both the biggest and smallest scales. From the chaos of storming Omaha Beach to the desperate final stand at the bridge, Spielberg captures the intensity and horror of war better than anyone ever has. The opening scene alone is one of the most brutal depictions of combat ever put on screen. But even in the middle of these massive, overwhelming sequences, the film never loses sight of the individual lives caught in the middle of it all.At its core, this isn't just a war movie. It's a story about the people who were thrown into something bigger than themselves. Sons, teachers, brothers, friends, all trying to hold on to their humanity in the middle of hell. The squad sent to find Private Ryan feels like real people, not just war movie characters.Tom Hanks is perfect as Captain Miller, a man trying to stay composed while slowly unraveling inside. The rest of the cast including Tom Sizemore, Edward Burns, Giovanni Ribisi, Barry Pepper, Jeremy Davies, and a young Matt Damon, feels fully formed and grounded. Even short scenes with minor characters leave an impact.Saving Private Ryan is one of the most powerful war films ever made. It reminds us that history isn't just shaped by battles, but by the people who fight them."
baulennathan,"Feb 6, 2025",10/10,"It's one of the best movies l think of
""Saving Private Ryan"" is a cinematic masterpiece that will leave you breathless, tearful, and utterly transformed. Directed by Steven Spielberg and starring Tom Hanks, this 1998 film is a powerful tribute to the bravery and sacrifice of the men who fought in World War II.From the opening scenes, ""Saving Private Ryan"" drops you into the midst of the D-Day landings, where the intensity and chaos of war are palpable. The film's cinematography is breathtaking, with handheld cameras and muted colors creating a sense of realism that's both immersive and unsettling.As the story unfolds, we follow a team of soldiers, led by Captain John Miller (Tom Hanks), as they embark on a perilous mission to find and rescue Private James Francis Ryan (Matt Damon), the last surviving brother of four servicemen from the same family. Along the way, they face treacherous terrain, enemy fire, and their own personal demons.The cast of ""Saving Private Ryan"" delivers performances that are both nuanced and powerful. Tom Hanks is, as always, outstanding, bringing a sense of gravitas and compassion to his portrayal of Captain Miller. The supporting cast, including Tom Sizemore, Edward Burns, and Barry Pepper, deliver memorable performances that add depth and complexity to the story.One of the most striking aspects of ""Saving Private Ryan"" is its unflinching portrayal of war."
albertval-69560,"Dec 25, 2021",9/10,"I watched this film the first time when it was released in 1998. I was 44 years old (2 years older than Tom Hanks) at that time. I watched it again recently. In both instances, the thrill that I experienced watching it didn't diminish a bit. It's truly a classic and perhaps the best war
movie ever made.Film technology has advanced so much since 1998. But as a movie buff with little technical knowhow on filmmaking, the movie's technical qualities didn't seem to age. It still looks good on the screen now despite the passage of time.The 2 action sequences, on the beach in Normandy and in the town defending a bridge, are a couple of the best extended sequences I've ever watched. Yet, it's not just the raw action or the realism that has earned plaudits from film critics. It's the quiet drama that unfolds as the Ranger company goes on its way looking for Pvt. James Ryan. (Matt Damon was only 28 when this film was released back then.) Those whispered simple words of Capt. John Miller to shell-shocked Ryan are immortal: earn this...earn it.War is really FUBAR. This should be enough deterrent to start another world war."
steiner-sam,"Jun 11, 2021",6/10,"It starts with D-Day landings on Omaha Beach in 1944. Captain John H. Miller (Tom Hanks) leads a squad on to the beach, losing numerous men but achieving his objective. When he reports, he is directed to a different kind of assignment -- to find Private James Ryan (Matt Damon), a young recruit from rural Iowa whose three brothers have just been killed in combat within the past week. The objective is to get him out of combat and sent home.The movie follows Captain Miller and a small portion of his squad as they try to find Ryan, who is part of the 101st Airborne, and whose location is not really known. The squad faces various challenges in their search, and two men are killed in the process.Finally, they locate Ryan, part of a small group trying to defend a small village bridge against attack by a much larger German force. Ryan refuses to leave. Captain Miller and his men stay and help defend the bridge. A severe battle ensues in which Miller and most of his men are killed, but Ryan survives. The closing scene shows Ryan 50 years later in Normandy's war cemetery visiting Miller's grave and wondering if his life has warranted Miller's sacrifice.The film was mostly highly praised and received all kinds of Academy Award nominations. It was especially praised for the reality of its battle scenes, which are actually quite difficult to watch. I cringed many times during these lengthy scenes. Purists quibbled about both the Americans' and Germans' tactical mistakes in the climactic battle scenes near the end. Some also complained the movie made it seem that only Americans were part of the D-Day landings.One academic critic said the film degenerated into a harmless, uncritical patriotic performance apparently designed to thrill 12-year-old boys during the summer bad-film season.I mostly agree with that critic. Yes, we see some bad behavior by American soldiers, but by and large, they come through stoutly at the end, including the young translator who cowered during most of the last battle. ""Saving Private Ryan"" does not glorify war, but it does glorify American exceptionalism on the world stage."
SHADO-5,"Mar 9, 1999",1/10,"Lame, revisionist crap. What the hell kind of squad does no recon, talks out loud, and stays bunched together? Also, many of the weapons (esp. the German M 60)are improperly, and fantastically used. How can you use a sniper scope out of the box, with no sighting in? Idiotic. Spielbergs enthusiastic portrayal of the murder of German prisoners is disturbing in the extreme."
svader,"Jan 24, 2021",9/10,"Good cast, acting and storyline.All has been said by other reviews.10x better than Dunkirk."
masonsaul,"Nov 5, 2021",10/10,"Saving Private Ryan is the definitive WW2 movie, a phenomenal war movie that has epic and harrowing spectacle whilst also showing some extremely emotional and human moments in between. Definitely one of Steven Spielberg's best.Tom Hanks gives a phenomenal lead performance with an extremely impressive supporting cast of characters and recognisable actors who all give really impressive performances, especially Matt Damon and Barry Pepper.Steven Spielberg's direction is incredible, action sequences are extremely intense and mobile but always clean and comprehensible. It's perfectly paced, consistently engaging no matter what's happening and the music by John Williams is reliably amazing."
Movie_Muse_Reviews,"Feb 1, 2008",9/10,"Many of us can't truly say we know what World War II looked like, but I would venture to say that Steven Spielberg gives us a pretty good idea with ""Saving Private Ryan."" Spielberg, in his second attempt to capture the WWII era on the big screen, has made a movie that plays out like the telling of a war story and in the combat scenes latching back on to a sense of harsh reality with violence and the death of many soldiers.Worthy of the most praise is the incredibly well-deserved second Oscar win for the team of Spielberg and Janusz Kaminski. The two have done everything together and this is certainly a high point of their partnership. The cinematography really captures a war that is both dark and in the case of D-Day, legendary. Rarely do most films capture a spirit of war that is scary and also beautiful without glorifying the war or its soldiers.Here is wear ""Ryan"" succeeds as a truly strong war film and probably the best depiction of World War II battle in history. The characters are strong and while they seem to be more like characters when they don't fight, they react like people when they are forced to do their jobs, not like super soldiers with the exception of Barry Pepper's character, but that only makes the film better by rounding out the way different soldiers viewed the war.The themes are incredibly strong thanks to this depiction of violence. The universal idea of fighting for something or obeying orders when you don't understand why is perfectly interpolated by the band of soldiers sent to find Private Ryan and in that way it requires every viewer to forcibly reconcile that which a soldier in any war must do. Those of us who aren't veterans should consider ourselves fortunate to only have to ponder it and not actually come to terms with it."
mal karma,"Sep 2, 2002",N/A,"Take a blockbuster and quality movies director such as Steven Spielberg, a good leading actor like Tom Hanks and a decent cast (Tom Sizemore and Edward Burns are my choices) and you'll get the best movie ever. Or you should at least. Steve got this one wrong in my opinion. Starting and ending the movie with a US flag isn't the way of making a movie hat will be shown throughout the world.The allied assault on Normandy was amazing and close to reality (I believe), making it the most remembered scene in the movie (and best).But then the plot sinks in the middle of the Atlantic ocean. Yes, sending 8 soldiers to rescue 1 just because his brothers are dead does seem unlikely and I wouldn't risk the lives of a capable platoon for only one soul.And making that chickenheart corporal Upham's mind change fast enough to make him shoot an unarmed man at point blank does nothing good to this movie.Overrated; The Thin Red Line and Black Hawk Down are much better. It's not bad, really, but I just can't figure out what the hell is so goo about it."
fudd99,"Jun 27, 2001",8/10,"The beach scenes are absolutely fantastic, and I'm not sure if I did breathe at all during those sequences. The sound and the effects are amazing, the use of small hand cams gave the whole thing a documentary feeling of the hell that met the men who landed on the beach. Sadly after that it is not too good, and the film quickly becomes a standard Hollywood WW2 film, with heroic Americans and stupid German soldiers. A better story and less sentimentality (everyone understands that young men being blow to pieces is a tragedy and this need not be pointed out by the director. The price for freedom is high)would have given this film a 10/10. I think the men who laid down their lives on the beaches in the fight to free Europe deserves more than this."
dee.reid,"Jun 28, 2005",10/10,"It seemed impossible (or was it inevitable?), but director Steven Spielberg did the unthinkable: he made a war movie. The creative and legendary mind behind such kiddie movies like ""E.T. the Extraterrestrial"" (1982) or ""Hook"" (1991) and who had ventured into more mature territory with ""Schindler's List"" (1993) made a movie that put a human face on the horrors of the World War II conflict. We know how personal WWII is to Spielberg (especially to anyone who's seen ""Raiders of the Lost Ark"" - he just loves to stick it those diabolical Nazis, or the aforementioned ""Schindler's List""), but after seeing ""Saving Private Ryan"" (1998), our assertions at just HOW personal it is to him are revealed. Opening on D-Day (June 6, 1944) at Omaha Beach in Normandy, France, the grainy cinematography and jerky camera movements are relentlessly imposing in capturing the graphic battlefield carnage of that day. We watch in horror as one after one, Allied soldiers are butchered by the automatic weapons being unloaded on them by the Germans that had taken up positions on the hills in front of them. In the middle of the chaos, is Captain Miller (Tom Hanks), as he leads his men from the sandy, bullet and body-riddled beach up to the top of the hill. In the scenes that follow, Spielberg is unflinching as we see American soldiers as well Germans become the casualties of history's costliest conflict. The movie doesn't end there; it's only the beginning and the main plot of the film, which is supposedly based on a true story, takes shape. It turns out, that an American mother is going to receive three telegrams in one day, each one informing her that her three sons have all been killed in the D-Day invasion. But there is hope: her fourth son, a paratrooper, the eponymous Private Ryan (Matt Damon, in what could essentially be considered a cameo) of the film's title, survived. The problem is, he's located deep behind enemy lines, and it'll take a small squad of American soldiers to bring him home, as word of this small victory will serve the army good on the home front. Miller leads his squad, which includes Sergeant Horvath (Tom Sizemore), Private Reiben (Edward Burns), Private Jackson (Barry Pepper), Private Mellish (Adam Goldberg), T-4 Medic Wade (Giovanni Ribisi), Private Caparzo (Vin Diesel) and the unproven translator Corporal Upham (Jeremy Davies), deep into the French countryside to rescue Private Ryan and bring him home. It should be stated foremost that this is not an easy movie to sit through. I remember hearing stories from when this film first came about out how WWII veterans who were at D-Day had to be escorted out of the theaters because it was too much for them to handle. But still, that is its goal: ""Saving Private Ryan"" is the most realistic, gritty, and horrifically violent war movie I've ever seen. It does the impossible task of shedding itself of the stigmas (patriotic flag-waving, one-dimensional soldiers, one-sided portraits of the enemy, no battle-related carnage, etc.) that haunted many WWII films made during the '50s and '60s; contrary to some reviews, none of this goes on in this film. The film is immediately effective in its portrait of soldiers on both sides of the WWII battle, and the cost it waged on them. The performances are flawless, as Spielberg is able to get commanding talent out of all the actors involved. The action, if you can sit through it, will definitely make you squirm in your seat at how realistic it is. It should also be noted that nearly every war film since this one has tried to mimic the style of ""Saving Private Ryan,"" but they can't ever live up to its originality and raw intensity. ""Saving Private Ryan"" is Spielberg's WWII masterpiece, and is my favorite war movie. It's no wonder Spielberg was voted #1 director of all time; this film proves why.10/10"
gregory-anderson-2,"Apr 24, 2006",9/10,"Spielberg mines a sullied gem with this bloody classic. A family film, I say, a demonstration of brotherhood and integrity. For me the decision to seek Private Ryan based on the mother's loss simultaneously undermines and glorifies the honour of war. And it is in this background that Hanks delivers a compelling performance worthy of many rewatches.The violence in this film is stark. So many examples you can think of - from the escaped German prisoner's revenge, to the sockbomb victim - show the arbitrary nature of violence. But the quieter moments between are tender and contemplative - Fubar anyone? Not a realist film, like Platoon or Full Metal Jacket, but art to provoke, like Jar Head and Apocalypse Now."
Jinx 138,"Jun 19, 1999",10/10,"The first time I saw this movie was in the cinema. The surround sound at the landing on the normandy made me ducking scared in my seat. I was panicked and could feel the soldiers' fear. I saw it today for the second time on my vcr, I was alone. But this time all my tears broke loose. I now realized the lack of sense in all this killing, all this waste of life! These hundreds of young men dying on the shores of France. A stunning and precious experience. In my eyes this is the best antiwarfilm ever made. No palliation, no exaggeration."
droogiedim77,"May 29, 2002",6/10,"so overrated. this film relies is saved by its gore and superb performances from tom hanks and tom sizemore. i dont see what the deal is all about. outside of jaws, and the indiana jones trilogy he hasnt made an excellent movie in his entire career. this movie is made cheesy by its use of a flashback to frame the story. not only that, it drags in parts by adding humor and trite dialogue where it should be focusing on the action. i think most of the credit to this film should go to the director of photography, the effect and make-up crew and tom hanks and tom sizemore. too bad that stalker never made it all the way to spielberg."
tgtround,"Feb 15, 2001",5/10,"I can't believe that this film currently rates on IMDB higher than both Paths of Glory and Platoon. The latter is one of the best anti-war films ever made - by a man WHO WAS ACTUALLY THERE.Speilberg's technical mastery may be great but his characters are cardboard and his understanding of men's motivation's is fatally flawed. As Oliver Stone recognises in Platoon, soldiers fight for one another not a great cause. As the Platoon Sergeant says in Hamburger Hill regarding the death of one of the men: 'He died taking out that automatic weapon for you and third squad - and don't you give him anything less.'"
Bacco,"Mar 2, 2001",N/A,"Just a couple of things :first of all I would like to say that ""History is written by winners"", please think about that. Hollywood productions don't give any objective account of WW2.Regarding ""Saving Private Ryan"" : at the beginning of the movie 2 hundred *poor* Americans are ruthlessly slaughtered by a punch of faceless ""Huns"" who are defending the beach. At the end of the movie an *heroic* punch of Americans are defending a bridge by killing 2 hundred SS and by destroying 2 Tiger tanks with sticky bombs (!) and hand-thrown mortar ammunitions (!!).In both cases Germans are dumb and on the wrong side, either as killers or as victims!It is my opinion that soldiers of both armies were equally forced to fight by orders from above and inspired by boastful belief. There is nothing really heroic in war.If you want to find a more believable perspective of operation Overlord try Max Hasting's book ""Overlord"" (1984). You'll learn much more about the poor performance of American infantry and ""evil"" Germans' fighting prowess."
Boba Fett,"Nov 5, 1999",9/10,Saving Private Ryan is a true horror movie.  I watched it because I wanted to see a good action movie but the opening sequence really scared the hell out of me and the movie left me pondering over it for hours afterwords.It's great that there is a movie that shows war's effects on the human body and mind rather than a toned down political chess game.  This movie has some amazing cinematography with lots of gray colors to add to the gloom.Spielburg always manages to create movies that stir up emotions like no other director can.  Spielburg and George Lucas are the dynamic duo of cinema.
paul_m_haakonsen,"Dec 19, 2015",8/10,"""Saving Private Ryan"" is one of those movies that you can watch with regular intervals of time, and even if you've seen it multiple times and am familiar with the storyline, the movie is solid enough to be watched over and over, and keeps on being entertaining.The story, quickly summarized, is about a small squad of soldiers during the 2nd World War who are given a mission to find private Ryan in war-torn Europe after having survived the D-Day onslaught at Omaha Beach.What makes ""Saving Private Ryan"" good, is a combination of multiple things. First, of course, is the storyline. But also the way it is filmed, which puts the audience right in the midst of the action. Most importantly, though, is the more than impressive cast who perform above and beyond the call of duty so to speak, no pun intended.The action is formidable and impressive, showing that war is brutal and bloody. And it is presented in a very realistic manner, again adding to the conviction of the entire movie.The cast list for ""Saving Private Ryan"" was impressive. And there is a number of actors who really prove their acting talents and break out of the stereotypical roles and genres they tend to cling to. Tom Hanks, of course, is the center of the movie and he fitted so well into the role and the movie. Usually I am not particularly fond of Tom Sizemore, but he was perfect for this movie and did a great job. Ted Danson was a breath of fresh air, and he was a great addition to the movie, as were Paul Giamatti. Barry Pepper was phenomenal in his role and brought a good amount of flavor to the movie. However, for me, it was Jeremy Davies who was the most outstanding of all in the movie, proving once again what a phenomenal character actor he is.And it is always a plus when Germans actually do speak German in a World War 2 movie, and not have those awful German accents added when they in fact are speaking English.""Saving Private Ryan"" is a movie experience that everyone should have, at least once. It is an impressive and very entertaining movie to say the least."
drqshadow-reviews,"Sep 15, 2014",9/10,"Gripping, horrific first-person experiences in the thick of World War II, as you're already, no doubt, keenly aware. It's held up exceptionally well over time, most likely due to the great lengths taken by Spielberg and company to stamp it down in a specific era and remain steadfastly historical. The Normandy beach landing that opens the action is still as powerful and haunting as ever, an effects showcase like none other that puts us right down in the middle of hell itself. I couldn't help but pontificate about the futility of ground warfare here, faced with row after row of doe-eyed teenagers, unceremoniously mowed down before taking so much as a single step on enemy territory. Which is part of its message, no doubt - though that's somewhat countered by the tales of bravado, camaraderie and character that sprawl out over the next two hours. A richly rounded war story, it enjoys a mess of acting performances even stronger than the work of the effects team. Tom Hanks is at the top of the mountain as Captain Miller, a demanding role that he owns from moment one. Supporting faces pop out of the woodwork at every corner; most of us remember Vin Diesel and Adam Goldberg in early roles, but quick shots from Paul Giamatti, Ted Danson, Bryan Cranston and more left my jaw agape. How did I miss spotting these guys the last time? A true epic, profound and moving, with plenty of action but just as much character-building and adventure also in the mix. One of Spielberg's - and Hanks's - best."
