user,date,rating,content
dbdumonteil,"Sep 14, 2003",6/10,"War movies have often been one of Steven Spielberg' specialities. This one achieved a huge public and critic success. What drew the attention in this war movie are fight sequences. They're extremely violent and bloody. We have been rarely so far in the reality of fights. It's difficult to forget the first half an hour of the movie during the Normandy landings. Spielberg's sober and showy directing increases the phenomenon.However, you must admit it, the movie is based on a trite, plain even conventional story. You could use this last word to describe the famous Ryan soldier. Indeed, he's told that he can go home because all his brothers have been killed. Instead, he wants to keep on fighting.Apart from this and in spite of a few weaknesses, ""saving private Ryan"" is a thrilling war movie."
I.K,"Aug 31, 1999",1/10,"Visually, the best WW2 movie. In other ways, far from the best. The movie is loaded with errors and falls into demonizing the German soldier and praising the American. A few examples, far from the reality the combat scenes show the Germans acting like cattle without ANY strategy at all they just run and shout, one funny part is the behavior of the German tankers, they drive in a ruined village in a VERY narrow street, like they have never heard of ambush! -One starts to think if the script writer has ever heard ofthe capabilities of the German panzer crews, SS-Captain Michael Wittmann attacked and destroyed 48 armored fighting vehicles alone in a single action! The most absurd part is the -""Macgyver/Rambo scene""-when Capt. Miller and friends start to throw the mortar grenades slaughtering a few dozen Germans. The most unforgivable error is that there were NO SS-units with Tiger tanks operational in Normandy at this point of time. This movie is way overestimated."
pct03,"Jan 6, 2023",10/10,"I remember when I watched the infamous opening scene of the Omaha beach invasion in my Grade 10 civics class in the spring of 2019, and seeing and hearing the reactions of classmates around me. It's a moment I'll never forget, as much as I have finally seen the movie in it's entirety recently. Seeing such a beautifully grim but brutally realistic action sequence put to film awestruck me, and I always had a burning desire to see this movie.Well after playing a few classic Call of Duty campaigns and ultimately gathering more knowledge (and humbling myself) about WWII, I can say this was a tremendous experience. Yes this film has some inaccuracies, but the pure heart, passion and history radiating from this production turned me into a huge fan of war movies, and being keen about learning of war and the sacrifices of our soldiers more than before.I always stood with everybody in the Remembrance Day assemblies in school and I knew of the sacrifices of my fellow citizens in participating in the wars of my country's past, however it wasn't until my latest binge of WWII related medias which truly exposed my eager mind to the terrors of combat, and the ultimate price our world had to pay for our human conflicts. And this amazing film is one of the things that has helped me formulate my utter respect and gratefulness for every man or woman that sacrifices their humanity and potentially their life to fight for victory."
SweetieReviews,"Mar 17, 2021",10/10,"We watched this movie in school, this is a really good movie and glad our teacher let us watch this movie. 🇺🇸"
CattyCombalatty,"Feb 10, 2021",9/10,"One of the greatest films ever made. Incredible cast, exquisite writing, action packed blockbuster. My favorite WW2 movie and a must see for anyone who hasn't yet!"
salehimojtaba,"Mar 12, 2021",9/10,Hello Rescue Rescue Soldier Ryan is a complete movie that is made with the best scenes and extraordinary details and fascinated edema. I suggest you watch
matthewscrugham,"Jul 28, 2021",10/10,"This movie literally has you crying before it's 5 minutes in. From then on, it shows you raw, unrestrained war for the next 2 hours and 45 minutes. You see the brutal violence and the emotional horror, but you also see the men who fought in WWII, who gave their lives to defend freedom. The movie gives you such a real look into each soldiers life that it feels like you know each one personally. The entire cast gives amazing performances, and Spielberg does his thing to make yet another masterpiece.I don't have a personal story involving me or a family member regarding the events of this movie like many people do, so I can't relate to it in that way. I just watched this movie and was captivated from scene one until the credits rolled.Thank you to everyone involved in the making of this film. You have made one of if not the greatest war movie of all time."
mmp-31376,"Sep 18, 2021",10/10,"Incredible movie! Definitely in my top 5 favorites. Phenomenal acting, storyline covering happy, sad, and humor all in one, and keeps attention throughout. Can't say enough about this movie. So good."
antonperehodenko,"Jan 25, 2022",10/10,"Without looking, I am sure other reviewers here have headlined their article ""Best War Movie Ever Made"""" and I agree. However, before briefly discussing the film, let me just say if you don't have a decent 5.1 surround sound system, you aren't going to fully appreciate this movie (DVD).It's a great film to start with, and sitting in a room surrounded by five speakers with bullets flying from all directions around you - as in that spectacular 22- minute opening scene or in the final 45 minutes of action against the Germans in tanks - is an astounding movie experience. The sound in this film elevates it even higher.The visuals are outstanding, too. I've never seen so many grays, beiges and olive-greens look this good: perfect colors for the bombed-out French city where the last hour takes place, perfect for the faces and uniforms of the gritty soldiers, for the machinery, the smoke-filled skies, etc.My only complaint is the usage of Lord's name in vain 25-30 times, but, hey, when you consider it's tough men in tough times, that's what you are going to hear. In real life, the profanity probably was worse than the film.It's hard to picture the brutality of war being any worse than you see here, but it probably was. This is about as graphic as it gets. The violence and gore was shocking when this film came out in 1997 and still is when watched almost a decade later. It's unbelievable what some of the WWII soldiers went through, but that can be said for any war. I believe the purpose of this film was to pay tribute to the sacrifices these men made, and it succeeds wonderfully. Hats off to Steven Spielberg and to Tom Hanks, the leading actor in here, both of whom have worked hard for WWII vets to get the recognition they deserve, not just on film but in a national memorial.Anyway, language or blood and guts aside, this is still an incredible portrait of WWII. The almost-three hour film is riveting start-to-finish, especially with that memorable beginning action scene, probably the most dramatic in the history of film.As ""entertaining"" as those action scenes were, I found the lulls, if you will, to be even better. Listening to Hanks and his men discuss various things as they look for Private Ryan, was fascinating to me. Hanks is just superb in here and once again shows why he is considered one of the best actors in his generation.The most memorable and powerful moment among the ""lulls,"" is the shot early on of the Ryan mother sinking to her knees on her front porch as she realizes she is about to get disastrous news from the war. Moments later, Harve Presenell, playing Gen. MacArthur, eloquently reads a letter by Abraham Lincoln that is so beautifully written, so profound that it is quoted near the end of the film, too, and I never get tired of hearing it.This is a man's movie, and shows the horrors of war as few others ever have. To say it is ""memorable,"" just doesn't do it justice. It is the greatest war movie ever made....period."
theskylabadventure,"Feb 6, 2007",7/10,"The best thing I can say about this movie is that it is passable entertainment which, if you know anything about The 'Berg's intention for the film, was not the point. This movie was released to overwhelmingly consistent reviews which frequently referred to it as ""one of the best war movies ever made"". Imagine my disgust when I saw it...The opening battle is undeniably brilliant in terms of putting you in the middle of the action/horror, but it relies solely on Spielberg's ability to push the right buttons and is almost totally ineffective on second viewing.Personally, I knew this film was going to be a disaster pretty early on. To be precise, I knew it when, in the midst of this mind-blowing battle sequence, Spielberg thought it'd be fun to throw in a joke about Sizemore being Hanks' mother.WHY?!? He had everyone on the edge of their seat (literally, I remember looking around the theatre and every jaw was dropped) and he decides to lighten the tone by dropping in a fricking JOKE?!?From here the film goes from bad to worse to utter garbage, as we are dragged through a war-is-hell-by-numbers affair. Never one to miss an opportunity to manipulate, Spielberg makes us endure some pretty feeble philosophising, Ted Danson trying to be serious (yes, Ted Danson), a token ""death of the youngest soldier"" tragedy and some of the most sentimentally contrived dialogue I have ever suffered, which never really stood a chance coming from the worst group of two-dimensional characters ever assembled for a movie.Then there's the premise; a group of men is sent across the country to find one guy because good ol' compassionate Uncle Sam thinks the titular soldier's poor Ma has suffered enough in losing her other three sons. Is this a joke?!?""But it's a true story"" I hear you cry. Wrongo! It may have been inspired by a true story, but that doesn't mean that anything beyond the name James Ryan actually existed. The words ""inspired by a true story"" don't mean a thing these days and, let us not forget, this is Spielberg.Let us not forget indeed, as Stevie does inject some excitement and tension into the action set pieces, even if they are overlong, predictable, and dangerously close to many a scene from many a war movie that came before it. The final sequence falls on its arse before it even begins due to the hilarious, A-Team style montage that precedes it, in which we see our apple-pie heroes create a stronghold from various items they find lying around a conveniently deserted village, before the six or so of them defeat an entire platoon of those nasty Germans.Perhaps the worst crime this film committed was being released against Terrence Mallick's 'The Thin Red Line', and subsequently taking the two Oscars which by right belonged to the latter (Best Director and Best Cinematography).'Ryan's Privates' pales in comparison not just to Mallick's film (as well as to Spielberg's other ""classic"" manipulative-therapy session, 'ET') but to almost every war movie I have seen ('Cross of Iron', 'Apocalypse Now', 'Platoon', 'All Quite on the Wetsern Front'), even those which do not profess to be the greatest war epic of all time or even take themselves seriously ('Mash', 'Kelly's Heroes', 'Where Eagles Dare', 'The Eagle Has Landed'). One great battle scene does not a great war movie make, but try telling the Academy that.Bottom line? Don't expect more than a sub-par Spielberg offering and you won't be disappointed. Expect a profoundly moving war classic, and you'll be choking on your rage like I was when I left the cinema nine years ago."
Fiona G.,"Jul 9, 2000",1/10,"This movie serves two purposes: a) glorify the American soldier from World War II and the American nation in general and b) help Mr. Spielberg overcome his own neurosis about being Jewish, a task he started with ""Schindler's List."" That probably makes him the envy of anyone who ever saw a psychologist: to get paid for spreading out your psyche instead of having to pay for it.The first 20 minutes of this movie are amazing, indeed. Very well captured is the sheer horror of landing on a fortified beach; the disorientation, the killing etc. But after that, this movie drops on the level of ""Armageddon"": a mother has a number of sons, all of them died during the war, except one and the US military surely puts the life of half a dozen soldiers into peril to save that last one. Of course, that is completely logical.The German soldiers, in the contrary, don't seem to have mothers or anyone who cares about them, they are ugly, lean-mean-killing machines, shouting incomprehensible things and should be killed wherever possible. They are also not just as scared as any other simple soldier on a battle field, they don't have any feelings at all.So, what could have been a great movie, with all the money spent for and stars on it, playing in the same league as ""All quiet on the Western Front"" gets to be completely pathetic, unrealistic, super-patriotic and one-sided. Steven Spielberg once said that he often didn't feel he was a ""real"" American and was left-out because of him being Jewish and that the past of his family haunts him. It is ok to feel that way and I wish him he will finally get rid of both feelings. But on the other hand he also was left out of getting an ""Oscar"" until ""Schindler's List."" That was a well done movie, but on the long run it seems it didn't do Spielberg too good. Somewhere he must have come to the conclusion that doing movies about WWII helps him overcome his problems and making them patriotic will help him getting an Oscar.If you are interested in a realistic look on war, watch ""All quiet on the Western Front"" or ""Das Boot."""
vasilievniki,"Jan 19, 2022",10/10,"A large-scale military drama showing all aspects of human existence in the conditions of world chaos without a transparencies.Attention to small details, historically accurate - such as the stunned bodies of fish on the shore, shown during a fast-paced amphibious landing operation on the shore. A frankly shown meat grinder inherent in clashes of troops. Emotions of living beings, of which there are few people left, attacks of religion, every second of hope, which is interrupted by a bullet that pierces through the head of a soldier who has just planned further actions.In between these are glimpses of the human from the conditions of the peaceful existence of the headquarters of the troops, from where the humane order comes, to resolve which is a moral dilemma, the 'trolley problem'.Tom Hanks, ingeniously conveying the emotion of the captain, who is entrusted with this task with a group of people, different in character and constitution, in the revelations of evening dialogues revealed through spoken speeches.Moral dilemmas throughout the film, the solution of which is either according to Bentham, or according to Hegel, which can lead to various consequences, but the essence of a biological being in an extreme situation is simple - 'either I, or Me'.Camera work, editing, sound accompaniment - immersing in the atmosphere, transmission through color shades - plot twists, everything is appropriate and accurate.The motivation and goal setting of many key characters is clearly conveyed.Symbiosis of animal and human - everything is intertwined into a single concept. The authors of this work, as if by the hand, lead the viewer along the road of war and actions, decisions - its accompaniments.Makes you reflect - that's the main thing.This is a classic - you need to know."
mauriciocaceresv,"Feb 6, 2021",9/10,Simply the best war movie of all the Time hanks and Spielberg did a excellent job with this
TinyThoughts,"Dec 4, 2021",10/10,"World War II was hell, and this film helps us to see glimpse of it. The best war film there is, hands down. Sadly it took me so long time to watch this. This is the one.Acting, directing, story, perfection."
mmalek-34877,"Dec 17, 2021",10/10,This film motivates and shows a sense of responsibility alongside violence.It is also a reminder of the values we held for others. The question that comes to mind when watching this movie is: What would I have chosen if I were Ryan's soldier?
Alyssa-the-Critic,"Feb 15, 2018",10/10,"Book-ended so deftly with genuine and heart felt honesty, this film is one of Spielberg's most important. And is definitely, in my view, the most important and impacting War genre film ever put to celluloid. From the gritty, in your face representation of what the Normandy landing was like -to which veterans in theaters often had to clear out for that harrowing opening, such that the depiction struck too real- to trudging into the unknown throughout war-torn France that Hank's character and his band of brothers face; this movie hits a combination of humanity and the brutality of War that everyone should see in their lifetime. Not for the violence of it but to honour the men who laid so costly a sacrifice.A technical feat of filmmaking, as well as respecting the lives and the bravery of young men in battle against a threatening foe (Hitler's Germany), this tributes their legacy in a truly human way. Without cliche, without glorification, nor a hint of faux emotion. John Williams score drives this humanity throughout every scene, especially in the transitions to the next sequence of events. And Spielberg guides these performances with precision to deliver unforgettable, and harrowing moments throughout.Thoroughly deserved Sound Design, Editing, and Director Oscars for Saving Private Ryan! A masterpiece. Enthralling. Engaging. Relentless in bursts, but will give you a handful of breathers and close on a tragic, if not reflective ending that shows the cost of War."
fernandez_1989,"Dec 19, 2006",N/A,"The greatest battle in the twentieth century took place at the shores of Normandy, and it was fought by courageous soldiers who spilled their guts and payed the ultimate sacrifice for freedom.Out there in that beach, Dog Green Sector, Omaha beach, hundreds if not thousands of courageous American soldiers took and kept a vital position for an invasion to liberate the old continent. Their warrior spirit allowed them to gain a bitter victory.Too many young Americans died in that battle for making possible to send other people free. This source of American pride moves me in so many ways. We love the American heroism and we share our admiration for the greatest warriors: the American soldiers.This movie, starring a great American actor, Tom Hanks, in the role of Captain Miller, 2nd Ranger, shows the American attitude and the struggle they went through to achieve one of the greatest American victories in world history. It is not easy to understand the huge victory it was for America and world freedom to win the most important war in history. I will always love America for that.Other fantastic American actors like Vin Diesel and Giovani Ribisi play an awesome performance as heroic kind-hearted soldiers in the face of evil, showing all the heroism we can expect from an Army Ranger.All in all this movie is a must-see and it is worth to buy the DVD. The fantastic soundtrack and the emotional flag-waving at the end of the movie make your eyes to water-up. You will never forget this excellent Hollywood production and the wonderful story told will get you speechless for a while."
alex-306,"Feb 8, 2003",6/10,"Best war movie ever made?  Please.  Go watch Full Metal Jacket, Platoon, Ran, Apocalypse Now, Das Boot, or any other film made by a director with a true understanding of artistry in film-making.  Spielberg's sycophants make me sick.Saving Private Ryan is best when Spielberg sticks to what he is actually good at, to wit, action.  I whole-heartedly admit that the two big battle scenes are breathtaking.  However, two scenes do not a movie make. Everything else was  duller than dull.  No profound insight.  Nothing but cookie cutter characters, cheesy dialogue, and mindless flag waving.  If this film was the only source of knowledge about Americans that someone had, s/he would come away with the conclusion that Americans sure are a bunch of cornballs.  But we can shoot people pretty adeptly, can't we?Spielberg, go back to making ET and Raiders of the Lost Ark and save the heavy stuff for real directors.  That is all.6/10 (the two battle scenes warrant a 6)"
Member,"Nov 29, 1999",1/10,"The more I think about this film and read differing reviews about it the more I feel it wasn't meant for me. I'm a Finn, not American. I don't know if Spielberg meant this film as a last hoorah for the G.I.:s, but to me that is what he made. All right the film does have something to tell for everyone: in the insane theatre of war one should try to do the right thing, have courage to do it, that your actions have consequences, war as a whole creates nothing but bad feelings and probably something else too but nothing that has not been told earlier.And I suppose that isn't so bad, I mean there have certainly been worse films. But what does bother me is that Spielberg set out to do a film about what war is really like and to me, he failed. Yes I have seen the opening scene and to me it was more about exploitation and action film then about anything else and not even very memorable action. Even if one would skip all the omissions and strange things about the film (in the landing scene no naval artillery support, no air force support and the illogical German tactics in the final battlescenes) to me the main plot is a strange curiosity that only serves to illustrate that the average soldier wasn't that interesting or important. Apparently with some links to reality the main plot remains distant and odd to me.With Oscar, block-buster, critically acclaimed material as ww2 with all the gore how could Spielberg go wrong? First of all the acting. Well I could not stop wishing there would have been some lesser known actors used, maybe even amateurs. A lot has been made out of the cinematography and yes, it is good. Although to me it is not so effective when there is apparently too much money to make a film and then the camera work tries to make it look more realistic. As ww2 films go this film is a far cry from ""Come and See"". Yes I do admit that flag waving is a common problem among ww2 movies, I just wished that Spielberg could have avoided it."
MAXIMUS_747,"Jul 5, 2023",9/10,"Amazing movie about a very serius topic! One of the things that makes Saving Private Ryan so special for me is its realism. Spielberg's has a veary special attention to historical details. Tom Hanks delivers as always and brings his characters to life, I think that results in a beautiful connection to the character and you really feel with him. The conection to the caracter and the raw storytelling will probability leave you breathless.The movie showing the reality of war in all its messiness, following young men unsure of their decisions and mostly just full of fear! The movie is really worth watching and I think it is a 9/10!"
jrugg19,"Apr 15, 2021",10/10,"Private Ryan is the best war movie to come around. Hacksaw Ridge, Dunkirk, and 1917 are all quite great, but they are nothing to Private Ryan, which redefined the genre and has made the formula for every modern war film. What amazes me is that Spielberg continues to be a master of technical filmmaking. He makes the impossible seem entirely possible. But he continues to be underrated for the way he can create emotion out of his audience.This movie makes you care so much about so many characters, which frankly many of them don't get all that much screen time; he makes characters such as Private Jackson or Cavarzo stand out with the few minutes they can shine on screen.I truly believe that this movie was certainly robbed of Best Picture at the Oscars, and that Tom Hanks delivering a completely authentic performance was also missed by the Academy.This movie brutally shows the horror of war, and continues to be the landmark of the war genre. It'll be shown in school for years as a firsthand look into what these people go through. It's pretty much a flawless war movie,"
billymcclean,"Nov 26, 2021",9/10,"Saving Private Ryan is a fantastic movie with a brilliant story line,an outstanding cast and inspired characters. The cast in this movie are all fantastic,but of course the best performance is the leading role,Tom Hanks,one of the greatest actors of all time,and if you liked him in previous films hes been in,you'll love him in this,he plays Captain Miller with great passion from start to finish,and this movies also one of Steven Spielbergs finest directing jobs,the movie looks magnificent,fifteen years later and it still looks great.Captain Miller (Tom Hanks) and several other soldiers are sent out during the war to find Private Ryan (Matt Damon) who's three brothers were killed in battle."
spinzpurple,"May 5, 2005",10/10,"This movie is one of the best war movies I have ever seen. This movie is hard to look at if you can't stand gory scenes. Tom Hanks plays his role extremely well in this movie. Along with other actors in here such as Matt Damon and Vin Diesel. Spielberg really got the costumes down pretty good. As well as the graphic explosions of the tanks. This is an adventure of Capt. Miller and his crew to save this one pvt., Pvt. Ryan. This movie was made on the 60th Anniverrsery of the invasion of Normandy. So this is the movie to see if you need to see a good WW II movie. Another movie that might be enjoyed if you liked this movie is Schindler's List."
