user,date,rating,content
lagudafuad,"Sep 1, 2012",7/10,"Fargo is a movie that depicts the Murphy's Law in total ""If anything can go wrong, it will..."" Well in this movie it all went wrong.The movie states this is a true story, but that can be argued since the movie itself is completely fictional. The Coen brothers claim that many of the events that took place in the movie were actually based on true events from other cases that they threw together to make one story.The movie's radical turn of events is something that will catch the interest of any audience, as things just don't go as they should for anybody. The film earned seven Academy Award nominations, winning two for Best Original Screenplay for the Coens and Best Actress in a Leading Role for McDormand. It also won the BAFTA Award and the Award for Best Director for Joel Coen at the 1996 Cannes Film Festival. The movie plots have Frances McDormand starring as Marge Gunderson, a pregnant police chief with a sharp and smart mind, who begins piecing together a case where a pair of motorists are found slain not far from the corpse of a state trooper.As Marge continues to put it all together, more people seem to be involved in the case than there should.On the other side of the events we have Jerry (William H. Macy) who has had his wife kidnapped so he can get the ransom money but everything just goes wrong.Kudos to the Coen brothers for a nice screenplay as everything that seems to happen on each shot complements the next, the characters are well depicted and the acting is a strong A+. The movie did have its faults, there were scenes that were totally unnecessary and a lot of people may complement the accents but I found it meaningless.Editing was top notch, directing to me was not so bad but won't award it. The story too had its lapse it took too long to pick up.Coen brothers are no stranger to the Academy awards, their 2000 movie O Brother, Where Art Thou? Was also nominated (no wins), their 2007 movie No Country for Old Men won 4 Academy awards and their 2010 movie True Grit had 10 nominations (no wins).Fargo is a drama, if you are not a huge fan of dramas this could bore you, but if you don't mind, you will find it interesting to watch.www.lagsreviews.com"
jayjaycee,"Feb 7, 2020",9/10,"""Fargo"" is a 1996 (comedic) thriller (officially) directed by Joel Coen starring Frances McDormand and William H. Macy. I gotta admit that I've already watched it roughly one year ago when I had personal issues and was in a bad mood that resulted in a disability to like films in general and that I heavily disliked this film. Now that the worst of my personal problem is over and I'm able to appreciate everything again, I had the strange feeling that I didn't do this film justice and that I had to give it a rewatch and after finding this nice little Mediabook I knew I had to set things straight. Like I expected, this film is actually pretty good. There's so much to cherish in it and I still cannot believe that, as the opening titles state, all these depicted events are based on a true story. It's just insane. What appears to be another brilliant gathering of thoughts of the Coen brothers really happened in 1987. They took it and made it a brilliant comedic thriller. Yes, I say it's a comedic thriller, because overall it might be a thriller, but there too many scenes that feature crude humour that I couldn't leave that part out. Actually, it's undeniable that in it's cold core it's a black satirical crime flick. First of all, the way how the plot is constructed and links several storylines with weird, but original characters is simply superb. It's full of funny running gags, dialogue and it perfectly combines the right amount of abstruse humour and true earnestness. From the wannabe gangster duo, to a desperate car salesman in the need for cash to a pregnant, but still determined police chief there's not a single character that is boring in any way. This cold-blooded thriller features so many outstanding actors and actresses that made them come to life with such an easiness. Leading lady Frances McDormand (who only has had one hour of screentime to again proof that she's the greatest) delivered an ingenious performance as the protagonist police chief. She's such a sweet lady and she dominates every single scene she's in, also the way she speaks is just lovely. Definitely one of the greatest actresses in the business. But let's not forget to praise Steve Buscemi and Peter Stormare as the quirky and evilly hilarious kidnappers and William H. Macy as the salesman who also knew to entertain with their weird charisma. Set in a scenery of frozen highways and endless widths of cold snow they all manage to create this unique atmosphere. Also, mostly enabled by the breathtaking cinematography of Roger Deakins. I could seriously feel the cold of the film crawling down my spine although I was sitting in my warm room under my even warmer blanket. It's so beautifully shot and moody that I still cannot understand why it took the Academy more than twenty years to award that man. He's a virtuoso with the camera! All in all, this shockingly beautiful and brutally bloody snow satire is an outstanding entry to the independent cinema, with an inimitable atmosphere and tense music and unbelievably real story lead by a magnificent McDormand. It took me another watch to appreciate this classic flick and feel redemption. Better late than never."
Pjtaylor-96-138044,"Oct 27, 2018",7/10,"Built around a sweet, polite, small-town police officer and her attempts to solve a murderous mystery seemingly by being as nice as possible, this strangely pleasant yet decidedly dark tale is somewhat satirical and screams 'Coen' as soon as it starts, with a totally phoney 'based on a true story' title-card that's supposed to excuse some of the more extreme coincidences and absurd-isms found in the plot. 'Fargo (1996)' is an entertaining time that feels as home-spun as its supposed to, doesn't always take the expected route and focuses on fairly realistic characters who are mostly atypical of the usual archetypes found in this type of story, but it is also sometimes slow and meandering, too (which is actually Coen trademark). 7/10"
MacAindrais,"Dec 4, 2005",9/10,"Fargo: ***.5*Fargo is a strange little movie. It is, in my opinion, the Cohen Brothers best film. It deals with a very serious subject, yet somehow it does so without taking itself overly serious. There is a very realistic quality to be found here- The subject matter is dark, yet there is a crack of light shining through always. The conversations are spot on with how they would probably be spoken in real life.McDormands character, the pregnant Marge, is the persistent pursuer but she is not obsessive like so many other movie clichéd 'good guys' are when it comes to catching their adversary. She is involved, but remains detached, just as 95% of real cops will be. You see it clearest in the conversations she has with her fellow officers; husband, and just about everyone else she speaks to. You really feel that she is, as her character says during an interview, just doing her job. This realism is not just present in Marge, but in every character. None are over the top, though the accents are probably slightly exaggerated.Jerry and his cronies are stupid. We never really find out Jerry's original troubles, but we are front row center for the idiocy that follows. There are no super intelligent characters which you find in many other crime dramas. There is only those who have some wits and common sense, and those who are helplessly daft.Personally, I loved this movie. It's quirky; it's real; it's charming; and its just plain fun (though bordering on the edge of painful) to watch this freezing fable of stupidity unfold. I did however feel that the ending was a little rushed, but this is not really a bad thing. I felt that the scene of Marge with her friend Mike in the city could have been removed, and that time could have gone to filling out the ending a little more. All in all, this nitpick is rather insignificant, and does little, if nothing at all to distract from the quality of the movie.I wanted to give this movie a 10, but it is lacking something, i don't know what, which is preventing me from giving it so. I also feel that it deserves more than a nine: 9.5/10"
tariqma2002,"Jan 16, 2021",7/10,"Frances McDormand Allison Tolman
I watched the Fargo series, the first part before watching this movie .. This may be the reason for my lower evaluation of the film .. In addition to the fact that the film is old and insulted, so the techniques used in its made were less .. The story line and script are better in the series .. The performance of the main actor in the film is less From the main actress in the series .. Frances Mc Domand Performance was normal and without excellence, and I don't know why She won an Oscar with it .. There is little excitement in the film and the events are not interesting .. The characters are all immature."
GoUSN,"Mar 28, 2008",1/10,"What galls me most about this movie specifically and the Coen brothers' movies generally is that they all reveal the insipidness of both the Coens and their fans. What they can't achieve with excellent dialogue, well-spun stories, and logical continuity in plotting, the Coens make up for via blood, lust, more blood, and then more blood. Vanquished from their movies is any sense of humanity or hope, and we are left in what I can best describe as a ""bleakscape"" - where the great positive is the presence of so much that is negative. I do delight, however, in the spectacle of reading swooning fans' fawning tributes to the Coens' ""films"" (and yes, their fans will watch only ""films"").Utterly unbelievable in the bleak, depressing, and joyless tableaux they offer, the Coen films are the perfect answer to a society full of soulless narcissists."
moviesleuth2,"Apr 26, 2009",10/10,"Going into a Coen brothers movie expecting something traditional is ridiculous by any stretch of the imagination. Any movie directed by the Coens is going to be severely warped in one way or another, either by approach (""No Country for Old Men"") or by their sense of humor (everything else).By all accounts, ""Fargo"" is a murder mystery, though it is anything but straightforward. This is not ""Law & Order."" It's about a simple crime that spiraled way out of control for all the principal characters. That's understandable, since everyone populating this story is either hopelessly inept or hopelessly stupid.Jerry Lundegaard (William H. Macy) is a car salesman who needs money to open a new car lot. But since he thinks that the only person who could give the money to him, his father-in-law (Harve Presnell), won't put down the money, he hires two thugs (Steve Buscemi and Peter Stormare) to kidnap his wife (Kristen Rudrud) and split the ransom that his father-in-law will pay. Unfortunately for Jerry, the two thugs he hired don't have any brain cells between them, and Jerry is probably the most incompetent criminal the world has ever seen. Things get out of hand very quickly and the bodies start piling up. This draws the attention of the very pregnant Police Chief Marge Gunderson (Frances McDormand).It may seem like I've given a lot away, but really, I haven't. That's just the set-up for a series of unexpected (not to mention bizarre) twist and turns that the Coens throw at us. Many thrillers, even the best ones, have easily projected paths. ""Fargo"" is anything but.Despite IMDb listing it as such, merely calling ""Fargo"" a crime/thriller is an insufficient description. The film is as much a comedy as anything else. From the character's stupidity or complete ineptitude, to the funny accents and way of speaking that everyone has, the Coens never take ""Fargo"" too seriously.The acting is the best part of the film. Frances McDormand is a real scene-stealer, and in many ways the best part of the movie. Marge is relentlessly chirpy and optimistic, and she's easily the smartest character in the film (although that's not exactly saying much). ""Fargo"" really takes off whenever she's on screen. William H. Macy gives his best performance as Jerry. As reprehensible as his plan is, you can't help but feel sorry for the guy. He's so bad at being a criminal, it's really pathetic. But seeing him try to get out of the jams he gets himself into are nothing short of hilarious. Steve Buscemi and Harve Presnell are good as the brainless kidnappers, and even though they think they're smart, they're really, REALLY dumb.Joel Coen has a knack for twisting the story just enough so that it's funny without lampooning the genre. This isn't a satire, but the jabs it takes almost make it so. It has its share of violence, including a scene that in any other movie would be completely sick and disturbing, but as told by the Coens, it's so shocking and absurd that it's laugh-out-loud hilarious.Roger Ebert heaped tons of praise on ""Fargo,"" saying that ""Movies like 'Fargo' are the reasons why I love movies."" While I greatly enjoyed ""Fargo,"" I can't heap that much praise on it. Some of the cuts in the film are too long, and I half-expected a commercial break. Additionally, there's one scene where Marge reunites with a guy from high school that, while funny and irreverent, really doesn't add anything to the story. Still, it's enjoyable enough that it's hardly worth complaining about.While it may not be perfect, ""Fargo"" is still a very good film, especially if you have a warped sense of humor."
briancham1994,"Apr 11, 2021",8/10,"I hesitate to call this a comedy film. I found parts of it funny but more in the way that Wes Anderson films are dainty rather than laugh-out-loud funny. The storyline features a clueless and bumbling car salesman attempting a hare-brained scheme with equally incompetent criminals, all juxtaposed a disarmingly mundane and friendly Midwest setting. The stand-out feature of this film is the acting, as the characters are all perfect depictions of those who simply cannot get anything right! I see more inspiration from old screwball films than traditional crime dramas. After a spate of Martin Scorsese films, Heat and Scarface, the easygoing style of this film was a breath of fresh air."
campbell-russell-a,"Aug 19, 2013",10/10,"Evil as depicted in films such as ""Fargo"" and ""Badlands"" is much more disturbing than in films in which evil geniuses or devilish fiends systematically carry out their plans. In ""Fargo"" unintelligent evil is matched against seemingly ordinary good people as embodied by Frances McDormand and good wins hands down. And it's not just a case of good defeats evil by catching and punishing it. That's the genius of this film. Enjoying the ordinary life shines through in Margie's relationship with her husband and the film does not patronize their homespun but genuine affection. Margie's comment to the dimwitted murderer about it being a beautiful day and ruining it over ""a little bit of money"" rings true because of the regrettably ridiculous tangle of folly caused by greed and insensitivity that has preceded it. Margie's final comment to her husband that they are ""doing pretty good"" is perfectly in keeping with the tale and its tone. Brutality has been beaten by simple human decency but with no overt sentimentality or grandly moral speechifying.This is a depiction of humankind at their worst and their best. It is a roller-coaster ride and possibly the best film ever made. And the score is just brilliant."
lukasleesteenhoek,"Dec 16, 2019",N/A,"""Fargo"" is a dualistic masterpiece that examines a world of great darkness and little joys. It achieves it's masterpiece status by fascinating character studies and fantastic dialogue. Between ""Fargo"" and ""No Country for Old Men"" the Coen brothers have put together two pieces of the greatest filmmaking I have ever seen."
maddmaxx46,"Dec 8, 2024",7/10,This was a pretty solid film from the Coen brothers but I can't figure out why it's such a highly rated movie. The acting is fantastic in this one; they capture the upper Midwest so well in each scene. I also appreciate the tremendous cinematography that the Coen brothers are consistent within their direction. Scenes like the kitchen where they can capture the husband at the table with the wife struggling to start the car are just a little attention to detail that they do so well in their films. But maybe this film hasn't aged as well. It might have been such a unique and cool concept in the 90s but I don't know what makes this movie so special and reading other reviews doesn't explain it either. I'm glad I watched it but it didn't hit high marks for me and I'll probably pass on a rewatch. 3.5/5 stars.
mbhgkmsgg,"Dec 30, 2020",9/10,"Fargo is one of those films that I have always known about and heard nothing but great things of. Yet, for some inexplicable reason, I had never seen it, until now, of course. What's more, the two other Coen films that I have seen, No Country for Old Men and The Big Lebowski, were both fantastic. So, while I'm a little mad that it took me this long to get around to Fargo, I'm glad that I've finally seen it.Interestingly, despite its critical acclaim and popularity, I had no idea what this film was about. And I'm glad that that was the case. I believe that Fargo benefits greatly, from being experienced without any prior knowledge. It gives the film a chance to create the narrative and expectations, which turns out to be quite important considering how simple it ultimately is. And while the story and the characters are relatively simple, it's that simplicity, I believe, that makes this film as fantastic as it is. It gives the chance to really focus on the characters and their personalities and what drives them. Because at the end of the day, this film is all about the characters. They make Fargo enjoyable and entertaining and easy to fall in to. The main characters, which there aren't many of, are all distinctly different, but together, they end up creating such a complete and perfect end product, that it's hard not to enjoy it.The story is certainly another highpoint, not that there are really any low points. It follows Jerry, a car salesman, who is under a debt burden. To get out of the pinch, he devises a plan to have his wife kidnapped, and for his father-in-law to pay the ransom. However, as the plan starts going sideways and bodies start dropping, Marge, the head of police, is called in. As Jerry and the bad guys start feeling the heat, it's clear that the plan will never work, and they must all hope to getaway.
The story ends up sounding far more complicated than it is when written out. Indeed, when watching the final product, it's especially the story that amazed me with its simplicity. But there is also a certain simplicity associated with the characters. All of them tend to follow a clear personality type, be it jumpy and uncertain, short-tempered and assertive, or calm and trusting. And apart from Marge, none of the characters goes through a phase of self-discovery or change. From the very first scene of each character, it's easy to understand who they are. And as the movie progresses, it's easy to predict how they are going to act. While that may, at first, sound like a bad thing, in the case of Fargo, it becomes the opposite. To keep the story concise and enjoyable, there needs to be a certain degree of predictability, and Fargo captures that balance perfectly.Although I have already discussed the characters, there is one that I have yet to touch upon. That character, who is omnipresent throughout, is, of course, the dialogue and the accents it is delivered with. A lot of the novelty, as well as the fun, comes from the way conversations flow, as well as the mannerisms and sayings that the characters have. There is this certain friendliness, even in the most uncomfortable and frustrating conversations which gives the film an almost surreal feel. And although Fargo deals with some familiar themes and topics, thanks to its dialogue and environment it feels oddly otherworldly. It's something that I can't really explain, and I'm not even sure that those who have seen it would all agree, but the whole film felt close, yet simultaneously distant, which certainly added a lot to the overall feel.Having now finally seen Fargo, I'm tremendously happy that I did so. It most certainly lives up to all the praise it has received, and is, without a doubt, one of the most perfect films ever created. While it might not be a personal favourite, nor one that I look forward to revisiting as soon as I get the chance, what it is, is a tremendously enjoyable and entertaining experience."
eagandersongil,"Jul 25, 2016",7/10,"""Fargo"" is a good movie, I confess that my experience with the movie was impaired because I watched the great series ""Fargo"" first, which contains a similar plot, but much better detailed and developed, because it is a series, so I watching the film compared to the series, and missed the further development of the characters, then the script to me, was not suppressed, on the contrary, I even I was disappointed a little (save dialogs), the soundtrack is good, photography the film is great, the acting is good, mainly from Frances McDormand, the way the situation is getting worse more is comical, his black mood is very good, violence is sarcastic, the great dialogues, the Coen brothers are masters in this type of humor, and use a lot of visual to help build all the comic climate / tragic film. For those who like comedy, especially the most acidic, or like the estilão Coen brothers' ""Fargo"" is a required film, otherwise straight pass through ""Fargo."" Forgive my English translator google"
matthewssilverhammer,"Apr 1, 2021",10/10,"Fargo is the optimistic counter-point to No Country..., each starring hard-working, small-town cops dealing with a crime so beyond their usual work that it stirs an existential crisis. However, where Jones' character seems forfeited to the insurmountable evil, Marge (best character ever?) is unflappable in her determination to beat the bad guys; this covers both ends of Coen-nihilism. Simpler, Fargo is as pure as the fresh-fallen snow, delicately balancing dry rural humor with pointed & surprising bursts of violence."
anders-28,"Jan 5, 1999",1/10,This movie must be one of the most annoying films I have ever seen.  The characters in the movie are incredibly stupid and talk in an absolutely annoying way.Seeing Fargo was a total waste of time and money.
rabiadelpueblo,"Feb 20, 2018",8/10,"I really don't know why i liked this movie. It's a good movie, for sure. Gret characters and story telling... And Roger Deakins... But why i liked this movie so much?! I'm little confused."
OrangeSequins,"Apr 28, 2024",8/10,"I have to say, the Coen brothers outdid themselves with ""Fargo"", as this film is just a fantastic: full of well-written characters, played by amazing actors, and a brilliantly constructed plot, full of funny and tense moments, fantastic direction and cinematography, and the soundtrack is also outstanding... By the way, the film kinda reminded me of ""Pulp Fiction""... for example, the criminals behave similarly in this film. But it's not nearly the same film.Overall, ""Fargo"" is a very good and very enjoyable movie, with a lot of outstanding features, and I gladly recommend it, fans of crime/comedy films will probably enjoy it."
braco,"Jul 30, 1998",10/10,"Clearly the best film of 1996 ""Fargo"" is a beautiful ""true"" story about greed and falsehood. This great Coen Brothers masterpiece is a movie that everybody should see and it's placement here on the IMDB 250 list(as #46) only shows how popular it really is. One of the greatest movies ever made."
