user,date,rating,content
lorene-bar,"Jun 4, 2012",9/10,"After having broken box office records in its native France and across Europe, The Intouchables is brought to American screens.It's a story about a white man and a black man. The white man is rich and paralyzed from the neck down; the black man is an ex-con from the projects. The former needs a caretaker; the latter needs someone to turn his job application down, so he'll be eligible for unemployment benefits. They meet. They clash. And, against all odds, they become friends.That's the plot of The Intouchables (based on a true story), and that storyline has prompted many American critics to label the film ""racist."" Maybe it's coming from a misunderstanding of some journalists, or from a cultural difference between USA and France, but race is absolutely not the subject.Indeed, the French title Intouchables which translates literally as untouchable, refers to the 5th Indian caste, these people ostracized by society, as the two characters. Philippe is rich but quadriplegic from a paragliding accident. Opposite, Driss is full of life, but he is poor and comes from the suburbs. His disability is purely social. Using humor to explore the sensitive topics of class inequality, and quality of life for handicapped individuals is a tall order for filmmakers of any country. However, directors Olivier Nakache and Eric Toledano accomplished all of this.An irreverent, uplifting comedy about friendship, trust and human possibility, The Intouchables depicts an unlikely camaraderie rooted in honesty and humor between two individuals who, on the surface, would seem to have nothing in common. A great film!"
henry8-3,"Jun 30, 2020",6/10,"Extremely rich, disabled Cluzet hires street smart ex con Sy to help him. They learn from each other and much fun is had by all.Despite rather typical messages about learning from each other which doesn't make for hugely original cinema, there is no denying the fun, witty script and the delivery of it by the 2 leads who certainly bring chemistry to this thankfully unsentimental journey."
charlottevgl,"Jul 25, 2013",10/10,"This movie is kinda like your first love, you will never forget it or what it gave you, and when you realize it's over you just sit there numb and full of emotions, unable to actually fathom what just happened.I have rarely laughed so wholeheartedly or with my soul as much as I did when I watched this masterpiece of a movie. There are few characters, and the main focus are on two men, who very obviously come from two different life's and struggles, but develops a friendship I have never seen anything like on a movie screen. I almost have trouble describing what this beautiful story does to you. You feel like you wanna run down to the streets and hug a stranger and let them know that whatever they are facing in life that it's gonna be okey.The reason i LOVE this movie is because of the story and the people portraying the main characters. They have really done an excellent job both on the cast and the script. You can relate to the characters, they suck you in and you have no other option but to listen and laugh(and cry)with them. The story is unique and original, it touches you in ways you didn't think possible. Don't mistake this movie for a sob-story because it's anything but.If you haven't seen it, and think for a second you are not going to either - well then, the jokes on you. Because it doesn't matter where you are, who you are or what kind of situation you are in, it will bring light and love right smack into your little beating bloodbox."
Jithindurden,"Feb 3, 2018",7/10,The chemistry of the lead actors and the overall fun mood keeps us entertained and the intentional avoidance of some usual formula is a plus point. But the film never really rise much above that either which I had been led to believe from all the great reviews and ratings.
dbogosian-1,"Aug 15, 2013",9/10,"This is easily the best and most memorable movie I've seen in a very long time. Its formula is simple: the juxtaposition of two people from two radically different backgrounds who, with time, become the best of friends. And oddly enough, there isn't the initial suspicion or antagonism; they hit it off right away. But the relationship grows and deepens until they become inseparable.The real strength of the film lies in the characters and the men who play them. One is a sophisticated, literate, older white man who is paralyzed and confined to a wheelchair; the other a young, lanky, street-savvy black man with naught but the clothes on his back. They have such charisma, such chemistry, it is a tour de force from beginning to end. Particularly the younger man, whose infectious smile and boisterous humour keeps the mood light even in the darker moments.It's set in France, and you do have to endure subtitles (which are not well done; occasionally the punch line of a joke comes up too soon), but it's well worth it nonetheless. This is the first time I've seen a French film that didn't leave me depressed and suicidal by the end. I hope many more like it will follow."
AurelienA21,"Dec 15, 2012",9/10,"This is a truly excellent french film which highlights themes from love to comedy. I really enjoyed the music which went with the movie as it captured the mood of the (based on a true story) storyline. The main piece was Fly by Ludovic Einaudi. The actors play a splendid role to depict the life of the real paralysed man and real carer.I only watched this last night and i watched the original - in french. It is a very recent film filmed in Paris and i find this film suits any watcher for the reason that it contains both high-up, posh lifestyles compared to ""chavs"" smoking and speeding Maserati's. The Humour is captured best in the original version as i would imagine a few humorous jokes may not work in translated English. I Loved it."
metalpixies,"Sep 6, 2012",10/10,"I hadn't expected too much of this film because of the carer/wheelchair storyline. It just didn't sound very interesting. So I was pretty much astonished to find myself watching a truly marvellous and entertaining movie.It's a unique storyline which is apparently based on true life.The two guys at the centre of the plot keep bouncing jokes off each other leaving you in fits of laughter. But it's not just a comedy; there's a lot of sad, moving and beautiful stuff in there as well.Script, direction, filming and acting are all of the highest standard.This is a very sensitive treatment of human relationships; sad, funny and involving. It's simply a great movie. I can't recommend it highly enough."
TheSquiss,"Sep 20, 2012",8/10,"Intouchables / Untouchable **** 10 September 2012 I hate having to start like this but, based on the discontented grunts from the morons who walked out in the first minute, I regret I must begin with: Intouchables is a French film. Which means it's in FRENCH. Which means there are subtitles!!! Arrrggghhh.For the readers who actually have a brain, Intouchables (Untouchable for those who can't work it out) will almost certainly end the year as one of the most tender, beautiful films of 2012. Yes, it was released in France last year but this is no place for such pedantry.Intouchables is the true story of Phillipe (François Cluzet), a wealthy, aristocratic quadriplegic and his relationship with his caretaker-cum-care assistant, the reluctant, defiant Driss (Omar Sy). When Driss turns up for an interview at Phillipe's home it is with the sole intention of failing in order to qualify for unemployment benefit. Phillipe, however, sees in him a man who will challenge and inspire him and, much to the annoyance of Magalie (Spiral's Audrey Fleurot), hires him on the spot.And so begins a clash of culture, class and conduct from which both parties will surely emerge richer, softer and sharper.There are no surprises in the broad story; if a true-life tale is worthy of the big screen treatment, there's a very good chance it sticks to the formula, although don't dismiss Intouchables as merely formulaic. The surprise here is how effortlessly engaging, inspiring and downright funny it is. No, it isn't specifically a comedy but I laughed out loud more often and with less control than I have in any films billed as such this year so far.There's no great villain, no huge love story, no major tragedy, just a simple story of friendship where two men, though apparently diametrically opposed in every aspect, are absolutely meant to share their lives and have more in common and so much more to give each other then either could have considered.Cluzet, in a welcome return to British screens after last year's superb Little White Lies, is huggably dour as Phillipe with an outer crust and a rod up his backside that are begging to be shattered. Sy meanwhile, in his most prominent film for English-speaking audiences (other than a supporting turn in Micmacs), storms into frame with a demeanour that would make most of us back away and cover our throats. But though we get the measure of both men fairly quickly and there are no road-to-Damascus conversions, each of them evolves and when the inevitable tug at the heartstrings arrives, it brings a hollowness that you'll hope desperately can be filled. Soon.I really want to award Intouchables another couple of stars but it misses out on perfection for being too swift and not allowing itself the time to unveil the arcs of a couple of supporting characters that could have added greater depth to the film. Although we meet members of Diss' family at various points, there is another plot line with them that is never fully explored and there is more that occurs in Phillipe's household than we are allowed to fully enjoy.But these are minor quibbles. See it. See it before it disappears from your local screen. See it if The Best Exotic Marigold Hotel left you hankering after India, see it if The Chorus made your heart skip, see it if Oh, just go and see it. It's beautiful, warm and very, very funny."
tnt-tarun,"Dec 12, 2012",9/10,"Wow. That's all I can say about this movie. The fact that it's based on a true story is all the more amazing, and I immediately looked up the people the movie was based on as soon as it ended.Once in a while, a movie comes along that elicits emotions from deep within the heart. You don't know how it's going to end and you are smiling when the movie is over, wishing there was more. I usually don't laugh out loud while watching a movie but found myself doing so because even the jokes in this movie were so genuinely funny without being crass.Both the lead actors did a wonderful job. The chemistry between them can be felt and you really feel as if you are watching the story unfold in front of you and not on the screen. All the characters were well developed in their own roles and there were no loose ends (something most movies neglect to tie up).Watch this movie. You will surely recommend it to others as I am doing right now."
Prismark10,"Jun 9, 2019",6/10,"I was surprised by Untouchable. I did not think that a French film about a wealthy quadriplegic and his black working class carer would be a comedy. Instead I thought the film would be bogged down with race, cultural and class issues.Francois Cluzet who looks a lot like former F1 world champion Nigel Mansell plays Phillipe. A wealthy widowed aristocrat living in a fabulous Parisian mansion paralyzed from the neck down in a paragliding accident. He needs round the clock care and none of them last long.Philippe meets Driss (Omar Sy) who is of Senegalese origin. He only attends the job interview to get a signature so he can get his unemployment benefits. Despite being a small time criminal, Philippe likes his irreverence and verve and employs him.Driss is physically strong but he also brings Philippe to life as he drives him around in one of Philippe's fast cars rather than his adapted disabled friendly van. Driss's lack of stuffiness is exactly what Philippe needed.Untouchable is a feel good buddy comedy of two men from different tracks of life who bond. It is really a simple story based on true facts, although the real life carer was a French Arab. It is an engaging enough film despite its stereotypes. There is a scene where Driss steals a Faberge egg that was given to Phillipe by his late wife.The film decided to go for the funk feel of Earth, Wind and Fire. It helps that both stars have an easy chemistry together."
asda-man,"Apr 4, 2013",9/10,"Prepare yourselves for one of the most touching relationships ever brought to screen! Forget Fred and Ginger, forget Humphrey and Ingrid, because now it's all about Phillipe and Driss. Most French films I watch are nasty (but brilliant) shockers like Inside and Martyrs. Of course I've seen the odd gentler one like, I've Loved You So Long but even that's depressing. The funniest French films I've seen are Jean-Pierre Jeunet's, Amelie and Micmacs, but Untouchable just about betters both of them. It's not just one of the most funny and touching French films I've seen, but just films in general. Only a seriously bitter and cynical person could hate Untouchable.The film opens with wit and energy as we see Phillipe and Driss trying to out-run and out-smart the police for speeding. It's a funny and clever sequence and just a taste for the even more amusing shenanigans to follow. But of course we can't just jump into the middle of the film! We need what Midge calls, ""a flash-back"" so we can see how they got there. What Untouchable does so well is build up its characters so we can care about them. Driss comes from a working-class background, living in a tiny and over-crowded flat. He's also a thief and his Mum has kicked him out, and although Driss is a thief we can still care about him, especially as the film goes on and we see just how funny he is.Phillipe is the opposite. He's a hugely rich invalid with silly money to spend on paintings that look like ""a nosebleed"" as Driss puts it. But like magnets opposites attract. Driss is obviously attracted to his lavish quarters, already bigger than the whole flat he used to live in! The film takes time building up their relationships, as we see them bond through some very funny and touching moments. The directors make the audience feel as though we're bonding with them, so in a sense it's a three-way relationship and becomes all the more personal. Untouchable is also a comedy, there are some hilarious moments which I won't spoil, but it had me and the audience laughing pretty much all the way through.The directing is really well done, and I also really liked the music which made some touching scenes even more touching! It's no wonder that Untouchable was a huge hit in France, because it's such a light-hearted and entertaining film, yet is also quite memorable too, thanks to the wonderful performances, witty screenplay and classy directing. Untouchable is a sort of rom-com but Jennifer Anniston is no where in sight! It's one of those 'buddy movies' which shows a touching kind of platonic love similar to that of Rain Man. It's a relationship we can all relate to and care about the couple involved.Untouchable is a French classic and one I hope to watching in years to come. I defy anyone to watch and not to become involved in Phillipe and Driss' wonderful relationship. An endlessly funny and moving film which those with a sense of humour can enjoy. It's a wonderful feel-good film!"
airinwongso,"Mar 10, 2022",6/10,"I've always wanted to watch this then I got the time. It's beautiful really, funny, and elegant in it's own way. I like it. The story not to mellow, and for some quiet reason it's just a nice movie like it's to good to be true or maybe it's just me but it's feels like that and the story is really cute but what I like the most is the character boundaries they have good chemistry, the chemistry seems not to deep or just like friends but they're more than just friends like i would simply say brother but they're not there yet..."
MichaelHur,"Feb 3, 2015",5/10,"Everybody said that this movie was awesome, so I gave it a shot.Iusually don't like France movies so I didn't expect a good movie, and I didn't get a good movie. The scenes escalated way to quickly. Why would the handicapped man want him to take care of him. The acting is either overacted or there is no act in the scenes. In short the acting is bad.The writing It's just off, awful, Scenes either contain Way to much information or no information at all, and that confused me a lot. It didn't feel realistic, I'm pretty sure no one would react like that in real life situation. My recommendation is not to watch this movie."
myungjahigh,"Mar 31, 2012",9/10,"In these days, in my country, the movie Intouchables is ranked very high in box office. Usually French films are not that popular or familiar in this country's movie industry. Therefore it is quite surprising to see that people are very eager to see Intouchables, a film from France. At first, it was not famous to people at all because promotions were not big for the movie. However, as time goes by, Intouchables is getting bigger and bigger. Almost every person who watched the movie tells to friends or writes review on the internet that Untouchables is a amazing film. And I think that is a real and successful marketing.I also watched it today, and I definitely recommend this film just like others did to me. So fun, moving, beautiful. While watching the movie, the audiences including me burst into laughter or tears for every single second. very priceless moment."
StevePulaski,"Jul 31, 2012",10/10,"Now here is a film that perfect defines the word ""wholesomeness."" The Intouchables is a moving parable about a wise but poor black man who becomes the caregiver and mentor for a wealthy tetraplegic in a series of unlikely but not unbelievable events in modern-day France. The film begins by showing the man's assistant, interviewing candidates for the job of being the man's hands and legs, but as the man sits close behind her, he becomes increasingly unsatisfied with the candidates due to their lack of motivation or their mundane nature.The man, named Philippe, played by François Cluzet, is brought to a smile when he is acquainted with Driss (Omar Sy), a man who has been through relentless struggles with money and social-status, but still manages to push through it with a smile. Driss is only looking for a signature on his unemployment checks so he can continue receiving welfare benefits and has absolutely no ambition to get this job.The next day, he is called up to begin the trial period as the role of Philippe's caretaker, and while Driss is clearly unqualified for a job of this nature, Philippe casually accepts him because he finds the man to be charming and good-natured. While both men come from the Parisian-area, Philippe lives in a heavenly mansion, while Driss inhabits the lowest end of the slums. Despite this setback, the men have an incredibly easy-going friendship, with deep, touching talks of inspiration and motivation throughout the picture. Subplots involve Driss demanding that Philippe maintain better control of his only daughter, Elisa, and trying to get the man back on his dating game with a digital lover.I'm aware the story sounds like cliché-after-cliché, but the film perfectly abides by my law of films with a seemingly cliché premise. The Intouchables knows its story functions with moments of incredulity and utter sappiness, but it doesn't try to overcompensate and milk those moments for more than they're worth. It also does more than give us contrivance, but inflates its moments of sentiment with wit, charm, attitude, style, and poignancy, making this for a very emotional experience on every level. Sometimes, we are greeted with a film we know is relatively simple, cliché, and unassuming, yet we are mesmerized unconditionally up until the final frame.The film became a colossal hit in France, selling over nineteen million tickets and is currently the second highest grossing film of all time, in France. Due to its very minimal promotion in the US, I could see some people going into this film expecting a somber, relatively monotone film depicting the life of a tetraplegic tragically and with a numbing aftertaste. The Intouchables has a talent much like the Alexander Payne film, The Descendants, which is depicting a relaxing environment, which includes making a character out of the setting, handling tragedy with a sustainable amount of poignancy, and providing touches of extremely funny comedy throughout its entire runtime.As of now, French cinema is one of the strongest cinemas in the world, as it has been for decades now. Rather than try to recreate the New Wave it experienced many years ago, try out a gimmicky, self-indulgent style, or even worse, replicate Hollywood formulas, it is at a stage now where it can take even the most basic storyline and rework it into a magnificent portrayal with humanity and lavishness subtly and majestically. The Intouchables is a beauty that will definitely be taken for granted.Starring: François Cluzet and Omar Sy. Directed by: Olivier Nakache and Éric Toledano."
adambenjamingibbons,"Oct 2, 2019",10/10,"This is an amazing film of friendship and it is very funny.At its core it is about someone who wants to be treated normally who meets someone that treats him that way. They get on like a house on fire, have a few ups and downs and a whole lot of fun too.Everyone moaning about this film is banging on about stereotypes and racism. I don't care, it was a film, stereotypes come about for a reason, some people do fit the stereotype.Unless you're a mardi little overly PC snowflake then it's a must watch."
jtprint,"Nov 29, 2020",10/10,"A beautiful film, I laughed a lot with it, one of the best films I have seen in my life and one of the few that really deserves a 10/10, it must have won best international film in The Oscars. I feel that the central message would be friendship, understanding, compassion ... 100% recommended. And should be on the top 30."
Calicodreamin,"Jan 28, 2021",10/10,"This film instantly draws you in with a real emotional connection to the characters. There is a good mix of humor and reality. The storyline has good flow, great acting, and vivid cinematography. Overall a well made film."
Kdosda_Hegen,"May 14, 2020",6/10,"It's a nice heartwarming movie for an evening, though nothing was special about."
kazzieh-31998,"May 20, 2021",10/10,"It's a beautifully written script, based on a true story. Francois Cluzet and Omar Sy, deliver a gorgeous chemistry on screen. The rapport gels from the moment they meet. The whole cast performance is delicious from beginning to end. I've probably watched this film 3 or four times a year, and still it moved me to tears at the end."
TheRealJuanPedro,"Nov 27, 2020",10/10,"This film is so beautiful.. i don't think I've laughed and (almost) cried so much during a movie.. based on a true story, it's just so heartwarming and wonderful.Took me some time to watch this but I'm so fakking glad I did.. wow"
lastliberal-853-253708,"Jul 20, 2013",9/10,"From the moment I see François Cluzet and Omar Sy, I know I am going to love this film.Driss (Sy) is a homeless loser that is hired as a personal attendant to a quadriplegic (Cluzet). He is crude, insensitive, and incredibly funny with superb dialog by writer/directors Olivier Nakache and Eric Toledano.Both Philippe (Cluzet) and Driss grow by leaps and bounds in the relationship that develops. Phillipe says that with modern medicine, he can live to 70. Who would want to live one more day as he is? Driss shows him how to really live no matter how long he has.Both men, and those around them, really start to live, and that is what makes this film so special."
selena5222222,"Nov 30, 2015",10/10,"This is the only film I manage to watch 3 times in 24 hours. I was so thrilled with the originality and humor that I couldn't stop watching and talking about it for days. Both characters are genuine, witty and original. Scenario has enough of intelligent humor and it is such a refreshment in the ocean of bad comedies. The film has the tragic note but also it shows we should use every moment of our life. The fact that the film was based on real persons and events makes it even more special. I would recommend it for every audience : each person can learn from the film. Its a story of life, love, daily problems, tragedy but it shows that we can change our perspective and experience the maximum. Also, it shows how two totally opposite people can build an amazing relationship. We just need to forget the prejudice we have about each other. I'm planning to watch it for the fourth time in short notice - that's how good the film is."
keithdonegan,"Dec 7, 2012",10/10,"A film that is so beautiful and sad at the same time, it really makes you think about everything: life, love, death and tragedy. I am a big fan of these type of 'minimalistic' movies and in particular, french film so this ticked all the boxes and I'm very glad I stumbled upon this.The movie grabbed me from the very start, it is a well made title that has a great story line, actors that fitted their roles perfectly, the production is top notch and don't get me started on the soundtrack. 10 out of 10.I won't go into too much depth but I absolutely loved the relationship between the main characters. They complimented each other very well together (you will understand when you watch it) and the other cast of the mansion too.Just a masterpiece for film lovers, please watch it."
