user,date,rating,content
Bill-stricker,"Feb 24, 2013",10/10,"This is a don't miss film if there ever was one! Any age will find this film to be one of the best films they have seen in years. Even teenagers, who typically only want to see action films, will be drawn to this film. One does not even remember the film was subtitled. This is the story of a quadriplegic who continually needs to find new caregivers because of how badly he treats them. He finally finds the most improbable candidate and hires him. This begins a fantastic and very funny relationship that kept me spellbound for the whole movie, as it did the entire audience. When it ended, the audience all clapped loudly. See this movie if you want to laugh a lot and if you appreciate the development of a true, unique friendship."
Searsino,"Mar 18, 2017",10/10,"This was one of the first titles I watched after taking a deep dive into the foreign film market. And as a result, I have never looked back in the endless search for more and more ""foreign hidden gems"".The Intouchables is a movie which comes out of France. A passionate story directed by Olivier Nakache and Eric Toledano which ultimately would become one of the most successful French films to ever hit the box office. You may also know there work from another film titled Samba, another hit which also starred Omar Sy (has also played several smaller roles such as Barry in Jurassic World - 2015).The general premise is that Philippe has been a lifelong paraplegic who is searching for an everyday caretaker to help him with menial tasks such as showering, shaving, eating, and any inconveniences that he may encounter on a given day. Driss happens to apply for the job, desperately in need of a new source of income. While many would have tossed aside Driss on his past alone (criminal record and seemingly never ending impatience for people), Philippe wants a person who will look at him as more than a handicapped man. He wants a friend and someone who will treat him like he is just as capable as the next.I quote a line from the film where Philippe is approached by a colleague who is concerned that hiring someone like Driss, a person with a rough background:Colleague: These street guys have no pity. Philippe: That's what I want.Antics ensue.I claim this to be one of my favorite films and gems for several reasons:1) The chemistry between the two leads, Omar Sy and François Cluzet is perfection. You truly believed these two individuals from polar opposite upbringings had becomes the closest of friends having discovered the beauty and benefits had from learning about one another. And quite frankly, chemistry of this magnitude is a rarity in film nowadays.2) The imagery was beautiful. Every scene from the nights at dinner or concerts, visiting private art galleries together, snowball fights (that humor could be drawn from having a snowball fight with a paraplegic speaks volumes), Driss helping Philippe with his everyday health needs, all the way to merely feeling like he's just a normal person who also wants to have fun once in a while.3) The story was told in such a way that keeps us wanting more. Both directors cleverly scatter humor throughout in order to offer the viewer some relief from the dark drama which is drawn out of these two characters with equally different struggles and rough pasts.I think what ultimately made this entertaining for me was thus: in situations where you have a helpless or handicapped lead (in this case a paraplegic), the first thing I wanted was for a physically capable person to stand up for them in situations where the other is not able to do so themselves.For example, early on in the film we are shown a situation where Philippe has a neighbor who constantly parks in the front of his drive way. It clearly bothers him but he can't do anything besides wait for the ignorant guy to move out of the way. Driss is now Philippe's right hand man, and upon recognizing the situation, jumps out of the car and gets in the drivers face, yelling for him to move his car and never park there again. You get a sense of satisfaction from this kind of relationship, as well as the developing friendship these two develop for one another as they learn to depend on each other.I won't ruin the ending for you, but rest assured that it won't disappoint. This is truly a hidden gem for any American, and I cannot recommend this title more highly.----- 10/10 STARS -------- Review by Searsino -----"
patryk-czekaj,"Jun 15, 2012",8/10,"Intouchables is probably one of the best French movies of the last few decades. It's not hard to see why it raised such a tremendous furor in Europe, and now it's creating an even bigger fan base for itself in the United States. It's so utterly pleasurable and heart-warming. Don't look at it as a foreign feature, though, or you will miss ale the excitement. It's a movie simply made for the viewers to love and remember. Films like this one don't come out too often these days, so just sit back and enjoy it while it's still out on the big screen.Intouchables presents a truly touching story about an unlikely friendship between an older, extremely rich, but severely paralyzed white man and a black man, who just got out of prison. Philippe is in need of a caretaker and as soon as Omar steps into his house he realizes that he might be the right person for this specific role. The plot doesn't concentrate too much on the way that those two guys connect over time, but quickly shows how they got so fond of each other. It was as if they were meant to work together and, in the process, become 'intouchable', in a very profound meaning of the word, and inseparable by any outer force. It's fantastic to see how people from completely different backgrounds are able to form such a strong bond and spend so many wonderful days and nights together. Even though at first it might seem that Omar may be overly vulgar, disrespectful, ignorant, and simply inadequate for this hard job, Philippe is still eager to give him a chance. What's more, many of Philippe closest friends don't approve of his new companion, but that doesn't discourage him.It is simply remarkable, how Omar is able to bring warmth, enthusiasm, and so much fun into Philippe's life. They actually operate on the same wavelength, as it might seem, sharing the same views and opinions on various topics. Through Omar Philippe understands that sometimes all it takes to achieve pure happiness is to let go and do what one feels like doing, as if nothing really mattered, even if you are attached to a wheelchair.And with that moving tale the movie creates a very powerful message, showing that all the wealth and money isn't capable of making a man truly happy, when he doesn't have someone to share it with. It's the richness in heart and mind that really matters, not the abilities of a body blessed with fortune and power.Through his brilliant, funny, and very real performance, Omar Sy will probably give his career a fantastic jump start. He is able to show the transition that his character goes through, from a cold man living on the streets, to a deeply compassionate and art-loving protector, in the most convincing manner.The amount of clever, laughable, and sometimes insulting (but timed very adequately) jokes is simply overwhelming. Also, notice the amazing mix of classic music and 60's soul and the way it enhances the visualization of this very peculiar friendship between the characters.I don't think that if someone would've come to me with a script and said: 'Listen, I got a story about a young black guy who makes fun of a handicapped man and gives him weed to smoke just to make him feel more relaxed' I would've bought it.It's a simple exaggeration, but through that straight statement I want to show that the movie has yet so much more to offer, making the marvelous Intouchables a true stand-out movie of the last few years. Highly recommended."
tom-mcdevitte,"Mar 23, 2013",N/A,"Rented this film with no intention of watching it but in a moment of boredom decided to give it a go . I didn't realise it was french and couldn't really be bothered with the subtitles but before I had time to turn it off I was already involved . the films is truly amazing from start to finish with an amazing perfromance from everyone in it . would put this in my top 10 films to see before you die with it currently being at number 1 . I could sit through the film again now even though I just watched it , the humour in it was perfect and had me cryin with laughter in more than one part . definitely a must see !!!!! 10 star film"
fortionat1,"Jan 10, 2013",6/10,"I NEVER post a professional review BUT now - - ROGER EBERT reviewed this and said exactly what I felt and wanted to say about this film. Rather than trying to paraphrase his review I am simply posting his original review found on his web page: (since links are not allowed i have put spaces in the link. you need to remove the space to follow the link)http://rogerebert.suntimes.com/ apps/pbcs.dll/ article?AID=/20120530 /REVIEWS /120539995/ 1023It might help to think of ""The Intouchables"" as a French spin off of ""Driving Miss Daisy,"" retitled ""Pushing Monsieur Philippe."" A stuffy rich employer finds his life enriched by a wise black man from the Paris ghettos and takes lessons in funky music and the joys of marijuana. This is a story that has been told time and again in the movies, and sometimes the performances overcome the condescension of the formula.The film was an enormous box-office hit in France, and indeed, it is easy to enjoy. Philippe (Francois Cluzet) is a millionaire who was paralyzed from the neck down in a para-gliding accident. Driss (Omar Sy) is a man out on parole for robbery, who applies for the job of Philippe's caregiver only so he can be rejected and get a signature on his application for unemployment benefits. As Philippe interviews one boring job applicant after another, we begin to understand that he needs not only physical help but someone to cheer him up. Driss' cheeky irreverence is refreshing, and Philippe astonishes him and his own household staff by offering him the job.The movie tells the story of a growing relationship between these two likable men, based on Driss' confidence that Philippe will improve if he escapes his stuck-up lifestyle and samples the greater freedoms of an immigrant from Africa. There may be a certain truth in this, but the education of Philippe proceeds in a series of essentially insulting clichés. Driss, you see, has rhythm and soul, and if only Philippe can absorb some of that, he'll be a happier man. He'll still be a French millionaire surrounded by a protective staff, he'll still be paralyzed, but he'll be happier. How many times have we seen the scene where an uptight square inhales pot for the first time and a smile slowly spreads across his face? ""The Intouchables"" has an element of truth that it never quite recognizes. The role of a good caregiver is hardly limited to lifting, bathing, grooming, dressing, pushing and supplying medicines. The patient is faced with a reality he finds it difficult to accept: he has been deprived of all he once took for granted, such as the simple ability to walk across a room. A caregiver can't provide that, but he can provide something more valuable, companionship. Philippe's wife is dead, his teenage daughter is a snotty brat, and his staff is preoccupied by their salaries and status. Driss comes from a different world.The success of the film, despite its problems, grows directly from its casting. Francois Cluzet, who acts only with his face and voice, communicates great feeling. Omar Sy is enormously friendly and upbeat. He reminded me of the African immigrant played by Souleymane Sy Savane in Ramin Bahrani's ""Goodbye Solo"" — a film that avoided the traps that ""The Intouchables"" falls into.The appeal of a film like this, and it is perfectly legitimate, is that when we begin to feel affection for the characters, what makes them happy make us happy. Caught up in the flow of events, we allow many assumptions to pass unchallenged. The writer-directors, Olivier Nakache and Eric Toledano, are cheerfully willing to go for broad gags, and their style is ingratiating. But at the end, by looking through the foreground details, what we're being given is a simplistic reduction of racial stereotypes.That was also true of ""Driving Miss Daisy,"" but it was a period picture set in the South in the late 1940s, with older characters who had been shaped by their times. There was a plausibility there. ""The Intouchables"" is more of a soothing fantasy.by Roger Ebert - May 30, 2012"
PipAndSqueak,"Sep 23, 2012",7/10,"This a straight-forward and simply told tale of two men discovering a mutual co-dependence based on physical need. Not what you might suppose! This is a tale of a poor immigrant man trying to keep heart and soul together whilst suffering various forms of social exclusion and another man trying to experience life whilst trapped in a paraplegic's body. They are poles apart ethnically, socially, culturally and pretty much every other way too. Nevertheless, the pair bond together through their common pragmatism. The wealthy invalid wants no pity and gets none from his unlikely carer. The outcast finds he has a social as well as an economic value. A heart warming tale and beautifully performed by all the actors - striking a very authentic note, even though we can see some 'facts' have been changed in the telling of this tale."
verrucktcarlos,"Oct 21, 2016",5/10,"I've heard about this movie and how good it is for so long. So I finally decided to watch it, And I did not enjoy it, I did not laugh once, the film was filled with super clichéd jokes.This is purely subjective of course, but Driss was unbearable and super dislikable, he was just a complete idiot, I mean, the way he referred to women???? The part were the man is talking on the phone with the woman he says ''don't forget to ask her about her weight'', was that supposed to be funny? Literally nothing in this movie was funny, there were just the same old repeated unfunny conventional jokes. And I know that a rating below 5 is something bad, a 6-7 is good, and something over 8 is excellent(most of the time), so one may think this is next level, but it wasn't, just from seeing the poster I knew how this was going to be, and I hoped I was wrong, but I wasn't. Not a bad film whatsoever OK, but nothing special."
placebotonic,"Apr 10, 2012",9/10,"Before watching, my only expectation was, that it really is a comedy, not a drama with two laughs in it. Turns out, it was a comedy with very subtle touch of drama, it is a movie worth every second of your time... does it have flaws? I don't know, I was too busy enjoying every minute of it. Captivating actors, beautiful script and great sense of humor. This is one of those very rare movies that make a tiny change deep inside you and you'll know it happened when the movie is over. Watching this, you can laugh at a tetraplegic's shortcomings without feeling bad, because it is in absolutely good spirit, you can laugh at the serious things in life, because they can't kill you and somehow can always find a way to have some fun no matter what."
nikolova-assya,"Apr 21, 2012",N/A,"At first I thought - they say it's a comedy, but I don't see this story about handicapped person finish in other way but in tears. And I was right...only they were tears of pure joy! Both actors Omar and Francois deserve great acclaim for their roles. The chemistry between them is so flawless that by the end they convince you that you are rather looking a documentary then a movie inspired by a true story. Special honors to Omar as his role is what makes the movie. Though he may appear having the happily ever after end of a Cinderella story he fails to fall in the cliché and makes the audience twist and turn till the very end, most of the times laughing out loud. I very much liked the humor - fresh, well pitched, never overboards. So if you are seeking to lighten your spirit yet entertain yourself - try the nice touch of Les Intouchables!"
diaradaisy,"Apr 27, 2017",7/10,"Foreign Films are often disregarded when choosing a film to watch. Foreign Films can also be associated with 'black and white films' which tends to have a negative stigma with young people.On a lazy Sunday afternoon when I would be scrolling through the net looking for a flick I myself would ignore the foreign sector as I would want something light and that wouldn't require too much effort.I then came across 'The Untouchables' I started to watch and the first few minutes in I knew it was going to be a lifelong favourite of mine so I went downstairs and got a drink and snack and snuggled up in bed ready to enjoy now one of my favourite films.If anybody is wanting to get into foreign films this is one that will defiantly let you ease into the genre, I guarantee you'll enjoy it. The genre of the film is so wide that I can recommend it to anyone."
Sergeant_Tibbs,"Jul 10, 2013",7/10,"The Intouchables is one of the popular foreign movies of the last couple of years, rocketing to a comfortable position in IMDb's top 100 and succeeding the European box office. It is a really charming film, but charm doesn't make a film. It's one of those films built on unconventional friendship and culture clash (also a true story and people it's based on appear in the end credits, similar to 127 Hours), but the difference is that the quadriplegic, Philippe, and the caretaker, Driss, have minimal conflict and bond right away as soon as they adjust to each other. Rather than disapprove or be irritated by Driss interfering or being a nuisance during things Philippe likes, he immediately finds it amusing and refreshing. It's nice to see, but it hinders growth of character, which instead they reach effortlessly by sharing the experience of music, hookers, drugs and paragliding. It is quite entertaining and sometimes moving, but there's not really a story or strong narrative here besides two people improving each others lives through a few light situations.Unfortunately the film doesn't have a particular style or it tries things which feel jarring - such as the montage split screen music video style opening credits after a very strong thriller theme. The cinematography is nothing special and the editing is quite distracting with some scenes with time jump cuts that really didn't do it for me. It does focus on its strongest aspects which are the eccentric and charismatic performances, writing and soundtrack (a mix of R'n'B and classical to fit the characters). All the situations are things we've seen before and it's never dealt in a way we haven't seen before (such as Philippe having a long distance lover that Driss pushes him towards), it is the chemistry of the central friendship that makes the film. It is very pleasant. But those pleasant ideas only work for the 2nd act, after an awkward 1st and 3rd that doesn't really satisfy or close itself. It trades potential for genuine conflict or dilemma for directionless despair due to crisis of confidence and ultimately renders the film not making much of an impression. Granted, as a buddy film, it's pretty damn good and it certainly has its strong feel-good moments.7/10"
arabnikita,"Feb 11, 2015",10/10,"Growing up in Russia, I was no stranger to movies from other places besides Hollywood. European cinematography is different when it comes to making Drama and comedies as it enriches movies with a soul and not just superficial emotions. This movie has been no exception.The Intouchables is incredible from the first minutes up until the closing scenes. It displays the aspects of drama by showing a connection between the two worlds that the main characters live in and when the two worlds merge together, the story manages to keep you smiling throughout the duration of the film. The beauty of the film is that it does not force the jokes and humor, the moments kind of happen on their on thanks to the brilliant play of the main characters who have good chemistry.Last but not least, when I rate movies I tend to give 9/10 and usually that last 10th star depends on the music and job that the composers have done. In The Inouchables music fits perfectly into the settings and the emotions... 10 out of 10"
bradencn,"Aug 8, 2014",10/10,"Watching movies with subtitles have never scared me, as several international movies have been a great inspiration to my life (Bon Voyage and Downfall to name a couple). Francois Cluzet is a very believable quadriplegic who is suffering spiritually and emotionally because of the death of his wife and the shame that is associated being paralyzed, while Omar Sy is also the believable ""welfare""-needy man that tries to also care for his several siblings.The one main reason I loved this movie was because of it's classy and genuine humor. Everything was real in this film and it was so easy to relate the themes expressed within it in my own life. There isn't a minute or two that passes by without genuine chuckles or laughter (and a good hearty laugh at that). You learn to love people for who they are, to see the good someone can bring to the world, and to live life always looking forward in the future."
abdelgulabkhan,"Oct 12, 2012",10/10,"This movie is about humanity and friendship, based on a true storyThe disabled man has all the money but he is sad and empty and his life is so boring and routine, he is trapped in his body inside his huge mansion.He employs a guy from the streets, used to hard life in gangs and no money. However this guy is down to earth, simple, and fun.It changes his whole world from boring, to living life on the edge, making the most out of things, having loads of fun. He cuts through all the formal rubbish in the disabled mans life to tell him just do it and go for it. This is the case when he writes love letters for 6 months and he finally gets the big push to meet up with the lady and be happy.It is a story of friendship and how people from two opposite ends of life meet up in order for a care job to be done. In real life it proves people from all backgrounds, money, handicapped can all be good to each other and make a big difference to each others lives.This film is so funny you will laugh so much, it maybe in subtitles but his movie is simply superb.Forget Hollywood £400 million pound blockbusters, this film is not about money it is about true friendship and it beats all them other films by miles"
ketgup83,"Jul 15, 2012",9/10,"The Intouchables had cult status written all over it. It is definitely worth watching thanks to the stupendous performances by Omar Sy and François Cluzet, superb direction and astounding background score.Philippe becomes a quadriplegic from a paragliding accident and is in search of a care-taker to look after him. Driss turns up for the interview , not to get the job though but to get a signature for the welfare trust. Impressed with his attitude, Philippe hires him as his care-take. Over a period of time , a rich white mid-age, filthy rich quadriplegic and an unemployed,poor,care-free black guy become good friend and earn mutual respect for each other. As the story progress, we see how two different people from different background becomes close friends and develops a strong bond.Directed by duo Olivier Nakache and Eric Toledano, The Intouchables, based on true story, is a classic comedy blended with high- octane drama and brave performances. The introductory scene is itself is so impressive that you get engrossed in the film right from the beginning. Hats off to the director to develop the each character effectively which blemishes with film scenario. The script is so tight that you would not feel bore for even a single second in the film. Couple of scenes are hilarious in the movie. The scene where Driss dances to his own tune on Philippe birthday party , the scene where Driss warns Bastein to stay away from Philippe's daughter are just like icing on the cake. Even the emotional scenes have shot so well coupled with beautiful background score. Coming to the performances , I was totally floored by Omar Sy's gallant performance. He makes the film alive the moment he steps in the scene. His care-free , straight from the heart , funny-loving character will stay with you even after leaving the theater for sometime. François Cluzet puts in powerhouse performance as Philippe. It takes guts to sit on chair through the entire film and still act well with just the expressions. Brilliant !!!I kept on hearing about this film for long time and am glad I took the decision to watch the film. There are so many reasons to watch this film - Nice Storyline , strong direction , fantastic performances and above all superb background score that gels with mood of the film !!! Highly recommended : 4/5"
sarlja,"Aug 29, 2023",10/10,The score is brilliant The pace is electric. The Masarati flies. Omar Sy is magnificent as caretaker of millionaire Francois Cluzet who is quadriplegic from an accident in a glider. The scenes gliding are wondrous. My favorite scene is Sy dancing to Earrh Wind And Fire.Most of all this film escapes it's plot. The characters's chemistry does it. The subplots do it. The other characters are all charming. There is humor throughout. The writing is quick and clever. The biggest surprise is the film is never dull but a multi faceted tale of a great friendship between two extremely different men whose main connection occurs because each treats the other as an equal. Great writing and great acting abound.
