user,date,rating,content
yris2002,"Mar 18, 2012",8/10,"It's quite rare to find and have the pleasure to enjoy a genuine movie, blending comedy and drama with such naturalness: that's why ""Intouchables"" is undoubtedly a rare authentic picture and the fact that the story is inspired by a true one helped make the movie more involving. Funny and touching at the same time, the picture evolves with simplicity but strong pathos, with the merit of avoiding every pathetic or melodramatic attitude: there's brutal honesty in representing the real condition of Philippe, as well as Driss's initial uncompassionate attitude. There are touching moments, there are true amusing moments, both accompanied by a forceful soundtrack. Acting proves brilliant, to say the least, and the pairing between Francois Cluzet and Omar Sy sparkles and captures the viewer's attention. I was swept away by Dryss's genuine smile as well as by Philippe's melancholic eyes, and the moments when they are together filled me with an authentic feeling-good sentiment. Definitely, a must-see picture."
luiscarvalho,"Apr 4, 2012",10/10,"This movie completely brought magic to my life. I don't remember the last time I've seen such an awesome movie.At the moment, this is my favorite movie.I had a bad opinion about the French people but after watching this movie my opinion has changed. I've learned a lot after watching it. What did I learn ? Holding everything I have to the most, loving everyone I have on my life and really living your life.This movie makes you want to get out and breathe, loving your world, how beautiful it is.I completely recommend it, I've rated it 10 out of 10.I'm sorry for any mispelling as English is not my primary language."
aasenindahouse,"Jul 24, 2012",10/10,"By just looking at the front-cover for this movie, I could imagine this would be something good. The beginning really got me into it and I just wanted to see what would happen later in the movie. It did not take long before I actually felt that I was in their lives. From start to the end I was just stunned by all emotions this movie gave out.I had never thought that I was both going to laugh and cry at the same time, just to mention I am not that guy who easily get affected by a movie. This was something really impressing! To all out there who not have seen this movie, I really recommend doing it. You may be thinking this is a another boring drama, but after seeing it I can tell it is more than drama. Comedy mixed with love, feelings and friendship makes this movie something out of its own."
Michael_Elliott,"Aug 5, 2012",N/A,"The Intouchables (2011)**** (out of 4)Terrific comedy-drama from France about Philippe (Francois Cluzet), a rich man who was left paralyzed from the neck down after an accident and Driss (Omar Sy), a man from the ghetto who hasn't had much going on in his life until he gets the job of taking care of the handicapped man. THE INTOUCHABLES has been breaking box office records around the world but I decided to stay away from it because of some rather lukewarm reviews. I'm certainly glad the trailer kept telling me to go see it because no matter what the critics say, this here is a complete winner and it's easy to see why so many people have fallen in love with it. I'm really not sure why so many critics have bashed it for being a ""crowd winner"" or ""too happy"" because neither makes much sense. I thought the film was quite remarkable because the pre-credit sequence is just so touching and funny that you can't help but fall in love with these two characters and the journey of their friendship that follows was incredibly touching and best of all is that it felt real. A lot of credit has to go to the two leads who deliver remarkable performances and I'd be willing to bet that you're not going to see better from anyone the rest of the year. If so, more credit to whoever is better. Cluzet and Sy are simply so terrific in their roles that you really do feel as if you're watching real people with real issues. The way to two play off one another is so remarkable to watch that once you've seen it I don't see how you could forget them. Directors Olivier Nakache and Eric Toledano do a remarkable job balancing the comedy with the drama and in the end they really create such a special atmosphere that it's impossible not to get caught up with it. THE INTOUCHABLES is without question one of the best films of the year and hopefully the strong word of mouth from around the world will get more people to check it out."
TheNabOwnzz,"May 7, 2018",6/10,"Ofcourse the entire premise of The Intouchables is a bit of a cliché these days with the strong black man helping the weak white man, yet it is not a film of irrelevant political propaganda and steers clears of this subject quite well.The better parts of the film is primarily that it has some great shots, an incredible piece of piano notes music by Ludovico Einaudi & some great acting by especially Francois Cluzet ( Phillipe ) as the invalid aristocrat. Unfortunately however, the bonding of the two cultures of the main characters make little sense. Driss ( Omar Sy ) does not seem like a particularly nice guy and even his family isn't all too keen on him for reasons that he has caused on his own. Somehow for reasons unknown this eventually changes causing Driss to seemingly even care and freak out about things in Philippe's life that seem to be a bit out of character for him. Yet even though their relationship seems far fetched, it does still have a certain charm to it which makes it convincing enough as a piece of entertainment.The acting is mostly good, especially by Francois as stated before, who does a great job of facial acting too. Omar Sy is a bit inconsistent as Driss due to some weird outbursts & a couple of cringy scenes ( the dancing or the consistent flirting with the secretary becomes quite a cringe to watch ) featuring him which kind of makes me think he is the French Chris Tucker. The film isn't as emotionally powerful as it would like to be. The music by Ludovico Einaudi is a splendid emotional piece, so that is not the problem. The problem seems the movie feels a bit too much like a 'feelgood' movie due to the buddy relationship that the mixes between emotion and light hearted feelgood scenes are hard to make. However, a couple of scenes especially near the end do manage to succeed in this aspect, helped by Einaudi's score and some excellent facial acting by Francois Cluzet.The movie is mostly quite grey and not very pretty, and a lot of shots follow Driss closely from over the shoulder resulting in quite an ugly bouncing camera kind of shots. However, there are a couple of shots where the cinematography really shines. Most of these shots come from the position of the camera behind the two men, with Driss left and Phillipe right, which is a pose used many times during the film. Especially the one right before the parachuting scene is a beautiful one, yet this is followed with quite a weird shot in the parachuting scene itself from some kind of onboard camera like it is a documentary, which is unfortunate since there truly are many great shots in the film, but also a lot of uglier ones.It is a film with some great acting and some lesser acting, some great emotional scenes and some cringy scenes, and some beautiful shots and some ugly ones. While overcoming its cliché concept of a story on a splendid manner, it is not quite as great as it wanted to be."
costounet2-1,"May 12, 2012",10/10,"I'm 21 and have lived in France nearly all my life. My cousin recommended this film to me and when I saw that Omar Sy was one of the main actors, I just laughed. For those of you who don't know, Omar Sy is one half of a famous Canal + sketch comedy show called Omar & Fred. To sum it up, it is very light hearted, even silly, comedy. However, to see him perform at this level and with such ease simply amazed me. The relationship & chemistry created between the two characters in the film would make you believe that Omar & François Cluzet were best friends in real life.François Cluzet is also excellent in this film. To a certain extent, his performance reminds me a bit of Dustin Hoffman's in Rain Man. This role shows how versatile he is as an actor. The last film I saw him in was ""Ne Le Dis à Personne"" (Tell No One) and his role in that is, literally, the complete opposite, yet he pulls off both wonderfully.I have seen my fair share of ""touching"" movies but this completely blew me away. If you have 1 hour 40 minutes of your time to spare, please, use it to watch this film. You will not regret it."
estebangonzalez10,"Jun 5, 2012",9/10,"¨Sometimes you have to reach into someone else's world to find out what's missing in your own.¨ Intouchables is a remarkable ¨feel good¨ French film mostly about friendship, but there is a little bit of drama and a love story included as well. This film with relatively unknown directors and actors has managed to make some big noise in Europe, and especially in France where it has become the second highest grossing French film of all time. The key to the success of Intouchables relies on the great chemistry and performances from Francois Cluzet and Omar Sy. They are just absolutely great in this film and their friendship felt authentic and real. The movie mixes the drama with the comedy really well and it works better than most films have in the past when combining two different and sometimes opposite characters together. Sy and Cluzet play totally different characters who come from very different backgrounds, and although we've seen this play out in hundreds of films in the past it works really well here thanks to their terrific performance and a great script from the directors Olivier Nakache and Eric Toledano. Cluzet has a sort of a Dustin Huffman vibe and he says so much with his expressions without having to say anything at times, while Sy plays a more outgoing character who isn't afraid to speak his mind. This odd pairing reminded me a lot of another film which I really loved, Goodbye Solo which follows a similar premise at times. Intouchables is a feel good movie, but it transcends the term at times and becomes much more. An absolute must see, especially if you've ever had to work or live with a handicapped person.Philippe (Francois Cluzet) is a very rich quadriplegic who lives in his mansion with several servants and his teenage daughter. He is hiring a live-in carer once again (since most only last a couple of days with him). Driss (Omar Sy) happens to be applying for the job, but actually just wants to get rejected so he can live on welfare without having to work. He's been in prison for the last 6 months and away from home, but Philippe decides to actually hire Driss for the job considering he is someone different who doesn't look at him with empathy and actually treats him like a normal person. Driss and Philippe come from very different backgrounds, but they seem to complement each other very well. Philippe is a millionaire who's interested in art and classical music; while Driss comes from a poor African background, who's interested in pop culture mostly and in bands such as Earth, Wind, and Fire. Driss is really outgoing and becomes really close friends with Philippe. Together they share various stories about their past and end up helping each other solving some present conflicts. There are some other secondary characters whose names I don't even remember because they are not very important to the story, but mostly revolving around other house servants.Intouchables is actually loosely based on a true story involving a quadriplegic and his Arab carer who ends up befriending him. The directors actually came across a documentary about these two men and decided to film a movie about it. One of the greatest things about the film beside the inspiring story was the casting. Omar Sy and Francois Cluzet were really the perfect match and they had me laughing real hard at times and at the border of tears during others. It is truly an emotional and powerful film, a story that will stick with you long after the film ends, and by the time the credits role you will have a smile on your face. It is a feel good movie, but never feels cursi or anything like that. I was really surprised with Omar Sy and hope he gets many more roles. This is really a great French film, very different from Le Prophet but just as good. I had a really good time watching this movie and recommend it to everyone.http://estebueno10.blogspot.com"
Chuba63,"Feb 2, 2012",10/10,"A typical, wonderful, french film, full of surprises that grip the mind and the heart, being an Englishman living in France and having a good grip on the French language this film enveloped me like a cozy blanket on the sofa on a Sunday.The Acting is marvelous, the scripting is genius, and the Paris 'decor' helps to give it a certain romance between the 2 principal actors.A must see even if you can't understand French get yourself an auto-translator or take some french student with you that can translate ""en-direct"".Go watch it!"
requiem_andrey,"Jun 9, 2012",9/10,"I saw this title and I was really skeptical to the storyline : ""Another comedy drama that will neither make you live the story alongside the characters (feel their emotions) nor will it make you laugh"" that is what i thought. But men was i wrong. I love the way François Cluzet and Omar Sy play in this movie ; so natural , so good. I lived every second of the movie like it was my life. I came to like Driss and Philippe as real characters and now at the end of the movie i wonder where did they go. That is the kind of emotion this movie generates. It has everything you could expect from a great movie : story, characters, laughs and cries, tension and so on. You won't regret seeing this movie alone or with someone. I appreciate great work when i see it and this film made me take into consideration seeing more french movies as it improved my opinion on them. Enjoy this movie and every frame of it :D."
kishorempatil2002,"Sep 14, 2012",10/10,"I was almost unknown to French Cinema, until two years back watched "" Tell no One "" one of the best thriller I ever seen and I become fan of Francois Cluzet.The Intouchables is an excellent movie to watch.The acting from all leading roles are really good, they lived their characters.Movie has emotions, jokes, funny situations & gives positive thoughts to look at life.One word, go and watch the movie10/10 for movie10/10 to Francois Cluzet"
adirtr,"Oct 19, 2012",10/10,"This is my first time stepping to the other side, from been a viewer to been a reviewer.This film made me do it. It shook me and made me realize that when you have nothing to lose then you have all to earn. It start with two mans that are in the lowest points of there lives. They are so different yet so connected. It will show you that you don't need to judge by look or by color and anyone can have a chance to influence the life of the other.I will not say any more but this: Go and see this movie. this is a once in a lifetime."
p_imdb-238-926380,"Mar 11, 2012",10/10,"This movie is excellent.Actors are very good and touch you on many levels. It is funny, it is serious and has a story to tell which won't leave you intouché.First I though this is going to be more or less a cultural film for a selected audience. But this wasn't true at all. This is a film for the broad audience, and I think it can be appreciated by everybody.I don't know if this film has been dubbed in English, it will certainly lose some of it charisma. If you understand french, then get it in the original voice.Give it a try, you won't be disappointed. It is a beautiful movie."
aamilsyed,"Apr 27, 2019",6/10,"Western filmmakers tend to make stories where someone poor who has zest for life meets someone really rich, but tired of life and turns their life around. In such movies, one often sees the impact that the poor person has on rich person's life, but seldom do the filmmakers try to tell the story from the poor person's point of view. The focus is the rich man and his boring life and how it can be turned around by a poor person who sees it in a different light. Towards the end of the movie, the poor person gets little or nothing out of the exchange, but the rich guy walks away with deep insights and a newfound will to live. It's really unfair how such films portray poor people (recurring trope of them being awestruck by bathrooms) and paint them as incapable of doing anything unless aided by the money from the rich person. I think that's because the target audience is rich people who will pay to watch a movie which gives them some hope."
axb,"Aug 12, 2012",5/10,"This french film starts with a Dustin Hoffman look-alike actor being driven by a black driver (Omar Sy) who is fond of Earth, Wind and Fire music and has a swagger made popular by many a black Hollywood actors including Eddie Murphy. In the typical Hollywood fashion he comes from the wrong side of tracks (think of Murphy in Trading Places), but ends up living in a Paris mansion (again echoes of Trading Places) taking care of a quadriplegic (François Cluzet). Somehow he learns to take care of his patient and in fact becomes quite an accomplished male nurse. The transition is mildly amusing, and won't bother you if you checked your skepticism at the door before entering the movie theater. If you have any doubts about whether or not this film is in the genre called Hollywood fantasy, you have to see what our tough man with heart of gold does next. He decides to teach his boss how to be a good father and ultimately becomes cupid for his boss. The film plays on the obvious disparities between expectations and attitudes of the privileged and under classes in ways that are funny. If you wish to enjoy this film, please keep your expectations low and ignore the obvious visual and other tricks. One of the early scenes shows a row of shoes and socks of the candidates waiting to be interviewed for the nurse's job. As the camera pans, all candidates are wearing shiny shoes with clean socks, but one pair stand out for being dirty and incongruous. Of course, they belong to Omar Sy's character and he gets the job at this super-rich household. How fuuunny!! I predict that in two to three years there will be a Hollywood clone of this film with Dustin Hoffman and Chris Rock playing the main characters. And it will be a box office hit."
susie_arena,"Sep 4, 2012",10/10,"Without giving away too much, this was simply one of the best movies I have seen in a very, very long time! It has humor, life lessons, friendship, love, etc. There are so many emotions, but mainly laughter and humor that really touches you. The acting is superb and all people of all ages, genders, backgrounds can really enjoy this movie. You would be foolish not to see this film.I have read that they want to remake this movie in America, however, I don't see why they should do such a thing. It is perfect exactly the way it is. Nothing about the movie needs to be changed one bit. Absolutely Oscar-worthy - saddens me that it was made in 2011 and this is the first I had heard of it. It leaves you with a warm, fuzzy feeling inside.Don't miss it - you will be sorry!!"
rubytuez,"Nov 20, 2021",9/10,"I loved this film. It was sweet and charming. The comedy is well placed, the acting is warm and realistic. And as a former CNA this was a welcome cinematic reminder of the clients who feel more like friends."
panosflor,"Nov 8, 2022",10/10,"It's a movie that touches your soul.In the midst of difficult situations a friendship is created,
a person who has not accepted his disability finds a person who looks him in the eye for who he is and not for what he shows,
between twists, comedic situations and tears.There are people who, when they see this movie, might recognize themselves among the characters.We will see moments where you will feel intense moments
It's also a good teen movie as it contains some great life lessons.I have seen this movie many times and it always gives me a beautiful feeling to see a much better side of people."
view_and_review,"Jan 4, 2022",9/10,"""The Intouchables"" took a tried and true formula, tweaked it a bit, and made a sensational movie. The idea of ""The Odd Couple"" has been around for ages. We see it most in buddy cop movies, but it also rears its head in other genres. I, for one, have gotten tired of the idea of polar opposites becoming friends. It's not that I don't appreciate or like the idea, it's just that it has been done so often. The very thought of having to watch two people get to know each other and appreciate their differences makes me roll my eyes. ""The Intouchables"" takes the idea, guts it, and gives us a gem.Francois Cluzet and Omar Sy star as Philippe and Driss. Philippe is a wealthy, paralyzed, white Frenchman who is in need of a caretaker. Driss is a poor, somewhat hood, African Frenchman who is just looking for a job. Driss has no passion for healthcare nor is he at all sensitive towards Philippe's condition, he just wants a paycheck. What you don't expect is that Philippe admires this about Driss. Philippe doesn't want a caretaker who feels pity for him, he wants one that treats him like any other able-bodied human being. And I think that's where the movie distinguished itself. Instead of us suffering through a contentious relationship that slowly transformed into something special, they were practically friends from the start, even if they didn't recognize it. Philippe wanted Driss as a caretaker and Driss wasn't going to pass up a good paying job.Their relationship grows over time from one of employer and employee to friendship. It's a funny movie that seems to hit all the right buttons. Driss is not so hood and criminal as to repulse you while Philippe is not so steeped in self-pity so as to depress you. I think their personalities were perfect for each other and perfect for the big screen."
Billy_Boy_,"Jul 1, 2025",7/10,"First of all, The Intouchables is a movie that's just very easy to enjoy and very watchable. The two main actors have great chemistry, the story's sweet, and it's got a good mix of laughs and heart. It's the kind of film that leaves you smiling by the end.That said, it didn't really blow me away. It's a solid feel-good movie, but pretty predictable and plays things safe. You kind of know where it's going from the start, and that's fine - just don't expect anything super deep or unique.Overall, a good time and definitely worth a watch, especially if you're in the mood for something light and uplifting."
simonpery,"May 30, 2016",9/10,"When I first saw Intouchables I thought it was great! I really loved the environment and the outstanding performance by Omar Sy and François Cluzet! The second time, I thought it was even better! All the details and the story itself.and the expressions of François Cluzet, is really breathtaking! He deserves an Oscar for his performance!(!!!) and I think the movie itself is worth an Oscar for 'Best film', 'best actor(s)', 'best photo' and 'best director'! I really recommend it for all kinds of people, exceptionally you with a sense of details and acting!You can't walk untouched from this movie!"
jose-cruz53,"Sep 29, 2012",4/10,"Its a harmless clichéd ridden comedy. Its identical to Hollywood films in pacing, plot and structure. Its well executed and may be entertaining for someone who doesn't have a sophisticated taste for movies.The fact that one of the main characters is quadriplegic doesn't affect the basic plot by any measurable degree. Its a traditional story of a rich guy meets a poor guy and the two become friends. The rich guy likes classical music, the poor guy likes pop music. The rich guy likes art, the poor guy, prostitutes. Etc The cliché goes on and on. Only someone who has watched few movies will be impressed by this story: its extremely conventional.The jokes can be funny sometimes. Specially the ones where the characters exploit the fact that he is quadriplegic. Since one cannot find these jokes in other comedies. But overall the film is okay, but not good and is not worthy of being viewed in a theater."
MnicaB-2,"May 17, 2025",10/10,"This movie was truly captivating from beginning to end. The story unfolds in a way that keeps you emotionally invested and eager to see what happens next. The actors delivered outstanding performances that felt genuine and powerful. The direction and cinematography were visually stunning, making each scene a piece of art. The soundtrack also added depth and emotion to key moments. It's the kind of film that stays with you long after the credits roll. I highly recommend it to anyone who enjoys quality storytelling and strong performances. It's not just a film - it's an emotional journey that leaves a lasting impression."
